"conversation_id_str","created_at","favorite_count","full_text","id_str","image_url","in_reply_to_screen_name","lang","location","quote_count","reply_count","retweet_count","tweet_url","user_id_str","username"
"1729994250136477971","Wed Nov 29 22:42:25 +0000 2023","1","PENDIDIKAN TINGGI MENTAL BUDAK YA REPOT Biaya Pendidikan S2 100.000.000 habis Nggak usah kuliah modal buat buka mie ayam jualan online... Hidup Saya bukan Arsitek bukan Insinyur bangun gedung 5 lantai mampu... Paham Struktur...jalur air/kelistrikan dll @gibran_tweet","1729994250136477971","","","in","","0","0","0","https://x.com/Untuk_Pelupa/status/1729994250136477971","1717391087479009280","Untuk_Pelupa"
"1729960919822958675","Wed Nov 29 20:29:59 +0000 2023","0","Bikin kaget! Cek inflasi biaya pendidikan anak &amp; prediksi harga perguruan tinggi yuk. Ada tips cara siapkan dana pendidikan juga lho di sini! https://t.co/QaWFxSoQeh","1729960919822958675","","","in","Taniwel, SBB, Maluku","0","0","0","https://x.com/seprida_9/status/1729960919822958675","82546208","seprida_9"
"1729894043344388280","Wed Nov 29 16:04:14 +0000 2023","0","Banyak anak tidak bisa menikmati indahnya bangku pendidikan. Selain keterbatasan biaya jarak juga kualitas dan kuantitas pendidik. Bahkan banyak pula layanan pendidikan yang tidak merata dipelosok negeri.","1729894043344388280","","","in","","0","0","0","https://x.com/CapingPrin8/status/1729894043344388280","1727697644053782528","CapingPrin8"
"1729854228976304492","Wed Nov 29 13:26:01 +0000 2023","0","Jangan bandingkan kerjaan 3 rb perhalaman sama 25 rb perhalaman ya biaya pendidikan kami ratusan juta &amp; yg ngerjain cumlaude IPK nyaris sempurna #jokitugas #tugashukum #jokihukum #zonauang https://t.co/HVBNJTVvme","1729854228976304492","https://pbs.twimg.com/media/GAGtJbVaQAABHxl.jpg","","in","Yogyakarta, Indonesia","0","1","1","https://x.com/Tugashukum_co/status/1729854228976304492","1533079199203745792","Tugashukum_co"
"1729852659924902082","Wed Nov 29 13:19:47 +0000 2023","0","Bikin kaget! Cek inflasi biaya pendidikan anak &amp; prediksi harga perguruan tinggi yuk. Ada tips cara siapkan dana pendidikan juga lho di sini! https://t.co/nVkPwhKORy","1729852659924902082","","","in","SBB","0","0","0","https://x.com/johncarmandolou/status/1729852659924902082","2369856479","johncarmandolou"
"1729834027299783047","Wed Nov 29 12:05:45 +0000 2023","3","Banyak orangtua yang mengeluhkan biaya pendidikan mahal daripada anaknya gak bisa makan siang. (harus bayar spp beli buku uang gedung biaya praktek dll.) itu point nya...!!!","1729834027299783047","","","in","","0","0","0","https://x.com/si_ciio/status/1729834027299783047","1073752140923826176","si_ciio"
"1729832488384508281","Wed Nov 29 11:59:38 +0000 2023","0","Bersama Ganjar-Mahfud tak ada lagi impian yang terlupakan karena terkendala biaya pendidikan! @kharisr1891 GPMMD 4Kupang https://t.co/MG42HSDz8M","1729832488384508281","https://pbs.twimg.com/media/GAGZejpbwAAdQ99.jpg","","in","","0","0","0","https://x.com/NauvalAdamm/status/1729832488384508281","1689924926734790656","NauvalAdamm"
"1729830192602882319","Wed Nov 29 11:50:31 +0000 2023","0","Bersama Ganjar-Mahfud setiap anak bangsa diajak untuk mengejar impian tanpa terkendala biaya pendidikan! @KholisMukti GPMMD 4Kupang https://t.co/wyWDukQa08","1729830192602882319","https://pbs.twimg.com/media/GAGXY8abgAAr6NJ.jpg","","in","Balikpapan","0","0","0","https://x.com/fauziaamanda6/status/1729830192602882319","1681882055137959936","fauziaamanda6"
"1729828937960751338","Wed Nov 29 11:45:32 +0000 2023","0","Ganjar-Mahfud membuka peluang bagi setiap generasi untuk meraih kesuksesan tanpa terhambat biaya pendidikan! @khelengkeng GPMMD 4Kupang https://t.co/r7aGlqytgG","1729828937960751338","https://pbs.twimg.com/media/GAGWP3nbIAAgsAn.jpg","","in","Ciater","0","0","0","https://x.com/zYulinnnn/status/1729828937960751338","1694990968452497408","zYulinnnn"
"1729804582786609254","Wed Nov 29 10:08:45 +0000 2023","32","2 karya saya ini dipamerkan pada Children Art Festival. Karya-karya ini juga bisa dikoleksi yang mana hasil penjualannya akan digunakan untuk membantu biaya pendidikan anak-anak dari keluarga prasejahtera. Silakan DM saya untuk detail karya harga dan info lainnya. Maturnuwun. https://t.co/VoG0v8TZRT","1729804582786609254","https://pbs.twimg.com/media/GAGAEhCbUAA88a1.jpg","","in","Yogyakarta, Indonesia","2","1","15","https://x.com/miftahrizaq_/status/1729804582786609254","1687863021589467136","miftahrizaq_"
"1729784009960390924","Wed Nov 29 08:47:00 +0000 2023","0","Pendidikan bersama Ganjar-Mahfud bukan lagi soal biaya melainkan investasi nyata untuk membangun generasi cerdas yang mampu membongkar tembok kemiskinan @marjamargareth GPMMD 4Kupang https://t.co/VfcmX0vzcM","1729784009960390924","https://pbs.twimg.com/media/GAFtYwta8AA6Qq5.jpg","","in","Jayapura","0","0","0","https://x.com/RuntuboyEv20/status/1729784009960390924","1689856369946718208","RuntuboyEv20"
"1729767588761137588","Wed Nov 29 07:41:45 +0000 2023","0","di lapangan juga sangat terasa bu pendapatan ikut turun krn insentif dari penjualan yang berkurang harga-harga kebutuhan pokok naik yang cukup terasa dan satu lagi cerita klasik biaya pendidikan yang terasa mahal dan bbrp tahun lagi masuk jenjang kuliah. #curhat","1729767588761137588","","","in","GoldenWater","0","1","0","https://x.com/SobatCuanBagger/status/1729767588761137588","1702895204876111872","SobatCuanBagger"
"1729766311360655391","Wed Nov 29 07:36:40 +0000 2023","0","[REVISI PENERIMA PROGRAM KARTU INDONESIA PINTAR (KIP) KULIAH PEMBIAYAAN PENUH (BANTUAN BIAYA HIDUP&amp;BIAYA PENDIDIKAN) TAMBAHAN SEMESTER GANJIL TAHUN AKADEMIK 2023/2024] Assalamualaikum warahmatullahi Wabarahkatuh Selamat siang teman-teman semuanya Diberitahukan informasi https://t.co/iHOKXA2uPI","1729766311360655391","https://pbs.twimg.com/media/GAFdSl9acAAb59m.jpg","","in","Bengkulu","0","1","0","https://x.com/HIMASI_UNIB/status/1729766311360655391","554750944","HIMASI_UNIB"
"1729742348953714853","Wed Nov 29 06:01:27 +0000 2023","0","Pansus Beasiswa Tegaskan Pemprov Papua Tuntaskan Tunggakan Biaya Pendidikan Bagi 1.718 Mahasiswa https://t.co/uMvxH3CzjG","1729742348953714853","","","in","Jayapura, Papua","0","0","0","https://x.com/eveertth/status/1729742348953714853","1483452624582381569","eveertth"
"1729740075833893193","Wed Nov 29 05:52:25 +0000 2023","1"," Beasiswa SMP - SMA Gratis Tahun 2024 oleh SMART Ekselensia Indonesia SMART Ekselensia Indonesia merupakan sekolah menengah berasrama dan bebas biaya untuk anak-anak yang tidak mempunyai kesempatan mendapatkan pendidikan berkualitas karena faktor ekonomi. ⬇️ ⬇️ ⬇️ https://t.co/sPuMRUINNH","1729740075833893193","https://pbs.twimg.com/media/GAFFbiCbYAATZE-.jpg","","in","Indonesia","0","1","0","https://x.com/INDBeasiswa/status/1729740075833893193","3119739176","INDBeasiswa"
"1729701457908187178","Wed Nov 29 03:18:58 +0000 2023","2","Ingin biaya pendidikan terjangkau ? #AMINAjaDulu","1729701457908187178","","","in","Bandar","0","0","1","https://x.com/BSipoel/status/1729701457908187178","864120370206519297","BSipoel"
"1729700369465311591","Wed Nov 29 03:14:39 +0000 2023","0","Biaya pendidikan anak diperkotaan tinggi khususnya biaya transportasi. Mungkin @DivHumas_Polri pk @ListyoSigitP bantu pk @bahlillahadalia ttg SIM dimana SIM C bisa utk anak umur 15 th bkn 17 th Cc @ganjarpranowo @jokowi @mohmahfudmd @aniesbaswedan @prabowo @cakimiNOW @msaid_didu","1729700369465311591","","","in","","0","0","0","https://x.com/Hendrikorachman/status/1729700369465311591","1119457371393146880","Hendrikorachman"
"1729697327147798680","Wed Nov 29 03:02:33 +0000 2023","0","Pengumuman Penerima Program Kartu Indonesia Pintar (KIP) Kuliah Pembiayaan Penuh (Bantuan Biaya Hidup dan Biaya Pendidikan) Tambahan Tahap II semester Ganjil Tahun Akademik 2023/2024 https://t.co/vDjWY2uVUI","1729697327147798680","","","in","Bengkulu, Indonesia","0","0","0","https://x.com/unibofficial/status/1729697327147798680","1044094709709201409","unibofficial"
"1729600024969945144","Tue Nov 28 20:35:55 +0000 2023","0","Bikin kaget! Cek inflasi biaya pendidikan anak &amp; prediksi harga perguruan tinggi yuk. Ada tips cara siapkan dana pendidikan juga lho di sini! https://t.co/qLP4Q1iCDU","1729600024969945144","","","in","SBB","0","0","0","https://x.com/johncarmandolou/status/1729600024969945144","2369856479","johncarmandolou"
"1729562738848866403","Tue Nov 28 18:07:45 +0000 2023","0","terlepas biaya pendidikan gua terpenuhi TAPI GUA MASIH BELOM SIAP ngerti gasih belom siap aja ","1729562738848866403","","","in","","0","0","0","https://x.com/wavetosix/status/1729562738848866403","1318819246055436288","wavetosix"
"1729546982174216382","Tue Nov 28 17:05:08 +0000 2023","11","Rill terutama ibuku beliau bakal ngusahain apapun buat pendidikan anak-anaknya. Bahkan keinget bgt waktu mau ambil profesi ortuku cekcok masalah biaya krn waktu itu ekonominya lg ga bagus. Tp mereka ngusahain bgt buat aku lanjut profesi bahkan sampe skrg lulus https://t.co/gC62XHrTAo","1729546982174216382","https://pbs.twimg.com/media/GACVz3rbYAA7rEY.jpg","","in","Udh bkn plat h","2","1","1","https://x.com/fleurence/status/1729546982174216382","1210593358722134019","fleurence"
"1729536380538405355","Tue Nov 28 16:23:01 +0000 2023","0","Ganjar-Mahfud membuka pintu emas bagi anak-anak Indonesia menuju masa depan cerah tanpa terbebani oleh biaya pendidikan @Lambert56018951 GPMMD 4Sabang GPMMD 4Merauke https://t.co/mP208fCHZb","1729536380538405355","https://pbs.twimg.com/media/GACMK92aEAAQJDK.jpg","","in","Salatiga","0","0","0","https://x.com/annisaftrr9/status/1729536380538405355","1686940859198246912","annisaftrr9"
"1729533704568205631","Tue Nov 28 16:12:23 +0000 2023","0","Anak-anak tak akan lagi terhalang oleh biaya pendidikan dengan Ganjar-Mahfud di pucuk kepemimpinan @littlegrrll12 GPMMD 4Sabang GPMMD 4Merauke https://t.co/tVQCVK0xnl","1729533704568205631","https://pbs.twimg.com/media/GACJvDNbAAAb34M.jpg","","in","Kupang","0","0","0","https://x.com/friskanadew/status/1729533704568205631","1681978696620728321","friskanadew"
"1729533173766492301","Tue Nov 28 16:10:16 +0000 2023","0","Keputusan mewajibkan sekolah 12 tahun tanpa biaya adalah langkah progresif untuk kemajuan pendidikan nasional @malessz65 GPMMD 4Sabang GPMMD 4Merauke https://t.co/rCW6doh5np","1729533173766492301","https://pbs.twimg.com/media/GACJQIYbsAAvDoe.jpg","","in","Banjarbaru","0","0","0","https://x.com/luna_cantikaaa/status/1729533173766492301","1688395405460180993","luna_cantikaaa"
"1729532099546497033","Tue Nov 28 16:06:00 +0000 2023","0","Ganjar-Mahfud memberikan solusi konkret dengan membebaskan biaya pendidikan untuk semua @malik6694847 GPMMD 4Sabang GPMMD 4Merauke https://t.co/vQjxWWKE2V","1729532099546497033","https://pbs.twimg.com/media/GACIRmdbUAAeTuH.jpg","","in","Sukabumi","0","0","0","https://x.com/DikaArdiiann/status/1729532099546497033","1688764046269661184","DikaArdiiann"
"1729528764663755185","Tue Nov 28 15:52:45 +0000 2023","0","Inisiatif untuk mewajibkan pendidikan 12 tahun tanpa biaya adalah langkah besar menuju masyarakat yang lebih cerdas @litarafira GPMMD 4Sabang GPMMD 4Merauke https://t.co/8axYT7hZoI","1729528764663755185","https://pbs.twimg.com/media/GACFPfRb0AAFigB.jpg","","in","Tangerang Selatan","0","0","0","https://x.com/IndahAtiyahh/status/1729528764663755185","1681882162734460929","IndahAtiyahh"
"1729527207113208274","Tue Nov 28 15:46:33 +0000 2023","0","Ganjar-Mahfud memberikan solusi konkret dengan mewajibkan pendidikan gratis 12 tahun memberikan hak setiap anak untuk belajar tanpa beban biaya @LaLa_Jasmi GPMMD 4Sabang GPMMD 4Merauke https://t.co/HJvU1tn8ab","1729527207113208274","https://pbs.twimg.com/media/GACD027aQAAo8QW.jpg","","in","Sibolga","0","0","0","https://x.com/syafikjafarrr/status/1729527207113208274","1686728061168111617","syafikjafarrr"
"1729526828619182396","Tue Nov 28 15:45:03 +0000 2023","0","Ganjar-Mahfud berkomitmen membebaskan biaya pendidikan hingga 12 tahun untuk memberikan peluang yang adil bagi setiap anak Indonesia @Lenso02 GPMMD 4Sabang GPMMD 4Merauke https://t.co/zAlVOJKe1l","1729526828619182396","https://pbs.twimg.com/media/GACDeyqbkAACqif.jpg","","in","Bogor, Indonesia","0","0","0","https://x.com/nurmala_sarass/status/1729526828619182396","1679737273334767616","nurmala_sarass"
"1729525780559155351","Tue Nov 28 15:40:53 +0000 2023","0","Dukungan terhadap Ganjar-Mahfud semakin menguat dengan komitmennya membebaskan anak-anak dari beban biaya pendidikan @lalapoodip GPMMD 4Sabang GPMMD 4Merauke https://t.co/Pw1GVmiGPf","1729525780559155351","https://pbs.twimg.com/media/GACChyvbYAAmg1w.jpg","","in","Cirebon","0","0","0","https://x.com/BellaAlfianii/status/1729525780559155351","1686646683973844992","BellaAlfianii"
"1729521425969729915","Tue Nov 28 15:23:35 +0000 2023","0","Ganjar-Mahfud ingin memastikan bahwa biaya pendidikan bukan lagi beban keluarga melainkan hak bagi setiap anak @Majestic136 GPMMD 4Sabang GPMMD 4Merauke https://t.co/UA766FWpEP","1729521425969729915","https://pbs.twimg.com/media/GAB-kTAbEAAZa4J.jpg","","in","Sabang","0","0","0","https://x.com/yahyasetya5/status/1729521425969729915","1688492308478758914","yahyasetya5"
"1729520361388339483","Tue Nov 28 15:19:21 +0000 2023","0","Ganjar-Mahfud menunjukkan komitmennya terhadap pendidikan dengan mewajibkan sekolah 12 tahun tanpa dipungut biaya @Lemonhe53790295 GPMMD 4Sabang GPMMD 4Merauke https://t.co/AR4orWykgo","1729520361388339483","https://pbs.twimg.com/media/GAB9mXDaUAADzGh.jpg","","in","Yogyakarta","0","0","0","https://x.com/AbdullhRohmat/status/1729520361388339483","1681913312844607488","AbdullhRohmat"
"1729517439216701574","Tue Nov 28 15:07:45 +0000 2023","0","Ganjar-Mahfud pahlawan pendidikan yang memastikan hak setiap anak untuk belajar tanpa biaya @Linda79610287 GPMMD 4Sabang GPMMD 4Merauke https://t.co/ZUuq3ZejTt","1729517439216701574","https://pbs.twimg.com/media/GAB6770bAAA8ozY.jpg","","in","Semarang, Indonesia","0","0","0","https://x.com/tatiana_namya/status/1729517439216701574","1679793319034130433","tatiana_namya"
"1729517320991818052","Tue Nov 28 15:07:16 +0000 2023","0","Ganjar-Mahfud tegas: setiap anak berhak mendapatkan pendidikan berkualitas tanpa biaya! @lilskkrrttt GPMMD 4Sabang GPMMD 4Merauke https://t.co/Qek7r97ndK","1729517320991818052","https://pbs.twimg.com/media/GAB61aabsAAYRRK.jpg","","in","Samarinda","0","0","0","https://x.com/wati_maryana/status/1729517320991818052","1681135071364026370","wati_maryana"
"1729516193667829897","Tue Nov 28 15:02:48 +0000 2023","0","Ganjar-Mahfud pilihan utama untuk memastikan pendidikan tanpa batas akses tanpa beban biaya @Limhood GPMMD 4Sabang GPMMD 4Merauke https://t.co/EsOEyJYv6g","1729516193667829897","https://pbs.twimg.com/media/GAB5zyva8AATDV-.jpg","","in","Yogyakarta","0","0","0","https://x.com/kusserini97/status/1729516193667829897","1680870005435674624","kusserini97"
"1729515719614931425","Tue Nov 28 15:00:55 +0000 2023","0","Ganjar-Mahfud mengusung misi mulia: setiap anak berhak menempuh pendidikan 12 tahun tanpa beban biaya @lafidarb GPMMD 4Sabang GPMMD 4Merauke https://t.co/X12xB7G41l","1729515719614931425","https://pbs.twimg.com/media/GAB5YNaaIAA24-9.jpg","","in","Tegal","0","0","0","https://x.com/VikaAudiinaa/status/1729515719614931425","1690997901454192640","VikaAudiinaa"
"1729514478499516893","Tue Nov 28 14:55:59 +0000 2023","0","Ganjar-Mahfud bapak pendidikan yang menyuarakan hak setiap anak untuk mendapatkan pendidikan tanpa hambatan biaya @lilfairyyee GPMMD 4Sabang GPMMD 4Merauke https://t.co/e4seZEADbx","1729514478499516893","https://pbs.twimg.com/media/GAB4P7RWkAEhr5H.jpg","","in","Salatiga","0","0","0","https://x.com/RezkiAnggaara/status/1729514478499516893","1680782993630330881","RezkiAnggaara"
"1729503369763451345","Tue Nov 28 14:11:50 +0000 2023","0","Bikin kaget! Cek inflasi biaya pendidikan anak &amp; prediksi harga perguruan tinggi yuk. Ada tips cara siapkan dana pendidikan juga lho di sini! https://t.co/mWHVG15OsP","1729503369763451345","","","in","SBB","0","0","0","https://x.com/johncarmandolou/status/1729503369763451345","2369856479","johncarmandolou"
