"conversation_id_str","created_at","favorite_count","full_text","id_str","image_url","in_reply_to_screen_name","lang","location","quote_count","reply_count","retweet_count","tweet_url","user_id_str","username"
"1668581039105781760","Tue Jun 13 11:28:15 +0000 2023","6","Dia mampu beli tiket ke Amerika bukan berarti mampu membiayai pendidikan di Amerika. Juilliard School itu terkenal mahal dan susah tembusnya belum lagi biaya hidup di sana. Mendingan kita dorong Kemendikbud memperbanyak jalur beasiswa atau pendidikan gratis daripada misuh-misuh.","1668581039105781760","","","in","Hutan-hutan Sumatera","0","0","0","https://x.com/Sean_Alma/status/1668581039105781760","2834985456","Sean_Alma"
"1668532530751094784","Tue Jun 13 08:15:29 +0000 2023","0","Asrama Gratis - Biaya Pendidikan Gratis - Alat Tulis Gratis - Seragam Gratis - Praktik Gratis Ganjar sudah berhasil wujudkan 15 sekolah di Jateng. https://t.co/NegGiJKfAr","1668532530751094784","https://pbs.twimg.com/media/FyfRdrSaEAEENFs.jpg","","in","","0","0","0","https://x.com/tita_evi/status/1668532530751094784","1590515883327115264","tita_evi"
"1668527313032708097","Tue Jun 13 07:54:45 +0000 2023","0","Saran aja. Untuk univ di beberapa negara mereka ada yg gak narik biaya pendaftaran. Caranya adalah daftar waktu mereka ikut pameran pendidikan di Indonesia. Ini untuk dapet LOA univ tadi dan LOA-nya bisa untuk daftar beasiswa.","1668527313032708097","","","in","","0","0","0","https://x.com/HolandRoma26644/status/1668527313032708097","1657258813861564416","HolandRoma26644"
"1668514369569964033","Tue Jun 13 07:03:19 +0000 2023","0","OPEN PRE ORDER KAOS HIMA IPA 2023 Memberitahukan kepada seluruh mahasiswa pendidikan IPA. Untuk meningkatkan keseragaman dan kesolidaritasan kami membuka Pre Order KAOS HIMA IPA 2023 Only 65k free ganci - Mulai ukuran XXL dikenakan biaya tambahan 5k https://t.co/lxHpKRrSFR","1668514369569964033","https://pbs.twimg.com/media/FyfA2dkakAEPQFD.jpg","","in","Universitas Negeri Yogyakarta","0","1","0","https://x.com/himaipa_uny/status/1668514369569964033","768893852","himaipa_uny"
"1668498287639560192","Tue Jun 13 05:59:25 +0000 2023","0","Magistra Utama Program Pendidikan dan Pelatihan 1 Tahun Lebih Siap dan Cepat Kerja Dibuka pendaftaran angkatan 28 dptkan potongan biaya pendidikan lbh banyak daftar ulang di Gel 1 Info lengkap 082 134 134 634 Kunjungi website https://t.co/lQKH3CXFU8 #kuliah #mahasiswa https://t.co/4aHAgTLgSR","1668498287639560192","https://pbs.twimg.com/ext_tw_video_thumb/1668498251904069632/pu/img/rL1Ie9hSwk6iVgRK.jpg","","in","Jl. Bogor 40, Malang, Jatim","0","0","0","https://x.com/MagistraUtama96/status/1668498287639560192","1555083065743253504","MagistraUtama96"
"1668487381694177280","Tue Jun 13 05:16:05 +0000 2023","6","Gue takut sebenernya buat komentar soal begini tpi dri apa yg gue liat definisi dari beasiswa itu sendiri adalah tunjangan biaya pendidikan. Melihat dri ekonomi Putri yg menurut gue 'berkecukupan' agaknya memang kurang tepat. Udah ah gitu aja. https://t.co/Go61J0esLr","1668487381694177280","https://pbs.twimg.com/media/FyeobmKacAExYRg.jpg","","in","she/her || fan acc","0","2","0","https://x.com/jptgbt/status/1668487381694177280","1531525501285568512","jptgbt"
"1668486671896309760","Tue Jun 13 05:13:16 +0000 2023","0"," Nah.. 1. Angsuran per bulan (?) = Harga rumah : jangka waktu angsuran. 2. Angsuran kendaraan 3. Sewa rumah 4. Biaya pendidikan anak 5. Biaya hidup per KK per bulan 6. Biaya2 tak terduga ; berobat dll --- Total pengeluaran per bulan @ Rp. ...(?)..","1668486671896309760","","","in","West Java, Indonesia","0","0","0","https://x.com/Bambang77197468/status/1668486671896309760","702038954426535937","Bambang77197468"
"1668466358798131200","Tue Jun 13 03:52:33 +0000 2023","1","Agak kocak pemikirannya. Emang yg pintar dan berprestasi pasti dari kalangan ber-privilege secara ekonomi?! Banyak orang pinter tapi gabisa lanjut krn biaya pendidikan mahal. Klo beasiswa ga disaring dari seberapa pintar seseorang terus pakai standar apa?","1668466358798131200","","","in","Bali, Indonesia","0","2","0","https://x.com/HaiArimbi/status/1668466358798131200","73314725","HaiArimbi"
"1668463146024189952","Tue Jun 13 03:39:47 +0000 2023","0","Emang yaa investasi ke pendidikan mahal. Kalau mau dapet peluang yang lebih baik lagi. Kemarin tuh wondering pas ambil les di wse dgn biaya mirip gini buat 15 bln apakah worth it bgt? Tp pas dijalanin worth it emang meski terseok-seok dan bentrok sana sini","1668463146024189952","","","in","Jakarta ","0","0","0","https://x.com/oniiex/status/1668463146024189952","320219516","oniiex"
"1668445848332808192","Tue Jun 13 02:31:03 +0000 2023","0","Sekarang udah susah bgt mau kuliah ke ptn supaya murah harganya banyak yg mirip swasta ujung2nya. Yuk kedepannya pas punya anak biaya pendidikan dia disiapin juga ya. Jangan doyan bikinnya aja ","1668445848332808192","","","in","","0","0","0","https://x.com/caramelllooooo/status/1668445848332808192","1226676962082508800","caramelllooooo"
"1668433031332515841","Tue Jun 13 01:40:07 +0000 2023","0","Asrama Gratis - Biaya Pendidikan Gratis - Alat Tulis Gratis - Seragam Gratis - Praktik Gratis Ganjar sudah berhasil wujudkan 15 sekolah di Jateng. #NCTDREAM_ISTJ | #BTS10thAnniversary | YOON JEONGHAN | MBTI | #10yearswithBTS | Mbappe | Happy 10th | Qatar | Bangtan https://t.co/WHduOEjioN","1668433031332515841","https://pbs.twimg.com/media/Fyd2s5LaEAEADnI.jpg","","in","indonesia","0","0","0","https://x.com/ganjarmilenials/status/1668433031332515841","1534740374391992320","ganjarmilenials"
"1668428711115513856","Tue Jun 13 01:22:57 +0000 2023","0","Dinas Pendidikan Kota Tangerang Gratis Kan Biaya 73 SMP dan MTS Swasta. https://t.co/xqsHo7zClU lewat @Pelita Tangerang","1668428711115513856","","","in","tangeranng selatan","0","0","0","https://x.com/pelitatangerang/status/1668428711115513856","1437688321497468930","pelitatangerang"
"1668426146105659392","Tue Jun 13 01:12:45 +0000 2023","0","Jadi gini rasanya puyeng sama biaya pendidikan anak Bapak gua kuat juga ya ","1668426146105659392","","","in","DKI Jakarta","0","0","0","https://x.com/salmaanalfarisy/status/1668426146105659392","90854843","salmaanalfarisy"
"1668300615854981120","Mon Jun 12 16:53:57 +0000 2023","6","Teteh doakan km say jd org sukses berguna bagi nusa bangsa dan sesama !! bahagiakan org tuamu bersyukurlah masih bisa mendapat pendidikan tinggi yg tidak pernah teteh rasakan krn masalah biaya!!! maknya jd sales rebahaners teteh itu","1668300615854981120","","","in","tangerang city","0","0","0","https://x.com/RheinaHerlina/status/1668300615854981120","293624229","RheinaHerlina"
"1668276864014778371","Mon Jun 12 15:19:34 +0000 2023","0","Penerimaan Murid SD Dimulai 73 Swasta Di Kota Tangerang Gratiskan Biaya Pendidikan https://t.co/jSpzcj2JSp https://t.co/urGKWgl1iY","1668276864014778371","https://pbs.twimg.com/media/Fybo92jaAAUTLyD.jpg","","in","Tangerang","0","0","0","https://x.com/TangerangNET/status/1668276864014778371","3096133082","TangerangNET"
"1668260628543295490","Mon Jun 12 14:15:03 +0000 2023","0","Penerimaan Murid SD Dimulai 73 Swasta Di Kota Tangerang Gratiskan Biaya Pendidikan https://t.co/Qy12ZWWsjv","1668260628543295490","","","in","Tangerang","0","0","0","https://x.com/TangerangNET/status/1668260628543295490","3096133082","TangerangNET"
"1668254133516746752","Mon Jun 12 13:49:14 +0000 2023","0","Penerimaan Murid SD Baru Dimulai 73 Swasta Di Kota Tangerang Gratiskan Biaya Pendidikan https://t.co/Qy12ZWWsjv","1668254133516746752","","","in","Tangerang","0","0","0","https://x.com/TangerangNET/status/1668254133516746752","3096133082","TangerangNET"
"1668228066072760320","Mon Jun 12 12:05:39 +0000 2023","0","Tasyakkuran Makan Bakso Bersama ===== NURUL HUDA - Lembaga Pendidikan Tanpa Pungutan Biaya. Tidak Ada Alasan Untuk Tidak Mencari Ilmu Karena Sekolah Di NURUL HUDA Gratis.!!! ===== YAYASAN | RAUDHATUL ATHFAL | TAMAN PENDIDIKAN QUR'AN | SEKOLAH AGAMA | PONDOK | UNIVERSITAS https://t.co/6LjLgec0LZ","1668228066072760320","https://pbs.twimg.com/media/Fya8j6DaIAEDalT.jpg","","in","Kwanyar, Indonesia","0","0","0","https://x.com/nh_online_id/status/1668228066072760320","1148396660361314305","nh_online_id"
"1668225293436489734","Mon Jun 12 11:54:38 +0000 2023","0","Selain pengorbanan dri ortu disisi lain aku punya kakak yg luar biasa selalu ingin mengalah dlam hal pendidikan... Pas dnger biaya UKT tahun ini pda melonjak naik kk terus an bilang Kalo kamu kuliah aku kerja aja kan hasil kerja jg bisa bantu-bantu kamu ","1668225293436489734","","","in","","0","1","0","https://x.com/Myushachi/status/1668225293436489734","1206574371138981888","Myushachi"
"1668178668005490696","Mon Jun 12 08:49:22 +0000 2023","0","Biaya Pendidikan Menanjak Saatnya Kelola Keuangan Berbasis Syariah https://t.co/OEc1FG2LIv","1668178668005490696","","","in","","0","0","0","https://x.com/JakartaNewsID1/status/1668178668005490696","1033940986169155586","JakartaNewsID1"
"1668166292736716800","Mon Jun 12 08:00:11 +0000 2023","26","Butuh biaya pendidikan atau mau beli barang impian? Top up limit #MandiriKPR aja! Ada bunga spesial 8 35% fixed 3 tahun penambahan limit kredit s/d Rp15 miliar dan beragam benefit menarik lainnya. Info lengkap klik https://t.co/KtQWEH1dCb #mandiripromo https://t.co/lZfq21TEMS","1668166292736716800","https://pbs.twimg.com/media/FyaEXiFaMAA742Y.jpg","","in","Jakarta","0","1","5","https://x.com/bankmandiri/status/1668166292736716800","2278761810","bankmandiri"
"1668157620212097024","Mon Jun 12 07:25:44 +0000 2023","0","dokter. keren aja gitu profesinya dokter dan di masa depan pun gaakan bisa digantiin dengan robot (wallahualam). tapi aku emang gamau jadi dokter karna aku lebih suka di bidang soshum gasuka hal yang identik dengan kesehatan dan juga biaya pendidikan dokter itu mahal.","1668157620212097024","","","in","toko daeng","0","0","0","https://x.com/mnjahit/status/1668157620212097024","1335579892214235140","mnjahit"
"1668155177935966208","Mon Jun 12 07:16:01 +0000 2023","0","Kehadiran program kelas beasiswa PT Timah tidak hanya untuk membantu meningkatkan kualitas SDM namun juga meringankan biaya pendidikan bagi orang tua karena semuanya ditanggung penuh oleh perusahaan. #taudarikepripedia https://t.co/Me5BhuohcD","1668155177935966208","","","in","Kepulauan Riau, Indonesia","0","0","0","https://x.com/kepripediacom/status/1668155177935966208","1093636091003817984","kepripediacom"
"1668142314471161856","Mon Jun 12 06:24:55 +0000 2023","0","Yu Minthul wis sara sejak muda. Selalu dadi tulang punggung keluarga. Menanggung biaya pendidikan adik-adike. Mergane kuwi perempuan asal Kecamatan Banyakan Kabupaten Kediri ini sampek lali rabi. Sangking repote oleh nyambut gawe.https://t.co/Erx2iiWdEl","1668142314471161856","","","in","Kota Kediri, Indonesia","0","0","0","https://x.com/jpradarkediri/status/1668142314471161856","1556509136749461507","jpradarkediri"
"1668133591837204482","Mon Jun 12 05:50:15 +0000 2023","0","[ASABERSAMA: PENDATAAN MAHASISWA BIDIKMISI/KIPK 2023] Halo FKM! Bantuan biaya pendidikan Bidikmisi/KIPK merupakan program Pemerintah Indonesia untuk membantu siswa Sekolah Menengah Atas (SMA) atau sederajat yang memiliki keterbatasan ekonomi. https://t.co/qXeSbeh6gh","1668133591837204482","https://pbs.twimg.com/media/FyZmqMGaYAIjrHt.jpg","","in","Depok, Indonesia","0","1","0","https://x.com/BEMFKMUI/status/1668133591837204482","110404464","BEMFKMUI"
"1668128824276701187","Mon Jun 12 05:31:18 +0000 2023","1","Magistra Utama Program Pendidikan dan Pelatihan 1 Tahun Lebih Siap dan Cepat Kerja Dibuka pendaftaran angkatan 28 dptkan potongan biaya pendidikan lbh banyak daftar ulang di Gel 1 Info lengkap 082 134 134 634 Kunjungi website https://t.co/lQKH3CXFU8 #kuliah #mahasiswa https://t.co/8sqjOvn8ui","1668128824276701187","https://pbs.twimg.com/ext_tw_video_thumb/1668128751207718912/pu/img/EM1S3kRlFOxh3ADO.jpg","","in","Jl. Bogor 40, Malang, Jatim","0","0","0","https://x.com/MagistraUtama96/status/1668128824276701187","1555083065743253504","MagistraUtama96"
"1668124470752722944","Mon Jun 12 05:14:00 +0000 2023","6","Kuliah memerlukan biaya yang tidak sedikit. Di bawah ini 10 provinsi dengan biaya pendidikan tingkat perguruan tinggi yang paling mahal. #Terbaru https://t.co/RYNuXKM5z1","1668124470752722944","","","in","redaksi@mojok.co","0","0","0","https://x.com/mojokdotco/status/1668124470752722944","2388795571","mojokdotco"
"1668111849165037570","Mon Jun 12 04:23:51 +0000 2023","0","Salam Kasih dari kami anak-anak Panti Asuhan Peduli Kasih Buala Elkan Bapak Ibu Mohon uluran tangan bapak ibu untuk kebutuhan dan biaya pendidikan anak anak yatim piatu Panti Asuhan Peduli Kasih https://t.co/hy7TH7Ledz","1668111849165037570","https://pbs.twimg.com/ext_tw_video_thumb/1668111698107174912/pu/img/B-SYQI0vAfZk6tfD.jpg","","in","","0","0","0","https://x.com/PantiBuala57339/status/1668111849165037570","1652314501675622400","PantiBuala57339"
"1668081680945659904","Mon Jun 12 02:23:58 +0000 2023","3","Pemerintah Provinsi DKI Jakarta mencairkan bantuan sosial biaya pendidikan KJP Plus tahap I-2023 secara bertahap mulai 7 Juni 2023 kepada lebih dari 600 ribu pelajar SD hingga SMA. Berikut laman #infografik: https://t.co/GNNtqmDzrL https://t.co/0RuK017vNr","1668081680945659904","https://pbs.twimg.com/media/FyY3cseakAEJ2gU.jpg","","in","NKRI","0","0","1","https://x.com/antaranews/status/1668081680945659904","18071520","antaranews"
"1668024518005383169","Sun Jun 11 22:36:50 +0000 2023","6","Kita masih mencari para muhsinin yang bersedia menjadi donatur bulanan untuk biaya pendidikan santri yatim dhua'fa 20.000/bulan. @PeduliYatimBrsm https://t.co/eD587m2u5q","1668024518005383169","https://pbs.twimg.com/media/FyYDdU5aUAEI6Rg.jpg","","in","Tapanuli Tengah, Sumatera Utar","0","0","4","https://x.com/HadaitFiman/status/1668024518005383169","1130823648560861185","HadaitFiman"
"1667935189979533312","Sun Jun 11 16:41:52 +0000 2023","0","bahagiain keluarga naik haji + umrah deposito beli tanah/property bikin kostan donate jadi relawan pendidikan keliling indo tanpa mikirin biaya","1667935189979533312","","","in","","0","0","0","https://x.com/mybabyxuxi/status/1667935189979533312","1184240133190471680","mybabyxuxi"
"1667878321261248512","Sun Jun 11 12:55:54 +0000 2023","0","Kalo diliat data sih lahan TPA selalu bertambah tiap tahun tp ga diimbangi peningkatan sampah jd usaha penambahan lahan ya gitu2doang Pengangkutan sampah yg skala kampus ke TPA aja msh ada biaya buat truk pengangkutnya kl mau instan. Bayangin aja skala lingkup pendidikan ini","1667878321261248512","","","in","","0","1","0","https://x.com/yapperifikasi/status/1667878321261248512","1377287170281508865","yapperifikasi"
"1667878011943911425","Sun Jun 11 12:54:40 +0000 2023","3352","BIAYA PENDIDIKAN PTN di INDONESIA 2023️ a thread; https://t.co/ueFVP3eeca","1667878011943911425","https://pbs.twimg.com/media/FyV-NYyagAI90Iy.jpg","","in","","26","27","1134","https://x.com/006png/status/1667878011943911425","1413087716594487302","006png"
"1667800009377726467","Sun Jun 11 07:44:43 +0000 2023","0","Ada sorang klien cakap Aku ambil Hibah bukan sbb aku nak mewahkan isteri tapi aku tau komitmen bulanan kami tinggi belanja harian hutang bil utiliti pendidikan anak2 lagi. Tjawab aku as ketua keluarga kena sediakan Hibah. Tak mampu isteri aku nak biaya keluarga sendiri ","1667800009377726467","","","in","Selangor, Malaysia","0","0","0","https://x.com/SalahudinBakar/status/1667800009377726467","1502077858348675072","SalahudinBakar"
"1667791043595751424","Sun Jun 11 07:09:05 +0000 2023","0","Yth. Pak @nadiemmakarim @Kemdikbud_RI tolong dievaluasi dong sekolah yg kelulusan siswa nya mewajibkan main wisuda wisudaan org tua akan pusing memikirkan mana biaya main wisudaan mana biaya cari tahap pendidikan selanjutnya Tembusan : @PAUDDikdasmen","1667791043595751424","","","in","Kingdom Island","0","0","0","https://x.com/abudaffa_klda/status/1667791043595751424","224115439","abudaffa_klda"
"1667744797430550528","Sun Jun 11 04:05:19 +0000 2023","1","[MATKES: BIAYA PENDAFTARAN DAN PENDIDIKAN SERTA KETENTUAN PEMBAYARAN JALUR SELEKSI MANDIRI PROGRAM DIPLOMA 3 DAN SARJANA UPNVJ TAHUN 2023] Halo CAMABA UPNVJ! https://t.co/vJdUAB12ks","1667744797430550528","https://pbs.twimg.com/media/FyUFDUWakAIQPyU.jpg","","in","","0","1","0","https://x.com/bem__upnvj/status/1667744797430550528","1213693118362476544","bem__upnvj"
"1667726262595620865","Sun Jun 11 02:51:40 +0000 2023","16"," Dialektika hak dan kewajiban Kita berhak menerima biaya pendidikan dari orang tua implikasinya kita wajib mengabulkan semua keinginan orang tua termasuk kesuksesan anaknya dalam pendidikan. Bener gak?","1667726262595620865","","","in","Sumenep - Sarang","0","1","0","https://x.com/faidhfudlali/status/1667726262595620865","1483862999672958977","faidhfudlali"
"1667709389896310789","Sun Jun 11 01:44:37 +0000 2023","0"," Siapa bilang gratis? Pendidikan itu juga pake biaya. Orang miskin gak boleh sekolah. Orang gak mampu gak punya kesempatan untuk mengenyam pendidikan. Mati saja kau! seakan perkataannya sekejam demikian","1667709389896310789","","","in","Itomori - Hida Mountains","0","0","0","https://x.com/bacanhawashwesy/status/1667709389896310789","1064219351836897281","bacanhawashwesy"
"1667697626324799490","Sun Jun 11 00:57:53 +0000 2023","0","Lulusan anak tk apa sd aja udah wisudaan di hotel bruhh. Biaya pendidikan (+gengsi) makin tinggi aja","1667697626324799490","","","in","Indonesia","0","0","0","https://x.com/hairera18/status/1667697626324799490","178737165","hairera18"
"1667533012781895680","Sat Jun 10 14:03:46 +0000 2023","0"," pa aku mau lnjt kuliah Bapa biaya in cuman sampe smk selebihnya cari sndri EH BNRAN LEPAS TANGGUNG JAWAB ANYING BUKAN PENDIDIKAN DOANG TPI SEMUANYA oalah jancok","1667533012781895680","","","in","","0","0","0","https://x.com/junjunijun03/status/1667533012781895680","1273244007892574208","junjunijun03"
"1667531403204886536","Sat Jun 10 13:57:22 +0000 2023","0","Liat jumlah UKT dari beberapa Univ berlewatan di timeline bikin ngeri sendiri. Mampu ga nih nguliahin anak kalau biaya pendidikan naiknya ga kira2 gini? Bakalan ada perubahan ga ya?","1667531403204886536","","","in","Yogyakarta, Indonesia","0","1","0","https://x.com/CorryLauraS/status/1667531403204886536","340282499","CorryLauraS"
"1667512528954609664","Sat Jun 10 12:42:22 +0000 2023","0","Itu hak mereka si ngomong kayak gitu cuman sepengalaman dan sepenglihatan gw gak kayak gitu faktanya. Semakin banyak kita ngeluarin biaya pendidikan hasil yang kita dapat juga lebih terlihat.","1667512528954609664","","","in","","0","0","0","https://x.com/3to3Bluegirl/status/1667512528954609664","1540777385788076033","3to3Bluegirl"
"1667486674052603904","Sat Jun 10 10:59:38 +0000 2023","0","Agak serem ya kalo mikirin biaya pendidikan anak. Makanya jangan dipikirin lah pasrahin aja semua sama Allah. Biar gak pusing sendiri mikir yg belum terjadi","1667486674052603904","","","in","","0","0","0","https://x.com/Anggi_DanLagi/status/1667486674052603904","109227580","Anggi_DanLagi"
"1667414914267484160","Sat Jun 10 06:14:29 +0000 2023","0","Program Pendidikan dan Pelatihan 1 Tahun Magistra Utama Lebih Siap dan Cepat Kerja Dibuka pendaftaran angkatan 28 dptkan potongan biaya pendidikan lbh banyak daftar ulang di Gel 1 Info lengkap 082 134 134 634 Kunjungi website https://t.co/lQKH3CXFU8 #kuliah #mahasiswa https://t.co/p9IFYsKZ2w","1667414914267484160","https://pbs.twimg.com/ext_tw_video_thumb/1667414835120992256/pu/img/nJAfnemtcURg3moE.jpg","","in","Jl. Bogor 40, Malang, Jatim","0","0","0","https://x.com/MagistraUtama96/status/1667414914267484160","1555083065743253504","MagistraUtama96"
"1667402870868807682","Sat Jun 10 05:26:37 +0000 2023","0","Karena banyak nonton drakor jadi mikir kalo urusan pendidikan anak indo hampir sama kayak koreya. Yang mikirin pendidikan anak kebanyakan ibunya mulai dari milih sekolah milih tempat les dateng pertemuan ortu dll. Bapaknya tinggal kasih biaya pendidikannya.","1667402870868807682","","","in","Lombok Barat, NTB, Indonesia","0","0","0","https://x.com/arifadr/status/1667402870868807682","77243921","arifadr"
"1667397660092035072","Sat Jun 10 05:05:55 +0000 2023","0","MA'HAD UMAR BIN KHATTAB HADIR DI MUSLIM LIFEFAIR.. Mau dapat DISKON PENDAFTARAN PROGRAM REGULER JULI 2023? Ada GIVEAWAY VOUCHER BELAJAR di YPIA Academy juga lho! Ada BANYAK DISKON kitab panduan &amp; biaya pendidikan juga lho! Yuk kunjungi booth kami nomor 76! https://t.co/Xma1Pfg1bZ","1667397660092035072","https://pbs.twimg.com/media/FyPJVcQaYAE083L.jpg","","in","Yogyakarta","0","0","0","https://x.com/mubk_jogja/status/1667397660092035072","1249463029","mubk_jogja"
"1667381070013030401","Sat Jun 10 04:00:00 +0000 2023","0","Bingung biaya pendidikan anak yang mahal? ‍ Tenang kan ada asuransi pendidikan yang bisa mewujudkan mimpi anakmu. Yuk baca manfaatnya di artikel ini! https://t.co/kjsGxUa2Xl #Qoala #SelaluAdaBuatKamu #asuransi #asuransipendidikan","1667381070013030401","","","in","Indonesia","0","0","0","https://x.com/qoalaid/status/1667381070013030401","1163278273909886976","qoalaid"
"1667358961367134208","Sat Jun 10 02:32:09 +0000 2023","1","Bagi yg mau punya anak silahkeun dipertimbangkan kembali Biaya pendidikan dan printilannya bukan main main yaa gengs","1667358961367134208","","","in","","0","0","0","https://x.com/mengskuyy/status/1667358961367134208","547443892","mengskuyy"
"1667203014166478849","Fri Jun 09 16:12:28 +0000 2023","0","#sobattangerang - Memasuki tahun ajaran baru 2023/2024 Pemerintah Kota (Pemkot) Tangerang melalui Dinas Pendidikan menggratiskan biaya 146 SD dan SMP swasta di Kota Tangerang. https://t.co/ZeD8G9jMHp","1667203014166478849","https://pbs.twimg.com/ext_tw_video_thumb/1667202881328644096/pu/img/gCwOmURq0o_AMTLS.jpg","","in","Kota Tangerang, Banten","0","3","0","https://x.com/tng_tv/status/1667203014166478849","737840089863053318","tng_tv"
"1667195807886643201","Fri Jun 09 15:43:50 +0000 2023","2","Barusan baca forum diskusi DU di grup yg ngomongin fee DU jaga ada yg flat 100k dan ngebandingin sama tukang parkir yg sehari dpt 1 3jt miris bgt ngeliat kenyataan biaya pendidikan kedokteran segini belum lagi masa studi nya ","1667195807886643201","","","in","825, Dream-ro 7-gil, Dream-gu","0","1","0","https://x.com/Clairdelune_66/status/1667195807886643201","1155712570839355392","Clairdelune_66"
"1667125513067073540","Fri Jun 09 11:04:30 +0000 2023","0","Testimoni peserta didik Magistra Utama yang telah Sukses Bekerja Sebelum Lulus Dibuka pendaftaran angkatan 28 dptkan potongan biaya pendidikan lbh banyak daftar ulang di Gel 1 Info lengkap 082 134 134 634 Kunjungi website https://t.co/lQKH3CXFU8 #kuliah #mahasiswa https://t.co/1I1Q9bISFt","1667125513067073540","https://pbs.twimg.com/ext_tw_video_thumb/1667125438500708353/pu/img/Qv8QHOwfiNQ6S05e.jpg","","in","Jl. Bogor 40, Malang, Jatim","0","0","0","https://x.com/MagistraUtama96/status/1667125513067073540","1555083065743253504","MagistraUtama96"
"1667110457352802304","Fri Jun 09 10:04:41 +0000 2023","0","Belum punya anak tapi udah pusing mikirin biaya pendidikan anak. Hanya sandwich generation yang bisa memahami ini","1667110457352802304","","","in","South Jakarta","0","0","0","https://x.com/tekad_something/status/1667110457352802304","3314936208","tekad_something"
"1667101319168143360","Fri Jun 09 09:28:22 +0000 2023","0","Gajiku 2 bulan udah nutup biaya pendidikan profesiku tapi kok habis buat bayar pinjol yaaaa","1667101319168143360","","","in","27 / Bali-Jkt  ","0","0","0","https://x.com/flxwerangels/status/1667101319168143360","1655918508310679555","flxwerangels"
"1667076017280909312","Fri Jun 09 07:47:49 +0000 2023","10","Hari ini #RelawanTangguh @SYatimPedalaman berkunjung ke kesekolah anak2 yang ingin dibeasiswai. Menjalankan amanah untuk memberikan beasiswa ke mereka yg benar2 butuh biaya pendidikan Alhamdulillah 10rb/bulan teman2 banyak membantu mereka https://t.co/7HUjCCHRce https://t.co/TypUbX75jx","1667076017280909312","https://pbs.twimg.com/ext_tw_video_thumb/1667075878533349377/pu/img/1rEgckrbRfJGkwdU.jpg","","in","Indonesia","0","0","1","https://x.com/IbrahimAzzaini/status/1667076017280909312","1069779728578437121","IbrahimAzzaini"
"1667054392451952652","Fri Jun 09 06:21:54 +0000 2023","33","Alhamdulillah sudah sampai. Karena hari Jum'at seluruh siswanya pada seragam putih. Madrasah Ibtidaiyah swasta sudah berdiri ±8 tahun biaya pendidikan anak gratis kecuali buku dan seragam sekolah. Yang kita berikan yaitu untuk menunjang pendidikan yatim beli seragam dan buku https://t.co/lxmRBMoBaf","1667054392451952652","https://pbs.twimg.com/ext_tw_video_thumb/1667054285748830208/pu/img/9X8Bw_HrOXep8iyW.jpg","","in","","1","0","4","https://x.com/SofiaTarihoran/status/1667054392451952652","1181467449725554694","SofiaTarihoran"
"1667050199955435520","Fri Jun 09 06:05:14 +0000 2023","14","Kini sampailah kita dalam satu generasi yg seolah mewajarkan pendidikan mahal. Atau lebih tepatnya kita tumbuh di satu era yg merasa ngilu dgn biaya pendidikan mahal tapi tidak melakukan apapun. Lagi kita kehilangan imajinasi akan perubahan sosial dari konstelasi laknat ini https://t.co/9aCxRiwOTd","1667050199955435520","https://pbs.twimg.com/media/FyKL-olWcAM9YNI.jpg","","in","Yogyakarta - Palembang","0","1","1","https://x.com/rgantas/status/1667050199955435520","1492990375","rgantas"
"1667023979801083905","Fri Jun 09 04:21:03 +0000 2023","0","Pendidikan Inklusif Siswa ABK Tak Sepenuhnya Merasakan Hak Pendidikan Gratis: Biaya menjadi masalah yang mengakibatkan siswa ABK sulit untuk mendapatkan pendidikan inklusif secara gratis. https://t.co/1eVzrI9aS9","1667023979801083905","","","in","Indonesia","0","0","0","https://x.com/pikiran_rakyat/status/1667023979801083905","58880688","pikiran_rakyat"
