"conversation_id_str","created_at","favorite_count","full_text","id_str","image_url","in_reply_to_screen_name","lang","location","quote_count","reply_count","retweet_count","tweet_url","user_id_str","username"
"1669857752238424065","Sat Jun 17 00:01:27 +0000 2023","0","Aku udah nabung biaya pendidikan anak ","1669857752238424065","","","in","she / her","0","0","0","https://x.com/puppysmile229/status/1669857752238424065","1591428555233456128","puppysmile229"
"1669817107020914689","Fri Jun 16 21:19:56 +0000 2023","0","Acara wisuda'an dari mulai tingkat SD SMP SMA bahkan dari tingkat TK juga sangat membebani Orangtua Siswa/murid. Karena harus keluar biaya yang tidak sedikit. Kiranya Dinas Pendidikan Terkait bisa menghentikan acara WISUDA'AN untuk tingkat pendidikan tersebut.","1669817107020914689","","","in","kedaung barat","0","0","0","https://x.com/ZeniAguz/status/1669817107020914689","2933121530","ZeniAguz"
"1669727301200932869","Fri Jun 16 15:23:05 +0000 2023","5","Jog dimusuhin 1 rumah gatau apa salahnya terusan ibu ngungkit2 biaya pendidikan ya Allah rasanya sakit bgt siapa coba yg minta di lahirin? Pdhl aku juga ga pernah minta di lahirin.","1669727301200932869","","","in","RULES ADA DI LIKES","0","2","0","https://x.com/jogmfs/status/1669727301200932869","420821783","jogmfs"
"1669715039388041222","Fri Jun 16 14:34:21 +0000 2023","0","Lo pernah kepikiran ga sih kalo seandainya lo ga lolos snbt'23 trus seolah² lo ngerasa kayak ... lo ngecewain ortu yg udh rela ngeluarin duit byk buat biaya pendidikan lo selama ini","1669715039388041222","","","in","","0","0","0","https://x.com/azeyyyhere/status/1669715039388041222","1626481376949051393","azeyyyhere"
"1669699014747627520","Fri Jun 16 13:30:41 +0000 2023","0","Kata w mah gpp wisuda dr tk sd smp sma Karena kalo wisuda kuliah tuh blm tentu mereka bisa ada kesempatan karena biaya kuliah tuh mahal bgt Buat kenangan manis yg indah menempuh pendidikan","1669699014747627520","","","in","","0","0","0","https://x.com/iyuuhbanget/status/1669699014747627520","195264847","iyuuhbanget"
"1669683834252857344","Fri Jun 16 12:30:21 +0000 2023","4","3 hal yang suka bikin kepikiran bapak-ibu di rumah: 1. Lupa matiin kompor 2. Token listrik 3. Biaya pendidikan anak Sini Jagomin kasih solusi buat nomor 3 ","1669683834252857344","","","in","","0","2","0","https://x.com/jadijago/status/1669683834252857344","1295310997196955648","jadijago"
"1669670334558269443","Fri Jun 16 11:36:43 +0000 2023","0"," BEM INFORMATION CENTER [ SURAT EDARAN PEMBAYARAN UKT SEMESTER GASAL ] Hallo sobat ekonom! Berikut kami sampaikan mengenai Pembayaran Biaya Pendidikan/UKT semester Gasal 2023/2024 pada tanggal *10 Juli 2023 s.d. 28 Juli 2023*. https://t.co/9dp18B3zjH","1669670334558269443","https://pbs.twimg.com/media/FyvcOzfaAAEXM-L.jpg","","in","Yogyakarta, Indonesia","0","1","0","https://x.com/bemfebuny/status/1669670334558269443","492248393","bemfebuny"
"1669667819980750848","Fri Jun 16 11:26:43 +0000 2023","18","Ganjar Pranowo berupaya meningkatkan Indeks Pembangunan Manusia (IPM) melalui program SMKN Jateng gratis untuk siswa dari keluarga tidak mampu. Siswa yang masuk melalui seleksi akan ditempa pendidikan dan menetap di asrama. Semuanya gratis tanpa biaya mulai dari pendaftaran https://t.co/gUVPHS6Djh","1669667819980750848","https://pbs.twimg.com/ext_tw_video_thumb/1669667691819573249/pu/img/3HRAI8wW8eIz95vC.jpg","","in","lokalisasi kelas teri","0","1","11","https://x.com/triwul82/status/1669667819980750848","2695463725","triwul82"
"1669655794978271232","Fri Jun 16 10:38:56 +0000 2023","0","OVT buat calon orangtua seperti saya selain soal biaya pendidikan anak juga soal pergaulan. Takut banget anak2 nanti deket sama orang2 kek gini atau lebih takut malah ikutan jadi pelakunya :(","1669655794978271232","","","in","Majalaya,Jawa Barat,Indonesia","0","0","0","https://x.com/omnyaponakan/status/1669655794978271232","51725765","omnyaponakan"
"1669647048671662081","Fri Jun 16 10:04:11 +0000 2023","0","Siap-siap arek Suroboyo #GrowWithHacktiv8 menjadi bagian dari pertumbuhan talenta digital berkualitas dengan ikut Hacktiv8 Scholarship! Dapatkan 100% potongan biaya pendidikan untuk belajar Full Stack JavaScript di kampus Surabaya Hacktiv8. https://t.co/FuziqRUL79","1669647048671662081","https://pbs.twimg.com/media/FyvDW48aQAE4P7H.jpg","","in","Pondok Indah, BSD, Surabaya","0","1","0","https://x.com/hacktiv8id/status/1669647048671662081","725275279124365312","hacktiv8id"
"1669632269794041857","Fri Jun 16 09:05:28 +0000 2023","10","Sayangnya ini data cuma sepotong-sepotong egk diikuti dg persebaran data fakultas &amp; kampus beserta rerata biayanya tapi tetap saja menunjukkan biaya mahal yg hrs ditanggung mahasiswa di daerah ini. Apakah solusinya pendidikan tinggi gratis? Bentar dulu. https://t.co/hHEPVpawdp","1669632269794041857","","","in","","0","0","1","https://x.com/CeletukWarga/status/1669632269794041857","1279726915469733889","CeletukWarga"
"1669629046031011841","Fri Jun 16 08:52:39 +0000 2023","0","Anggaran Pendidikan 20% amanat UUD tapi biaya kuliah (UKT) levih mahal dari sekolah swasta ada apa dengan sistem penghitungan Uang Kuliah?","1669629046031011841","","","in","Indonesia","0","0","1","https://x.com/partaimurba/status/1669629046031011841","276330740","partaimurba"
"1669615039526084608","Fri Jun 16 07:57:00 +0000 2023","0","Lebih ke dananya gasih jujur menurut ku juga wisuda untuk jenjang pendidikan sebelum Perguruan tinggi ngga terlalu penting bayar biaya sekolah aja udh makin mahal mending perpisahan aja","1669615039526084608","","","in","","0","0","0","https://x.com/rul_azizah/status/1669615039526084608","1383759518119563265","rul_azizah"
"1669570471254433794","Fri Jun 16 04:59:54 +0000 2023","0","Ini baru biaya pendidikan belum makan listrik pulsa bbm rumah piknik (mungkin) https://t.co/dGhKhIMkUV","1669570471254433794","https://pbs.twimg.com/media/FyuBeiCakAEM-Zg.jpg","","in","Yogyakarta, Indonesia","0","0","0","https://x.com/ferie182/status/1669570471254433794","346996617","ferie182"
"1669564515053346816","Fri Jun 16 04:36:14 +0000 2023","0","SMK Diponegoro Samboja Tahun Pelajaran 2023/2024 Fasilitas memadai Pengajar tersertifikasi dan Pendidikan berkarakter PROMO : - Gratis Biaya Pendaftaran - Gratis SPP 12 Bulan - Bebas Uang Gedung ️ Call Center ️ Umi Sakdiyah S.Pd (WA) : 085246101703 ️ Basman Rasyid S.Pdi","1669564515053346816","","","in","","0","1","0","https://x.com/s1_malik/status/1669564515053346816","1569540363580493824","s1_malik"
"1669544713110835202","Fri Jun 16 03:17:32 +0000 2023","1","Untung Dapat Beasiswa Segini Biaya Pendidikan Putri Ariani di Juilliard School https://t.co/pdPkm1s2NE","1669544713110835202","","","in","","0","0","1","https://x.com/VIVAcoid/status/1669544713110835202","41730943","VIVAcoid"
"1669530502771138561","Fri Jun 16 02:21:04 +0000 2023","6","Untuk Dapat Beasiswa Segini Biaya Pendidikan Putri Ariani di Juilliard School https://t.co/QF935oblOj","1669530502771138561","","","in","","0","0","1","https://x.com/VIVAcoid/status/1669530502771138561","41730943","VIVAcoid"
"1669510801663852544","Fri Jun 16 01:02:47 +0000 2023","0"," udah males sama tugas enak kerja dapet duit no aku takut biaya kuliahku semakin jadi beban sementara tanggung jawab orangtuaku masih banyak dan masih panjang. siapa sih yang mau direndahkan karena pendidikan? https://t.co/7rGHodSbSD","1669510801663852544","https://pbs.twimg.com/media/FytLOOlakAAestV.jpg","","in","","0","0","0","https://x.com/x_veautiful/status/1669510801663852544","1216070757463158784","x_veautiful"
"1669492499919036416","Thu Jun 15 23:50:04 +0000 2023","0","Coba biaya hidup n pendidikan ga mahal. Mungkin ortu2 yg ngerasa anaknya investasi dan mesti balikin modal jumlahnya bisa berkurang tingkat stres anak muda (n ortu) berkurang","1669492499919036416","","","in","","0","0","0","https://x.com/flamevoir/status/1669492499919036416","1039059697","flamevoir"
"1669465708630269953","Thu Jun 15 22:03:36 +0000 2023","0","Gila ini lama2 biaya pendidikan","1669465708630269953","","","in","Japan","0","0","0","https://x.com/kogoromilenial/status/1669465708630269953","1310222077702541319","kogoromilenial"
"1669350499722883075","Thu Jun 15 14:25:48 +0000 2023","0","Kepada Menteri Pendidikan wisuda yang dilakukan Anak TK SD SMP dan SMA sebaiknya dilarang - biaya semakin mahal dan memberatkan bagi orang tua.","1669350499722883075","","","in","Indonesia","0","0","0","https://x.com/partaimurba/status/1669350499722883075","276330740","partaimurba"
"1669340824793120769","Thu Jun 15 13:47:22 +0000 2023","0","beneran nyiapin dana pendidikan anak kudu istiqomah bin getol nih makin mahal aja biaya pendidikan eui","1669340824793120769","","","in","Carat Land, Joshushushu Land","0","0","0","https://x.com/shuapasta/status/1669340824793120769","1013193041526419457","shuapasta"
"1669327653118316545","Thu Jun 15 12:55:01 +0000 2023","0","Ngeliat biaya pendidikan di sekolah swasta yg bagus bikin sedikit khawatir.. kira kira kami bisa gak ya.. klo di hitung kalkulator manusia mah mungkin bikin keteteran.. tapi seseungguhnya allah yg maha kaya. Semoga kami bisa ya nak.","1669327653118316545","","","in","Bandung Kulon, Indonesia","0","0","0","https://x.com/ratu_khoeriyah/status/1669327653118316545","3052166569","ratu_khoeriyah"
"1669314825095376897","Thu Jun 15 12:04:03 +0000 2023","3","Calon maba ITS udah pada tau belum biaya pendidikan di ITS tuh berapa? Bentar lagi udah masuk masa perkuliahan loh #its #institutteknologisepuluhnopember #belajarbarenggepmedia #pejuangptn #utbk2023 #utbk #ujianmandiri2023 #ujianmandiri #seleksimandiri https://t.co/JJEePAe6PN","1669314825095376897","https://pbs.twimg.com/media/FyqY-fwaEAA3Ut8.jpg","","in","","0","1","0","https://x.com/gep_media/status/1669314825095376897","1547375203423887360","gep_media"
"1669292543375478786","Thu Jun 15 10:35:30 +0000 2023","0","Inflasi biaya pendidikan yang tinggi membuat biaya kuliah makin mahal dari waktu ke waktu Salah satu cara mitigasinya bisa mulai investasi sedari sekaeang apalagi kalau anak masih kecil Masih ada waktu belasan tahun untuk rutin investasi mempersiapkan dana pendidikan anak","1669292543375478786","","","in","Jakarta, Indonesia","0","0","0","https://x.com/febians25/status/1669292543375478786","1009095326588809218","febians25"
"1669292249627398144","Thu Jun 15 10:34:20 +0000 2023","0","Seharusnya sekolah&amp;lembaga pendidikan lbh Fokus meningkatkan soft skill dan ketarampilan lain peserta didiknya dgn Memaksimalkan proses belajar-mengajar seminar low budget&amp; Tontonan edukasi yg hrmat biaya lainnya. Bukan justru memperbanyak seremonial tour wisuda gathring dll.","1669292249627398144","","","in","Bekasi, Jawa Barat","0","0","0","https://x.com/fauzyahmad95/status/1669292249627398144","4880769689","fauzyahmad95"
"1669292190189899776","Thu Jun 15 10:34:06 +0000 2023","60","Biaya pendidikan di Al Zaytun itu tidak murah karena sebanding dengan fasilitas yang diberikan. Tapi apakah para orang tua santri gak tau ada yang gak beres dengan pesantren tersebut? https://t.co/BsHrFsBbCg","1669292190189899776","https://pbs.twimg.com/ext_tw_video_thumb/1669292156958408705/pu/img/0SxTvB5ceip2W8Yl.jpg","","in","","0","11","21","https://x.com/HisyamMochtar/status/1669292190189899776","853069924956160000","HisyamMochtar"
"1669286136861306882","Thu Jun 15 10:10:03 +0000 2023","0","Dengan memiliki penghasilan tetap. Seseorang yang sebelumnya kelas miskin dapat naik kelas ke kelas menengah. Dan dibilang gak mampu juga tidak dibilang kaya ya enggak. Bener2 sekhawatir itu dengan biaya pendidikan kedepannya ","1669286136861306882","","","in","Indonesia","0","1","0","https://x.com/muhnaim_/status/1669286136861306882","572744005","muhnaim_"
"1669282466149072896","Thu Jun 15 09:55:28 +0000 2023","0","Buat Kamu Camaba mohon untuk berhati-hati dalam melakukan pembayaran biaya seleksi maupun biaya pendidikan! Lakukan pembayaran melalui nomor Virtual Account atas nama Kamu sendiri ya. https://t.co/AkHBLUVF74","1669282466149072896","https://pbs.twimg.com/media/Fyp7i7zaYAI_Yji.jpg","","in","Grogol Petamburan, Indonesia","0","1","1","https://x.com/usakti_official/status/1669282466149072896","961818871744282624","usakti_official"
"1669279098135531522","Thu Jun 15 09:42:05 +0000 2023","0","Apakah orang yg ngeluh biaya pendidikan mahal dan berharap guru sejahtera adalah orang yang sama?","1669279098135531522","","","in","","0","0","0","https://x.com/hargoswebo/status/1669279098135531522","102907643","hargoswebo"
"1669234836664643584","Thu Jun 15 06:46:12 +0000 2023","0","sebenernya kita mampu kalau biaya pendidikan gak separah ini wkwk mehong bgt brouu sampe ada yg setara sama harga dp mobil unit apart atau rumah","1669234836664643584","","","in","km mikirnya ak dmn coba ksh tw","0","1","0","https://x.com/druipg/status/1669234836664643584","1455045489443819520","druipg"
"1669233796355588097","Thu Jun 15 06:42:04 +0000 2023","0","Yaallah pgn pendidikan lg tp analis pgn jd org lab mudah2an bisaa biaya sendiri lg sambil kerja aamiin huhu","1669233796355588097","","","in","","0","0","0","https://x.com/siniwbisikin/status/1669233796355588097","981116511606644737","siniwbisikin"
"1669232767387975680","Thu Jun 15 06:37:59 +0000 2023","2","Jadi inget 3 mahasiswi keperawatan untirta undur diri karena gak sanggup bayar ukt awal :) betapa mirisnya pendidikan di Indonesia bisa mematikan mimpi seseorang cuma karena biaya.","1669232767387975680","","","in","🤍","0","1","0","https://x.com/adekchangbin/status/1669232767387975680","703833628699000832","adekchangbin"
"1669226990954504192","Thu Jun 15 06:15:02 +0000 2023","0","Demo Damai orang tua di kantor Gubernur karena Biaya Pendidikan Otsus tidak bayar oleh BPSDM. Banyak mahasiswa luar negri dan dalam negri terancam DROPOUT Kamis Juni 13 Lokasi: Kantor Gubernur Prov Papua https://t.co/QmMcuuf3QR","1669226990954504192","https://pbs.twimg.com/media/FypJGcLWAAExxGW.jpg","","in","","0","0","0","https://x.com/MrBlack15951017/status/1669226990954504192","771141945402032128","MrBlack15951017"
"1669221111178104832","Thu Jun 15 05:51:40 +0000 2023","0","Magistra Utama Program Pendidikan dan Pelatihan 1 Tahun Lebih Siap dan Cepat Kerja Dibuka pendaftaran angkatan 28 dptkan potongan biaya pendidikan lbh banyak daftar ulang di Gel 1 Info lengkap 082 134 134 634 Kunjungi website https://t.co/lQKH3CXFU8 #kuliah #mahasiswa https://t.co/cB5zzBtIEM","1669221111178104832","https://pbs.twimg.com/ext_tw_video_thumb/1669221079062282241/pu/img/k-BQfm7BuJyUW7-a.jpg","","in","Jl. Bogor 40, Malang, Jatim","0","0","0","https://x.com/MagistraUtama96/status/1669221111178104832","1555083065743253504","MagistraUtama96"
"1669204077664931841","Thu Jun 15 04:43:59 +0000 2023","86","INFO SE PEMBAYARAN BIAYA PENDIDIKAN/UKT SEMESTER GASAL 2023/2024 https://t.co/wmgskNoGwm","1669204077664931841","https://pbs.twimg.com/media/Fyo0LslaIAADA2t.jpg","","in","Yogyakarta, Indonesia","7","5","5","https://x.com/unycommunity/status/1669204077664931841","597426380","unycommunity"
"1669188225506877440","Thu Jun 15 03:40:59 +0000 2023","0","Baca reply replynya... Sekarang kebayang kan biaya pendidikan itu banyak biaya sisihannya Makanya kalo punya anak itu bener2 mayoritas income buat pendidikan anak ","1669188225506877440","","","in","","0","0","0","https://x.com/askmearmything/status/1669188225506877440","1014757048553127936","askmearmything"
"1669185979943620609","Thu Jun 15 03:32:04 +0000 2023","3","Pembayaran biaya pendidikan secara online ini akan lebih menghemat waktu. Tertarik untuk mencobanya? https://t.co/XV20ZWdzce","1669185979943620609","","","in","Jakarta","0","0","1","https://x.com/kompascom/status/1669185979943620609","23343960","kompascom"
"1669185010904223745","Thu Jun 15 03:28:13 +0000 2023","0","Jd inget dulu alm papa bilang gak ikut wisuda kelulusan sarjana krn gk ada biaya pesta tsb. Namanya wisuda kan sbnrny kayak ceremony pesta perayaan lah ya utk anak2 yg uda menyelesaikan pendidikan dan bersiap menuju dunia sesungguhnya. Cari duit utk hidup!","1669185010904223745","","","in","","0","1","0","https://x.com/PinpanValentine/status/1669185010904223745","112432050","PinpanValentine"
"1669181946705088514","Thu Jun 15 03:16:02 +0000 2023","0","Cara Bayar Biaya Pendidikan di Blibli dengan Mudah https://t.co/bNfouVxGzc","1669181946705088514","","","in","Indonesia","0","0","0","https://x.com/KompasEkonomi/status/1669181946705088514","188438662","KompasEkonomi"
"1669180390760919042","Thu Jun 15 03:09:51 +0000 2023","2"," Fakta yg menyedihkan tp benar di masa depan akan sgt sulit menguliahkan anak dg peningkatan biaya pendidikan n gaji yg tdk sesuai Ingat dulu ortu dg gaji 3.5 jt biaya kuliah per semester 750k Skrg gaji beliau 4.5jt biaya kuliah standar sdh 2.5jt n biaya hidup jg smkn tinggi","1669180390760919042","","","in","BTOB","0","4","0","https://x.com/GeMelLoveSik/status/1669180390760919042","1175318472995172353","GeMelLoveSik"
"1669176863309299714","Thu Jun 15 02:55:50 +0000 2023","0","Biaya pendidikan makin mahal aja ","1669176863309299714","","","in","","0","0","0","https://x.com/onyourlisa/status/1669176863309299714","1320750627689906176","onyourlisa"
"1669162582480154624","Thu Jun 15 01:59:05 +0000 2023","1","ada tanggungan biaya pendidikan adik dan pengeluaran tak terduga yg harus ditanggung Udah biasa jd tulang punggung switch jd tulang rusuk enak kali ya hahaha","1669162582480154624","","","in","Jakarta, Indonesia","0","0","0","https://x.com/laailyrhus/status/1669162582480154624","236720161","laailyrhus"
"1669093806703280129","Wed Jun 14 21:25:48 +0000 2023","1","Yang saya lakukan kerja income tabung buat biaya pendidikan kasih orang tua invest ke peternakan buat biaya adik kuliah. . Ya bukannya pamer sih. I mean bangga bisa sekolahkan adik sampek kuliah.","1669093806703280129","","","in","Kota Kediri, Indonesia","0","0","0","https://x.com/Ranggadisetya/status/1669093806703280129","582583998","Ranggadisetya"
"1669014641631203329","Wed Jun 14 16:11:14 +0000 2023","1","Gakuat kali aku dengar drama finansial keluarga middle income trap yang punya banyak hutang tapi perlu ada beban emosional ngurus orang sana sini tp gabisa dapat bantuan uang pendidikan dan biaya maintenance keluarga yang harus dibayar2 terus.","1669014641631203329","","","in","Singapore","0","0","0","https://x.com/IamMemet07/status/1669014641631203329","1574657275545128960","IamMemet07"
"1669008083232899072","Wed Jun 14 15:45:10 +0000 2023","0","Habis bayar biaya konferensi langsung jadi semangat nulis. Ga mau rugi sekian banyak. &gt;_&lt; Pendidikan tu mahal. Contohnya ya yang begini ini.","1669008083232899072","","","in","indonesia","0","0","0","https://x.com/darkiepadmae/status/1669008083232899072","211367230","darkiepadmae"
"1669007307353755649","Wed Jun 14 15:42:05 +0000 2023","0","T..tapi yayasan pendidikan di sekolah tempatku ngajar ga dipungut biaya lagi dari TKIT-SMAIT udah include biaya awal masuk sekolah.","1669007307353755649","","","in","","0","0","0","https://x.com/imkikiy/status/1669007307353755649","463431388","imkikiy"
"1668996664080625666","Wed Jun 14 14:59:47 +0000 2023","0","2045 menuju era keemasan? Pendidikan masih blm bisa dirasakan oleh semua WN Biaya pendidikan Tk-Kuliah masih mahal. Apalagi ya? Apa iya masih bisa dapet emas? Perak aja blm tentu hehe.","1668996664080625666","","","in","","0","0","0","https://x.com/Dodyharryy/status/1668996664080625666","1622808757","Dodyharryy"
"1668995928647139329","Wed Jun 14 14:56:52 +0000 2023","0","Ganti menterinya. Angkat pejabat yg berkomitmen wajib belajar/ kuliah minimal S 1. Bebaskan segala bentuk iuran. Belajar merdeka itu bebas halangan dan kendala. Biaya pendidikan 100% urusan dan tgjawab Pemerintah. Amanat UUD penghidupan yg layak bg WNI. https://t.co/RtjkRLRJTV","1668995928647139329","","","in","jkt - indonesia","0","0","0","https://x.com/bambang2k/status/1668995928647139329","112328236","bambang2k"
"1668981049651613699","Wed Jun 14 13:57:45 +0000 2023","0","tadi baca berita hanya 40% siswa SD di cimahi yang akan diterima di SMP Negeri karena minimnya kapasitas SMP Negeri di Kota Cimahi lalu melihat biaya kuliah di kampus negeri udah lebih mahal dari kampus swasta pengelolaan pendidikan di Indonesia semakin buruk ga sih?","1668981049651613699","","","in","cimahi","0","0","0","https://x.com/Day0Preventer/status/1668981049651613699","78018025","Day0Preventer"
"1668965946193743872","Wed Jun 14 12:57:44 +0000 2023","1","Jujur kurang setuju dgn acara wisuda anak TK SD SMP SMA di era pendidikan sekarang karena secara pribadi hal itu blm perlu.. Banyak orangtua yg mengeluhkan mahalnya biaya wisuda anak2 mrk terlebih mrk hrs bayar daftar ulang utk anak mrk yg lain yg lumayan besar nominalnya ️","1668965946193743872","","","in","Jakarta - Indonesia","0","1","1","https://x.com/Lady_lavina/status/1668965946193743872","48055156","Lady_lavina"
"1668888544247701504","Wed Jun 14 07:50:10 +0000 2023","0","Banyak yg ingin kuliah tapi biaya hidup dan biaya kuliah sangat mahal Kenapa ya di saat pendidikan begitu penting tp biaya kuliah dsn biaya hidup selalu yg menjadi masalah utamanya","1668888544247701504","","","in","bisa mewakili UT lomba🔗✨️","0","0","0","https://x.com/yoweaterybirds/status/1668888544247701504","1645065022996094982","yoweaterybirds"
"1668887637997023235","Wed Jun 14 07:46:33 +0000 2023","0","Magistra Utama Program Pendidikan dan Pelatihan 1 Tahun Lebih Siap dan Cepat Kerja Dibuka pendaftaran angkatan 28 dptkan potongan biaya pendidikan lbh banyak daftar ulang di Gel 1 Info lengkap 082 134 134 634 Kunjungi website https://t.co/lQKH3CXFU8 #kuliah #mahasiswa https://t.co/yt5fC6bJ1t","1668887637997023235","https://pbs.twimg.com/ext_tw_video_thumb/1668887507596103680/pu/img/X00kf3LPNkiqxgZV.jpg","","in","Jl. Bogor 40, Malang, Jatim","0","0","0","https://x.com/MagistraUtama96/status/1668887637997023235","1555083065743253504","MagistraUtama96"
"1668863645613428737","Wed Jun 14 06:11:13 +0000 2023","7","Alhamdulillah... Makasih ya untuk yang sudah peduli. Kita samperin sekolahnya diskusi dengan kepala sekolah dan guru². Hingga akhirnya terpilih lah 2 anak yang benar² membutuhkan biaya pendidikan sebab hampir putus sekolah Ikut yuk membeasiswai mreka mulai 10rb/bln https://t.co/Q2G5SDKhWN","1668863645613428737","https://pbs.twimg.com/media/Fyj-o0taAAA25YZ.jpg","","in","Indonesia","0","0","2","https://x.com/IbrahimAzzaini/status/1668863645613428737","1069779728578437121","IbrahimAzzaini"
"1668824785529503744","Wed Jun 14 03:36:48 +0000 2023","0","Liat perincian biaya pendidikan anak sambil banyak-banyak istighfar. YaAllah kudu kerja model gimanaa lagi","1668824785529503744","","","in","Ohara","0","0","0","https://x.com/kidungrenjanaa/status/1668824785529503744","1319327489806663681","kidungrenjanaa"
"1668813430114123776","Wed Jun 14 02:51:41 +0000 2023","0","Ini bener karena banyak sekolah yg matokin biaya wisuda ga ngotak. Padahal uangnya bisa untuk keperluan mendaftar ke jenjang pendidikan selanjutnya.","1668813430114123776","","","in","screw you!","0","0","0","https://x.com/arthemissoul/status/1668813430114123776","1500159326","arthemissoul"
"1668805475696279552","Wed Jun 14 02:20:04 +0000 2023","3","Mahasiswa S1 Universitas Gadjah Mada (UGM) yang membutuhkan bantuan biaya pendidikan bisa mendaftar beasiswa Yayasan Marga Pembangunan Jaya. https://t.co/cY3gXKJui7","1668805475696279552","","","in","Jakarta","0","0","1","https://x.com/kompascom/status/1668805475696279552","23343960","kompascom"
"1668784663014551552","Wed Jun 14 00:57:22 +0000 2023","0","yailah kalo beasiswa prestasi kaga ada palingan gue ntar ngepet dulu biar bisa masuk ugm dikira semua orang yang berprestasi kaya apa jadi bisa bayar biaya pendidikan yang mahal itu. satu-satunya jalan ya cuma beasiswa prestasi buset dah.","1668784663014551552","","","in","jeno only ","0","1","0","https://x.com/elepyuso/status/1668784663014551552","1384133456175669260","elepyuso"
"1668761354000531456","Tue Jun 13 23:24:45 +0000 2023","0","mari kita pikirkan lagi biaya pendidikan untuk kedepan","1668761354000531456","","","in","","0","0","0","https://x.com/dheness_/status/1668761354000531456","228260973","dheness_"
"1668713117067640832","Tue Jun 13 20:13:04 +0000 2023","0","6 Kecemasan Ini Kerap Dialami Orangtua Salah Satunya Biaya Pendidikan https://t.co/ChoavvQtx2 https://t.co/qxgqHRC8dF","1668713117067640832","https://pbs.twimg.com/media/Fyh1vDZacAECt2f.jpg","","in","","0","0","0","https://x.com/IDNTimes/status/1668713117067640832","388190238","IDNTimes"
"1668623700214820865","Tue Jun 13 14:17:46 +0000 2023","0","Kalo mikir balik modal ngganya mah tergantung waktu wkwkwk Aku ambil prodi pendidikan kurang lebih habis 200jt (include biaya hidup) sedangkan gaji guru honorer ditempatku ngga nyampe 500k/bulan. Kalo mau balik modal ya harus 400 bulan aka 33 tahun ","1668623700214820865","","","in","Indonesia","0","0","0","https://x.com/epepetiyin/status/1668623700214820865","1232230236647022592","epepetiyin"
"1668607125055238144","Tue Jun 13 13:11:54 +0000 2023","0","Butuh Bantuan Biaya Pendidikan? Yuk Manfaatkan Beasiswa PIP Begini Penjelasan Lengkapnya - https://t.co/HNZmTHJ9OV","1668607125055238144","","","in","Jakarta","0","0","0","https://x.com/kalderanews/status/1668607125055238144","817669043792420864","kalderanews"
"1668591375565324288","Tue Jun 13 12:09:19 +0000 2023","0","Cita cita gw dulu dokter anjir tapi pas liat biaya pendidikan nya ajgg gw ga jadi mundur","1668591375565324288","","","in","rant","0","0","0","https://x.com/kit5chyujin/status/1668591375565324288","1305656986894131202","kit5chyujin"
