"conversation_id_str","created_at","favorite_count","full_text","id_str","image_url","in_reply_to_screen_name","lang","location","quote_count","reply_count","retweet_count","tweet_url","user_id_str","username"
"1405798801198120960","Fri Jun 18 08:05:27 +0000 2021","6","UMS menjadi salah satu perguruan tinggi yang berhasil lolos seleksi Program Kompetisi Kampus Merdeka (PKKM) oleh Direktorat Jenderal Pendidikan Tinggi (Ditjen Dikti) dengan kedudukan di Liga 1. Baca berita selengkapnya di https://t.co/Xqy14ft36t @umsofficialid @MahasiswaUMS https://t.co/WCzCYD9ic9","1405798801198120960","https://pbs.twimg.com/media/E4JmLuPUYAMAxuy.jpg","","in","Pabelan, Surakarta, Id","0","0","2","https://twitter.com/infopabelan/status/1405798801198120960","215901944","infopabelan"
"1405790696313819136","Fri Jun 18 07:33:14 +0000 2021","0","Mutualku ada yg pernah ikut kampus merdeka kah?","1405790696313819136","","","in","","0","0","0","https://twitter.com/scorpiogirl21s/status/1405790696313819136","1254125412294090752","scorpiogirl21s"
"1405790184608649220","Fri Jun 18 07:31:12 +0000 2021","9","IISMA merupakan program baru yg diluncurkan oleh Kementerian Pendidikan dan Kebudayaan Riset &amp; Teknologi dalam rangka implementasi kebijakan Merdeka Belajar Kampus Merdeka &amp; menjadi salah satu program unggulan dari delapan program Kampus Merdeka. https://t.co/5ijJBaCVWq","1405790184608649220","","","in","Yogyakarta","0","0","3","https://twitter.com/majalahSM/status/1405790184608649220","836611718","majalahSM"
"1405788858650820610","Fri Jun 18 07:25:56 +0000 2021","0","ya Allah nyelesain tugas uas sama bikin berkat buat kampus merdeka","1405788858650820610","","","in","Edinburgh, Scotland","1","1","0","https://twitter.com/z8oro/status/1405788858650820610","1314163745518542849","z8oro"
"1405779855346569221","Fri Jun 18 06:50:10 +0000 2021","0","iri bgt knp kampusmerdeka baru dijalani sih?? kl 2017 dapet pasti kerjaan w apply2 magang aja n yg exchange krn ke convert sks hsjskjskhsj","1405779855346569221","","","in","","0","1","0","https://twitter.com/foolswh0dream/status/1405779855346569221","1051473408330883072","foolswh0dream"
"1405777567634788353","Fri Jun 18 06:41:04 +0000 2021","0","Strategi Talent boosting bernama program kampus merdeka. Geliat Maju Negeriku https://t.co/BcSSv7zmhv","1405777567634788353","https://pbs.twimg.com/media/E4JTPvyUYAEzWyo.jpg","","in","","0","0","0","https://twitter.com/AlexiaCinta/status/1405777567634788353","1350273656035819520","AlexiaCinta"
"1405777319881363462","Fri Jun 18 06:40:05 +0000 2021","0","Dengan program kampus Merdeka diharapkan mampu menjadi pionir untuk Indonesia kedepan. Geliat Maju Negeriku https://t.co/1ItyQmGFlA","1405777319881363462","https://pbs.twimg.com/media/E4JTBXDVcAUhSUR.jpg","","in","","0","0","0","https://twitter.com/PenuhCinta16/status/1405777319881363462","1347689265287766017","PenuhCinta16"
"1405776199666659333","Fri Jun 18 06:35:38 +0000 2021","0","Strategi talent booting itu bernama program kampus merdeka Geliat Maju Negeriku https://t.co/NB0hOQrK5Q","1405776199666659333","https://pbs.twimg.com/media/E4JR_zaVgAAhP0_.jpg","","in","","0","0","0","https://twitter.com/InsanMandiri3/status/1405776199666659333","1372412998745124870","InsanMandiri3"
"1405775786552872977","Fri Jun 18 06:34:00 +0000 2021","1","ambil Kampus Merdeka dimana y","1405775786552872977","","","in","","0","0","0","https://twitter.com/lavorit/status/1405775786552872977","1059117583461318656","lavorit"
"1405773593221292032","Fri Jun 18 06:25:17 +0000 2021","8","Pagi ini ke Undip bersama rombongan Komisi X... Sebelumnya siapa nih yang anak Undip atau alumni Undip? Di Undip kami membahas soal program kampus merdeka yang dicanangkan Kemendikbudristek ada yg sudah tahu juga apa program kampus merdeka? https://t.co/aRR0gXFdqP","1405773593221292032","https://pbs.twimg.com/media/E4JPoOwVUAQGF2O.jpg","","in","Semarang, Jawa Tengah","0","1","1","https://twitter.com/yoyoksukawi/status/1405773593221292032","260304063","yoyoksukawi"
"1405773339361124358","Fri Jun 18 06:24:16 +0000 2021","0","Geliat Maju Negeriku akan bisa terwujud apabila kolaborasi untuk mewujudkan gerakan merdeka belajar dan kampus merdeka di Indonesia bisa berjalan dengan baik. https://t.co/5SuNu7lpTN","1405773339361124358","https://pbs.twimg.com/media/E4JPZYsVUAIiAKo.jpg","","in","Jakarta Pusat, DKI Jakarta","0","0","0","https://twitter.com/SanggaBuanaAji/status/1405773339361124358","1417953438","SanggaBuanaAji"
"1405772463938564110","Fri Jun 18 06:20:48 +0000 2021","0","Kenapa pas udah lulus program kampus makin keren-keren dan visionerkuingin ikut kampus merdeka","1405772463938564110","","","in","","0","2","0","https://twitter.com/salpeeeee/status/1405772463938564110","157233645","salpeeeee"
"1405771965281959940","Fri Jun 18 06:18:49 +0000 2021","0","Program kampus merdeka sangat diharapkan untuk menghantar Indonesia maju Geliat Maju Negeriku https://t.co/b2YXGx04Xf","1405771965281959940","https://pbs.twimg.com/media/E4JOHlFUcAErlEr.jpg","","in","","0","0","0","https://twitter.com/PeopleCare16/status/1405771965281959940","1385581434975391747","PeopleCare16"
"1405770750728970241","Fri Jun 18 06:13:59 +0000 2021","0","Program Kampus Merdeka diharapkan menghantar menuju Indonesia maju. Geliat Maju Negeriku https://t.co/l2zscBBswV","1405770750728970241","https://pbs.twimg.com/media/E4JNCoxVkAccv5v.jpg","","in","","0","0","0","https://twitter.com/__wantaNKRI/status/1405770750728970241","1325364675534467073","__wantaNKRI"
"1405769871472742402","Fri Jun 18 06:10:29 +0000 2021","0","Program Kampus Merdeka diharapkan menghantar menuju Indonesia maju. Geliat Maju Negeriku https://t.co/U3nUJptUMH","1405769871472742402","https://pbs.twimg.com/media/E4JMPcgUYAEANX-.jpg","","in","","0","0","0","https://twitter.com/PakPoh_OneTa/status/1405769871472742402","1310515094128713730","PakPoh_OneTa"
"1405769340763316228","Fri Jun 18 06:08:23 +0000 2021","1","Program Kampus Merdeka diharapkan menghantar menuju Indonesia maju. Geliat Maju Negeriku https://t.co/Vd2Kf9rwaQ","1405769340763316228","https://pbs.twimg.com/media/E4JLwmuUUAEesOZ.jpg","","in","","0","0","0","https://twitter.com/WawaSakti/status/1405769340763316228","1348441453047910402","WawaSakti"
"1405767754049724421","Fri Jun 18 06:02:05 +0000 2021","0","owww jadi kurikulum kampus merdeka","1405767754049724421","","","in","babymons7er","0","0","0","https://twitter.com/veinzburn/status/1405767754049724421","985775130948255745","veinzburn"
"1405767482099519488","Fri Jun 18 06:01:00 +0000 2021","0","Kolaborasi sangatlah penting wujudkan gerakan merdeka belajar dan kampus merdeka Geliat Maju Negeriku https://t.co/ZIyEOkZQgW","1405767482099519488","https://pbs.twimg.com/media/E4JJt8fVcAAIsRu.jpg","","in","","0","0","0","https://twitter.com/dudurojobrono/status/1405767482099519488","737087958864547840","dudurojobrono"
"1405767234040086528","Fri Jun 18 06:00:01 +0000 2021","0","Program Kampus Merdeka diharapkan menghantar menuju Indonesia maju. Geliat Maju Negeriku https://t.co/1WcV0CJID8","1405767234040086528","https://pbs.twimg.com/media/E4JGnAyVoA4H6u6.jpg","","in","","0","0","0","https://twitter.com/SulungId2/status/1405767234040086528","1366555371335086083","SulungId2"
"1405766057919275008","Fri Jun 18 05:55:20 +0000 2021","0","[ZONA BEASISWA : Program Pertukaran Mahasiswa Merdeka] Ada kabar baik nih teman-teman Universitas Brawijaya telah membuka program Pertukaran Mahasiswa Kampus Merdeka. Selengkapnya silahkan cek ig : @kbmsi_ub SI JAYA! #ADVOKESMA_EMSIUB #INFOPERTUKARANPELAJAR_KBMSI https://t.co/2rFyDXncfo","1405766057919275008","https://pbs.twimg.com/media/E4JIw_dVUAYvz7c.jpg","","in","Malang, Indonesia","0","0","0","https://twitter.com/emsi_ub/status/1405766057919275008","2386083852","emsi_ub"
"1405762245494149121","Fri Jun 18 05:40:11 +0000 2021","0","tolong kampus merdeka kampus merdeka ini apa sebenarnya? kan memang udah lama merdeka","1405762245494149121","","","in","Kota Medan, Sumatera Utara","0","0","0","https://twitter.com/walimaarfa/status/1405762245494149121","277332027","walimaarfa"
"1405747887292567552","Fri Jun 18 04:43:08 +0000 2021","0","ugm_fess kampus merdeka tu bisa daftar magang ke banyak perusahan ga? Buat jaga jaga kalau yang lainnya ngga keterima","1405747887292567552","","","in","RULES","0","0","0","https://twitter.com/UGM_FESS/status/1405747887292567552","1277749122296983552","UGM_FESS"
"1405743911348281359","Fri Jun 18 04:27:20 +0000 2021","0","RT fpub_official Pertukaran Mahasiswa Merdeka! ikutan Program Pertukaran Mahasiswa Merdeka.. bakalan dapet kesempatan berkuliah di kampus lain dan berbagai peluang lain.. dapat pengalaman seru untuk belajar berkenalan dengan orang - orang baru C https://t.co/TYDNOnTf6z ","1405743911348281359","https://pbs.twimg.com/media/E4I0aieVEAsy5YK.jpg","","in","Malang","0","0","0","https://twitter.com/soilUB_official/status/1405743911348281359","1358469254","soilUB_official"
"1405743678702845958","Fri Jun 18 04:26:25 +0000 2021","2","Pertukaran Mahasiswa Merdeka! ikutan Program Pertukaran Mahasiswa Merdeka.. bakalan dapet kesempatan berkuliah di kampus lain dan berbagai peluang lain.. dapat pengalaman seru untuk belajar berkenalan dengan orang - orang baru Cek info lebih lengkapnya di link pada flayer https://t.co/yxqTvltNiE","1405743678702845958","https://pbs.twimg.com/media/E4I0aieVEAsy5YK.jpg","","in","FPUB","0","1","1","https://twitter.com/fpub_official/status/1405743678702845958","473555639","fpub_official"
"1405740323817459713","Fri Jun 18 04:13:05 +0000 2021","6","ugm_fess GUYS ADA YG IKUT PROGRAM MAGANG KAMPUS MERDEKA GA? Itu klo misal ikut skrng gitu bisa gak sih tanpa hrs konfrim ke kampus dulu atau gmn? Btw aku sem 4 udh ada pengalaman magang trs pengen nyoba magang lagi buat liburan nnt","1405740323817459713","","","in","RULES","0","3","0","https://twitter.com/UGM_FESS/status/1405740323817459713","1277749122296983552","UGM_FESS"
"1405737288961830915","Fri Jun 18 04:01:01 +0000 2021","0","Cetak SDM Siap Kerja Telkomsel Dukung Program Magang Kampus Merdeka https://t.co/PlY7Skwjdz","1405737288961830915","","","in","Sulawesi Tenggara, Indonesia","0","0","0","https://twitter.com/penasultra_id/status/1405737288961830915","1388567274","penasultra_id"
"1405733486950969349","Fri Jun 18 03:45:55 +0000 2021","24","Ada program baru nih! Daftar yuk di Program Kampus Merdeka Studi Independen Bersertifikat dengan kurikulum global bersama Dicoding. Program ini dapat diikuti dengan durasi 1 semester dan dapat dikonversi hingga 20 SKS dengan persetujuan pembimbing. Terus benefitnya apa? https://t.co/leiekJm74e","1405733486950969349","https://pbs.twimg.com/media/E4IrHzYUUAMFttU.jpg","","in","Indonesia","3","4","7","https://twitter.com/dicoding/status/1405733486950969349","2826650155","dicoding"
"1405731465099284487","Fri Jun 18 03:37:53 +0000 2021","0","Telkomsel dukung program Magang Kampus Merdeka dari Kemendikbudristek https://t.co/22N2DJvB5S","1405731465099284487","","","in","Makassar, Sulawesi Selatan","0","0","0","https://twitter.com/antaramakassar/status/1405731465099284487","1288496856","antaramakassar"
"1405724549086285824","Fri Jun 18 03:10:24 +0000 2021","0","wkwk gila sih program KampusMerdeka coba dari dulu ada ","1405724549086285824","","","in","Dunnya","0","0","0","https://twitter.com/haranobuhardo/status/1405724549086285824","241020769","haranobuhardo"
"1405724231405424640","Fri Jun 18 03:09:08 +0000 2021","0","UI Luncurkan Aplikasi Web Program Magang Kampus Merdeka https://t.co/EaOI4IKM6p","1405724231405424640","","","in","Jakarta - Indonesia","0","0","0","https://twitter.com/mediaindonesia/status/1405724231405424640","68930552","mediaindonesia"
"1405723244057923586","Fri Jun 18 03:05:13 +0000 2021","0","Program kampus merdeka sangat diharapkan menghantar menuju indonesia maju #LindungiRIDenganVaksin https://t.co/sYCiXdZYiV","1405723244057923586","https://pbs.twimg.com/media/E4Ih1XMVUAMbJAW.jpg","","in","Jakarta Capital Region","0","0","0","https://twitter.com/_cakalang_/status/1405723244057923586","1401320216647192576","_cakalang_"
"1405722724928954368","Fri Jun 18 03:03:09 +0000 2021","0","Strategi talent boosting itu bernama program kampus merdeka #LindungiRIDenganVaksin https://t.co/JyMrzjlaQy","1405722724928954368","https://pbs.twimg.com/media/E4IhXMjVgAER4oE.jpg","","in","Jakarta Capital Region","0","0","0","https://twitter.com/_cakalang_/status/1405722724928954368","1401320216647192576","_cakalang_"
"1405712454491860993","Fri Jun 18 02:22:20 +0000 2021","1","masih ga paham pertukaran mahasiswa kampus merdeka itu maksudnya th naon","1405712454491860993","","","in","","0","0","0","https://twitter.com/panpingween22/status/1405712454491860993","1666325155","panpingween22"
"1405710050950213633","Fri Jun 18 02:12:47 +0000 2021","0","Kampus Merdeka","1405710050950213633","","","in","GPS error","0","0","0","https://twitter.com/MP_Memanggil/status/1405710050950213633","44688516","MP_Memanggil"
"1405707355556220928","Fri Jun 18 02:02:05 +0000 2021","3","SELAMAT JUMAT PAGI SOB! Siapa yang belum tau soal Program Kampus Merdeka dari Kemendikbudristek?? Spesial mimimn buatin infografis soal 8 Program Kampus Merdeka yang bisa buat kamu belajar banyak hal baru di luar kampus! https://t.co/LenKxsVmTu","1405707355556220928","https://pbs.twimg.com/media/E4ITVl2UYA8uKnf.jpg","","in","","1","1","4","https://twitter.com/MasMenteri/status/1405707355556220928","891564038781415424","MasMenteri"
"1405702921770070018","Fri Jun 18 01:44:27 +0000 2021","0","magang kampus merdeka kayak gimana si.","1405702921770070018","","","in","Cyber.","1","0","0","https://twitter.com/useraame/status/1405702921770070018","1274150023362539522","useraame"
"1405701233742999554","Fri Jun 18 01:37:45 +0000 2021","0","Kolaborasi sangatlah penting wujudkan gerakan merdeka belajar dan kampus merdeka .. .. .. #LindungiRIDenganVaksin https://t.co/ie7oPajdPS","1405701233742999554","https://pbs.twimg.com/media/E4IN0kiVgAIQwzu.jpg","","in","Jakarta Capital Region","0","0","0","https://twitter.com/Anggrekpermata6/status/1405701233742999554","1379829978229960706","Anggrekpermata6"
"1405701077626867712","Fri Jun 18 01:37:08 +0000 2021","33","Kawan Kabinet simak yuk harapan Presiden @jokowi tentang 5 profil kompetensi lulusan perguran tinggi Indonesia yang diungkapkan pada acara Bincang Bersama Presiden Jokowi dalam rangka Festival Kampus Merdeka 2021 Selasa (15/06/2021) lalu. #PernyataanPresiden https://t.co/pP0KLScF9y","1405701077626867712","https://pbs.twimg.com/media/E4IMP6VUUAIj1cu.jpg","","in","Jakarta","0","1","7","https://twitter.com/setkabgoid/status/1405701077626867712","260686783","setkabgoid"
"1405697570324697088","Fri Jun 18 01:23:12 +0000 2021","3","Selamat pagi #SobatVokasi! Yuk simak penjelasan bagian terakhir Kampus Merdeka Vokasi. Program ini merupakan skema transformasi Dikti Vokasi yakni Dikti Vokasi yang semakin terintegrasi dengan dunia kerja &amp; menghasilkan lulusan kompeten produktif &amp; kompetitif. (1) #VokasiKeren https://t.co/x7fAf8fOWG","1405697570324697088","https://pbs.twimg.com/media/E4IKdPQUYAEAGa_.jpg","","in","Gedung D lt. 4, Kemendikbud","0","1","0","https://twitter.com/DiktiVokasi/status/1405697570324697088","1299188108127207424","DiktiVokasi"
"1405689968064794624","Fri Jun 18 00:52:59 +0000 2021","0","UI Luncurkan Aplikasi Web Program Magang Kampus Merdeka https://t.co/vEpIY8NTlP","1405689968064794624","","","in","Jakarta Capital Region, Indone","0","0","0","https://twitter.com/medcom_id/status/1405689968064794624","902837643024539651","medcom_id"
"1405656823353384961","Thu Jun 17 22:41:17 +0000 2021","0","Anak peteka gabisa ikutan kampus merdeka ya? Iyalah kan kampusnya terikat","1405656823353384961","","","in","Indonesia","1","1","0","https://twitter.com/albamastt/status/1405656823353384961","1130600263","albamastt"
"1405635964576272388","Thu Jun 17 21:18:24 +0000 2021","0","Oke kampus merdeka menarik jajal dah","1405635964576272388","","","in","Yogyakarta, Indonesia","0","0","0","https://twitter.com/archer_simp/status/1405635964576272388","2328514202","archer_simp"
"1405606732085166080","Thu Jun 17 19:22:14 +0000 2021","0","Wujud Kampus Merdeka Vokasi IPB pada Kandang Modern - https://t.co/TCOjwwvt4t","1405606732085166080","","","in","Cirebon","0","0","0","https://twitter.com/RumahPena/status/1405606732085166080","155424650","RumahPena"
"1405579112333254662","Thu Jun 17 17:32:29 +0000 2021","0","Enak bener si skrg kampus merdeka. Jirrrr dulu gw empot empotan Masuk Danone skrg ada programmnya","1405579112333254662","","","in","","0","0","0","https://twitter.com/migwort/status/1405579112333254662","2362480230","migwort"
"1405499214482841603","Thu Jun 17 12:15:00 +0000 2021","0","Berbagai program Kampus Merdeka memberikan peluang bagi mahasiswa agar dapat belajar langsung di dunia kerja. Dengan demikian mereka siap terjun ke dunia nyata. Nah sudah tahukah Sobat Muda tentang kebijakan Kampus Merdeka? #Dikbud #AdadiKompas https://t.co/3vW4v28iJT","1405499214482841603","","","in","ÜT: 62.478419,21.330711","0","0","0","https://twitter.com/kompasmuda/status/1405499214482841603","79237556","kompasmuda"
"1405495526708051970","Thu Jun 17 12:00:21 +0000 2021","17","Kami mendukung program Magang Kampus Merdeka guna mempersiapkan generasi muda Indonesia yang lebih berdaya dan mampu bersaing di level internasional. Yuk ambil bagian dari generasi perubahan dengan mendaftarkan diri di program ini https://t.co/bmKDvYEUn7. https://t.co/9TAM67YoEx","1405495526708051970","https://pbs.twimg.com/media/E4FSuxiVEAAz1kd.jpg","","in","Indonesia","0","2","4","https://twitter.com/Telkomsel/status/1405495526708051970","255409050","Telkomsel"
"1405492047444733963","Thu Jun 17 11:46:31 +0000 2021","0","pusing bgt dehh yaallah ngebantuin bapa ngurus data non asn adek ppdb mau ikutan kampus merdeka uas dateline laprak msh ada juga plissss stress berat nangis","1405492047444733963","","","in","","0","0","0","https://twitter.com/rocksaltcaramel/status/1405492047444733963","1277524850655948800","rocksaltcaramel"
"1405486719005347843","Thu Jun 17 11:25:21 +0000 2021","0","Telkomsel Dukung Program Magang Kampus Merdeka Perkuat Pengembangan Talenta Indonesia Berdaya Saing https://t.co/b8lWOV102G @indoict","1405486719005347843","","","in","INDONESIA","0","0","0","https://twitter.com/indoict/status/1405486719005347843","957482702","indoict"
"1405486680262406147","Thu Jun 17 11:25:11 +0000 2021","0","Telkomsel Dukung Program Magang Kampus Merdeka Perkuat Pengembangan Talenta Indonesia Berdaya Saing https://t.co/b8lWOUJoE6 via @indoict","1405486680262406147","","","in","INDONESIA","0","0","0","https://twitter.com/indoict/status/1405486680262406147","957482702","indoict"
"1405484489950650373","Thu Jun 17 11:16:29 +0000 2021","3","Program kampus merdeka seru seru woi ","1405484489950650373","","","in","Venezuela","0","1","0","https://twitter.com/mfdillahr/status/1405484489950650373","1215522685343551488","mfdillahr"
"1405480395320139776","Thu Jun 17 11:00:13 +0000 2021","0","Gila. Kampus Merdeka enak banget cuy. Kapan lagi ke Korea University student exchange...","1405480395320139776","","","in","","0","0","0","https://twitter.com/konstruktivis/status/1405480395320139776","2242063766","konstruktivis"
"1405476537697112069","Thu Jun 17 10:44:53 +0000 2021","1","Kmrn chat dosen perihal magang kampus merdeka. Samoe skrg gada info boleh ikut apa ga wkwk. Soalnya konversi sks nya 20 si. Mayan bgt ga si hahaha","1405476537697112069","","","in","","0","0","0","https://twitter.com/av0calypsee/status/1405476537697112069","1014134707829653504","av0calypsee"
"1405475781426302978","Thu Jun 17 10:41:53 +0000 2021","0","Tokopedia Buka Banyak Kesempatan Magang lewat Kampus Merdeka https://t.co/kH0W9y3S4t via @indoict","1405475781426302978","","","in","INDONESIA","0","0","0","https://twitter.com/indoict/status/1405475781426302978","957482702","indoict"
"1405474884856139778","Thu Jun 17 10:38:19 +0000 2021","1","#Infobintaro #KampusMerdeka - Tokopedia Buka Banyak Kesempatan Magang lewat Kampus Merdeka Simak selengkapnya di https://t.co/xCQZTySIUA #Bintaro #Tangsel #Tokopedia #HackathonDevcamp #InfoMagang #LowonganMagang https://t.co/fgPiqYvHI3","1405474884856139778","https://pbs.twimg.com/media/E4E_0FkVEAUPDC7.jpg","","in","Tangerang - Banten","0","0","0","https://twitter.com/Info_Bintaro/status/1405474884856139778","43105474","Info_Bintaro"
"1405465248631508993","Thu Jun 17 10:00:02 +0000 2021","0","Kampus Merdeka merupakan bagian dari kebijakan Merdeka Belajar yang memungkinkan mahasiswa melakukan berbagai kegiatan di luar kampus. @topanyuniarto #LitbangKompas #AdadiKompas https://t.co/KKDCFfqEr3","1405465248631508993","","","in","Palmerah, Jakarta","0","0","0","https://twitter.com/KompasData/status/1405465248631508993","771030588","KompasData"
"1405462492902400002","Thu Jun 17 09:49:05 +0000 2021","0","Kenapa ga dari dulu sih program kampus merdeka jalan ","1405462492902400002","","","in","Beks","0","0","0","https://twitter.com/irksyu/status/1405462492902400002","253470299","irksyu"
"1405461789681152000","Thu Jun 17 09:46:17 +0000 2021","6","#Assemblr dengan bangga mengumumkan bahwa kami telah resmi menjadi Mitra Kampus Merdeka! 🇮🇩 Kalau kamu mahasiswa tingkat akhir yang lagi mencari pengalaman magang daftarkan dirimu di https://t.co/NufOfJOmVM! Yuk gabung di tim Assemblr! #magang https://t.co/ElRsKnYKps","1405461789681152000","https://pbs.twimg.com/media/E4EzziAVgAA6JZB.jpg","","in","Bandung, Indonesia","0","0","5","https://twitter.com/assemblrworld/status/1405461789681152000","897321884001251329","assemblrworld"
"1405460608036884485","Thu Jun 17 09:41:35 +0000 2021","0","Perkuat Pengembangan Talenta Indonesia Berdaya Saing Telkomsel Hadirkan Kampus Merdeka https://t.co/wc55qVbDZ7","1405460608036884485","","","in","Indonesia","0","0","0","https://twitter.com/IDNNews_id/status/1405460608036884485","3250224038","IDNNews_id"
"1405458875902414848","Thu Jun 17 09:34:42 +0000 2021","1","[ Hasil Verifikasi Mahasiswa/i Kegiatan Magang Kampus Merdeka Kementrian ATR / BPN ] https://t.co/nlJe3pQnoT","1405458875902414848","https://pbs.twimg.com/media/E4ExZiLVgAA_FRW.jpg","","in","Semarang, Jawa Tengah","0","1","0","https://twitter.com/BEMUndip_/status/1405458875902414848","130747272","BEMUndip_"
"1405458583936929797","Thu Jun 17 09:33:33 +0000 2021","0","Perusahaan oke banyak buka intern tapi buat kampus merdeka wkwkwkw ya bisa ditebak kalo freshgraduate tentunya tak bisa","1405458583936929797","","","in","Kota Yogyakarta, Yogyakarta","0","2","0","https://twitter.com/auwaliiiii/status/1405458583936929797","1401592742","auwaliiiii"
"1405456481827266568","Thu Jun 17 09:25:12 +0000 2021","4","#MagangPam - Traveloka Internship X Kampus Merdeka - https://t.co/HSUn1oh7mz https://t.co/ljBxJCwDwX","1405456481827266568","https://pbs.twimg.com/media/E4EvNCbVIAMF9_Z.jpg","","in","Tokyo-to, Japan","0","2","1","https://twitter.com/infocariloker/status/1405456481827266568","1069906064756199424","infocariloker"
"1405450155843723268","Thu Jun 17 09:00:03 +0000 2021","1","Kampus merdeka sarana dapat pekerja murah dengan embel-embel fafifuwasweswosssshhh..","1405450155843723268","","","in","posisi","0","0","0","https://twitter.com/zatmumtaz/status/1405450155843723268","1150790544823468034","zatmumtaz"
"1405444737113362434","Thu Jun 17 08:38:31 +0000 2021","0","Programnya kampus merdeka seru-seru deh aku iri :(","1405444737113362434","","","in","","0","5","0","https://twitter.com/nisadinus/status/1405444737113362434","1154724153326391296","nisadinus"
"1405444102322221060","Thu Jun 17 08:36:00 +0000 2021","0","Telkomsel Dukung Kampus Merdeka Lewat Program Magang https://t.co/ZvyxZgfmzJ lewat @zonasultracom","1405444102322221060","","","in","Kendari, Sulawesi Tenggara","0","0","0","https://twitter.com/zonasultraid/status/1405444102322221060","3299433440","zonasultraid"
"1405443296760004611","Thu Jun 17 08:32:48 +0000 2021","0","kok kesel ya ga kebagian program kampus merdeka :&lt;","1405443296760004611","","","in","my own universe","0","0","0","https://twitter.com/ariiaara/status/1405443296760004611","1185546831272349698","ariiaara"
"1405438038256148480","Thu Jun 17 08:11:54 +0000 2021","2","Rektor IPB University dan Dirjen Diksi Panen Ayam Teknologi Closed House #IPBUniversity #IPBNesian #IPBDigdaya #KampusTerbaik #KampusMerdeka #IPB24JAM #IPBKeren #InovasiIPB #KampusIPB #InfoIPB #IPBbogor #AnakIPB #AlumniIPB #DosenIPB #AlumniKeren #KaryaIPB #PrestasiIPB https://t.co/CHAAPBvcK3","1405438038256148480","https://pbs.twimg.com/media/E4EeLiyVkAADhI8.jpg","","in","","0","0","0","https://twitter.com/IPB24JAM/status/1405438038256148480","1191652637302640641","IPB24JAM"
"1405427306286354433","Thu Jun 17 07:29:16 +0000 2021","0","pengen nyoba ikut kampus merdeka tapi bingung","1405427306286354433","","","in","","0","0","0","https://twitter.com/asahinatakuto/status/1405427306286354433","963175850622435332","asahinatakuto"
"1405425739122364420","Thu Jun 17 07:23:02 +0000 2021","0","Saran buat mahasiswa baru yang lolos SBMPTN atau test mandiri gitu dan masih punya opsi. Ambil kampus yang support kampus merdeka buat program pertukarannya itu bakal membantu banget pasti nanti kalau ada yang jenuh disatu kampus aja atau mau cari pengalaman baru https://t.co/HjuG4Xv3nI","1405425739122364420","https://pbs.twimg.com/media/E4ETQukVkAAW879.jpg","","in","","0","1","0","https://twitter.com/DeOngekroonde/status/1405425739122364420","984436818287276032","DeOngekroonde"
"1405423262184525824","Thu Jun 17 07:13:11 +0000 2021","4","gaes masa politeknik ga kena program student exchange kampus merdeka sih? :( mana KUI kita pasif bgt di pandemi beda sama lembaga student exchange kampus lain ","1405423262184525824","","","in","Visit Us 👉🏽","0","6","0","https://twitter.com/polbanfess/status/1405423262184525824","1187636674269827073","polbanfess"
