"conversation_id_str","created_at","favorite_count","full_text","id_str","image_url","in_reply_to_screen_name","lang","location","quote_count","reply_count","retweet_count","tweet_url","user_id_str","username"
"1407512930019545092","Wed Jun 23 01:36:47 +0000 2021","0","ᴅᴘʀ ᴅᴜᴋᴜɴɢ ᴋᴀᴍᴘᴜꜱ ᴍᴇʀᴅᴇᴋᴀ! Harapan @dpr_ri kepada @kemdikbud.ri agar dapat menambah fokus program pada bidang birokrasi serta politik yang tak kalah menarik dalam Program Kampus Merdeka hingga orientasi mahasiswa saat magang tidak hanya fokus pada dunia usaha &amp; https://t.co/BmAkkM9FA1","1407512930019545092","https://pbs.twimg.com/media/E4h9i9xVoAA0AZT.jpg","","in","","0","1","0","https://twitter.com/MasMenteri/status/1407512930019545092","891564038781415424","MasMenteri"
"1407509722375213060","Wed Jun 23 01:24:02 +0000 2021","2","kampus merdeka menggiurkan sekali ya","1407509722375213060","","","in","http://localhost:3000","0","0","0","https://twitter.com/firhanrm/status/1407509722375213060","1276133235999694849","firhanrm"
"1407509154629971976","Wed Jun 23 01:21:47 +0000 2021","0","Teman-teman FTb sudah daftar program #Kampusmerdeka belum? Tertarik magang kemana?","1407509154629971976","","","in","Kota Surabaya, Jawa Timur","0","0","0","https://twitter.com/FTb_ubaya/status/1407509154629971976","1351369639217950720","FTb_ubaya"
"1407506163034320903","Wed Jun 23 01:09:54 +0000 2021","0","Sedikit menyesal g ikut program kampus merdeka smt kmrn tp gpp","1407506163034320903","","","in","Tanyakan peta","0","1","0","https://twitter.com/nadaadellia/status/1407506163034320903","3088674607","nadaadellia"
"1407506060177338370","Wed Jun 23 01:09:29 +0000 2021","1","Program magang kampus merdeka baru dari Berau (Mining) sama beberapa dari sofware/data/IT. Semoga makin nambah deh kedepannya. Ngarep banget bisa dapet di power/electrical/automation/instrumentation xixixi","1407506060177338370","","","in","Indonesia","0","0","0","https://twitter.com/rekalibrasi/status/1407506060177338370","1042019824937783296","rekalibrasi"
"1407503226480435200","Wed Jun 23 00:58:13 +0000 2021","0","Kampus merdeka tapi mahasiswa kga merdeka","1407503226480435200","","","in","Jagakarsa, Indonesia","0","1","0","https://twitter.com/njirlahwk/status/1407503226480435200","1384932677862649861","njirlahwk"
"1407502540464300032","Wed Jun 23 00:55:30 +0000 2021","0","anak 2017 bisa ga sihhhh ikutan magang kampus merdeka hhh","1407502540464300032","","","in","🏎💻📱📖","0","1","0","https://twitter.com/rajahbirdwings/status/1407502540464300032","1082619276303904768","rajahbirdwings"
"1407502196850130944","Wed Jun 23 00:54:08 +0000 2021","0","udah seneng liat promosi internship pas di klik link redirecting nya ke kampus merdeka mulu heran :)","1407502196850130944","","","in","Tangerang-Palembang","0","0","0","https://twitter.com/rendy_filovia/status/1407502196850130944","755596859775737856","rendy_filovia"
"1407389126840655875","Tue Jun 22 17:24:50 +0000 2021","0","kenapa kampus merdeka ini adanya gak dari dulu siiiiii","1407389126840655875","","","in","","0","1","0","https://twitter.com/snalsdn/status/1407389126840655875","240120592","snalsdn"
"1407387525522493442","Tue Jun 22 17:18:28 +0000 2021","0","pgn bgt ikut pertukaran mahasiswa kampus merdeka tp ibu barusan blg emang kamu sanggup? dahlah mls.","1407387525522493442","","","in","she/her","0","2","0","https://twitter.com/pjmoonj/status/1407387525522493442","1210689781518090240","pjmoonj"
"1407385353544077312","Tue Jun 22 17:09:50 +0000 2021","0","Karna kan gue ngurus untuk kampus merdeka tuh kan","1407385353544077312","","","in","","0","0","0","https://twitter.com/whatafucklife/status/1407385353544077312","1398119026820190213","whatafucklife"
"1407378237244641282","Tue Jun 22 16:41:34 +0000 2021","0","Program Mas Menteri utk Merdeka Belajar Kampus Merdeka lenceng banget.. Kampus yg berusaha menjalankan ide Mas Menteri be like... https://t.co/WwxeT4Xmcl","1407378237244641282","https://pbs.twimg.com/tweet_video_thumb/E4gDCrGVoAUFp-P.jpg","","in","ÜT: -7.31606,112.7572","0","1","0","https://twitter.com/aldarahardjaa/status/1407378237244641282","1252522194","aldarahardjaa"
"1407352681652314113","Tue Jun 22 15:00:01 +0000 2021","4","[INFO] Halo Teman-Teman ITB! Saat ini Program-Program Kampus Merdeka sedang dibuka Loh! Ada program Magang dan Studi Independen Bersertifikat Daftarkan dirimu yuu! Pendaftaran dimulai sejak 10 Juni 2021 - 15 Juli 2021. Kunjungi &gt;&gt; https://t.co/sq0EIEcfRo Ajak teman-temanmu! https://t.co/xpjlOFPNfV","1407352681652314113","https://pbs.twimg.com/media/E4eAPTuUcAA7Ppi.jpg","","in","GKU Timur ITB, Lantai Dasar","0","0","0","https://twitter.com/ITBCareerCenter/status/1407352681652314113","334542843","ITBCareerCenter"
"1407351704534794249","Tue Jun 22 14:56:08 +0000 2021","0","Demi alekzzz K️ k️ we dh persiapan daftar kampus merdeka Gue malah gk kepikiran mau ngapa ngapain ","1407351704534794249","","","in","","0","1","0","https://twitter.com/90swalkman/status/1407351704534794249","1317684868696862720","90swalkman"
"1407349266033655812","Tue Jun 22 14:46:26 +0000 2021","0","Wakil Ketua Komisi X DPR RI Agustina Wilujeng Pramestuti mendukung Program Kampus Merdeka untuk fokus pada bidang industri usaha dan politik. Bahkan nantinya mahasiswa juga harus didorong menjadi enterpreneur peneliti scientis dan berbagai profesi lainnya. https://t.co/5CIDdDsQ5z","1407349266033655812","https://pbs.twimg.com/media/E4fosRwWQAg7BxM.jpg","","in","West Java, Indonesia","0","0","0","https://twitter.com/pergusoID/status/1407349266033655812","48612796","pergusoID"
"1407349121971896337","Tue Jun 22 14:45:52 +0000 2021","0","Dengan adanya Program Kampus Merdeka Mahasiswa justru tdk mundur ke belakang namun membangunb sisi konseptor dan jiwa enterpreneur. Tentu ini kesempatan bagi mahasiswa untuk mempersiapkan diri dlm menghadapi revolusi industri dgn membekali kecakapan kompetensi. https://t.co/8Yq0EiHaYb","1407349121971896337","https://pbs.twimg.com/media/E4foj2kXoAYlkIy.jpg","","in","West Java, Indonesia","0","0","0","https://twitter.com/pergusoID/status/1407349121971896337","48612796","pergusoID"
"1407346024402894850","Tue Jun 22 14:33:34 +0000 2021","1","kalian yg jurusan adm publik ada yg ikt magang kampus merdeka ga? kalo magang boleh daftar lebih dr 1 posisi kan ya? ada yang udah daftar? work!","1407346024402894850","","","in","AUTOBASE — ❌POST MANUAL❌","0","0","0","https://twitter.com/worksfess/status/1407346024402894850","1244597361826885636","worksfess"
"1407334962639032330","Tue Jun 22 13:49:36 +0000 2021","0","kalo gue ikut program kampus merdeka terus milih yang magang juga kayaknya gaada yang sesuai sama jurusan gue","1407334962639032330","","","in","선재업고튀어","0","1","0","https://twitter.com/siercous/status/1407334962639032330","1314116812414488576","siercous"
"1407334423348060168","Tue Jun 22 13:47:28 +0000 2021","10","ugm_fess kak mau tanya. Yang sekarang lagi semester 2 boleh gak ya ikut program kampus merdeka? Kan nanti tuh bulan Agustus udah masuk semester 3 sesuai dengan syarat..... kira-kira bisa gak ya buat daftar sekarang?","1407334423348060168","","","in","RULES","1","0","0","https://twitter.com/UGM_FESS/status/1407334423348060168","1277749122296983552","UGM_FESS"
"1407333997248757769","Tue Jun 22 13:45:46 +0000 2021","0","[REPOST KARIER UNPAD] [INFO MAGANG] Halo Unpaders! Buat kamu yang penasaran dan mau tahu lebih banyak tentang kesempatan berkarir di berbagai industri dan bidang jangan sampai kamu lewatkan Festival Kampus Merdeka edisi Magang dan Studi Independen Bersertifikat bersama -c- https://t.co/qxo6secu7I","1407333997248757769","https://pbs.twimg.com/media/E4faz8_WQAsJl3c.jpg","","in","Jatinangor, Sumedang, INA","0","1","1","https://twitter.com/himatikaunpad/status/1407333997248757769","122949791","himatikaunpad"
"1407333872984113176","Tue Jun 22 13:45:16 +0000 2021","12","Yg mau magang #KampusMerdeka di @LazadaID ada banyak lowongan ya. Buruan daftar. Daftarnya langsung lewat situs resmi Kemendikbud-ristek pendaftaran dibuka sampai 15 Juli 2021. Thread cara daftar: https://t.co/fmWiAKdV7U","1407333872984113176","https://pbs.twimg.com/media/E4fasY4WUAYvuJ0.jpg","","in","Jakarta Capital Region","0","1","5","https://twitter.com/srl789/status/1407333872984113176","58545290","srl789"
"1407332474921881603","Tue Jun 22 13:39:43 +0000 2021","0","lg bingung ikut program magang kampus merdeka apa ngga","1407332474921881603","","","in","joining acc","0","1","0","https://twitter.com/ginkkum/status/1407332474921881603","1403152711793614849","ginkkum"
"1407332468605259788","Tue Jun 22 13:39:42 +0000 2021","0","AAAA SENENG BGT DAPET KURSI BUAT PELATIHAN DESAIN GRAFIS !!!! makasi pa nadiem program kampus merdeka nya","1407332468605259788","","","in","she%they","0","0","0","https://twitter.com/userinupi/status/1407332468605259788","1294301184858054658","userinupi"
"1407331153640624130","Tue Jun 22 13:34:28 +0000 2021","0","program magang di kampus merdeka banyak yg menarik dan menantang apakah ini tanda memanjangkan masa studi lagi? ","1407331153640624130","","","in","","0","1","0","https://twitter.com/dilllearning_97/status/1407331153640624130","1172463570019160064","dilllearning_97"
"1407330902896746500","Tue Jun 22 13:33:28 +0000 2021","0","Mau ikut program kampus merdeka cuma kek takut gt dah. Btw moots kalian ada yg ikut program ini?","1407330902896746500","","","in","","0","1","0","https://twitter.com/haechanyeolino/status/1407330902896746500","1373168847168020484","haechanyeolino"
"1407329587147640832","Tue Jun 22 13:28:15 +0000 2021","0","perdebatan malam ini jd magang kampus merdeka itu masuk sks apa kaga?","1407329587147640832","","","in","Jakarta Capital Region","0","1","0","https://twitter.com/ddrawww/status/1407329587147640832","491982493","ddrawww"
"1407327386803183618","Tue Jun 22 13:19:30 +0000 2021","0","Program-Program Kampus Merdeka Hai #SobatPolibatam berita selengkapnya silahkan klik https://t.co/pYbExIq8am #Polibatam #HumasPolibatam #ProgramKampusMerdeka","1407327386803183618","","","in","Kota Batam, Kepulauan Riau","0","0","0","https://twitter.com/polibatam_/status/1407327386803183618","986896192385597440","polibatam_"
"1407326770299240448","Tue Jun 22 13:17:03 +0000 2021","38","Jadi program Kampus Merdeka ini diadakan oleh Kementerian Pendidikan dan Kebudayaan di mana kamu akan dapat pembekalan dalam mengembangkan keterampilan berdasarkan bakat dan minat dengan terjun langsung ke dunia kerja. #JadiLebihBaik https://t.co/aa0L3jmOim","1407326770299240448","https://pbs.twimg.com/media/E4fUO9vXEAIT2Xt.jpg","","in","XL Axiata Tower, Kuningan, Jak","0","1","8","https://twitter.com/XLAxiata_Tbk/status/1407326770299240448","711842070080544770","XLAxiata_Tbk"
"1407324967260213248","Tue Jun 22 13:09:53 +0000 2021","0","tolong ingatkan saya smt4 pen ikut kampus merdeka","1407324967260213248","","","in","","0","3","0","https://twitter.com/biblebibleb/status/1407324967260213248","1158219787077427211","biblebibleb"
"1407324268631785478","Tue Jun 22 13:07:07 +0000 2021","1","Pengen bgt ikut kampus merdeka lumayan buat cv jugaa tapi takut ga dibolehin ortu :))","1407324268631785478","","","in","","0","1","0","https://twitter.com/sayangakulahh/status/1407324268631785478","1300614957084684288","sayangakulahh"
"1407322070422233091","Tue Jun 22 12:58:23 +0000 2021","0","Ada kabar gembira nih untuk teman-teman yang akan melanjutkan studi ke perguruan tinggi . Yuuuuk buruan daftar di UK ^_^ https://t.co/XmiSw7ahTu #kuliah #mahasiswabaru #mahasiswa2021 #utbk2021 #kampus #kampusmerdeka #purwakarta #karawang #subang #universitaskartamulia https://t.co/9x6WWVEUmv","1407322070422233091","https://pbs.twimg.com/media/E4fP2P8VIAA7DB8.jpg","","in","Indonesia","0","0","0","https://twitter.com/KrisnoGiovanni2/status/1407322070422233091","1263255941044031489","KrisnoGiovanni2"
"1407318289261371396","Tue Jun 22 12:43:21 +0000 2021","0","Hopeless bgt kalau misal kampusku ga bisa ikutan program kampus merdeka","1407318289261371396","","","in","under the sea","0","0","0","https://twitter.com/yosoyoo_/status/1407318289261371396","1327916161862799360","yosoyoo_"
"1407313837108301829","Tue Jun 22 12:25:40 +0000 2021","0","Daftar akun kampus merdeka lama banget dah :)","1407313837108301829","","","in","he/him '01","1","0","0","https://twitter.com/jeongsxt/status/1407313837108301829","1365527660521156608","jeongsxt"
"1407313418101485573","Tue Jun 22 12:24:00 +0000 2021","0","bingung banget ikut program kampus merdeka yay or nay","1407313418101485573","","","in","","0","2","0","https://twitter.com/xsyouun/status/1407313418101485573","1156947561455837186","xsyouun"
"1407311660918841353","Tue Jun 22 12:17:01 +0000 2021","0","Ada yg bisa jelasin ke aku ga sistemnya magang Kampus Merdeka ini gimana?? :((","1407311660918841353","","","in","","0","0","0","https://twitter.com/starieshwa3/status/1407311660918841353","1267326723885940737","starieshwa3"
"1407294770053980165","Tue Jun 22 11:09:54 +0000 2021","0","Mudik lebaran ke rumah Oma Pulangnya bawa buah mangga Hai #Changemakers semua Daftar jadi intern di Campaign udah bisa via Kampus Merdeka! https://t.co/WZ656BdAiY","1407294770053980165","https://pbs.twimg.com/media/E4e2kl7VgAIdPsZ.png","","in","Indonesia","1","1","0","https://twitter.com/campaign_id/status/1407294770053980165","1728180828","campaign_id"
"1407294165969301513","Tue Jun 22 11:07:30 +0000 2021","1","work! Magang Kampus Merdeka dari Indosat katanya oke banget ya? Ada yang daftar disini juga kah? Mau apply divisi Sales tapi masih ragu https://t.co/jrLXcgZtNJ","1407294165969301513","https://pbs.twimg.com/media/E4e2lZbUcAMHWfN.jpg","","in","AUTOBASE — ❌POST MANUAL❌","0","2","0","https://twitter.com/worksfess/status/1407294165969301513","1244597361826885636","worksfess"
"1407292420258029578","Tue Jun 22 11:00:33 +0000 2021","0","Halo Communite! Sehubungan dengan tindak lanjut dari Sosialisasi MBKM (Merdeka Belajar Kampus Merdeka) pendaftaran program magang akan dilaksanakan pada tanggal 9 Juni 15 Juli 2021. https://t.co/kvzSdlioUa","1407292420258029578","https://pbs.twimg.com/media/E4e0_qCVIAAL8Kz.jpg","","in","Malang","0","1","1","https://twitter.com/himanikaUB/status/1407292420258029578","260565884","himanikaUB"
"1407287833811767307","Tue Jun 22 10:42:20 +0000 2021","0","tertarik sama kampus merdeka tapi ga tertarik baca ketentuannya..","1407287833811767307","","","in","","0","1","0","https://twitter.com/sevenoftheclock/status/1407287833811767307","1283293785674276864","sevenoftheclock"
"1407280062517239811","Tue Jun 22 10:11:27 +0000 2021","0","kampus merdeka keren banget dah nyesel dikit baru tau pas smt 4 padahal kl tau dr dulu bisa persiapan buat ikut programnya trus kabur dr ub ngueenggg","1407280062517239811","","","in","﹟221112 ﹟221113","0","0","0","https://twitter.com/voyeages/status/1407280062517239811","1262743160590970883","voyeages"
"1407279718668259330","Tue Jun 22 10:10:05 +0000 2021","0","Pengen ikut kampus merdeka tapi kok takut kelimpungan ya","1407279718668259330","","","in","Hogwarts","0","0","0","https://twitter.com/kekepoanku/status/1407279718668259330","3223372474","kekepoanku"
"1407278613670547457","Tue Jun 22 10:05:42 +0000 2021","0","Kemendikbudristek Apresiasi Implementasi Kampus Merdeka di SMK dan jajaran Politeknik eLBajo Commodus NTT https://t.co/hx4k6RgNMT","1407278613670547457","","","in","Bekasi, Jawa Barat","0","0","0","https://twitter.com/MediaNawacita/status/1407278613670547457","1297798716133236736","MediaNawacita"
"1407278321059057667","Tue Jun 22 10:04:32 +0000 2021","0","Kantor kalian ada yang ikut Kampus Merdeka ndk? Mengribet sekali hidupku nambah teroooooss tugase","1407278321059057667","","","in","Kota Madiun, Jawa Timur","0","0","0","https://twitter.com/yulidaristi/status/1407278321059057667","180774292","yulidaristi"
"1407275261754712065","Tue Jun 22 09:52:22 +0000 2021","0","gemes bgt ngeliat program magang kampus merdeka yg mostly buat semester 5 itu","1407275261754712065","","","in","","0","0","0","https://twitter.com/qnadss/status/1407275261754712065","1073593162696978432","qnadss"
"1407273467217539078","Tue Jun 22 09:45:15 +0000 2021","0","sumpah kampus merdeka ini bener-bener mgebingungin: )","1407273467217539078","","","in","","0","1","0","https://twitter.com/tirssi_/status/1407273467217539078","354636251","tirssi_"
"1407267544923136001","Tue Jun 22 09:21:43 +0000 2021","0","Mau ikut kampus merdeka maju mundur","1407267544923136001","","","in","","0","0","0","https://twitter.com/hoshksoon/status/1407267544923136001","1248489579461500929","hoshksoon"
"1407266792792150017","Tue Jun 22 09:18:43 +0000 2021","1","Mahasiswa yg mau daftar program magang kampus merdeka di Berau coal bisa cek di sini https://t.co/Xwz6LntAk6 Ketik nama perusahaan berau coal","1407266792792150017","","","in","Berau - Indonesia","0","1","0","https://twitter.com/bamsharyanto/status/1407266792792150017","159153653","bamsharyanto"
"1407266102539812865","Tue Jun 22 09:15:59 +0000 2021","0","- Program Kampus Merdeka - Melalui program Kampus Merdeka mahasiswa disiapkan sbg calon pekerja di dunia usaha dan industri. Zainuddin Maliki Anggota Komisi X DPR RI mengatakan mahasiswa harus didorong mnjd enterpreneur peneliti dan berbagai profesi lainnya. @Kemdikbud_RI https://t.co/ZN2o2hk185","1407266102539812865","https://pbs.twimg.com/media/E4edDrZUcAA0T_y.jpg","","in","Medan ","0","0","0","https://twitter.com/M3juahjuah/status/1407266102539812865","1070343155319369728","M3juahjuah"
"1407264942491766784","Tue Jun 22 09:11:22 +0000 2021","0","DPR mendukung Kampus Merdeka. Harapan DPR agar Kemendikbud ristek dapat menambah fokus program pada bidang birokrasi dan politik. Tentunya jika merambah ke dunia politik dan birokrasi akan menjadi lebih menarik. @Kemdikbud_RI @ditjendikti https://t.co/IGgDeOhfvi","1407264942491766784","https://pbs.twimg.com/media/E4eb_4UVcAE1X7o.jpg","","in","Medan ","0","0","0","https://twitter.com/M3juahjuah/status/1407264942491766784","1070343155319369728","M3juahjuah"
"1407258665615200257","Tue Jun 22 08:46:26 +0000 2021","0","[ REPOST | PROGRAM KAMPUS MERDEKA SUDAH DIBUKA ] Hello Ilkomers! Program-program Kampus Merdeka sudah dibuka loh pendaftaran nya. Yuk di swipe biar gak ketinggalan informasi nya. Segera daftarkan diri kamu dan juga ajak teman-teman yang lain juga ya! Kunjungi : https://t.co/XjvWYDD5bY","1407258665615200257","https://pbs.twimg.com/media/E4eWSC3UYAAKZFP.jpg","","in","Pekan Baru, Riau","0","1","0","https://twitter.com/himalkomunri/status/1407258665615200257","870277772643414017","himalkomunri"
"1407257473526878210","Tue Jun 22 08:41:41 +0000 2021","0","cari info kampus merdeka kali ya drtd lewat program magang sama mengajar","1407257473526878210","","","in","selm/laras/ayas (22↑)","0","1","0","https://twitter.com/shioreianma/status/1407257473526878210","1483671079","shioreianma"
"1407254252813099010","Tue Jun 22 08:28:54 +0000 2021","1","Work! Halo di sini ada yang tertarik daftar program start-up kampus merdeka tapi ga ada temen satu kampus yang mau ikut? Ayo diskusi sama aku siapa tau kita bisa ngajuin ide startup. Tadi aku udah nanya katanya boleh beda kampus kok","1407254252813099010","","","in","AUTOBASE — ❌POST MANUAL❌","0","1","0","https://twitter.com/worksfess/status/1407254252813099010","1244597361826885636","worksfess"
"1407252348502634497","Tue Jun 22 08:21:20 +0000 2021","0","[ INFO FIKOM ] Halo teman-teman! Diberitahukan kepada teman-teman bahwa pendaftaran Program Kampus Merdeka telah dibuka. Program Kampus Merdeka ini diselenggarakan oleh Kementerian Pendidikan dan Kebudayaan. Program Kampus Merdeka ini terdiri dari Kampus Mengajar dan https://t.co/qhggeEYTdJ","1407252348502634497","https://pbs.twimg.com/media/E4eQiqxVUAIlqki.jpg","","in","Universitas Islam Bandung","0","1","0","https://twitter.com/bemfikomunisba/status/1407252348502634497","196136619","bemfikomunisba"
"1407239477190434816","Tue Jun 22 07:30:11 +0000 2021","2","mau tanya dong semisal saat ini aku smt 8 &amp; tinggal skripsi tapi pingin ikut magang perusahaan naungan kampus merdeka.. semisal nantinya keterima &amp; ternyata di bulan juli/agustus nanti alhamdulillahnya aku sidang &amp; lulus apa kegiatan magangnya masih bisa dilanjutkan (...)","1407239477190434816","","","in","BACA RULES➡️","0","2","0","https://twitter.com/unnesmenfess/status/1407239477190434816","1187284958370398209","unnesmenfess"
"1407238342341582848","Tue Jun 22 07:25:40 +0000 2021","0","[ PENDAFTARAN PROGRAM KAMPUS MERDEKA ] HI-Mates Pendaftaran program kampus merdeka sudah dibuka nihh!. Ada tiga program yang bisa kalian ikuti di program kampus merdeka. Ada Magang dan Studi Independen Bersertifikat Pertukaran Mahasiswa Merdeka dan Kampus Mengajar. https://t.co/M1v2w5xIMb","1407238342341582848","https://pbs.twimg.com/media/E4eDxJfVgAQYn8U.jpg","","in","","0","1","1","https://twitter.com/himahiupnvyk/status/1407238342341582848","362966101","himahiupnvyk"
"1407237693755461640","Tue Jun 22 07:23:06 +0000 2021","2","WORKSHOP : SINKRONISASI KURIKULUM MERDEKA BELAJAR KAMPUS MERDEKA https://t.co/Qwl4QFgPLo https://t.co/F6hTmVnPjx","1407237693755461640","https://pbs.twimg.com/media/E4eDMuIUUAMrRRG.png","","in","Moluccas, Indonesia","0","0","0","https://twitter.com/UnpattiOfficial/status/1407237693755461640","3195156979","UnpattiOfficial"
"1407233637141995520","Tue Jun 22 07:06:58 +0000 2021","2","program kampus merdeka mantep2 amat dah keknya","1407233637141995520","","","in","","0","2","1","https://twitter.com/txtdradel/status/1407233637141995520","143367358","txtdradel"
"1407228939991339009","Tue Jun 22 06:48:19 +0000 2021","1","Sad. Kampus merdeka tapi untuk kampus2 tertentu aja https://t.co/09VvkEo01Q","1407228939991339009","https://pbs.twimg.com/media/E4d7QYTUcAEc40D.jpg","","in","bdg, lautan api","0","0","0","https://twitter.com/gratidudess/status/1407228939991339009","1029640754455408641","gratidudess"
"1407226472750665731","Tue Jun 22 06:38:30 +0000 2021","7","Jerome Polin aja nonton Festival Kampus Merdeka MSIB yakali kalian enggak sob! Yuk langsung pantengin youtube @Kemdikbud_RI ‼️Banyak perusahaan besar dan ternama Indonesia yg hadir menawarkan magang untuk kalian! HARI INI BANGET SOB‼️ https://t.co/nmTRRTb5T8 https://t.co/uVLRLICH3R","1407226472750665731","https://pbs.twimg.com/ext_tw_video_thumb/1407226366295113741/pu/img/oFGxV7LswT3POTtM.jpg","","in","","1","0","0","https://twitter.com/MasMenteri/status/1407226472750665731","891564038781415424","MasMenteri"
"1407224119704227843","Tue Jun 22 06:29:09 +0000 2021","0","Dalam kebijakan 'Kampus Merdeka' mahasiswa harus mampu bangun karakter dan jati diri. https://t.co/ORazXnNhU7","1407224119704227843","","","in","Jakarta, Indonesia","0","0","0","https://twitter.com/republikaonline/status/1407224119704227843","22126902","republikaonline"
"1407222227821424641","Tue Jun 22 06:21:38 +0000 2021","1","mau nanya program magang kampus merdeka kira2 untuk yang lagi skripsian boleh ikut juga ga ya? work!","1407222227821424641","","","in","AUTOBASE — ❌POST MANUAL❌","0","2","0","https://twitter.com/worksfess/status/1407222227821424641","1244597361826885636","worksfess"
"1407221574407757839","Tue Jun 22 06:19:02 +0000 2021","0","Agate Academy dukung program Kampus Merdeka | Indotelko https://t.co/MelPRept9a","1407221574407757839","","","in","Jakarta","0","0","0","https://twitter.com/indotelko/status/1407221574407757839","410485110","indotelko"
"1407216399651459073","Tue Jun 22 05:58:29 +0000 2021","1"," Universitas Kristen Maranatha Raih Hibah Program Kompetisi Kampus Merdeka . . Selengkapnya dapat dibaca disini: https://t.co/7t5wBlGrFV . #maranathanews #kitamaranatha #immaranatha #universitaskristenmaranatha","1407216399651459073","","","in","Bandung, Indonesia","0","0","0","https://twitter.com/ukm_official/status/1407216399651459073","347599160","ukm_official"
"1407212833402589184","Tue Jun 22 05:44:18 +0000 2021","0","kampus merdeka oh kampus merdeka~","1407212833402589184","","","in","Indonesia","0","0","0","https://twitter.com/skychaaannn/status/1407212833402589184","998969766","skychaaannn"
"1407211721068929026","Tue Jun 22 05:39:53 +0000 2021","0","guys gue pengen ikut magang di kampus merdeka tapi gue juga ada kkn dalam rentang waktu yang samaㅠㅠ ganggu ga ya? :(","1407211721068929026","","","in","SHE/HER","0","1","0","https://twitter.com/thirdof_june/status/1407211721068929026","1396190784538382339","thirdof_june"
"1407210868744474624","Tue Jun 22 05:36:30 +0000 2021","0","Program kampus merdeka yang paling menarik adalah bisa ngerasain 1 semster di jurusan lain atau kampus lain. ini sangat bermanfaat jika sejurusan lontong semua... Yakali genek nyawang lontong trus 8 smester.","1407210868744474624","","","in","Jawa Timur, Indonesia","0","1","0","https://twitter.com/pwerkedeltempe/status/1407210868744474624","1073856695439257600","pwerkedeltempe"
"1407208577534627849","Tue Jun 22 05:27:24 +0000 2021","0","ikut Kampus Merdeka karena ngerasa salah jurusan ️","1407208577534627849","","","in","","0","0","0","https://twitter.com/lawdy_e/status/1407208577534627849","810845600","lawdy_e"
"1407204286463811586","Tue Jun 22 05:10:21 +0000 2021","0","Pengen daftar magang kampus merdeka tapi tidak pede","1407204286463811586","","","in","22","0","1","0","https://twitter.com/coralessences/status/1407204286463811586","1212353777983840256","coralessences"
"1407200044831236099","Tue Jun 22 04:53:29 +0000 2021","0","semester 8 masih boleh daftar magang kampus merdeka ga si?","1407200044831236099","","","in","Indonesia, Ravi","0","0","0","https://twitter.com/itskindaaliaaaa/status/1407200044831236099","1405590346302582788","itskindaaliaaaa"
