"conversation_id_str","created_at","favorite_count","full_text","id_str","image_url","in_reply_to_screen_name","lang","location","quote_count","reply_count","retweet_count","tweet_url","user_id_str","username"
"1248214801978802176","Thu Apr 09 11:42:54 +0000 2020","0","SBY Kritik Pasal Penghinaan Presiden: Semua Pihak Agar Fokus Penghentian Covid-19 Bukan Penghinaan Presiden. @SBYudhoyono Sangat Pantas Mengingatkan (bahkan lebih tepat menegor ) karena Jaman SBY tak ada orang mengkritik ditangkap. @hnurwahid @prabowo https://t.co/iF9oeK1dfJ","1248214801978802176","","","in","","0","0","0","https://twitter.com/Kampus_Merdeka/status/1248214801978802176","2984157584","Kampus_Merdeka"
"1248086059017256960","Thu Apr 09 03:11:19 +0000 2020","0","Perguruan tinggi berharap keleluasaan dalam Program Kampus Merdeka https://t.co/zBx3WCqnd8 https://t.co/PCccdMRz4n","1248086059017256960","https://pbs.twimg.com/media/EVIXqBdWAAUsBcD.jpg","","in","","0","0","0","https://twitter.com/topinfo_id/status/1248086059017256960","1215289012551741443","topinfo_id"
"1247988563477540864","Wed Apr 08 20:43:54 +0000 2020","0","Demokrat Ingatkan Jokowi: Anda Diktator Kalau Belanjakan Uang Negara tanpa Disetujui DPR. #RezimGagap #RezimAntiKritik https://t.co/dKANAov75g","1247988563477540864","","","in","","0","0","0","https://twitter.com/Kampus_Merdeka/status/1247988563477540864","2984157584","Kampus_Merdeka"
"1247865430158356480","Wed Apr 08 12:34:37 +0000 2020","0","75GB dari three + 80GB dari Tsel + 10GB free Tsel dari kampus buat WFH perbulan udah merdeka walau tanpa wifi. ","1247865430158356480","","","in","Sleman,Yogyakarta,Indonesia","0","0","0","https://twitter.com/Aji_Setia0ne/status/1247865430158356480","740143891","Aji_Setia0ne"
"1247831350515830784","Wed Apr 08 10:19:12 +0000 2020","0","VIDEO: Penting! Anies Beberkan Peraturan PSBB di Jakarta - https://t.co/kXKAUZhezc lewat @DailymotionUSA","1247831350515830784","","","in","","0","0","0","https://twitter.com/Kampus_Merdeka/status/1247831350515830784","2984157584","Kampus_Merdeka"
"1247823917038747653","Wed Apr 08 09:49:39 +0000 2020","0","Bertambahnya Makin Besar. Langkah serba terlambat. #RezimGagap #PecatLBP","1247823917038747653","","","in","","0","0","0","https://twitter.com/Kampus_Merdeka/status/1247823917038747653","2984157584","Kampus_Merdeka"
"1247823036910145536","Wed Apr 08 09:46:10 +0000 2020","0","Ratusan Tokoh Desak Jokowi Pecat Luhut. Apa Rakyat Perlu Bikin PETISI: #PECATLBP #PECATLBPDARISEMUAJABATAN #PECATLBPatauGantiSemuaMenteri https://t.co/GPXpPk6NbA","1247823036910145536","","","in","","0","0","0","https://twitter.com/Kampus_Merdeka/status/1247823036910145536","2984157584","Kampus_Merdeka"
"1247818395195596800","Wed Apr 08 09:27:43 +0000 2020","0","Ridwan Kamil: Orang Terindikasi COVID-19 Ditemukan di 4 Institusi Kenegaraan #RezimGagap #RezimAntiKritik https://t.co/CEQmCOw5bu","1247818395195596800","","","in","","0","0","0","https://twitter.com/Kampus_Merdeka/status/1247818395195596800","2984157584","Kampus_Merdeka"
"1247792280678744072","Wed Apr 08 07:43:57 +0000 2020","0","Selamat y dede dede semoga kampus merdeka sistemnya lebi baik","1247792280678744072","","","in","Neozone","0","0","0","https://twitter.com/tebakcik/status/1247792280678744072","1031883546036559878","tebakcik"
"1247717082411622400","Wed Apr 08 02:45:08 +0000 2020","38","#SahabatDikbud bagaimana kebijakan dan praktik baik pembelajaran daring untuk perguruan tinggi pada masa pandemi Covid-19? Yuk ikuti gelar wicara radionya pagi ini pukul 10.00 WIB hanya di @RRIPrograma3 atau https://t.co/64ITtCXx17. #KampusMerdeka #BersamaHadapiKorona https://t.co/pCiloRkLWm","1247717082411622400","https://pbs.twimg.com/media/EVDIEJ3XkAcXgzj.jpg","","in","Jakarta","1","2","3","https://twitter.com/Kemdikbud_RI/status/1247717082411622400","631701837","Kemdikbud_RI"
"1247707614449975296","Wed Apr 08 02:07:31 +0000 2020","0","#SolaFekonUnsulbar Bersama Fekon melawan Covid-19 #kakak yg kerennnnn #KampusMerdeka #FekonJaya https://t.co/TZ7TwH6Pnp","1247707614449975296","","","in","Majene, Sulawesi Barat","0","0","0","https://twitter.com/UsbFekon/status/1247707614449975296","1210961988362194944","UsbFekon"
"1247706858346835968","Wed Apr 08 02:04:30 +0000 2020","0","#SolaFekonUnsulbar Bersama Fekon melawan Covid-19 #kakak yg kerennnnn #KampusMerdeka #FekonJaya https://t.co/8qysOWMoNC","1247706858346835968","","","in","Majene, Sulawesi Barat","0","0","0","https://twitter.com/UsbFekon/status/1247706858346835968","1210961988362194944","UsbFekon"
"1247697470739460097","Wed Apr 08 01:27:12 +0000 2020","2","Apakah hari ini kampus merdeka?!Tumbentunbenan dah jam segini gaada tanda tanda kulon","1247697470739460097","","","in","","0","1","0","https://twitter.com/shellasos/status/1247697470739460097","401368195","shellasos"
"1247691279229542402","Wed Apr 08 01:02:36 +0000 2020","2","Simak gelar wicara radio Kebijakan dan Praktik Baik Pembelajaran Daring Perguruan Tinggi di Masa Pandemik Covid-19 Siaran langsungnya bisa didengar di https://t.co/QvOU1l0oXG lho #MerdekaBelajar #KampusMerdeka #MasMenteri https://t.co/Ft6DYWHOtH","1247691279229542402","https://pbs.twimg.com/media/EVCwmKFU4AA-jQC.jpg","","in","","0","0","1","https://twitter.com/MasMenteri/status/1247691279229542402","891564038781415424","MasMenteri"
"1247559956351639552","Tue Apr 07 16:20:46 +0000 2020","0","RUU Ciptaker Diklaim Sejalan dengan Program Kampus Merdeka https://t.co/puzI8Iqlnu","1247559956351639552","","","in","","0","0","0","https://twitter.com/topinfo_id/status/1247559956351639552","1215289012551741443","topinfo_id"
"1247551657514164225","Tue Apr 07 15:47:48 +0000 2020","0","RUU Ciptaker Dapat Sediakan Ruang Kondusif Bagi Kampus Merdeka https://t.co/5QGDPJ9g4T https://t.co/UDdJoC8bBE","1247551657514164225","https://pbs.twimg.com/media/EVAxnilUMAAyGZO.jpg","","in","Jakarta, Indonesia","0","0","0","https://twitter.com/InvestorID/status/1247551657514164225","238091066","InvestorID"
"1247447395450880000","Tue Apr 07 08:53:30 +0000 2020","1","Mendukung kebijakan kampus merdeka yang diluncurkan Kementerian Pendidikan dan Kebudayaan Kepala Kantor Hubungan Masyasarakat Universitas Pendidikan Indonesia Prof. Dr. H. Deni Darmawan S.Pd https://t.co/PhrYwmSqRV. MCE melatih https://t.co/dMIMBnJwL2","1247447395450880000","","","in","","0","0","1","https://twitter.com/upi_official/status/1247447395450880000","1214053300082900995","upi_official"
"1247241890371489792","Mon Apr 06 19:16:53 +0000 2020","0","Hadaaah....!!!! BNPB Blak-blakan Data Corona Kemenkes Tertutup &amp; Tak Sinkron dengan Pemda. #RezimGagap #RezimGagap https://t.co/mEaSArS0A3","1247241890371489792","","","in","","0","0","0","https://twitter.com/Kampus_Merdeka/status/1247241890371489792","2984157584","Kampus_Merdeka"
"1247191132242497536","Mon Apr 06 15:55:12 +0000 2020","1","BEM kampus jln. Istana merdeka utara","1247191132242497536","","","in","Endonezya","0","0","0","https://twitter.com/03_malikha/status/1247191132242497536","1239627909834223616","03_malikha"
"1247162222112993281","Mon Apr 06 14:00:19 +0000 2020","1","Maybe anak ips gabisa ambil kesehatan deh. Why? Because yang aku tau tentang program kampus merdeka nantinya semua bisa lintas jurusan gitu kan biar skill kita ga di satu jurusan kecuali kesehatan. Anak fisip bisa ke teknik psi dll begitupun kebalikannya kecuali kesehatan..","1247162222112993281","","","in","West Java, Indonesia","0","0","0","https://twitter.com/gistasavv/status/1247162222112993281","850365986876276736","gistasavv"
"1247160185031766016","Mon Apr 06 13:52:13 +0000 2020","1","Gejayan Memanggil Desak Jokowi Bubarkan BPIP dan KSP demi Tangani Corona. #RezimGagap #RezimGagap https://t.co/923Lz9rYFx","1247160185031766016","","","in","","0","0","0","https://twitter.com/Kampus_Merdeka/status/1247160185031766016","2984157584","Kampus_Merdeka"
"1247084992661872640","Mon Apr 06 08:53:26 +0000 2020","0","Riset Katadata: Jakarta Paling Baik Hadapi Pandemi Covid-19. Jabar Lampung dan Banten Terburuk dalam Pelayanan Kesehatan. #RezimGagap #RakyatButuhPemimpin https://t.co/OPrmYVe6Sk","1247084992661872640","","","in","","0","0","0","https://twitter.com/Kampus_Merdeka/status/1247084992661872640","2984157584","Kampus_Merdeka"
"1247081956174475267","Mon Apr 06 08:41:22 +0000 2020","0","Kalau ga terlambat ya bukan Rezim ini bro. #RezimGagap #RekzimGagap","1247081956174475267","","","in","","0","0","0","https://twitter.com/Kampus_Merdeka/status/1247081956174475267","2984157584","Kampus_Merdeka"
"1247068039968722944","Mon Apr 06 07:46:04 +0000 2020","0","Pak Anies Berhentilah Bicara yang Sesungguhnya...!!! Anda terlalu jujur dan kelebihan kecerdasan @aniesbaswedan @DKIJakarta https://t.co/Dl7MG2GiUb","1247068039968722944","","","in","","0","0","0","https://twitter.com/Kampus_Merdeka/status/1247068039968722944","2984157584","Kampus_Merdeka"
"1247066631869587456","Mon Apr 06 07:40:29 +0000 2020","2","Ngakak banget tonton sd selesai.....Ampyuuun","1247066631869587456","","","in","","0","0","0","https://twitter.com/Kampus_Merdeka/status/1247066631869587456","2984157584","Kampus_Merdeka"
"1247061619433070592","Mon Apr 06 07:20:34 +0000 2020","0","Ada-ada saja. Rakyat Butuhnya: Jika disuruh di rumah yg mau dimakan ada. Disuruh cuci tangan pakai sabun sabunya ada. Disuruh pakai masker maskernya ada. Bukan hanya di TV. Sudah sebulan koq cuma itu2 saja.","1247061619433070592","","","in","","0","0","0","https://twitter.com/Kampus_Merdeka/status/1247061619433070592","2984157584","Kampus_Merdeka"
"1247058025287831554","Mon Apr 06 07:06:17 +0000 2020","2","Simak tulisan saya di @republikaonline tentang Virus Corona dan Pembuktian Kampus Merdeka @Kemdikbud_RI https://t.co/kEWlkn15fT #PakaiMaskerCekalCorona #kampusmerdeka #Covid_19","1247058025287831554","","","in","Jakarta, Indonesia","0","0","0","https://twitter.com/FaozanAmar/status/1247058025287831554","222104880","FaozanAmar"
"1247047691894263809","Mon Apr 06 06:25:13 +0000 2020","1","Survei INDEF: 66 28% Publik Merespons Negatif Kinerja Pemerintah Menangani COVID-19. Di Kelas Bawah Respon Negatif Jauh Lebih Besar. Disuruh Di Rumah Saja: Pekerjaan Ga Ada. Makan Ga Ada. Boro-boro Masker Sabun dll. Ada Bantuan Cuma di TV https://t.co/CwQWEU6zMe","1247047691894263809","","","in","","0","0","2","https://twitter.com/Kampus_Merdeka/status/1247047691894263809","2984157584","Kampus_Merdeka"
"1246991548991934467","Mon Apr 06 02:42:07 +0000 2020","0","SD Darmono: Jababeka Ada 2.000 Pabrik di Kawasan Industri Itulah Kampus Merdeka Sebenarnya - https://t.co/0vbA2bl5u9 https://t.co/ioGOS0GAUO","1246991548991934467","","","in","Bogor, Jawa Barat","0","0","0","https://twitter.com/mata_candra/status/1246991548991934467","732784283916460036","mata_candra"
"1246886083926908928","Sun Apr 05 19:43:03 +0000 2020","0","Waktu pas kamu jadi pembicara diskusi kampus merdeka satu hal yang aku paling inget sampe skrng senyuman mu :) Njir merasa gagal gw jadi pembicara kalo audiens nya cuma inget senyum doang https://t.co/JI1OiuT7NP","1246886083926908928","","","in","","0","0","0","https://twitter.com/FADJRANPRO/status/1246886083926908928","1374318823","FADJRANPRO"
"1246796385506095104","Sun Apr 05 13:46:37 +0000 2020","0","#SobatPrestasi yang sedang kuliah di D4/S1 yuk ikutan Kompetisi Poster dan Penulisan Opini yang #Puspresnas selenggarakan kami tunggu karyanya sebelum tanggal 25 April ya.. @Kemdikbud_RI #KampusMerdeka #DirumahAja #Prestasi https://t.co/7n6k0wfRju","1246796385506095104","https://pbs.twimg.com/media/EU2BZhQUcAAkv3q.jpg","","in","Indonesia","0","0","0","https://twitter.com/puspresnas/status/1246796385506095104","1245249011885289472","puspresnas"
"1246737601232420865","Sun Apr 05 09:53:02 +0000 2020","1","Logika Aneh Melawan Kewarasan. Harus Dilawan. Napi Koruptor Mau Dibebaskan gegara Corona Penjaranya Sempit. Mudah2an Makin Banyak yg Mendadak Jadi Waras.","1246737601232420865","","","in","","0","0","0","https://twitter.com/Kampus_Merdeka/status/1246737601232420865","2984157584","Kampus_Merdeka"
"1246736622516760577","Sun Apr 05 09:49:08 +0000 2020","0","Mereka Berjibaku Untuk Kita. Padahal Tugas Mereka Sangatlah Berbahaya. Sejak Awal Sudah Muncul Masalah Perlindungan thd Mereka. Kawal dan Doakan Keselamatan Mereka. #PahlawanKemanusiaan #RezimGagap","1246736622516760577","","","in","","0","0","0","https://twitter.com/Kampus_Merdeka/status/1246736622516760577","2984157584","Kampus_Merdeka"
"1246733931849768960","Sun Apr 05 09:38:27 +0000 2020","0","Ketika Perjalanan si Corona Masih di Negeri Seberang Sering Tampil dan Sangat Ke PD an. Rakyat mikirnya memang telah mempersiapkan dg baik dan harap2 cemas. Namun ketika Corona Benar Datang ternyata: Serba Tak Siap. Gagap. Jarang Muncul atau kemana Rakyat..","1246733931849768960","","","in","","0","0","0","https://twitter.com/Kampus_Merdeka/status/1246733931849768960","2984157584","Kampus_Merdeka"
"1246727123705843715","Sun Apr 05 09:11:24 +0000 2020","1","Semoga Beliau Diterima Sebagai Syuhada' di Jalan Allah. Selamat Jalan #PahlawanKemanusian Doa Kami untuk Para Pejuang Kemanusian di Garda Depan.","1246727123705843715","","","in","","0","0","0","https://twitter.com/Kampus_Merdeka/status/1246727123705843715","2984157584","Kampus_Merdeka"
"1246725158246604800","Sun Apr 05 09:03:35 +0000 2020","0","Hadaaah.... yg masih Waras ngalah. Banyak Negara Justru Menutup Masuknya Orang &amp; Melarang Warga Pergi. Obral Tiket.... #RezimGagap #RakyatButuhSehat","1246725158246604800","","","in","","0","0","0","https://twitter.com/Kampus_Merdeka/status/1246725158246604800","2984157584","Kampus_Merdeka"
"1246723361368993793","Sun Apr 05 08:56:27 +0000 2020","0","Pasti Salah Satu Salah Atau Bohong. Anda masih percaya? #RezimGagap #ApaSajaKerjanya","1246723361368993793","","","in","","0","0","0","https://twitter.com/Kampus_Merdeka/status/1246723361368993793","2984157584","Kampus_Merdeka"
"1246722039706050560","Sun Apr 05 08:51:11 +0000 2020","0","Sebanyak 226 Jemaat Tertular Virus Corona di Gereja Bethel Bandung. Pendetanya Juga Meninggal Positif Convid-19. Kita Tetap Ekstra Hati-hati. Semoga Terlindungi dari Segala Musibah termasuk Corona #PemerintahLambanLawanCorona #PemerintahLembekLawanCorona https://t.co/zH5RC1adgK","1246722039706050560","","","in","","0","0","0","https://twitter.com/Kampus_Merdeka/status/1246722039706050560","2984157584","Kampus_Merdeka"
"1246705128188661761","Sun Apr 05 07:43:59 +0000 2020","0","#SolaFekonUnsulbar Aksi dari Kakak Fekon terhadap pencengahan penyelenggaraan Virus Covid-19 .. #kampusmerdeka #fekonunsulbarjaya https://t.co/vCN5dz7MEq","1246705128188661761","","","in","Majene, Sulawesi Barat","0","0","0","https://twitter.com/UsbFekon/status/1246705128188661761","1210961988362194944","UsbFekon"
"1246650377186889728","Sun Apr 05 04:06:26 +0000 2020","1","Udah mulai kampus lain kpan nyusul khususnya @Stai_awr_sarang. Waktunya mahasiswa merdeka dari tekanan dn cekaman maut. ","1246650377186889728","","","in","pontianak","0","0","0","https://twitter.com/Manusia_No_/status/1246650377186889728","3399797832","Manusia_No_"
"1246639740993949698","Sun Apr 05 03:24:10 +0000 2020","1","Andai aja kalau kampus merdeka benar benar terjadi Betapa bahagian nya Anak kelahiran 1999-1998 anak tw anak ig anak fb anak tg anak path anak tiktok dan pastinya anak mamak nya","1246639740993949698","","","in","Sumatera Utara, Indonesia","0","0","0","https://twitter.com/haii_ky/status/1246639740993949698","1147031117708398592","haii_ky"
"1246483749862174722","Sat Apr 04 17:04:19 +0000 2020","0","Survey Pace Mace sekalian seharusnya berjudul: Survey untuk Mahasiswa Akhir dalam Penelitian/skripsi di Tengah Wabah Covid-2020 Ini kebijakan kampus saya tercinta. Tidak ada penangguhan uang kuliah Pace Mace admin sekalian. Saya tunggu kebijakan dari Mas Nadiem MERDEKA BELAJAR https://t.co/m1haWc2Wq3","1246483749862174722","https://pbs.twimg.com/media/EUxlWRDUUAAzUBV.jpg","","in","","0","2","0","https://twitter.com/Juniorternama/status/1246483749862174722","715667594","Juniorternama"
"1246434085326606336","Sat Apr 04 13:46:58 +0000 2020","0","Evaluasi kuliah daring #STMIKWidyaPratama Semoga bisa melayani dengan total dan sepenuh hati #STMIKwp #KotaPekalongan #Pekalongan #KampusBiru #KampusHebat #KampusMerdeka https://t.co/S2VN49qaHt","1246434085326606336","https://pbs.twimg.com/media/EUw5LuCU0AE0uab.jpg","","in","Semarang","0","0","0","https://twitter.com/bayuandoro/status/1246434085326606336","122717275","bayuandoro"
"1246396668318109696","Sat Apr 04 11:18:17 +0000 2020","0","Ngotot Bangun Ibu Kota Baru untuk Siapa? Super Aneh. Di Tengah Rakyat Susah Dilanda Wabah. Dasar........ https://t.co/uv4RiqBemW","1246396668318109696","","","in","","0","1","0","https://twitter.com/Kampus_Merdeka/status/1246396668318109696","2984157584","Kampus_Merdeka"
"1246306266638508037","Sat Apr 04 05:19:03 +0000 2020","0","Kompetisi/Lomba/Festival yang biasadilaksanakan di tiap Direktorat kini bergabung di #Puspresnas #MerdekaBelajar #KampusMerdeka #dirumahaja #prestasi #kemdikbud https://t.co/Ohy8dtG78J","1246306266638508037","https://pbs.twimg.com/media/EUvDpeYUUAAuDoj.jpg","","in","Indonesia","0","0","0","https://twitter.com/puspresnas/status/1246306266638508037","1245249011885289472","puspresnas"
"1246169095646482432","Fri Apr 03 20:13:59 +0000 2020","0","[INFO SURAT EDARAN KMB TAHUN 2020] Hello Industrial Engineers Berdasarkan surat edaran nomor: 168/UN43.3/KP.02.02/2020 tentang Petunjuk Teknis Konversi Kegiatan Pembelajaran Berbasis Kampus Merdeka-Merdeka Belajar di Lingkungan Fakultas Teknik... https://t.co/bgGZTVgNNY https://t.co/Z0rXFXRBSP","1246169095646482432","https://pbs.twimg.com/media/EUtHxpWU0AASkbz.jpg","","in","Cilegon, Banten","0","0","0","https://twitter.com/HMTI_UNTIRTA/status/1246169095646482432","306088582","HMTI_UNTIRTA"
"1245692641657774081","Thu Apr 02 12:40:44 +0000 2020","7","Press Release | KUBIK Talks Selamat Malam FISIP! Setelah diadakannya KUBIK TALKS dengan tema Kampus Merdeka: Fakultas Ilmu Sosial Dalam Intervensi Pasar berikut adalah press release yang dapat masyarakat jingga baca. https://t.co/aeVAQ1dOXl","1245692641657774081","https://pbs.twimg.com/media/EUmW1p-U0AEwUAU.jpg","","in","Brawijaya, Malang - Indonesia","0","1","0","https://twitter.com/BEMFISIPUB/status/1245692641657774081","758839291","BEMFISIPUB"
"1245674802347532289","Thu Apr 02 11:29:51 +0000 2020","1","[Diskusi Publik] . Halo semuanya Yukk berdiskusi bersama dengan tema Kampus merdeka: Untung atau buntung? pada: Jumat 3 April 2020 20.00 Wita -Selesai Via zoom meeting ( Meeting ID : 258-453-291) Link : https://t.co/mqHFOYitxx . . #apakabarhimajie https://t.co/9ROibyyjIt","1245674802347532289","https://pbs.twimg.com/media/EUmGlLpUwAAajZd.jpg","","in","Universitas Hasanuddin","0","0","0","https://twitter.com/apakabarhimajie/status/1245674802347532289","573212910","apakabarhimajie"
"1245659569696563200","Thu Apr 02 10:29:19 +0000 2020","3","Bagaimana realisasi kampus merdeka di tengah wabah corona? https://t.co/wqz77P4NlP","1245659569696563200","","","in","Yogyakarta, Indonesia","0","0","0","https://twitter.com/IBTimesID/status/1245659569696563200","1412074356","IBTimesID"
"1245606158812897281","Thu Apr 02 06:57:05 +0000 2020","0","Kampus Merdeka Aktivitas Mahasiswa Relawan COVID-19 Disetarakan SKS https://t.co/1ud1JLN6WW","1245606158812897281","","","in","Indonesia","0","0","1","https://twitter.com/pikiran_rakyat/status/1245606158812897281","58880688","pikiran_rakyat"
"1245282291720437761","Wed Apr 01 09:30:09 +0000 2020","0","Setelah lulus pilih kampus &amp; daftarnya gimana ya? Cek langkahnya disini https://t.co/S8YqPxju44 #podomorouniversity #daftarkuliah #PerguruanTinggi #KampusMerdeka #MerdekaBelajar https://t.co/zWHH0btcNd","1245282291720437761","https://pbs.twimg.com/media/EUghomrUwAEZGmq.jpg","","in","Jakarta Capital Region, Indone","0","0","0","https://twitter.com/PodomoroUniv/status/1245282291720437761","2338599487","PodomoroUniv"
"1245205716240961536","Wed Apr 01 04:25:52 +0000 2020","0","BEM SI: Pemerintah Jangan Main-Main Dengan Nyawa Rakyat..!!! #IndonesiaSehat #IndonesiaButuhPemimpin #KarantinaWilayah #TetapDiamDirumah https://t.co/LKkUbBkt60","1245205716240961536","","","in","","0","0","0","https://twitter.com/Kampus_Merdeka/status/1245205716240961536","2984157584","Kampus_Merdeka"
"1245169086218162176","Wed Apr 01 02:00:18 +0000 2020","16","#SahabatDikbud mari simak gelar wicara radio Edukasi Relawan Mahasiswa Kesehatan Hadapi Pandemik Covid-19 pagi ini pukul 10.00 WIB di @RRIPrograma3. #SahabatDikbud juga dapat menyimak di https://t.co/64ITtCXx17. #KampusMerdeka #BersamaHadapiKorona https://t.co/4O694fZd3z","1245169086218162176","https://pbs.twimg.com/media/EUe6rWGWsAEvlaf.jpg","","in","Jakarta","0","0","1","https://twitter.com/Kemdikbud_RI/status/1245169086218162176","631701837","Kemdikbud_RI"
