"conversation_id_str","created_at","favorite_count","full_text","id_str","image_url","in_reply_to_screen_name","lang","location","quote_count","reply_count","retweet_count","tweet_url","user_id_str","username"
"1409975163509100547","Tue Jun 29 20:40:49 +0000 2021","0","Dari kasus BEM UI ini kita semua tahu bahwa mahasiswa nggak mati. Pandemi nggak mematikan semangat itu. Harapannya BEM dari kampus merdeka lainnya mau dan berani untuk ngambil langkah yang sama. Aspirasi dan kritik harus jalan terus. Panjang umur perjuangan!","1409975163509100547","","","in","she/they","1","1","0","https://twitter.com/starclust/status/1409975163509100547","1715344074","starclust"
"1409939723024429057","Tue Jun 29 18:20:00 +0000 2021","1","gila ya kampus merdeka keren banget omg???????? programnya bener2 serentak &amp; bikin mindblown bgt","1409939723024429057","","","in","he/they","0","1","0","https://twitter.com/9OSREMIX/status/1409939723024429057","1249006047773122560","9OSREMIX"
"1409925214574571525","Tue Jun 29 17:22:20 +0000 2021","0","Minat bgt ikut program magang kampus merdeka. Cuma buat jurusan dan kampus gue...ah sudahlah","1409925214574571525","","","in","","0","0","0","https://twitter.com/luvhewan/status/1409925214574571525","3166800158","luvhewan"
"1409920797620117508","Tue Jun 29 17:04:47 +0000 2021","0","program kampus merdeka malah bikin susah nyari intern","1409920797620117508","","","in","","0","0","0","https://twitter.com/malmerman/status/1409920797620117508","224159238","malmerman"
"1409912004819636226","Tue Jun 29 16:29:51 +0000 2021","0","Untung karena ngurus dokumen kampus merdeka jadi agak sedikit ikhlas dengan ending #DoomAtYourService hiksssss","1409912004819636226","","","in","kwangya","0","0","0","https://twitter.com/mydayisjungwoo/status/1409912004819636226","1216986362206801920","mydayisjungwoo"
"1409910561626750992","Tue Jun 29 16:24:07 +0000 2021","0","magang kampus merdeka kenapa ngga dari taun kemaren ya:( kan aku pengen nyoba","1409910561626750992","","","in","","0","0","0","https://twitter.com/heemsterbambi/status/1409910561626750992","856348602","heemsterbambi"
"1409906285819023368","Tue Jun 29 16:07:07 +0000 2021","2","Halo gais ada yg daftar kampus merdeka? Aku ada daftar salah satu perusahaan tp gadapet email konfirmasi gimana ya? work!","1409906285819023368","","","in","AUTOBASE — ❌POST MANUAL❌","0","0","0","https://twitter.com/worksfess/status/1409906285819023368","1244597361826885636","worksfess"
"1409884081026912265","Tue Jun 29 14:38:53 +0000 2021","0","Apa daya gabisa daftar ke kampus merdeka huhu","1409884081026912265","","","in","Melbourne, Australia","0","0","0","https://twitter.com/AiRikux/status/1409884081026912265","1386162223563694083","AiRikux"
"1409881105394720772","Tue Jun 29 14:27:04 +0000 2021","0","Kampus Merdeka itu harusnya menjamin kemerdekaan akademik. Apalagi mahasiswa itu tunas muda bangsa yang hanya menyuarakan nurani masyarakat gimana Mas Menteri? https://t.co/XCU0FifIFu","1409881105394720772","","","in","Jakarta","0","0","0","https://twitter.com/MNariyadi/status/1409881105394720772","104859397","MNariyadi"
"1409879363470962701","Tue Jun 29 14:20:09 +0000 2021","0","Program kampus merdeka bikin pengen balik kuliah","1409879363470962701","","","in","","0","0","0","https://twitter.com/satria96pradika/status/1409879363470962701","208439694","satria96pradika"
"1409879335566249990","Tue Jun 29 14:20:02 +0000 2021","3","Artikel @NugrahaDerri pada 2020. Tampaknya isinya masih relevan dan kontekstual dengan peristiwa yang jadi perbincangan belakangan ini. @BEMUI_Official --- Ironi Kampus Merdeka: Pincang Nalar-Bungkam Mahasiswa Kritis https://t.co/xUa3WN1NWZ","1409879335566249990","","","in","Bandar Lampung","0","0","1","https://twitter.com/AJI_Balam/status/1409879335566249990","2919929138","AJI_Balam"
"1409874513467162629","Tue Jun 29 14:00:52 +0000 2021","0","Maksudnya kampus merdeka itu apa ya? Sampai skrg masih bertanya-tanya.","1409874513467162629","","","in","Jakarta Capital Region, Indone","0","0","0","https://twitter.com/AndyRWijaya/status/1409874513467162629","113142598","AndyRWijaya"
"1409870705777336334","Tue Jun 29 13:45:45 +0000 2021","3","Surat Untuk Mas Menteri Terimakasih telah membuat program yang sangat luar biasa kampus merdeka. Saya cindy nur oktaviani adalah satu dari 15.000 mahasiswa yang merdeka melalui program kampus mengajar. #IPBUniversity #IPBNesian #KampusTerbaik #KampusMerdeka #IPB24JAM https://t.co/NB0fj6HlEm","1409870705777336334","https://pbs.twimg.com/ext_tw_video_thumb/1409869947409469449/pu/img/mLL7XWbxMSZVLvfB.jpg","","in","","0","0","0","https://twitter.com/IPB24JAM/status/1409870705777336334","1191652637302640641","IPB24JAM"
"1409867130900815874","Tue Jun 29 13:31:32 +0000 2021","0","Pen ambil internship kampus merdeka tapi masi ada praktikum pusing pala baim","1409867130900815874","","","in","","0","0","0","https://twitter.com/ikhsandwl/status/1409867130900815874","1655163024","ikhsandwl"
"1409858726136205314","Tue Jun 29 12:58:08 +0000 2021","0","Coba coba kampus merdeka kali ye? Pulau tujuannya jawa oke si ye? Tapi univnya random gapapa lah ya.. Hmm...","1409858726136205314","","","in","","0","2","0","https://twitter.com/Ditt_dty/status/1409858726136205314","1005118786779865088","Ditt_dty"
"1409850954095095810","Tue Jun 29 12:27:15 +0000 2021","0","magang kampus merdeka kaliya","1409850954095095810","","","in","","0","0","0","https://twitter.com/myunobin/status/1409850954095095810","1058500910475751424","myunobin"
"1409849353032802310","Tue Jun 29 12:20:54 +0000 2021","0","[WAFATNYA IKLIM DEMOKRASI DI KAMPUS] Halo IKM FF UI UI dan Indonesia! Sebagai manusia utuh dan merdeka seluruh manusia memiliki banyak hak yang fundamental salah satunya adalah hak untuk berpendapat. Dengan banyaknya regulasi yang mengatur tentang kebebasan (...) https://t.co/tojQEdhINb","1409849353032802310","https://pbs.twimg.com/media/E5DKgq8VoAY0rpn.jpg","","in","Depok, Jawa Barat","0","1","0","https://twitter.com/BEMFFUI/status/1409849353032802310","251199919","BEMFFUI"
"1409848357552463876","Tue Jun 29 12:16:56 +0000 2021","0","Katanya kampus merdeka terus kalau regulasi seperti ini merdeka dimana?","1409848357552463876","","","in","Indonesia","0","0","0","https://twitter.com/hhusein88/status/1409848357552463876","192599199","hhusein88"
"1409846031341158404","Tue Jun 29 12:07:42 +0000 2021","22","Ingin rasakan kuliah satu semester di Kampus Merdeka Universitas Airlangga dengan suasana berbeda? Segera daftarkan dirimu pada program #PertukaranMahasiswaMerdeka Universitas Airlangga telah menawarkan sebanyak 47 mata kuliah yang dapat kamu ambil. https://t.co/2WfFNHc9jl","1409846031341158404","https://pbs.twimg.com/media/E5DG-eoUcAARk9Z.jpg","","in","Surabaya, Indonesia","1","1","3","https://twitter.com/Unair_Official/status/1409846031341158404","1110709339","Unair_Official"
"1409843898625802241","Tue Jun 29 11:59:13 +0000 2021","0","!upi daftar kampus merdeka bisa pake hp ga yaa?","1409843898625802241","","","in","","0","2","0","https://twitter.com/UPI_fess/status/1409843898625802241","1409432647038738432","UPI_fess"
"1409843681792729090","Tue Jun 29 11:58:22 +0000 2021","0","Ngeliat kampus merdeka bisa ambil matkul ilustrasi di kampus lain hnnnngggggggg","1409843681792729090","","","in","","0","0","0","https://twitter.com/tuna_mayo_crepe/status/1409843681792729090","1037375558282170368","tuna_mayo_crepe"
"1409842374340091913","Tue Jun 29 11:53:10 +0000 2021","0","pengen ikut magang kampus merdeka tapi ilmuku masih cetek bgt:(","1409842374340091913","","","in","","0","0","0","https://twitter.com/preciyouz/status/1409842374340091913","3365175467","preciyouz"
"1409842059708489729","Tue Jun 29 11:51:55 +0000 2021","0","Mitra Integrasi Informatika Terpilih Sebagai Mitra Kampus Merdeka https://t.co/5rBdm5AQeS @indoict","1409842059708489729","","","in","INDONESIA","0","0","0","https://twitter.com/indoict/status/1409842059708489729","957482702","indoict"
"1409841987734315009","Tue Jun 29 11:51:38 +0000 2021","0","Mitra Integrasi Informatika Terpilih Sebagai Mitra Kampus Merdeka https://t.co/5rBdm5AQeS via @indoict","1409841987734315009","","","in","INDONESIA","0","0","0","https://twitter.com/indoict/status/1409841987734315009","957482702","indoict"
"1409841603947073540","Tue Jun 29 11:50:06 +0000 2021","0","Kampus merdeka https://t.co/gwqPfJHiz0","1409841603947073540","https://pbs.twimg.com/media/E5DDds-VcAILCvl.jpg","","in","","0","0","0","https://twitter.com/awfannnn1/status/1409841603947073540","228979127","awfannnn1"
"1409839263089262598","Tue Jun 29 11:40:48 +0000 2021","0","Ah maju mundur bgt ini mo ikut magang bersertifikatnya kampus merdeka :(","1409839263089262598","","","in","warga lokal","0","0","0","https://twitter.com/bicikkkk/status/1409839263089262598","463501686","bicikkkk"
"1409837328319713281","Tue Jun 29 11:33:07 +0000 2021","1","KULIAH UMUM ________________ Pemantapan Paradigma Mahasiswa Dalam Pengelolaan Agrowisata. Fakultas Pertanian - Universitas Muhammadiyah Aula Lantai III Faperta Ummat 30 Juni 2021 Jam 08.00 - 12.00 WITA. #umm #ummat #faperta #kampusmerdeka #agrowisata #NTBGemilang #LobarMantap https://t.co/g2FN2vqE8V","1409837328319713281","https://pbs.twimg.com/media/E5C_lALVUAABXl7.jpg","","in","","0","0","0","https://twitter.com/loezawa1978/status/1409837328319713281","936273395095703553","loezawa1978"
"1409836429753024520","Tue Jun 29 11:29:33 +0000 2021","0","Untuk mas menteri apa sih yang ngga...Demi menyusun Kurikulum Merdeka Belajar Kampus Merdeka ngga masak ngga nyuci anak main sendiri dan aku manteng terus depan layar. Liat te el ah biar ga sepet. Merdeka!!! https://t.co/rhO2aFufF2","1409836429753024520","https://pbs.twimg.com/media/E5C-wsNVkAAiyPR.jpg","","in","Bandung","0","0","0","https://twitter.com/aishaamecca/status/1409836429753024520","3083950994","aishaamecca"
"1409833773588381697","Tue Jun 29 11:18:59 +0000 2021","33","UX Challenge: Skilvul Virtual Internship Program Magang Bersertifikat Kampus Merdeka https://t.co/60tSgi3BP8","1409833773588381697","https://pbs.twimg.com/media/E5C8VpNVgAkWHIK.jpg","","in","Cloud","2","2","11","https://twitter.com/txtdrprogramer/status/1409833773588381697","1275808843168006146","txtdrprogramer"
"1409833140273639428","Tue Jun 29 11:16:28 +0000 2021","0","Sehubungan dengan Hibah Program Kompetisi Kampus Merdeka (PKKM) Liga 2 yg diterima oleh Program Studi Pendidikan Biologi dari Fakultas keguruan dan Ilmu Pendidikan hari ini bertempat di Hotel Beston terlaksana MoU dan MoA dgn berbagai mitra Dunia Usaha dan Dunia Industri (DUDI). https://t.co/QGpHxf9Vll","1409833140273639428","https://pbs.twimg.com/media/E5C7xPTVIAEkeNS.jpg","","in","","0","0","0","https://twitter.com/fkip_ump/status/1409833140273639428","1286920808221163522","fkip_ump"
"1409832975328370690","Tue Jun 29 11:15:49 +0000 2021","0","gila kampus lain pada direkomendasiin kampus merdeka sedangkan kampus gue diem diem aja. ","1409832975328370690","","","in","","0","0","0","https://twitter.com/abcdfuckuolee/status/1409832975328370690","1108622641240248321","abcdfuckuolee"
"1409831121278279688","Tue Jun 29 11:08:27 +0000 2021","0","Giliran niat mau magang lg banyak dr kampus merdeka fakultas yg kaga jelas ketentuannya ga ada kabarnya samsek. Brengseek brengsek ","1409831121278279688","","","in","","0","0","0","https://twitter.com/kiIIdarlings/status/1409831121278279688","189379120","kiIIdarlings"
"1409829154002898950","Tue Jun 29 11:00:38 +0000 2021","0","ditolak itb? gapapa unpad x itb kampus merdeka ada","1409829154002898950","","","in","","0","0","0","https://twitter.com/torlaies/status/1409829154002898950","1042378556179865600","torlaies"
"1409829091210006530","Tue Jun 29 11:00:23 +0000 2021","3","[ APA ITU KAMPUS MENGAJAR? ] Kampus Merdeka bertujuan untuk memberikan kesempatan kepada mahasiswa untuk belajar dan mengembangkan diri melalui aktivitas di luar kelas perkuliahan. Yuk cek info selengkapnya di Instagram BEM FEB UNS - https://t.co/KLFFlXnw3D https://t.co/jeFLsSQdNV","1409829091210006530","https://pbs.twimg.com/media/E5C4FPhVUAg-x2T.jpg","","in","Gedung UKM FEB UNS","0","0","1","https://twitter.com/BEMFEBUNS/status/1409829091210006530","124148265","BEMFEBUNS"
"1409828103682072579","Tue Jun 29 10:56:27 +0000 2021","0","sistem sks pertukaran pelajar kampus merdeka gimana dah? asli ga ngertiii","1409828103682072579","","","in","","0","0","0","https://twitter.com/leejenologist/status/1409828103682072579","1118238682987679744","leejenologist"
"1409826131088318470","Tue Jun 29 10:48:37 +0000 2021","0","Aku sampe hafal topik yang ditanya di colle tuh mostly ap aja dari spss rekomen laptop pindah jurusan kampus merdeka curhat kulon sampe tips wawancara","1409826131088318470","","","in","she/her ","0","0","0","https://twitter.com/seungct/status/1409826131088318470","1281007109211975681","seungct"
"1409824961741553665","Tue Jun 29 10:43:58 +0000 2021","0","ni website kampus merdeka knp lemot bgt dr kmrn dahh","1409824961741553665","","","in","","0","0","0","https://twitter.com/yddabluee/status/1409824961741553665","1335860978815172608","yddabluee"
"1409819441253085193","Tue Jun 29 10:22:02 +0000 2021","9","Halo #InsanDikti Ada kabar gembira nih. Pendaftaran Pertukaran Mahasiswa Merdeka diperpanjang hingga 2 Juli 2021 pukul 23.59 WIB. Jangan sampai ketinggalan! Sebarkan informasi ini ke teman mahasiswa yang lain ya. #MerdekaBelajar #KampusMerdeka #PertukaranMahasiswaMerdeka https://t.co/aR8b4KYDkU","1409819441253085193","https://pbs.twimg.com/media/E5CvToiVkAEbbl4.jpg","","in","Jl Pintu Satu Senayan, Jakarta","1","1","2","https://twitter.com/ditjendikti/status/1409819441253085193","855008917247545344","ditjendikti"
"1409818469059629058","Tue Jun 29 10:18:10 +0000 2021","0","Kampus merdeka seru keknya pengen ikut ntar","1409818469059629058","","","in","Bogor, Jawa Barat","0","0","0","https://twitter.com/tuanputrivelice/status/1409818469059629058","841475178","tuanputrivelice"
"1409818045980151821","Tue Jun 29 10:16:29 +0000 2021","0","Besok 30 Juni double pengumuman Semangat emang gak gampang sih apalagi yang mengejar Kampus Merdeka . Capek emang usaha ikhtiar gak karuan https://t.co/EVdoWSg7cW","1409818045980151821","https://pbs.twimg.com/media/E5CuCBaVkAAIu46.jpg","","in","Malang, Jawa Timur","0","0","0","https://twitter.com/cekamarsebelah/status/1409818045980151821","1239582291577331712","cekamarsebelah"
"1409807584823975940","Tue Jun 29 09:34:55 +0000 2021","0","gue gak ngerti di program webinar kampus merdeka aja bahkan masih ada buzzer ppffff","1409807584823975940","","","in","mostly talk about kpop&anime","0","0","0","https://twitter.com/fairylinow/status/1409807584823975940","949445269","fairylinow"
"1409805266091085826","Tue Jun 29 09:25:43 +0000 2021","0","Katanya program kampus merdeka bisa bebas pilih matkul dari berbagai jurusan nyatanya matkul diaturin kaprodi semua. Merdeka engga meninggal iya Secara matkul TI semua","1409805266091085826","","","in","Jakarta Capital Region, Indone","0","0","0","https://twitter.com/_yourbobaa/status/1409805266091085826","1146295669814173697","_yourbobaa"
"1409805018333552646","Tue Jun 29 09:24:43 +0000 2021","0","(1/6) [WAFATNYA IKLIM DEMOKRASI DI KAMPUS] Pagi Teknik! Sebagai manusia utuh dan merdeka seluruh manusia memiliki banyak hak yang fundamental salah satunya adalah hak untuk berpendapat. https://t.co/wY5Bjk5ELt","1409805018333552646","https://pbs.twimg.com/media/E5CiMKEUYAQQinK.jpg","","in","Depok, Jawa Barat","0","1","0","https://twitter.com/BEMFTUI/status/1409805018333552646","145570516","BEMFTUI"
"1409802040021188610","Tue Jun 29 09:12:53 +0000 2021","0","Ayo dapatkan 20 SKS dengan mengikuti program Synergized Aquaculture Innovative Learning yang bekerja sama dengan Kampus Merdeka @JAPFACOMFEEDTBK https://t.co/Vs8a7QlNU3","1409802040021188610","https://pbs.twimg.com/media/E5CfaaXVkAIe3vi.jpg","","in","Bogor, Jawa Barat","0","1","0","https://twitter.com/minapoli_id/status/1409802040021188610","901840290759172096","minapoli_id"
"1409793794317242370","Tue Jun 29 08:40:07 +0000 2021","0","Bisa nyogok gak Min? Kok dosen Fisip @adearmando1 nanya ke ketua @BEMUI_Official kak @Leon_Alvinda dia masuknya nyogok? UI itu sekarang dah jadi kampus gak bener ya? Merdeka dari mana? Ketua mahasiswanya dikatain bencong diem aja","1409793794317242370","","","in","Location","0","0","0","https://twitter.com/AntiPengPeng/status/1409793794317242370","1097021784212135936","AntiPengPeng"
"1409791518030716929","Tue Jun 29 08:31:05 +0000 2021","447","Halo Calon Mahasiswa Baru UI. Pengumuman Seleksi SIMAK UI 2021 akan diumumkan pada Rabu 30 Juni 2021 pukul 13.00 WIB. #simakui #universitasindonesia #kampusmerdeka https://t.co/IotdtabLJj","1409791518030716929","https://pbs.twimg.com/media/E5CV6REVUAEKIG-.jpg","","in","","35","32","38","https://twitter.com/univ_indonesia/status/1409791518030716929","74646907","univ_indonesia"
"1409783844006350850","Tue Jun 29 08:00:35 +0000 2021","3","Kementan Kemenkop-UKM IPB Kembangkan Pertanian Korporasi #IPBUniversity #IPBNesian #IPBDigdaya #KampusTerbaik #KampusMerdeka #IPB24JAM #IPBKeren #InovasiIPB #KampusIPB #InfoIPB #IPBbogor #AnakIPB #AlumniIPB #DosenIPB #MerdekaBelajar #KampusMerdeka https://t.co/IjqTvg8OUl","1409783844006350850","https://pbs.twimg.com/media/E5COicVVUAEHVpt.jpg","","in","","0","0","1","https://twitter.com/IPB24JAM/status/1409783844006350850","1191652637302640641","IPB24JAM"
"1409782192083963904","Tue Jun 29 07:54:01 +0000 2021","2","Inovasi Keju Nabati dari Dosen IPB University Cocok Untuk Penderita Alergi Susu #IPBUniversity #IPBNesian #IPBDigdaya #KampusTerbaik #KampusMerdeka #IPB24JAM #IPBKeren #InovasiIPB #KampusIPB #InfoIPB #IPBbogor #AnakIPB #AlumniIPB #DosenIPB #AlumniKeren #KaryaIPB #PrestasiIPB https://t.co/rdIZNBpsyL","1409782192083963904","https://pbs.twimg.com/media/E5CNa8MVcAMP_qD.jpg","","in","","0","0","2","https://twitter.com/IPB24JAM/status/1409782192083963904","1191652637302640641","IPB24JAM"
"1409780439875682307","Tue Jun 29 07:47:03 +0000 2021","14","Suara mahasiswa jernih independen dan merdeka. Saya percaya Kampus adalah ruang untuk kritik yang bermartabat dan beretika https://t.co/D3ILTp6c3K","1409780439875682307","https://pbs.twimg.com/media/E5CLsi4VIAUC-mV.jpg","","in","Indonesia","0","2","4","https://twitter.com/eddy_soeparno/status/1409780439875682307","3091912583","eddy_soeparno"
"1409780041458741252","Tue Jun 29 07:45:28 +0000 2021","0","Mau daftar kampus merdeka yg program magang tp prodiku ga mendukung hm","1409780041458741252","","","in","unlabeled","0","0","0","https://twitter.com/amasasiiy/status/1409780041458741252","263052205","amasasiiy"
"1409777984282656771","Tue Jun 29 07:37:18 +0000 2021","1","sblm apply kampus merdeka izin dulu ke bokap buat apply ke perusahaan kompetitor ^___^ https://t.co/3MgsYbDiOt","1409777984282656771","https://pbs.twimg.com/media/E5CJd3UVkAgV2Es.png","","in","","0","2","0","https://twitter.com/raraazuraa/status/1409777984282656771","1070632073369546752","raraazuraa"
"1409776804634714113","Tue Jun 29 07:32:37 +0000 2021","0","Biarlah REKTOR mendapat tugas tambahan sebagai KOMISARIS di perusahaan atau BUMN say a biar di sini saja menambah tugas sendiri. #kampusmerdeka #independensi #aktivismahasiswa @ Makassar https://t.co/xVjtcPK3c6","1409776804634714113","","","in","Makassar","0","0","0","https://twitter.com/Attock_Suharto/status/1409776804634714113","525973693","Attock_Suharto"
"1409776114751328261","Tue Jun 29 07:29:52 +0000 2021","0","Kerjasama Tridharma Perguruan Tinggi Implementasi Merdeka Belajar Kampus Merdeka Bersama Fakultas Teknis Universitas 17 Agustus 1945 Banyuwangi dan Pemerintah @DesaKaligondo @kecgenteng https://t.co/G7u35GB0Fj","1409776114751328261","https://pbs.twimg.com/media/E5CH5JOUYAU2ex4.jpg","","in","Banyuwangi, Indonesia","0","0","0","https://twitter.com/firmansanyoto/status/1409776114751328261","773432307462107137","firmansanyoto"
"1409774780669071366","Tue Jun 29 07:24:34 +0000 2021","0","Work! Kalo ikut magang kampus merdeka itu boleh apply sebanyak-banyak nya atau cuma satu ya?","1409774780669071366","","","in","AUTOBASE — ❌POST MANUAL❌","0","2","0","https://twitter.com/worksfess/status/1409774780669071366","1244597361826885636","worksfess"
"1409774073803116544","Tue Jun 29 07:21:46 +0000 2021","0","Kampus merdeka merdeka melanggar statuta ","1409774073803116544","","","in","The Hague, The Netherlands","0","0","0","https://twitter.com/fardanmfn/status/1409774073803116544","1043650950","fardanmfn"
"1409773496025059328","Tue Jun 29 07:19:28 +0000 2021","1","[INTERNSHIP | DPR] Halo Sobat Vokasi! Saat ini DPR RI yang bekerja sama dengan Kemdikbudristek dalam program kampus merdeka yaitu #MagangDirumahRakyat Info lebih lanjut : https://t.co/pgONgpHyh3 Lalu search DPR . Narahubung : anafadilaaa (Line) #ChampionsEverywhere https://t.co/SwH1l3Cek7","1409773496025059328","https://pbs.twimg.com/media/E5CFgSIVkAcLTEp.jpg","","in","","0","0","0","https://twitter.com/bemsvundip_/status/1409773496025059328","1372887696817881089","bemsvundip_"
"1409770636285648897","Tue Jun 29 07:08:06 +0000 2021","2","Hallo Mahasidwa UNS! Selamat sore guys Mimin ada info pengkar nih buat kalian.. ⭐INFO MAGANG UNILEVER ACADEMY INTERSHIP PROGRAM X KAMPUS MERDEKA⭐ Cekidot #Adkesma https://t.co/hOFPSobRD1","1409770636285648897","https://pbs.twimg.com/media/E5CCzUcVcAAhmx6.jpg","","in","Surakarta, Jawa Tengah","0","0","0","https://twitter.com/hallo_uns/status/1409770636285648897","1247876119459549187","hallo_uns"
"1409769671595757590","Tue Jun 29 07:04:16 +0000 2021","0","#Podcast #TopicOfTheDay Diskusi @RadioIdolaSMG dengan Robertus Robet - Seberapa Jauh Konsep KAMPUS MERDEKA Mampu Memelihara Semangat Kebebasan Berpendapat? https://t.co/2PFFbXL08Y - https://t.co/qgxDC7eqEs","1409769671595757590","","","in","Semarang, Jawa Tengah","0","0","0","https://twitter.com/RadioIdolaSMG/status/1409769671595757590","385894867","RadioIdolaSMG"
"1409769464145453056","Tue Jun 29 07:03:27 +0000 2021","0","#Podcast #TopicOfTheDay Diskusi @RadioIdolaSMG dengan Ubaid Matraji ( @SeknasJppi ) - Seberapa Jauh Konsep KAMPUS MERDEKA Mampu Memelihara Semangat Kebebasan Berpendapat? https://t.co/2PFFbXL08Y - https://t.co/tzNHjgWoUh","1409769464145453056","","","in","Semarang, Jawa Tengah","0","0","0","https://twitter.com/RadioIdolaSMG/status/1409769464145453056","385894867","RadioIdolaSMG"
"1409769223803478017","Tue Jun 29 07:02:29 +0000 2021","0","#Podcast #TopicOfTheDay Diskusi @RadioIdolaSMG dengan Abdul Fikri Faqih - Seberapa Jauh Konsep KAMPUS MERDEKA Mampu Memelihara Semangat Kebebasan Berpendapat? https://t.co/2PFFbXL08Y - https://t.co/4IPQxhMZzR","1409769223803478017","","","in","Semarang, Jawa Tengah","0","0","0","https://twitter.com/RadioIdolaSMG/status/1409769223803478017","385894867","RadioIdolaSMG"
"1409767337981480965","Tue Jun 29 06:55:00 +0000 2021","0","Yuk segera daftar mahasiswa baru Program KIP Kuliah di Universitas Paramadina https://t.co/rMLvyP2PSf @DJRachbini @handi_risza @lldikti3 @Kemdikbud_RI #kampusmerdeka https://t.co/0fS4U7wrmA","1409767337981480965","https://pbs.twimg.com/media/E4jB9DMVEAEu4q3.jpg","","in","Jakarta Capital Region","0","0","0","https://twitter.com/paramadina/status/1409767337981480965","63422142","paramadina"
"1409766801966174208","Tue Jun 29 06:52:52 +0000 2021","0","Kampus merdeka seru ga","1409766801966174208","","","in","Gg. Kondang","0","0","0","https://twitter.com/Iostyoungster/status/1409766801966174208","2957975943","Iostyoungster"
"1409755125791424516","Tue Jun 29 06:06:28 +0000 2021","1","Nih program kampus merdeka itb-unpad udah jadi mimpi gue sejak lama. Baru kewujud sekarang pas udah lulus ","1409755125791424516","","","in","Bandung, Indonesia","0","0","0","https://twitter.com/ramaputram/status/1409755125791424516","150094812","ramaputram"
"1409752829967749123","Tue Jun 29 05:57:21 +0000 2021","0","dddd yg magang di kampus merdeka ini dibayar ga ya?","1409752829967749123","","","in","","0","0","0","https://twitter.com/dataargh/status/1409752829967749123","186068250","dataargh"
"1409749966633852949","Tue Jun 29 05:45:58 +0000 2021","0","Ada juga kampus yang sering munculin logo kampus merdeka di tiap poster seminar dll Tapi waktu ngepost sesuatu di official account IG dan banyak yang kasih kritik kolom komennya dinonaktifkan heuheu ","1409749966633852949","","","in","'67 chevy impala's backseat","0","0","0","https://twitter.com/tasyabibah/status/1409749966633852949","74038170","tasyabibah"
"1409745823752024064","Tue Jun 29 05:29:30 +0000 2021","1","#KampusMerdekaSeutuhnya Kampus Merdeka dimulai dari merdeka belajar berpikir berekspresi dn berdemokrasi. https://t.co/azhKiTmpl5","1409745823752024064","https://pbs.twimg.com/media/E5BsUsVVkAIlzVr.jpg","","in","Makassar, Indonesia","0","0","0","https://twitter.com/yusrintosepu/status/1409745823752024064","212610023","yusrintosepu"
"1409744803823190018","Tue Jun 29 05:25:27 +0000 2021","2","E-Fest PMWxTOP ITB 2021 Batch 1 Lahirkan Wirausaha Muda dari ITB Baca berita selengkapnya di laman https://t.co/CqwGa5VYLi #ITBNews #Webinar #Wirausaha #Inovasi #Penelitian #Pendidikan #KampusMerdeka #InstitutTeknologiBandung #dirumahaja #gerakansocialdistancing #COVID19","1409744803823190018","","","in","Bandung - Jatinangor - Cirebon","0","0","0","https://twitter.com/itbofficial/status/1409744803823190018","22878447","itbofficial"
"1409742103123415042","Tue Jun 29 05:14:43 +0000 2021","0","Keren dah kemendikbud ada program kampus merdeka gini bisa bantu mahasiswa explore ilmu baru dan pengalaman yang bener2 dibutuhin di dalam dunia kerja sekarang.","1409742103123415042","","","in","Depok-Metro","0","2","0","https://twitter.com/JeDarmawan/status/1409742103123415042","133946935","JeDarmawan"
"1409726759105306638","Tue Jun 29 04:13:45 +0000 2021","0","knp ya program kampus merdeka ada pas gue udh mo kelar ^_^","1409726759105306638","","","in","hogwarts","0","2","0","https://twitter.com/apaansiiie/status/1409726759105306638","1092793525551407106","apaansiiie"
