"conversation_id_str","created_at","favorite_count","full_text","id_str","image_url","in_reply_to_screen_name","lang","location","quote_count","reply_count","retweet_count","tweet_url","user_id_str","username"
"1409041407474425857","Sun Jun 27 06:50:24 +0000 2021","0","Rektor IPB Bertemu Danjen Kopassus Bahas Inovasi Rompi Antipeluru dari Limbah Sawit #IPBUniversity #IPBNesian #IPBDigdaya #KampusTerbaik #KampusMerdeka #IPB24JAM #IPBKeren #InovasiIPB #KampusIPB #InfoIPB #IPBbogor #AnakIPB #AlumniIPB #DosenIPB #AlumniKeren #KaryaIPB https://t.co/Qx0gj8mko9","1409041407474425857","https://pbs.twimg.com/media/E43rgp4VoAEWweA.jpg","","in","","0","0","0","https://twitter.com/IPB24JAM/status/1409041407474425857","1191652637302640641","IPB24JAM"
"1409038788882419714","Sun Jun 27 06:40:00 +0000 2021","2","Oyi titipan Halo rek aku mahasiswi semester 8 pengen ikut program kampus merdeka adakah dari kalian yang pernah ikut program itu bidang mentorship project atau internship. Huhu butuh insight","1409038788882419714","","","in","","0","2","0","https://twitter.com/ngalamfess/status/1409038788882419714","1159400358482833408","ngalamfess"
"1409038144582742017","Sun Jun 27 06:37:26 +0000 2021","2","-rek titipan Halo rek aku mahasiswi semester 8 pengen ikut program kampus merdeka adakah dari kalian yang pernah ikut program itu bidang mentorship project atau internship. Huhu butuh insight","1409038144582742017","","","in","Kota Surabaya, Jawa Timur","0","0","0","https://twitter.com/sbyfess/status/1409038144582742017","1152437175587241985","sbyfess"
"1409029202314100741","Sun Jun 27 06:01:54 +0000 2021","3","[ INFORMASI MERDEKA BELAJAR KAMPUS MERDEKA ] Halo sobat gensoed! Saat ini sedang dibuka registrasi untuk sejumlah Program Kampus Merdeka loh. Simak informasi diatas baik baik yaa. https://t.co/xP6vo8MYQD","1409029202314100741","https://pbs.twimg.com/media/E43glc4UcAE5aTR.jpg","","in","Universitas Jenderal Soedirman","0","1","0","https://twitter.com/Batir_Unsoed/status/1409029202314100741","1373591189459365896","Batir_Unsoed"
"1409027700799328260","Sun Jun 27 05:55:56 +0000 2021","0","prodi w bru mau sosialisasi kampus merdeka ea ampyun ","1409027700799328260","","","in","dont mbak me","0","0","0","https://twitter.com/YEAMlKO/status/1409027700799328260","241767857","YEAMlKO"
"1409019137762816000","Sun Jun 27 05:21:55 +0000 2021","0","Aslinya sedih banget gak bisa ikut program kampus merdeka semster ini karena satu dan lain hal :')","1409019137762816000","","","in","","0","1","0","https://twitter.com/dianlahay20/status/1409019137762816000","1134583928105259008","dianlahay20"
"1409015567617429504","Sun Jun 27 05:07:44 +0000 2021","1","[𝗞𝗘𝗚𝗜𝗔𝗧𝗔𝗡 𝗠𝗕𝗞𝗠 𝗗𝗜 𝗟𝗜𝗡𝗚𝗞𝗨𝗡𝗚𝗔𝗡 𝗣𝗥𝗢𝗗𝗜 𝗦𝟭 𝗣𝗪𝗞 𝗙𝗧𝗨𝗕] Halo KBM PWK FT-UB! Siapa nih yang berminat untuk ikut kegiatan Merdeka Belajar-Kampus Merdeka (MBKM)? Silakan klik untuk berikut untuk informasi lebih lanjut https://t.co/dD86oJJISa https://t.co/2JqefR9msu","1409015567617429504","https://pbs.twimg.com/media/E43UL6vVgAUp4Pu.jpg","","in","","0","0","0","https://twitter.com/HMPWKFTUB/status/1409015567617429504","391063293","HMPWKFTUB"
"1409013180244787201","Sun Jun 27 04:58:15 +0000 2021","0","Mau ikut magang kampus merdeka tapi takut ga bisa manage waktu","1409013180244787201","","","in","Stay at Home","0","0","0","https://twitter.com/NataDecode/status/1409013180244787201","816658903848992768","NataDecode"
"1409012806972698627","Sun Jun 27 04:56:46 +0000 2021","0","Opini yang bagus beberapa program Kampus Merdeka tapi kamu tidak tercantum di buku panduan MBKM prodi sehingga kerditmu tidak diakui. Sekarang jangan minta merdeka lagi. Kembalilah terjajah laprak.","1409012806972698627","","","in","Котор, Југославија","0","1","0","https://twitter.com/BGN_RI/status/1409012806972698627","1368201360991121410","BGN_RI"
"1408998604820287489","Sun Jun 27 04:00:19 +0000 2021","78","Kampus merdeka kan harusnya merdeka juga dalam critical thinking. Termasuk critical thinking terhadap pihak-pihak yg memiliki otoritas tinggi di lingkup negara.","1408998604820287489","","","in","","2","3","4","https://twitter.com/iqbal_farabi/status/1408998604820287489","65872114","iqbal_farabi"
"1408990987158908928","Sun Jun 27 03:30:03 +0000 2021","0","meh daftar kampus merdeka tp khs masih kosong","1408990987158908928","","","in","","0","0","0","https://twitter.com/arthaedo/status/1408990987158908928","391846115","arthaedo"
"1408968862524067840","Sun Jun 27 02:02:08 +0000 2021","0","Kenapa si waktu i kuliah belum ada tuh kampus merdeka : )","1408968862524067840","","","in","Jakarta ","0","1","0","https://twitter.com/dinisaursssss/status/1408968862524067840","1054140804","dinisaursssss"
"1408958996820553730","Sun Jun 27 01:22:56 +0000 2021","1","Ternyata kalo udah ngambil magang di kampus merdeka udah ga bisa ngambil kelas smtr depan mana smtr 5 matkul penting semua","1408958996820553730","","","in","","0","0","0","https://twitter.com/abrianabee/status/1408958996820553730","1212967729063292928","abrianabee"
"1408954434202181637","Sun Jun 27 01:04:48 +0000 2021","0","wrk! mau daftar magang kampus merdeka emang harus izin ke kampus sendiri ya?","1408954434202181637","","","in","AUTOBASE — ❌POST MANUAL❌","0","1","0","https://twitter.com/worksfess/status/1408954434202181637","1244597361826885636","worksfess"
"1408760645927899136","Sat Jun 26 12:14:46 +0000 2021","1","terlepas dari kondisi pandemi sekarang mahasiswa skrg beruntung bgt bisa ngerasain program kampus merdeka","1408760645927899136","","","in","known world","0","0","0","https://twitter.com/fjralma/status/1408760645927899136","174943982","fjralma"
"1408760448762011653","Sat Jun 26 12:13:59 +0000 2021","3","Kami mengucapkan selamat kepada kelima Communite yang berhasil meraih program IISMA Kampus Merdeka. 1. Aida Radifa Gunawan 2. Ivan Bimantoro 3. Nayika Kumara 4. Radhiyya Farhin 5. Alanis Desramadini https://t.co/OTR01ryTRx","1408760448762011653","https://pbs.twimg.com/media/E4zsIr9UcAErt6S.jpg","","in","Malang","2","1","0","https://twitter.com/himanikaUB/status/1408760448762011653","260565884","himanikaUB"
"1408760095903653899","Sat Jun 26 12:12:35 +0000 2021","0","pengen ikut kampus merdeka tp bingung minta izinnya :)","1408760095903653899","","","in","","0","0","0","https://twitter.com/kqiiww/status/1408760095903653899","1327021896","kqiiww"
"1408758294739513350","Sat Jun 26 12:05:25 +0000 2021","0","Gokar! Misi disini kakak2 unsika ada yg ikutan program magang dari kampus merdeka ga?","1408758294739513350","","","in","Indonesia","0","1","0","https://twitter.com/karawangmf/status/1408758294739513350","1184031349100777475","karawangmf"
"1408742800082882573","Sat Jun 26 11:03:51 +0000 2021","0","[Unilever Academy Internship Programme] Halo teman-teman mahasiswa! Ada info magang nih dari Unilever yang baru aja meluncurkan program magang terbaru bernama Unilever Academy Internship Programme (UAIP) yang berkolaborasi bersama Kampus Merdeka. https://t.co/1xQUozO41J","1408742800082882573","https://pbs.twimg.com/media/E4zcGuxVoAQhiUQ.jpg","","in","South Jakarta","0","1","1","https://twitter.com/bem_tau/status/1408742800082882573","3024372295","bem_tau"
"1408734877919289346","Sat Jun 26 10:32:22 +0000 2021","0","Kampus merdeka g y?","1408734877919289346","","","in","Bikini Bottom","0","2","0","https://twitter.com/menolakgabut/status/1408734877919289346","1260242224970756096","menolakgabut"
"1408731391211233281","Sat Jun 26 10:18:31 +0000 2021","0","Jadi generasi unggul tanpa narkoba sepakat ? #nodrug #saynotodrug #generasiunggul #generasikeren #kampusmerdeka #merdekabelajar #anakpintar #budayadigital #UICI https://t.co/ixxuDwXBmI","1408731391211233281","","","in","Jakarta","0","0","0","https://twitter.com/UICIofficial/status/1408731391211233281","1352985827127697408","UICIofficial"
"1408730518045151234","Sat Jun 26 10:15:03 +0000 2021","4","ptn! ada yang ikut program pertukaran mahasiswa kampus merdeka? ko aku ga bisa kirim ya?? balik ke opsi ini terus padahal aku udh isi ipk https://t.co/9Y859Ho5jw","1408730518045151234","https://pbs.twimg.com/media/E4zQXE9VEAYLvYd.jpg","","in","RULES 👉","0","4","0","https://twitter.com/sbmptnfess/status/1408730518045151234","1205629250423779328","sbmptnfess"
"1408724659218960385","Sat Jun 26 09:51:46 +0000 2021","54","Selamat Memperingati Hari Anti Narkoba Internasional. Mari tanamkan semangat berprestasi untuk memajukan masa depan bangsa. Jadikan motivasi untuk berkarya dan stop penyalahgunaan narkoba! #universitasindonesia #kampusmerdeka #HANI2021 #PerangMelawanNarkoba https://t.co/fV6K2Adgu6","1408724659218960385","https://pbs.twimg.com/media/E4zK71LUUAI4BOM.jpg","","in","","2","28","6","https://twitter.com/univ_indonesia/status/1408724659218960385","74646907","univ_indonesia"
"1408723719460069379","Sat Jun 26 09:48:02 +0000 2021","0","Moots ada yang ikut pertukaran pelajar di Kampus Merdeka?","1408723719460069379","","","in","London, England","0","0","0","https://twitter.com/hyoonaye/status/1408723719460069379","1009782548438765568","hyoonaye"
"1408696879697653768","Sat Jun 26 08:01:23 +0000 2021","0","Hai mahasiswa Indonesia! Jangan ketinggalan serunya magang di Kompas Gramedia tahun ini! KG Internship 2021 merupakan kerja sama dengan @ditjendikti dalam program @KampusMerdeka TUNGGU INFONYA #KGInternshipChallege2021 #KGIC2021 #internshipKG #KampusMerdeka #GrowBeyondYourWork https://t.co/Zh2g86IeN6","1408696879697653768","https://pbs.twimg.com/ext_tw_video_thumb/1408696823837958147/pu/img/ig6WIkH7iBEvQjOS.jpg","","in","Palmerah, Indonesia","0","0","0","https://twitter.com/growwith_kg/status/1408696879697653768","1497063792","growwith_kg"
"1408679922583830528","Sat Jun 26 06:54:00 +0000 2021","0","Yuk segera daftar mahasiswa baru Program KIP Kuliah di Universitas Paramadina https://t.co/rMLvyP2PSf @DJRachbini @handi_risza @lldikti3 @Kemdikbud_RI #kampusmerdeka https://t.co/VOTbUuj2HS","1408679922583830528","https://pbs.twimg.com/media/E4jB0QnVEAIEYEY.jpg","","in","Jakarta Capital Region","0","0","0","https://twitter.com/paramadina/status/1408679922583830528","63422142","paramadina"
"1408637572914372611","Sat Jun 26 04:05:43 +0000 2021","1","[ INFO MAGANG DPR RI] Hallo teman teman Otomasi !! Ada sedikit info beasiswa nih yuk disimak. Saat ini DPR RI yang bekerja sama dengan Kemdikbudristek dalam program kampus merdeka yaitu #MagangDirumahRakyat untuk mahasiswa semester 5 dan/ atau 7 diseluruh Indonesia. https://t.co/oNxkFjLuwO","1408637572914372611","https://pbs.twimg.com/media/E4x8Z0pVcAIv4hX.jpg","","in","Semarang, Jawa Tengah","0","1","0","https://twitter.com/himatro_svundip/status/1408637572914372611","1264029171950342145","himatro_svundip"
"1408635344224849921","Sat Jun 26 03:56:51 +0000 2021","0","Selamat pagi Mas Menteri @nadiemmakarim bgmn caranya orang yg expert di dunia industri/kerja dpt ikut mengajar related to program kampus merdeka.","1408635344224849921","","","in","","0","0","0","https://twitter.com/luc_patre/status/1408635344224849921","241374543","luc_patre"
"1408633533828980742","Sat Jun 26 03:49:40 +0000 2021","0","Tahun lalu keterima magang di setjen dpr trus corona sekarang diadain lagi magang kampus merdeka tapi mffff ak udah wisudaa ","1408633533828980742","","","in","","0","2","0","https://twitter.com/dailydiarydhyra/status/1408633533828980742","1363332759679213570","dailydiarydhyra"
"1408630518346706945","Sat Jun 26 03:37:41 +0000 2021","3","Magang kampus merdeka bener-bener godaan banget dah","1408630518346706945","","","in","","0","0","0","https://twitter.com/farhanderis/status/1408630518346706945","416681473","farhanderis"
"1408629969702375424","Sat Jun 26 03:35:30 +0000 2021","0","IH MAU IKUT KAMPUS MERDEKA","1408629969702375424","","","in","Rumah, Kingdom of Saudi Arabia","0","1","0","https://twitter.com/abigdealtho/status/1408629969702375424","1098887278594674688","abigdealtho"
"1408629780165976067","Sat Jun 26 03:34:45 +0000 2021","1","Work! Yang daftar magang kampus merdeka di DPR sudah dapet info Test pengetahuan umum?","1408629780165976067","","","in","AUTOBASE — ❌POST MANUAL❌","0","0","0","https://twitter.com/worksfess/status/1408629780165976067","1244597361826885636","worksfess"
"1408627146759630852","Sat Jun 26 03:24:17 +0000 2021","7","Dubes #HeriAkhmadi hadiri wisuda sarjana ke-100 UMM dan sampaikan orasi ilmiah dengan judul: Kampus Merdeka Merdeka Belajar &amp; Belajar Merdeka. https://t.co/hY9dXwIPLj","1408627146759630852","https://pbs.twimg.com/media/E4xy61FVkAAgHBo.jpg","","in","Tokyo, Japan","0","1","0","https://twitter.com/KBRITokyo/status/1408627146759630852","264139663","KBRITokyo"
"1408625702866280457","Sat Jun 26 03:18:33 +0000 2021","0","Kundapil ke Pemalang Bisri Romly Minta Masukan kepada Pelaku Pendidikan Soal Kampus Merdeka https://t.co/nUAt3OfJLR","1408625702866280457","","","in","indonesia","0","0","0","https://twitter.com/suaramerdeka/status/1408625702866280457","219527452","suaramerdeka"
"1408625042758397953","Sat Jun 26 03:15:55 +0000 2021","0","Ngulik-ngulik program kampus merdeka nih promising ya. Jadi iri : ","1408625042758397953","","","in","Indonesia","0","0","0","https://twitter.com/matchaamilkyway/status/1408625042758397953","1008706018899947526","matchaamilkyway"
"1408620282521296902","Sat Jun 26 02:57:00 +0000 2021","2","Guys kalian tau ga kenapa ugm update yg ngobrolin kampus merdeka tuh info yg dipost di akun official @/UGMYogyakarta cuma yg pertukaran mahasiswa aja? Apa buat yg magang sosialisasinya gabung sm zoom yg dr alumniugm?? Tp ko kyk ga dipublish infonya ugm_fess","1408620282521296902","","","in","RULES","0","0","0","https://twitter.com/UGM_FESS/status/1408620282521296902","1277749122296983552","UGM_FESS"
"1408612215435907073","Sat Jun 26 02:24:57 +0000 2021","0","Kok semua orang ikut kampus merdeka","1408612215435907073","","","in","","0","0","0","https://twitter.com/iamstilltrying/status/1408612215435907073","1201118644291244032","iamstilltrying"
"1408609213438255125","Sat Jun 26 02:13:01 +0000 2021","0","gue mau daftar kampus merdeka tapi belum paham kampus merdeka itu apa","1408609213438255125","","","in","Gotham City","0","0","0","https://twitter.com/suiciedead/status/1408609213438255125","1289378444699004928","suiciedead"
"1408608682510667778","Sat Jun 26 02:10:55 +0000 2021","0","beruntung banget ya yang ngerasain program Kampus Merdeka sekarang mana ada program Kuliah Bareng ITB x UNPAD lagi hiyyyyaaaaa https://t.co/dkMLxyKQg6","1408608682510667778","https://pbs.twimg.com/tweet_video_thumb/E4xiHj4VkAIFSxJ.jpg","","in","","0","1","0","https://twitter.com/xyberya/status/1408608682510667778","1046214083710603264","xyberya"
"1408600441554833414","Sat Jun 26 01:38:10 +0000 2021","0","Naon atuh kampus merdeka teh... ","1408600441554833414","","","in","myWife'sHeart","0","0","0","https://twitter.com/ebithEBITH/status/1408600441554833414","74553795","ebithEBITH"
"1408592410326695939","Sat Jun 26 01:06:15 +0000 2021","0","Baru agak seneng pas liat transkrip kampus merdeka di atas 8 semua eh temen ada yang dapet cepe semua. Ada aja hal yang selalu bikin insecure di tempat ini. Bgst emang wkwk","1408592410326695939","","","in","Kasur","0","0","0","https://twitter.com/menolakrevisi/status/1408592410326695939","1799456634","menolakrevisi"
"1408584734007980033","Sat Jun 26 00:35:45 +0000 2021","0","Lah kok riwayat lamaran di akun kampus merdeka ku gabisa diliat sih","1408584734007980033","","","in","🌐 ","0","0","0","https://twitter.com/isicoklatt/status/1408584734007980033","2196767828","isicoklatt"
"1408522980225810434","Fri Jun 25 20:30:22 +0000 2021","0","Natalius Pigai: Injustice Vonis Habib Rizieq Hakim Sudah Diganggu Pihak Luar. #TOLAKVonis4TahunHRS #TOLAKVonis4TahunHRS https://t.co/pyApIPD7M1","1408522980225810434","","","in","","0","0","0","https://twitter.com/Kampus_Merdeka/status/1408522980225810434","2984157584","Kampus_Merdeka"
"1408522196830408705","Fri Jun 25 20:27:15 +0000 2021","1","Mantap Pak Kyai... Tolak vonis 4 tahun HRS Wantim MUI: Banyak Pemimpin bohong tapi tak diproses hukum. #TOLAKVonis4TahunHRS #TOLAKVonis4TahunHRS @nahdlatululama @muhammadiyah @IASSPusat @sidogiri @tebuirengonline @PMGontor https://t.co/1qdFaKW3Fs","1408522196830408705","","","in","","0","0","1","https://twitter.com/Kampus_Merdeka/status/1408522196830408705","2984157584","Kampus_Merdeka"
"1408493704025759748","Fri Jun 25 18:34:02 +0000 2021","0","Dilema bgt pengen magang kampus merdeka tapi ga ada yang relate sama jurusan yaa allaahh pdhl perusahaannya ciaamikk woe tolonkk","1408493704025759748","","","in","","0","0","0","https://twitter.com/cecebebby/status/1408493704025759748","760827228","cecebebby"
"1408489000063569921","Fri Jun 25 18:15:20 +0000 2021","1","ngeliat program magang di kampus merdeka rasanya kayak apply kerja. sialnya bener kata alumni fisika ugm waktu sharing session dulu. lulusan fisika tuh kalo di linkedin atau jobstreet bisanya ya di programming instrument kalo ga keguruan.","1408489000063569921","","","in","Quantum Universe","0","1","0","https://twitter.com/your_astropsych/status/1408489000063569921","363353937","your_astropsych"
"1408472931169038341","Fri Jun 25 17:11:29 +0000 2021","0","Pengan ikutan kampus merdeka","1408472931169038341","","","in","Cikampek, Indonesia","0","1","0","https://twitter.com/AtmajaShendy/status/1408472931169038341","1230919917064597506","AtmajaShendy"
"1408466267455983618","Fri Jun 25 16:45:00 +0000 2021","3","Itb! Yang otw semester 3 ada yang bisa daftar kampus merdeka ga?","1408466267455983618","","","in","Ganesha, Jatinangor, Cirebon","0","2","0","https://twitter.com/itbfess/status/1408466267455983618","1273190263121297409","itbfess"
"1408457241519296518","Fri Jun 25 16:09:08 +0000 2021","0","kampus merdeka muncul pas besok udah wisuda : ","1408457241519296518","","","in","","0","0","0","https://twitter.com/faizrafii_/status/1408457241519296518","1853811637","faizrafii_"
"1408454221297377282","Fri Jun 25 15:57:08 +0000 2021","0"," pas angkatan aku gada tuh kampus merdeka gada UNPAD X ITB udah bagus lu dapet cowo anak teknik masih satu kampus ngelunjak ye lu. Makasi banyak kemendikbud ga memfasilitasi deby program kampus merdeka soalnya matanya jelalatan Alip suudzonnya gila gilaan gua liat.","1408454221297377282","","","in","Bandung, Jawa Barat","0","1","0","https://twitter.com/ibukostcantik/status/1408454221297377282","1164545558054232064","ibukostcantik"
"1408451567624232960","Fri Jun 25 15:46:36 +0000 2021","0","PresUniv lolos seleksi dua prodi yang akan mendapat dana hibah Kampus Merdeka https://t.co/jVHVYn0PyT","1408451567624232960","","","in","Jakarta, Indonesia","0","1","0","https://twitter.com/republikaonline/status/1408451567624232960","22126902","republikaonline"
"1408450705472450561","Fri Jun 25 15:43:10 +0000 2021","1","mau ikut magang kampus merdeka tapi konversi sks bikin bingung bgt jujur","1408450705472450561","","","in","","0","0","0","https://twitter.com/pfmgrace/status/1408450705472450561","1310970183981256704","pfmgrace"
"1408447844864860163","Fri Jun 25 15:31:48 +0000 2021","0","Kalo ikut pertukaran pelajar kampus merdeka berarti ga ketemu temen temen kampus yunan selama sesemester huft","1408447844864860163","","","in","Indonesia","0","3","0","https://twitter.com/notsadrip/status/1408447844864860163","1011954104183091202","notsadrip"
"1408443174415081477","Fri Jun 25 15:13:15 +0000 2021","2","Yuk ikutan KABAR Kajian Bareng HIMA PBA UMT lusa! #himapbaumt #pbaumt #faiumt #umtindonesia #umt #kampusmerdeka #kajianbareng #kabar https://t.co/HFzuyle9FM","1408443174415081477","https://pbs.twimg.com/media/E4vLl60VcAAQbd2.jpg","","in","Tangerang, Banten","1","0","1","https://twitter.com/himapbaumt/status/1408443174415081477","1313779501482926082","himapbaumt"
"1408441867612475392","Fri Jun 25 15:08:03 +0000 2021","1","Ada apa.sih #unpad jadi trending topik. Pastinya organik bukan buzzer. . .. Apa karena kampus merdeka kah? #kepo ","1408441867612475392","","","in","","0","0","0","https://twitter.com/ceu_meta/status/1408441867612475392","377724465","ceu_meta"
"1408439621944365061","Fri Jun 25 14:59:08 +0000 2021","0","ada apa ini ada apa ini kampus gw trending di twitter. Blom baca2 kampus merdeka. Pusing besok sajalah.","1408439621944365061","","","in","","0","0","0","https://twitter.com/noriceandsugar/status/1408439621944365061","229332392","noriceandsugar"
"1408438091367387138","Fri Jun 25 14:53:03 +0000 2021","0","Dirjen Dikti Resmi Membuka Berbagai Program Kampus Merdeka https://t.co/UmIbjUj9f1","1408438091367387138","","","in","Jakarta Selatan, Indonesia","0","0","0","https://twitter.com/UAlazhar/status/1408438091367387138","328891279","UAlazhar"
"1408437938220724224","Fri Jun 25 14:52:26 +0000 2021","0","Mudah-mudahan kebijakan kampus merdeka bisa berjalan dengan bajik","1408437938220724224","","","in","","0","0","0","https://twitter.com/namasayajawad/status/1408437938220724224","1310757128546607105","namasayajawad"
"1408426236599103489","Fri Jun 25 14:05:56 +0000 2021","0","jiakh dianggap jalur cari pacar dong kampus merdeka sama itb","1408426236599103489","","","in","","0","0","0","https://twitter.com/taecyron/status/1408426236599103489","327302242","taecyron"
"1408403746808205313","Fri Jun 25 12:36:34 +0000 2021","0","Kenapa kampus merdeka baru ada pas SKS w udah full sih","1408403746808205313","","","in","","0","1","0","https://twitter.com/bagussryo/status/1408403746808205313","1348679960","bagussryo"
"1408398064541335563","Fri Jun 25 12:14:00 +0000 2021","1","program kampus merdeka nih kenapa baru ada pas udah mau lulus yaa huft","1408398064541335563","","","in","","0","0","0","https://twitter.com/kuincidence/status/1408398064541335563","389161388","kuincidence"
"1408388135919095809","Fri Jun 25 11:34:32 +0000 2021","0","Dosen : Kamu gak minat ikutan program kampus merdeka a Kris? Hamba : Terus saya lulusnya kapan Buu.. ","1408388135919095809","","","in","Jawa Timur, Indonesia","0","0","0","https://twitter.com/krisdian_d/status/1408388135919095809","3112682818","krisdian_d"
"1408386902965690371","Fri Jun 25 11:29:38 +0000 2021","0","Ingin ikut kampus merdeka yg kerjasama sama platform bljr.. tapi takutnya gw mls2an.. ini kursus jpn aja mleyot mulu gw","1408386902965690371","","","in","","0","0","0","https://twitter.com/tetsaky_theo/status/1408386902965690371","959975170218770433","tetsaky_theo"
"1408379024255057922","Fri Jun 25 10:58:20 +0000 2021","1","[ PODKESMA ] Halo kawan sosiologi Ada info penting nihh! Podkesma kini hadir menyapa dengan obrolan pertama yang akan membahas MBKM. Pengen tau kan kiat-kiat dan informasi lengkap soal Kampus Merdeka? Nah daripada mati penasaran mending join aja. https://t.co/CF2BYTpJfE","1408379024255057922","https://pbs.twimg.com/media/E4uRQYeUUAkQhSG.jpg","","in","Jember, Jawa Timur","0","1","0","https://twitter.com/himasosunej22/status/1408379024255057922","1402104846510018561","himasosunej22"
"1408375403253702659","Fri Jun 25 10:43:57 +0000 2021","0","mau cerita dikit masih ngakak bgt tapi yaudahlah. gue kan udah semester 8 tapi masih ada matkul nih kemaren ada matkul wajib kwu yg baru gue ambil di semester 8 ini dan gue ngambilnya sama anak-anak fia sementara gue anak fpik (kelas kampus merdeka gitu makanya bisa lintas fak)","1408375403253702659","","","in","personal account","0","1","0","https://twitter.com/minnielols/status/1408375403253702659","1128694572060561409","minnielols"
"1408371893674168322","Fri Jun 25 10:30:00 +0000 2021","9","Mau kuliah di luar kampus dan dapat sertifikat kompetensi berdaya saing global? Tenang aja! PROGRAM DICODING X KAMPUS MERDEKA adalah solusinya Banyak banget loh benefitnya! Tunggu apalagi? Segera daftarkan dirimu di https://t.co/M0h6wmy0ce Pendaftaran ditutup 15 Juli 2021!! https://t.co/sl0q8bgDD1","1408371893674168322","https://pbs.twimg.com/media/E4tCqPYVcAA6lXh.jpg","","in","Indonesia","2","0","3","https://twitter.com/dicoding/status/1408371893674168322","2826650155","dicoding"
"1408360600460087301","Fri Jun 25 09:45:07 +0000 2021","2","Untag dan Kabupaten Blitar Wujudkan Merdeka Belajar Kampus Merdeka https://t.co/NqL1iOvA3v","1408360600460087301","","","in","Kota Surabaya, Jawa Timur","0","0","0","https://twitter.com/e100ss/status/1408360600460087301","848614550","e100ss"
"1408351080723881985","Fri Jun 25 09:07:18 +0000 2021","0","program kampus merdeka tu bisa diikutin sama mhs smt 8 ga sii?","1408351080723881985","","","in","","0","0","0","https://twitter.com/miisssiippi/status/1408351080723881985","1036804794","miisssiippi"
"1408350506594934795","Fri Jun 25 09:05:01 +0000 2021","3","itb! mau nanya gue otw semester 5 mau magang di salah satu program kampus merdeka itu nantinya masuk sks kampus atau gimana deh?","1408350506594934795","","","in","Ganesha, Jatinangor, Cirebon","0","2","0","https://twitter.com/itbfess/status/1408350506594934795","1273190263121297409","itbfess"
"1408334756404621312","Fri Jun 25 08:02:26 +0000 2021","2","Program pertukaran mahasiswa dari kampus merdeka tu kek buat yang jenjang sarjana aja ya Pa kabar anak vokasi","1408334756404621312","","","in","nangorian","0","5","0","https://twitter.com/inf3ri0rity/status/1408334756404621312","1193001182945370113","inf3ri0rity"
"1408301306339487746","Fri Jun 25 05:49:31 +0000 2021","0","!upi guys aku udah daftar program pertukaran mahasiswa kampus merdeka tapi belum ngelengkapin berkasnya nah akutuh agak ragu buat lengkapin datanya huhu mending lanjut apa ngga ya? :'))","1408301306339487746","","","in","lg mejeng di partere","0","3","0","https://twitter.com/UPIfess/status/1408301306339487746","1084456172395016193","UPIfess"
"1408291320234270720","Fri Jun 25 05:09:50 +0000 2021","0","Magang kampus merdeka kok ya baru ada pas gue udh lulus","1408291320234270720","","","in","","0","0","0","https://twitter.com/ainunskrr/status/1408291320234270720","178301937","ainunskrr"
