"conversation_id_str","created_at","favorite_count","full_text","id_str","image_url","in_reply_to_screen_name","lang","location","quote_count","reply_count","retweet_count","tweet_url","user_id_str","username"
"1255400848533917696","Wed Apr 29 07:37:41 +0000 2020","2","Halo #SobatLLDIKTI3 berikut ini terlampir tautan Buku Panduan Merdeka Belajar: Kampus Merdeka https://t.co/kDVBeW25xC #lldiktiwilayah3 #lldikti3update","1255400848533917696","","","in","Jakarta Timur, DKI Jakarta","0","0","1","https://twitter.com/lldikti3/status/1255400848533917696","1082480504983543808","lldikti3"
"1255229033224310786","Tue Apr 28 20:14:57 +0000 2020","2","Ayolah pak nadiem tetapkan kampus merdeka","1255229033224310786","","","in","Probolinggo, Jawa Timur","0","1","0","https://twitter.com/opangid98/status/1255229033224310786","4714147748","opangid98"
"1255073066607996928","Tue Apr 28 09:55:11 +0000 2020","0","/edc kebijakan kampus merdeka yg bisa ambil 3 semester di luar prodi tuh kira2 dimulai semester berapa yak?","1255073066607996928","","","in","","0","0","0","https://twitter.com/yourmomylilan/status/1255073066607996928","2957866723","yourmomylilan"
"1255020195745165312","Tue Apr 28 06:25:06 +0000 2020","0","Sertijab Empat Wakil Rektor Unja Terpilih Rektor Unja: Mari Sambut Kampus Merdeka dan Merdeka Belajar - https://t.co/srxNm46Uju | Berita Jambi Digital https://t.co/NWmJ5Mwro5","1255020195745165312","","","in","Jambi,Indonesia","0","0","0","https://twitter.com/metrojambi/status/1255020195745165312","209940336","metrojambi"
"1255010388699209729","Tue Apr 28 05:46:08 +0000 2020","0","#Solafekonunsulbar Fekon bersama melawan Covid-19 #Kampusmerdeka #Fekonunsulbarjaya https://t.co/RngkXYgvdn","1255010388699209729","","","in","Majene, Sulawesi Barat","0","0","0","https://twitter.com/UsbFekon/status/1255010388699209729","1210961988362194944","UsbFekon"
"1255000703396990977","Tue Apr 28 05:07:39 +0000 2020","0","Buku Panduan Merdeka Belajar: Kampus Merdeka - Website LLDIKTI Wilayah V https://t.co/c4SdiciLdy","1255000703396990977","","","in","Yogyakarta","0","0","0","https://twitter.com/lldikti5/status/1255000703396990977","892595156582408193","lldikti5"
"1254998932893036544","Tue Apr 28 05:00:37 +0000 2020","8","[cm] Gaes boleh minta tolong untuk isi kuisioner penelitian? Untuk mahasiswa dan tau/pernah dengar tentang kebijakan Kampus Merdeka yaa https://t.co/ISweGgRbFN","1254998932893036544","","","in","","0","1","0","https://twitter.com/collegemenfess/status/1254998932893036544","1046084008742801408","collegemenfess"
"1254990388886032385","Tue Apr 28 04:26:39 +0000 2020","0","#SahabatPerpusdikbud Buku Panduan Merdeka Belajar Kampus Merdeka disusun dipergunakan dalam tahap perancangan pelaksanaan penilaian hingga evaluasi pelaksanaan kebijakan Merdeka Belajar - Kampus Merdeka. Buku diakses pada https://t.co/Vvv2FYuND2 #MerdekaBelajar #KampusMerdeka https://t.co/D4ndHe7rcK","1254990388886032385","https://pbs.twimg.com/media/EWqfFj4UMAMdTQn.jpg","","in","Senayan, Jakarta","1","1","0","https://twitter.com/perpusdikbud/status/1254990388886032385","2191873495","perpusdikbud"
"1254872235992428548","Mon Apr 27 20:37:10 +0000 2020","2","Sejak menjabat @MasMenteri selalu berinovasi dgn sistem pendidikan Indonesia. Diantaranya Merdeka Belajar dan Kampus Merdeka. Nah kira-kira kemana ya haluan pendidikan Indonesia saat ini? Baca disini ya https://t.co/npdz4n3RqG","1254872235992428548","","","in","Heroes City, Indonesia","0","0","0","https://twitter.com/dee_arif/status/1254872235992428548","88920967","dee_arif"
"1254817385887891457","Mon Apr 27 16:59:12 +0000 2020","5","[SURVEY 2 MEI ] Halo teman-teman Vokasi Katanya menuju kampus merdeka merdeka belajar. Bolehkan merdeka juga untuk mengkritisi kampus? https://t.co/mUAAFgtGgd","1254817385887891457","https://pbs.twimg.com/media/EWoBwFCVAAQKtAM.jpg","","in","Surakarta, Jawa Tengah","0","1","1","https://twitter.com/bemsvuns/status/1254817385887891457","1217495116186652672","bemsvuns"
"1254800018462015488","Mon Apr 27 15:50:12 +0000 2020","1","SERTIJAB WAKIL REKTOR PERIODE 2020-2024 REKTOR: MARI SAMBUT KAMPUS MERDEKA DAN MERDEKA BELAJAR JAMBI - Serah terima jabatan (sertijab) Wakil Rektor dilingkungan Universitas Jambi dari pejabat lama kepada pejabat baru dipimpin langsung oleh Rektor Prof. Drs. H. Sutrisno ... https://t.co/x4aUW6Jnni","1254800018462015488","https://pbs.twimg.com/media/EWnx9iNUEAMqKXW.jpg","","in","Muaro Jambi, Jambi","0","0","0","https://twitter.com/univ_jambi/status/1254800018462015488","963650572195901440","univ_jambi"
"1254793885022224385","Mon Apr 27 15:25:49 +0000 2020","0","[cm] Gaes boleh minta tolong untuk isi kuisioner penelitian? Untuk mahasiswa dan tau/pernah dengar tentang kebijakan Kampus Merdeka yaa https://t.co/ugjMRz80aN","1254793885022224385","","","in","","0","0","0","https://twitter.com/collegemenfess/status/1254793885022224385","1046084008742801408","collegemenfess"
"1254750410104991744","Mon Apr 27 12:33:04 +0000 2020","5","Tweeps..Kalian tahu kalau @masmenteri Nadiem Makarim sdh menggebrak dunia pendidikan Indonesia? Merdeka Belajar dan Kampus Merdeka adalah skema modern pendidikan kita. Mau dibawa ke arah mana? Simak ya.. https://t.co/MEIRa6G8mw #masmenteri #mendikbud #kemendikbud","1254750410104991744","","","in","Malang, Jawa Timur","0","0","0","https://twitter.com/ErnyKusuma6/status/1254750410104991744","1037277918177579018","ErnyKusuma6"
"1254720213582401536","Mon Apr 27 10:33:05 +0000 2020","0","haluan baru Dunia Pendidikan ditangan @MasMenteri beliau membuat Merdeka belajar dan Memerdekakan kampus Agar kta dapat berinovasi menjadi SDM yg unggul dlm Pendidikan.. https://t.co/UifUF4ttCY","1254720213582401536","","","in","Semarang, Jawa Tengah","0","0","1","https://twitter.com/iAmLogan95/status/1254720213582401536","2520613604","iAmLogan95"
"1254563612435165186","Mon Apr 27 00:10:48 +0000 2020","0","Manusia Merdeka Kampus merdeka Merdeka Belajar Negara merdeka","1254563612435165186","","","in","اندونيسيا","0","0","0","https://twitter.com/SiNazraz/status/1254563612435165186","207535198","SiNazraz"
"1254341341586141185","Sun Apr 26 09:27:35 +0000 2020","1","!upi temen-temen ada yang tau tentang kebijakan Kampus Merdeka? Aku butuh kalian buat isi kuesioner penelitian nih tolong reply ya :)","1254341341586141185","","","in","lg mejeng di partere","0","0","0","https://twitter.com/UPIfess/status/1254341341586141185","1084456172395016193","UPIfess"
"1254250948848836609","Sun Apr 26 03:28:23 +0000 2020","1","Yuk gabung dan dapatkan beasiswanya #kampus #kampusindonesia #UNIVERSITAS #stiestembi #amikhass #kampusmerdeka https://t.co/GdDNvyrIHP","1254250948848836609","https://pbs.twimg.com/media/EWf-lFyUMAITC-s.jpg","","in","Bandung, Jawabarat","0","0","0","https://twitter.com/NoviaSetiaasih/status/1254250948848836609","2449253474","NoviaSetiaasih"
"1254075049193033732","Sat Apr 25 15:49:25 +0000 2020","0","Kayaknya setan2 di kampus gue juga bebas merdeka deh tiap malem ngadain party di kelas2","1254075049193033732","","","in","Depok, Indonesia","0","0","0","https://twitter.com/trplennon/status/1254075049193033732","279849594","trplennon"
"1253939042321752065","Sat Apr 25 06:48:59 +0000 2020","10","[MENGENAL KAMPUS MERDEKA] . . https://t.co/6djA202T76","1253939042321752065","https://pbs.twimg.com/media/EWbi35OU8AATHcE.jpg","","in","Gd. Sekertariat BEM - DEMA","0","1","1","https://twitter.com/BEMUNS/status/1253939042321752065","760955376","BEMUNS"
"1253854030410903554","Sat Apr 25 01:11:10 +0000 2020","0","100 Hari Kerja Nadiem Banggakan Merdeka Belajar dan Kampus Merdeka - https://t.co/kO8Nkcmnv2","1253854030410903554","","","in","Jakarta","0","0","0","https://twitter.com/kalderanews/status/1253854030410903554","817669043792420864","kalderanews"
"1253613779322941440","Fri Apr 24 09:16:30 +0000 2020","0","Ketika masa kemsa trs berubah mka pendidikan pun sehrsnya ikut menysuaikn dgn konteks zamnnya Yg terpnting ttp sesuai tujuan pendidikan nasioanal &amp; itu yg sdng dilakukan @MasMenteri. Mmbawa perubhan pendidikan dgn perahu Merdeka Belajar &amp; Kampus Merdeka. https://t.co/FAQlcvESdQ","1253613779322941440","","","in","Semarang, Jawa Tengah","0","0","0","https://twitter.com/iAmLogan95/status/1253613779322941440","2520613604","iAmLogan95"
"1253512190449070080","Fri Apr 24 02:32:49 +0000 2020","0","Assalamualaikum.... Let's join ke tempat kuliah nya orang kreatif ... Informasi lebih lanjut bisa langsung hubungi aja contact person ... Yukyuk.. #universitas #kuliahonline #kampusmerdeka https://t.co/j4Qkaz1gCz","1253512190449070080","https://pbs.twimg.com/media/EWVee0ZUEAMajkn.jpg","","in","Bandung, Jawabarat","0","0","0","https://twitter.com/NoviaSetiaasih/status/1253512190449070080","2449253474","NoviaSetiaasih"
"1253504699128516608","Fri Apr 24 02:03:03 +0000 2020","0","Kemendikbud dorong Techno Park jadi Sarana Implementasi Kampus Merdeka https://t.co/FuQulShqY7","1253504699128516608","","","in","Cianjur, Indonesia","0","0","0","https://twitter.com/unpicjr2015/status/1253504699128516608","4186481959","unpicjr2015"
"1253358189061509121","Thu Apr 23 16:20:53 +0000 2020","0","Efektivitas Swipe Right di Aplikasi Perjodohan Berbasis Lokasi Terhadap Dukungan Moril Kepada Perantau Lajang di Ibukota. Studi Kasus: Selama Ramadan 1441 Hijriyah di Masa Pembatasan Sosial Berskala Besar Akibat Pandemi Korona. #judulskripsi #kampusmerdeka #merdekabelajar","1253358189061509121","","","in","just a click away","0","2","0","https://twitter.com/dbrahmantyo/status/1253358189061509121","90809267","dbrahmantyo"
"1253107101582241792","Wed Apr 22 23:43:09 +0000 2020","0","Tweet pro omnibus law dan kampus merdeka wkwk","1253107101582241792","","","in","Province of Leningrad, Russia","0","0","0","https://twitter.com/0nlyselow/status/1253107101582241792","3268850262","0nlyselow"
"1252937370766176264","Wed Apr 22 12:28:42 +0000 2020","0","Ra sah ndakik2 ngomong kampus merdeka lur bocahku wae sih do kangelan kuliah online mergo angel sinyal ki lho https://t.co/Mqcsxlg6lI","1252937370766176264","https://pbs.twimg.com/media/EWNT473U0AA55cn.jpg","","in","","0","0","1","https://twitter.com/mikostubborn/status/1252937370766176264","377211750","mikostubborn"
"1252918873495605248","Wed Apr 22 11:15:12 +0000 2020","0","#SolaFekonUnsulbar kreasi dari kakak Fekon #kampusmerdeka #fekonunsulbarjaya https://t.co/x6snu7ZKir","1252918873495605248","","","in","Majene, Sulawesi Barat","0","0","0","https://twitter.com/UsbFekon/status/1252918873495605248","1210961988362194944","UsbFekon"
"1252907640318914560","Wed Apr 22 10:30:34 +0000 2020","1"," Mencari Siapa Yang Merdeka dalam Kebijakan Kampus Merdeka Ala Nadiem Makarim tulisan baru yang bisa rekan-rekan baca di kolom kami. Ditulis oleh Benny salah satu peserta Sekolah Lingkar Ilmu Pemerintahan. Sila dibaca dan mari berdiskusi. https://t.co/TprF672lyX","1252907640318914560","","","in","","0","0","0","https://twitter.com/lingkarip/status/1252907640318914560","1128665946124574721","lingkarip"
"1252888711848538112","Wed Apr 22 09:15:21 +0000 2020","0","Ratih Marini: Swiss German University (SGU) Sudah Aplikasikan Kampus Merdeka Sejak Pertama Didirikan - https://t.co/JFp712VMrs","1252888711848538112","","","in","Jakarta","0","0","0","https://twitter.com/kalderanews/status/1252888711848538112","817669043792420864","kalderanews"
"1252696907811438592","Tue Apr 21 20:33:11 +0000 2020","0","Seharus Dipecat untuk Buktikan Pemerintahan yg Benar-bemar Anti KKN. Banyak Masalah Rekrutmen Orang Kepercayaan Istana Dipertanyakan. #RezimGagap #JKWMundurSaja @SBYudhoyono @hnurwahid @ZUL_Hasan @Fahrihamzah @fahiraidris @fadlizon","1252696907811438592","","","in","","0","0","0","https://twitter.com/Kampus_Merdeka/status/1252696907811438592","2984157584","Kampus_Merdeka"
"1252585504429633537","Tue Apr 21 13:10:30 +0000 2020","0","ngetawain adek gue polos bgt lol dikiranya kampus merdeka kampus bakal bener2 manfaatin buat nyari bibit unggul ya ga 100% salah cuma ga semua kampus kek gitu HAHA yaqueen banyak jg yg bakal manfaatin buat dapet duit dr mahasiswa","1252585504429633537","","","in","eng/ina • kinda ia 📚","0","1","0","https://twitter.com/jjebitales/status/1252585504429633537","1248518071196602368","jjebitales"
"1252516501849956352","Tue Apr 21 08:36:19 +0000 2020","0","Ratih Marini: Swiss German University (SGU) Sudah Aplikasikan Kampus Merdeka Sejak Pertama Didirikan - https://t.co/JFp712VMrs","1252516501849956352","","","in","Jakarta","0","0","0","https://twitter.com/kalderanews/status/1252516501849956352","817669043792420864","kalderanews"
"1252452651591069696","Tue Apr 21 04:22:36 +0000 2020","0","pantes Nadiem Makarim cetusin konsep Kampus Merdeka ","1252452651591069696","","","in","In your arms ","0","0","0","https://twitter.com/ayamgwprwk/status/1252452651591069696","1083143317259337728","ayamgwprwk"
"1252438691303153665","Tue Apr 21 03:27:07 +0000 2020","0","Universitas Bung Hatta Berusia 39 Tahun Terapkan Kampus Digital Wujudkan Kampus Merdeka https://t.co/brqc6SGRLc","1252438691303153665","","","in","","0","0","0","https://twitter.com/posmetro_padang/status/1252438691303153665","2989556305","posmetro_padang"
"1252248056793186304","Mon Apr 20 14:49:37 +0000 2020","3","[cm] haloo boleh minta tolong buat ngisi beberapa kuesioner aku nggak? Yang paham tentang kebijakan kampus merdeka ya. Nanti aku kasih linknya! Terimakasih.","1252248056793186304","","","in","","0","3","0","https://twitter.com/collegemenfess/status/1252248056793186304","1046084008742801408","collegemenfess"
"1252169722323300353","Mon Apr 20 09:38:20 +0000 2020","0","Menteri Teten ajak Kaesang untuk Pelatihan UMKM Rp.200 M Pengamat: Makin Masif KKN...!!! #JKWMundurSaja #RezimGagap https://t.co/chOYv9SS4H","1252169722323300353","","","in","","0","0","0","https://twitter.com/Kampus_Merdeka/status/1252169722323300353","2984157584","Kampus_Merdeka"
"1252169261126004738","Mon Apr 20 09:36:30 +0000 2020","1","Kalau Ga Cerdas bukan #RockyGerung Rocky Gerung: Kasus Belva seperti Corona Harus Diasumsikan Banyak Pejabat Istana Berstatus ODP. Perlu Karantina? https://t.co/1RuNW1l3qH","1252169261126004738","","","in","","0","0","0","https://twitter.com/Kampus_Merdeka/status/1252169261126004738","2984157584","Kampus_Merdeka"
"1251485107350732800","Sat Apr 18 12:17:55 +0000 2020","0","Halo Himasta! Ada kabar baik nih! Alhamdulillah TINTA (Buletin Statistika) 2020 Vol. 1 sudah terbit!!! Buletin ini membahas tentang kampus merdeka publish jurnal sebagai syarat lulus cumlaude dan kuliah online lho! Pasti penasaran kan??","1251485107350732800","","","in","Jatinangor, Kab. Sumedang","0","1","0","https://twitter.com/HimastaUnpad/status/1251485107350732800","121772652","HimastaUnpad"
"1251461917715034114","Sat Apr 18 10:45:46 +0000 2020","1","Tiba tiba ke ingat kampus. Fakultas ku sama pendidikan di palestina sama sama susah Cuma bedanya aku di indonesia Menang di merdeka doang.","1251461917715034114","","","in","Kota Padang Sidempuan","0","0","1","https://twitter.com/OmBOkir2/status/1251461917715034114","1233054818903580673","OmBOkir2"
"1251453004290469888","Sat Apr 18 10:10:21 +0000 2020","0","Konferensi Asia Afrika atau Konferensi Bandung menjadi tempat bagi sejumlah negara yang baru merdeka untuk menyuarakan aspirasinya lho warga kampus. Selamat Hari Peringatan Konferensi Asia-Afrika. #PeringatanKAA #KonferensiBandung #BangkitBersama #RadioBudiLuhur https://t.co/1p6p4ukgbJ","1251453004290469888","https://pbs.twimg.com/ext_tw_video_thumb/1251452950800551936/pu/img/nQ3QCUFaNEPqrixr.jpg","","in","","0","0","0","https://twitter.com/RadioBudiLuhur/status/1251453004290469888","93356134","RadioBudiLuhur"
"1251415567652839425","Sat Apr 18 07:41:36 +0000 2020","0","Sejak Mendikbud baru mantan CEO Gojek itu sudah membawa berbagai wacana yang boleh disebut 'Gebrakan.' Mulai dari wacana mengganti kurikulum menghapus honorer kampus merdeka hingga wacana penghapusan UN. Wacana https://t.co/33N3sEwYhE","1251415567652839425","","","in","Jember, Jawa Timur","0","0","0","https://twitter.com/maul_alfath/status/1251415567652839425","967590760081010688","maul_alfath"
"1251165605958311942","Fri Apr 17 15:08:20 +0000 2020","0","Di Petamburan Tanah Abang 34 Mahasiswa Kristen Bethel Petamburan Positif Corona 180 Jalani Isolasi. https://t.co/7CUL5NaGXI","1251165605958311942","","","in","","0","0","0","https://twitter.com/Kampus_Merdeka/status/1251165605958311942","2984157584","Kampus_Merdeka"
"1251031877382574081","Fri Apr 17 06:16:57 +0000 2020","1","Jadilah bagian dari Kampus Merdeka dengan siap menjadi mahasiswa Unika Atma Jaya. Yuk daftar caranya mudah dengan daftar online di https://t.co/WhYwtHfbrQ atau https://t.co/TTh24AIVPC Raih mimpimu bersama Unika Atma Jaya 10 besar Perguruan Tinggi Swasta Terbaik se Indonesia. https://t.co/2L1czk4J9j","1251031877382574081","https://pbs.twimg.com/media/EVyOlRzUcAIi6N_.jpg","","in","Jakarta","0","0","0","https://twitter.com/UnikaAtmaJaya/status/1251031877382574081","208480486","UnikaAtmaJaya"
"1250680506238111744","Thu Apr 16 07:00:43 +0000 2020","1","Otonomi kampus yang kebablasan. @Kemdikbud_RI beginikah kampus merdeka? Merdeka kampusnya tidak mahasiswanya.","1250680506238111744","","","in","east end","0","0","0","https://twitter.com/frsfauzan/status/1250680506238111744","292890904","frsfauzan"
"1250594654631821312","Thu Apr 16 01:19:35 +0000 2020","132","Belakangan kabar2 begini kian sering muncul. DO jd senjata lagi utk bungkam mahasiswa. Menteri Nadiem (cc Pak Dirjen @hilmarfarid) perlu seriusi yg begini. Proram kampus merdeka mesti kembalikan kampus sbg mimbar akademik yg sehat. Gimana merdeka jika beropini diancam DO?","1250594654631821312","","","in","Di antara Larashati dan Serat ","1","1","113","https://twitter.com/zenrs/status/1250594654631821312","57409021","zenrs"
"1250387278477713409","Wed Apr 15 11:35:32 +0000 2020","0","Kampus embel2nya doang ada merdeka nya padahal di dalemnya isinya penindasan semua. Sampah!.","1250387278477713409","","","in","","0","1","0","https://twitter.com/auahndre/status/1250387278477713409","1221291267264352257","auahndre"
"1250386167293300736","Wed Apr 15 11:31:07 +0000 2020","0","Staf Khusus Kantor Presiden bermasalah dan jadi sorotan publik. Ruang guru KETIBAN Proyek Warganet: Rakyat Disuruh Nyalakan Lilin Eh Dianya Ngepet https://t.co/NY0BwPZQYl","1250386167293300736","","","in","","0","0","0","https://twitter.com/Kampus_Merdeka/status/1250386167293300736","2984157584","Kampus_Merdeka"
"1250366562252386305","Wed Apr 15 10:13:13 +0000 2020","0","Ini Fakta dan Kondisi Riil Rakyat Kita. Butuh Kehadiran Pemimpin dan Pemeeintahnya Secara Nyata. #RezimGagap #StopPindahIbuKota","1250366562252386305","","","in","","0","0","0","https://twitter.com/Kampus_Merdeka/status/1250366562252386305","2984157584","Kampus_Merdeka"
"1250365887577649152","Wed Apr 15 10:10:32 +0000 2020","1","Bagus... !!! Apa Bukan itu Seharusnya yg dikerjakan? Banyak Rakyat yg Sudah Susah Makan kena PHK ga bisa jualan ga ada kerja dan usaha. Butuh Uang dan Makan. Bukankah Beberapa Presiden sebelumnya itu yg telah dikerjakan dan dirasakan rakyat...???","1250365887577649152","","","in","","0","0","1","https://twitter.com/Kampus_Merdeka/status/1250365887577649152","2984157584","Kampus_Merdeka"
"1250321518648635398","Wed Apr 15 07:14:14 +0000 2020","0","Imbas Minyak Dunia Turun Malaysia Jual Pertamax Rp4.500. Rudi Rubiandini (Mantan SKK Migas): Harga yang Pantas Diterima Masyarakat Sebesar Rp5.500 per Liter. #TurunkanHargaBBMSegera #TurunkanHargaBBMSegera https://t.co/VqmMpeH4fG","1250321518648635398","","","in","","0","0","0","https://twitter.com/Kampus_Merdeka/status/1250321518648635398","2984157584","Kampus_Merdeka"
"1250321421466603520","Wed Apr 15 07:13:51 +0000 2020","0","#SolaFekonUnsulbar Semangat Menjaga Bumi #kampusmerdeka #fekonunsulbarjaya https://t.co/BfXYiNUof5","1250321421466603520","","","in","Majene, Sulawesi Barat","0","0","0","https://twitter.com/UsbFekon/status/1250321421466603520","1210961988362194944","UsbFekon"
"1250320447528288256","Wed Apr 15 07:09:59 +0000 2020","0","Pengamat: Jokowi harusnya jamin kebutuhan pangan masyarakat bukan sekadar bagi-bagi sembako di Pinggir Jalan. #RezimGagap #IndonesiaButuhPemimpin https://t.co/eXg8A9VLJi","1250320447528288256","","","in","","0","0","0","https://twitter.com/Kampus_Merdeka/status/1250320447528288256","2984157584","Kampus_Merdeka"
"1249897114450178054","Tue Apr 14 03:07:48 +0000 2020","0","#SolaFekonUnsulbar aksi Kakak Fakultas Ekonomi prodi Manajemen #KampusMerdeka #fekonunsulbarjaya https://t.co/SSKtCy09Ug","1249897114450178054","","","in","Majene, Sulawesi Barat","0","0","0","https://twitter.com/UsbFekon/status/1249897114450178054","1210961988362194944","UsbFekon"
"1249674998874136576","Mon Apr 13 12:25:12 +0000 2020","3","Ini dia fase kegiatan crisis center #COVID19 yang dilakukan Universitas IPB @ipbofficial #KampusMerdeka #MasMenteri https://t.co/3T9MO2SN2i","1249674998874136576","https://pbs.twimg.com/media/EVe8xGDU8AA4tDU.jpg","","in","","0","0","0","https://twitter.com/MasMenteri/status/1249674998874136576","891564038781415424","MasMenteri"
"1249544253136490500","Mon Apr 13 03:45:40 +0000 2020","0"," Apakah bagi-bagi sembako tugas Presiden? Eh giliran sidang umum PBB kok gak dateng.. Knp Tak Membuat Kebijakan &amp; Mengawasinya Agar Benar2 jalan. Banyak Rakyat yg MASIH menunggu Paket Sembako sbb hrs di rumah. #IndonesiaButuhPemimpin #RezimGagap https://t.co/n2qOVF11Yg","1249544253136490500","","","in","","0","0","0","https://twitter.com/Kampus_Merdeka/status/1249544253136490500","2984157584","Kampus_Merdeka"
"1249351894381678594","Sun Apr 12 15:01:18 +0000 2020","0","Jokowi Bagi-bagi Sembako Secara Langsung di Depan Istana Bogor Saat Corona. Ketua DPRD Bogor: Harusnya Lewat RT. Naah....lo....!!! #IndonesiaButuhPemimpin #RezimGagap https://t.co/4bAe9C5nzP","1249351894381678594","","","in","","0","0","0","https://twitter.com/Kampus_Merdeka/status/1249351894381678594","2984157584","Kampus_Merdeka"
"1249349121476984832","Sun Apr 12 14:50:17 +0000 2020","0","Anies Pantau Langsung Proses Pengemasan Paket Bantuan Sosial. Ini Baru Kerja Pemimpin Punya Leadership yg Jelas. #IndonesiaButuhPemimpin #AniesTheRealLeader #RezimGagap https://t.co/iI5TY4GtTZ","1249349121476984832","","","in","","0","0","0","https://twitter.com/Kampus_Merdeka/status/1249349121476984832","2984157584","Kampus_Merdeka"
"1249338036241874950","Sun Apr 12 14:06:14 +0000 2020","0","100 Hari Kerja Nadiem Banggakan Merdeka Belajar dan Kampus Merdeka - https://t.co/10urf0GFZz","1249338036241874950","","","in","Jakarta","0","0","0","https://twitter.com/kalderanews/status/1249338036241874950","817669043792420864","kalderanews"
"1249330958182100992","Sun Apr 12 13:38:06 +0000 2020","1","Halo #SivitasUPI! Sudahkah mengetahui beberapa informasi di bawah ini? 1. Terobosan Kementerian Pendidikan dan Kebudayaan tentang Kampus Merdeka di awal tahun 2020 ini menimbulkan banyak komentar di kalangan https://t.co/ZcdDqZ5N7o","1249330958182100992","","","in","","0","0","1","https://twitter.com/upi_official/status/1249330958182100992","1214053300082900995","upi_official"
"1249296921719529472","Sun Apr 12 11:22:51 +0000 2020","9","Konsep Kampus Merdeka yang digagas oleh Nadiem Makarim sebagai Mendikbud masih membawa logika pasar. Logika pasar apa yang dimaksud? Selengkapnya: https://t.co/5wIAVm8WI3","1249296921719529472","","","in","Rawamangun, Jakarta, Indonesia","1","1","3","https://twitter.com/lpmdidaktika/status/1249296921719529472","273096629","lpmdidaktika"
"1249293119385829378","Sun Apr 12 11:07:45 +0000 2020","22","Dibalik nama baik kampus Ironi kebijakan KampusMerdeka:Merdeka Belajar ketika kampusnya merdeka tapi mahasiswanya tidak. Kampus lebih suka sorot media dan pemeringkatan internasional bukan menyasar pengoptimalan mutu pendidikan yang baik. #UNSAprilmop #NamaBaikKampus https://t.co/u20K8HHxtb","1249293119385829378","https://pbs.twimg.com/media/EVZdFIuU0AE5Nos.jpg","","in","","0","1","4","https://twitter.com/ArifinPena1/status/1249293119385829378","841863962044047363","ArifinPena1"
"1249281063941095424","Sun Apr 12 10:19:50 +0000 2020","1","Ilusi Dibalik Program Kampus Merdeka Oleh : Ifa Mufida Pemerhati Kebijakan Publik #AhadunAhad #6YehT https://t.co/reLkLVULjG","1249281063941095424","","","in","","0","0","0","https://twitter.com/Afandi06769634/status/1249281063941095424","1247847857677164546","Afandi06769634"
"1248887204694253570","Sat Apr 11 08:14:47 +0000 2020","0","Pengamat Kiritisi Kebijakan 'Gimik' Kampus Merdeka ala Nadiem https://t.co/6VkCoNO6nG","1248887204694253570","","","in","Bandar Lampung, Lampung","0","0","1","https://twitter.com/TahirAlkarum/status/1248887204694253570","1213587503640264704","TahirAlkarum"
"1248766949472886784","Sat Apr 11 00:16:56 +0000 2020","0","Edaran Rektor: Tindaklanjut WFH dan Perkuliahan Secara Daring di Lingkungan Universitas Kaltara. #Kampusmerdeka #Kampusberkarakter #Unikaltar https://t.co/4AYmBLJ8Xf https://t.co/q93Y51bIp3","1248766949472886784","https://pbs.twimg.com/media/EVSC5udUMAAopz7.jpg","","in","Jln. Sengkawit, Tanjung Selor","0","0","0","https://twitter.com/univkaltara/status/1248766949472886784","939807970325495808","univkaltara"
"1248332101234987009","Thu Apr 09 19:29:00 +0000 2020","0","gamabaran efek jangka panjang kebijakan kampus merdeka","1248332101234987009","","","in","","0","0","0","https://twitter.com/tweetbadaah/status/1248332101234987009","1152177160326483968","tweetbadaah"
"1248215688197496839","Thu Apr 09 11:46:25 +0000 2020","0","Gejala Covid-19 Memburuk PM Inggris Boris Johnson Dimasukkan ke ICU. #RezimGagap #RezimGagap https://t.co/32Y8okGOvc","1248215688197496839","","","in","","0","0","0","https://twitter.com/Kampus_Merdeka/status/1248215688197496839","2984157584","Kampus_Merdeka"
