"conversation_id_str","created_at","favorite_count","full_text","id_str","image_url","in_reply_to_screen_name","lang","location","quote_count","reply_count","retweet_count","tweet_url","user_id_str","username"
"1205701118778462213","Sat Dec 14 04:08:42 +0000 2019","1","Simak POLEMIK MERDEKA BELAJAR MERDEKA UN! Sabtu 14 Desember 2019 pukul 10-12 WIB LIVE dari Hotel Ibis Tamarin Jakarta. #POLEMIKHapusUN https://t.co/sBHasS3itP","1205701118778462213","https://pbs.twimg.com/media/ELuCxICU4AEaNJV.jpg","","in","Jakarta","0","0","2","https://twitter.com/MNCSportstars/status/1205701118778462213","2916393212","MNCSportstars"
"1205700998032871425","Sat Dec 14 04:08:13 +0000 2019","0","Dan apa saja langkah Kemdikbud untuk merealisasikan program MERDEKA BELAJAR di tahun 2021 mendatang? #POLEMIKHapusUN","1205700998032871425","","","in","Jakarta","0","0","2","https://twitter.com/MNCSportstars/status/1205700998032871425","2916393212","MNCSportstars"
"1205700202155429888","Sat Dec 14 04:05:03 +0000 2019","0","Simak POLEMIK MERDEKA BELAJAR MERDEKA UN! Sabtu 14 Desember 2019 pukul 10-12 WIB LIVE dari Hotel Ibis Tamarin Jakarta. #POLEMIKHapusUN https://t.co/iW36AiIbjv","1205700202155429888","https://pbs.twimg.com/media/ELuB8bpXUAURSxG.jpg","","in","Jakarta","0","0","3","https://twitter.com/mnctrijaya/status/1205700202155429888","88593647","mnctrijaya"
"1205700187848445957","Sat Dec 14 04:05:00 +0000 2019","2","Simak POLEMIK MERDEKA BELAJAR MERDEKA UN! Sabtu 14 Desember 2019 pukul 10-12 WIB LIVE dari Hotel Ibis Tamarin Jakarta. #POLEMIKHapusUN https://t.co/icYQ8b6jln","1205700187848445957","https://pbs.twimg.com/media/ELt01hSUEAEyIBZ.jpg","","in","iNews Tower Jakarta","0","0","2","https://twitter.com/SeputariNews/status/1205700187848445957","375995332","SeputariNews"
"1205699909724205056","Sat Dec 14 04:03:53 +0000 2019","0","Mas menteri bilang soal merdeka belajar. hmm merdeka belajar itu kayak apa sih","1205699909724205056","","","in","","0","0","0","https://twitter.com/bermaintiktaktu/status/1205699909724205056","90109533","bermaintiktaktu"
"1205698950768005122","Sat Dec 14 04:00:05 +0000 2019","2","Dan apa saja langkah Kemdikbud untuk merealisasikan program MERDEKA BELAJAR di tahun 2021 mendatang? #POLEMIKHapusUN","1205698950768005122","","","in","Jakarta","0","0","4","https://twitter.com/mnctrijaya/status/1205698950768005122","88593647","mnctrijaya"
"1205698930266320896","Sat Dec 14 04:00:00 +0000 2019","0","Dan apa saja langkah Kemdikbud untuk merealisasikan program MERDEKA BELAJAR di tahun 2021 mendatang? #POLEMIKHapusUN","1205698930266320896","","","in","iNews Tower Jakarta","0","0","2","https://twitter.com/SeputariNews/status/1205698930266320896","375995332","SeputariNews"
"1205697644141527040","Sat Dec 14 03:54:53 +0000 2019","0","Disdik Riau Siap Kawal Kebijakan Merdeka Belajar Kemendikbud https://t.co/w13riR9aLk","1205697644141527040","","","in","Pku","0","0","0","https://twitter.com/Maswir15/status/1205697644141527040","981444947730685952","Maswir15"
"1205692519805120513","Sat Dec 14 03:34:32 +0000 2019","0","Merdeka Belajar konsep yang saya idam2kan dari dulu akhirnya bisa terwujud di tangan Mas Menteri yang sekarang... https://t.co/QkS60CXcK9","1205692519805120513","https://pbs.twimg.com/media/ELt689nUUAADkxk.jpg","","in","Tabanan, Indonesia","0","0","0","https://twitter.com/awekananda/status/1205692519805120513","1121071734","awekananda"
"1205688938003779584","Sat Dec 14 03:20:18 +0000 2019","0","Empat fokus kebijakan Merdeka belajar terkait Ujian Sekolah Berstandar Nasional (USBN) Ujian Nasional ( UN) Rencana Pelaksanaan Pembelajaran (RPP) dan Peraturan Penerimaan Peserta Didik Baru (PPDB) Zonasi. #POLEMIKHapusUN","1205688938003779584","","","in","Jakarta","0","0","2","https://twitter.com/MNCSportstars/status/1205688938003779584","2916393212","MNCSportstars"
"1205688863143931904","Sat Dec 14 03:20:00 +0000 2019","1","Empat fokus kebijakan Merdeka belajar terkait Ujian Sekolah Berstandar Nasional (USBN) Ujian Nasional ( UN) Rencana Pelaksanaan Pembelajaran (RPP) dan Peraturan Penerimaan Peserta Didik Baru (PPDB) Zonasi. #POLEMIKHapusUN","1205688863143931904","","","in","iNews Tower Jakarta","0","0","3","https://twitter.com/SeputariNews/status/1205688863143931904","375995332","SeputariNews"
"1205688826745614336","Sat Dec 14 03:19:51 +0000 2019","0","Terobosan tersebut adalah kebijakan pendidikan yang disebutnya dengan istilah Merdeka Belajar meliputi empat program pendidikan yang akan menjadi fokusnya. #POLEMIKHapusUN","1205688826745614336","","","in","Jakarta","0","0","2","https://twitter.com/MNCSportstars/status/1205688826745614336","2916393212","MNCSportstars"
"1205687613778210816","Sat Dec 14 03:15:02 +0000 2019","0","Terobosan tersebut adalah kebijakan pendidikan yang disebutnya dengan istilah Merdeka Belajar meliputi empat program pendidikan yang akan menjadi fokusnya. #POLEMIKHapusUN","1205687613778210816","","","in","Jakarta","0","0","3","https://twitter.com/mnctrijaya/status/1205687613778210816","88593647","mnctrijaya"
"1205687604756135936","Sat Dec 14 03:15:00 +0000 2019","1","Terobosan tersebut adalah kebijakan pendidikan yang disebutnya dengan istilah Merdeka Belajar meliputi empat program pendidikan yang akan menjadi fokusnya. #POLEMIKHapusUN","1205687604756135936","","","in","iNews Tower Jakarta","0","0","2","https://twitter.com/SeputariNews/status/1205687604756135936","375995332","SeputariNews"
"1205685593180532736","Sat Dec 14 03:07:00 +0000 2019","0","Nadiem Makarim: Program Merdeka Belajar Baru Step Pertama https://t.co/gpqPlufVz1","1205685593180532736","","","in","Cirebon, Jawa Barat, Indonesia","0","0","0","https://twitter.com/pubinform/status/1205685593180532736","2449382456","pubinform"
"1205676287135641600","Sat Dec 14 02:30:01 +0000 2019","0","Hapus Aku #kreasiakhirpekan #UN #ujiannasional #typography #MerdekaBelajar https://t.co/R4eWLfHuvA","1205676287135641600","https://pbs.twimg.com/media/ELtsLtlVUAAFU-2.jpg","","in","depok.indonesia","0","0","0","https://twitter.com/widodosugiman/status/1205676287135641600","230466320","widodosugiman"
"1205672460428824576","Sat Dec 14 02:14:49 +0000 2019","0","Konsep Merdeka Belajar Pak Mendikbud sangat bermakna semoga dunia pendidikan tanah air semakin lebih baik sukses Pak Menteri","1205672460428824576","","","in","","0","0","0","https://twitter.com/sbm018/status/1205672460428824576","1203200784298430464","sbm018"
"1205667107528032256","Sat Dec 14 01:53:33 +0000 2019","0","Mendikbud Nadiem Akui Belum Bahas Soal Kesejahteraan Guru di Program 'Merdeka Belajar' https://t.co/f1BzoPKY6w https://t.co/8BTaIXz0VR","1205667107528032256","https://pbs.twimg.com/media/ELtj2FHUEAA2htG.jpg","","in","Indonesia","0","0","0","https://twitter.com/wow_keren/status/1205667107528032256","313946561","wow_keren"
"1205664933498802176","Sat Dec 14 01:44:54 +0000 2019","0","Merdeka Belajar... ##Mas Nadiem Makarim##","1205664933498802176","","","in","Bagik Longgek Rakam","0","0","0","https://twitter.com/FaizFadhilAsri/status/1205664933498802176","1644862021","FaizFadhilAsri"
"1205658784263065600","Sat Dec 14 01:20:28 +0000 2019","0","Merdeka Belajar Ala Nadiem Makarim https://t.co/zoXkT3n9qJ","1205658784263065600","","","in","Jakarta Capital Region","0","0","1","https://twitter.com/cnbcindonesia/status/1205658784263065600","847372542830444544","cnbcindonesia"
"1205657080675221504","Sat Dec 14 01:13:42 +0000 2019","0","EMPAT POKOK KEBIJAKAN #MERDEKA_BELAJAR https://t.co/W5nBNEzHlg","1205657080675221504","","","in","Indonesia","0","0","0","https://twitter.com/muchamadhamam/status/1205657080675221504","1028121180","muchamadhamam"
"1205649213004099585","Sat Dec 14 00:42:26 +0000 2019","0","Sangat visioner dan kekinian pak menteri kita ini. Sukses pak.. Merdeka Belajar! https://t.co/ZOMNXzIpvo","1205649213004099585","","","in","","0","0","0","https://twitter.com/AdeSyar49259907/status/1205649213004099585","1193325276169506818","AdeSyar49259907"
"1205649042258067456","Sat Dec 14 00:41:46 +0000 2019","5","Memupuk sejak dini Mengajarkan ke mereka tentang keberagaman rasa Berbagi dan pentingnya menjunjung tinggi kejujuran di dalam Persahabatan. #ceritaAkhirpekan #merawatkebaikan #tamanbaca #mandiri #nonprofit #merdekabelajar https://t.co/2ui65tYfWH","1205649042258067456","https://pbs.twimg.com/media/ELtTZD4UYAAXFtm.jpg","","in","Kertosono- jawa timur","0","0","2","https://twitter.com/PelangiSokola/status/1205649042258067456","1094617259916414976","PelangiSokola"
"1205640855622520833","Sat Dec 14 00:09:14 +0000 2019","2","Talkshow Akhir Pekan Terhangat POLEMIK Radio MNC TRIJAYA NETWORK Live 100 Radio Edisi: Sabtu 14 Desember 2019 Pukul: 10.00 12.00 WIB Tempat: IBIS TAMARIN Hotel Jl Wahid Hasyim No.77 Menteng - Jakarta Pusat Topik : MERDEKA BELAJAR MERDEKA UN! https://t.co/P0IYkesHAU","1205640855622520833","https://pbs.twimg.com/media/ELtL9RPVUAAYt9G.jpg","","in","Jakarta","0","1","5","https://twitter.com/mnctrijaya/status/1205640855622520833","88593647","mnctrijaya"
"1205632092907794432","Fri Dec 13 23:34:25 +0000 2019","2","Buku mini yang saya serahkan ke salah seorang santri Pondok Tazakka ini berisi potret pelajar tanah air yang masih dipenjara oleh ujian nasional. Beda ama santri Pondok Modern Gontor yang sudah lama menikmati #merdekabelajar dgn metode ujiannya sendiri. https://t.co/f9yLicp8eR","1205632092907794432","https://pbs.twimg.com/media/ELtD_jxVUAE7-5S.jpg","","in","Indonesia","0","1","0","https://twitter.com/iskandarjet/status/1205632092907794432","16995323","iskandarjet"
"1205630536724541440","Fri Dec 13 23:28:14 +0000 2019","0","Merdeka belajar adalah hal yang sangat baik..tetapi kita jangan sampai lengah..karena di Indonesia ada sebagian yang masih belum mempu memerankan sistim yang jadi harapan bapak menteri...kalau yang dikota mungkin bisa..bagaimana dengan yang di pelosok2 desa....","1205630536724541440","","","in","","0","0","0","https://twitter.com/RasmadiKohar/status/1205630536724541440","1092449145791512576","RasmadiKohar"
"1205625238953684992","Fri Dec 13 23:07:11 +0000 2019","0","Apalah merdeka belajar jika yang mengajarnya (guru) tidak bisa merdeka mengajar karena memiliki beban Ekonomi yang tak cukup dicukupi dengan dia mengajar pak Nadiem Makarim","1205625238953684992","","","in","","0","0","0","https://twitter.com/Edelweissalways/status/1205625238953684992","1179985360610156545","Edelweissalways"
"1205610734903627776","Fri Dec 13 22:09:33 +0000 2019","10","Mendikbud Nadiem Makarim meminta ahli di BSNP benar-benar menerapkan merdeka belajar dalam pendidikan. https://t.co/zKDkPIPkg0","1205610734903627776","","","in","","1","1","1","https://twitter.com/kumparan/status/1205610734903627776","759692754985242625","kumparan"
"1205608841007620097","Fri Dec 13 22:02:01 +0000 2019","0","Komponen Inti Format RPP Terbaru yang disederhanakan Mendikbud Nadiem Merdeka Belajar https://t.co/clh6FZEUat","1205608841007620097","","","in","Cibolerang city","0","0","1","https://twitter.com/sfaridhaaas/status/1205608841007620097","400426286","sfaridhaaas"
"1205598732269445120","Fri Dec 13 21:21:51 +0000 2019","28","Konsep Merdeka Belajar Nadiem Belum Sentuh Kesejahteraan Guru https://t.co/lhFrAIp9Hr","1205598732269445120","","","in","","2","1","7","https://twitter.com/CNNIndonesia/status/1205598732269445120","17128975","CNNIndonesia"
"1205565187941527554","Fri Dec 13 19:08:33 +0000 2019","0","TRANSFORMASI PENDIDIKAN NASIONAL : Nadiem &amp; Terobosan Merdeka Belajar https://t.co/9BtI7m3u9o","1205565187941527554","","","in","Jakarta, Indonesia","0","0","0","https://twitter.com/Bisniscom/status/1205565187941527554","118646322","Bisniscom"
"1205557339320807424","Fri Dec 13 18:37:22 +0000 2019","0","Dukung #MerdekaBelajar Memerdekakan pembelajaran di Indonesia","1205557339320807424","","","in","Brebes","0","0","0","https://twitter.com/ahasqi/status/1205557339320807424","456516346","ahasqi"
"1205551456650031107","Fri Dec 13 18:13:59 +0000 2019","6","Halo mbak si kakak ini keren bgt! Indonesia perlu byk anak2 mandiri &amp; merdeka belajar kayak si kakak. Anyway mbak mgkn mau liat2 https://t.co/Ym34VQyxWa sbg referensi. Sayang Erudio baru buka setara SMA but anw kalau mau discuss soal democratic ed we d be very happy to do so!","1205551456650031107","","","in","Jakarta Selatan, DKI Jakarta","0","0","3","https://twitter.com/barrysianturi/status/1205551456650031107","2237377454","barrysianturi"
"1205540123443638278","Fri Dec 13 17:28:57 +0000 2019","5","Nadiem Makarim: Program Merdeka Belajar Baru Step Pertama https://t.co/k9NDm5fxHf","1205540123443638278","","","in","Jakarta","0","3","1","https://twitter.com/liputan6dotcom/status/1205540123443638278","47596019","liputan6dotcom"
"1205527423674044416","Fri Dec 13 16:38:30 +0000 2019","0","Perubahan tidak selalu baik tetapi perubahan mampu menawarkan cara yang lebih baik untuk segala sesuatu. #merdekabelajar #nadiemmakarim","1205527423674044416","","","in","ngk tau","0","0","0","https://twitter.com/AdamAbiya1/status/1205527423674044416","1167383791758741504","AdamAbiya1"
"1205522835612950528","Fri Dec 13 16:20:16 +0000 2019","1","UN 2020 JADI UN TERAKHIR? OBROLAN KEBIJAKAN MERDEKA BELAJAR episode Gelas Kosong https://t.co/UJPsmWiHRr","1205522835612950528","","","in","","0","0","0","https://twitter.com/DimasRyandi17/status/1205522835612950528","1136534772711190528","DimasRyandi17"
"1205512279850135552","Fri Dec 13 15:38:19 +0000 2019","1","Mendikbud Tetapkan Empat Pokok Kebijakan Pendidikan Merdeka Belajar Jakarta Kemendikbud --- Menindaklanjuti arahan Presiden Republik Indonesia Joko Widodo dan Wakil Presiden Republik Indonesia Ma ruf Amin https://t.co/japFVRD17t","1205512279850135552","","","in","Kota Makassar","0","0","0","https://twitter.com/DisdikMakassar/status/1205512279850135552","1084289106564210693","DisdikMakassar"
"1205498876741816320","Fri Dec 13 14:45:03 +0000 2019","0","Mendikbud Nadiem Akui 'Merdeka Belajar' Masih Harus Dibenahi https://t.co/aXsk8gfzCN","1205498876741816320","","","in","Jakarta, Indonesia","0","0","0","https://twitter.com/GATRA_com/status/1205498876741816320","202559038","GATRA_com"
"1205476095111258114","Fri Dec 13 13:14:32 +0000 2019","0","Selamat dan Sukses Rapat Kerja MKKS SMP Swasta Wilayah Surabaya Timur #merdekabelajar #sukseskanUNBK #Pendidikankarakter","1205476095111258114","","","in","surga_kehidupan@yahoo.com","0","0","0","https://twitter.com/kangajay/status/1205476095111258114","139043027","kangajay"
"1205471389018398720","Fri Dec 13 12:55:50 +0000 2019","0","Haii Smartgen.. Menteri Pendidikan dan Kebudayaan (Mendikbud) Nadiem Anwar Makarim menyampaikan empat program pokok kebijakan pendidikan Merdeka Belajar . Program tersebut meliputi perubahan pada Ujian... https://t.co/6u5ktmOqey","1205471389018398720","","","in","Jawa Barat - Indonesia","0","0","0","https://twitter.com/PrimagamaCTC/status/1205471389018398720","584433422","PrimagamaCTC"
"1205468526590300160","Fri Dec 13 12:44:27 +0000 2019","0","Merdeka belajar","1205468526590300160","","","in","Sakra, Lombok Timur","0","0","0","https://twitter.com/efpoel/status/1205468526590300160","1052466753639407618","efpoel"
"1205468045063229441","Fri Dec 13 12:42:33 +0000 2019","2","Mendikbud Nadiem gagas konsep pendidikan Merdeka Belajar instansi pendidikan agar berubah bisa menjadi solusi agar anak2 bisa berkreasi dan berinovasi. Ini yang butuhkan di masa depan dunia tidak butuh anak-anak yang jago menghafal https://t.co/MmzrWPCwb3 @Ze_sukma @Oetaryo7","1205468045063229441","","","in","Jakarta Capital Region, Indone","1","0","1","https://twitter.com/cagubnyinyir2/status/1205468045063229441","1013331201396912128","cagubnyinyir2"
"1205465033427210240","Fri Dec 13 12:30:35 +0000 2019","5","Mendikbud Nadiem Makarim meminta ahli di BNSP benar-benar menerapkan merdeka belajar dalam pendidikan. https://t.co/vnFZKiZe9m","1205465033427210240","","","in","","1","1","3","https://twitter.com/kumparan/status/1205465033427210240","759692754985242625","kumparan"
"1205463432977272832","Fri Dec 13 12:24:13 +0000 2019","3","Jokowi Dukung Hapus Ujian Nasional Presiden Joko Widodo mendukung keputusan Mendikbud Nadiem Makarim hapus Ujian Nasional 2021 #UjianNasional #GebrakanNadiem #MerdekaBelajar #MasMenteri #Kemendikbud #Jokowi #Mendikbud https://t.co/o5kd7m4CyA","1205463432977272832","https://pbs.twimg.com/ext_tw_video_thumb/1205463313200476161/pu/img/fVDaVf7Rfzrr_KnX.jpg","","in","","0","0","2","https://twitter.com/MasMenteri/status/1205463432977272832","891564038781415424","MasMenteri"
"1205461097681018881","Fri Dec 13 12:14:56 +0000 2019","0","Sebuah catatan yang menarik. Tentang pendidikan untuk anak. Dan bisa juga dikaitkan dengan #MerdekaBelajar","1205461097681018881","","","in","","0","0","0","https://twitter.com/rocky_pras/status/1205461097681018881","20650710","rocky_pras"
"1205458931293786112","Fri Dec 13 12:06:20 +0000 2019","0","Kata Mas Mentri 'Merdeka Belajar' kayaknya tinggal dibalik aja karena selama ini saya sudah 'Belajar Merdeka'","1205458931293786112","","","in","","0","0","0","https://twitter.com/romomiswanto/status/1205458931293786112","1122840076780630016","romomiswanto"
"1205458045808984064","Fri Dec 13 12:02:49 +0000 2019","1","Dikbud NTB Dukung Kebijakan Merdeka Belajar https://t.co/I7mqlbLJWA lewat @SUARANTB.com","1205458045808984064","","","in","Mataram, Indonesia","0","0","0","https://twitter.com/suarantbcom/status/1205458045808984064","1699074884","suarantbcom"
"1205453288742608897","Fri Dec 13 11:43:54 +0000 2019","2","Kampus Guru Cikal akan Kembangkan Konsep Sekolah Merdeka Belajar https://t.co/aXjGjVwBb5","1205453288742608897","","","in","Surakarta, Jawa Tengah","0","1","2","https://twitter.com/bukik/status/1205453288742608897","16734434","bukik"
"1205449366544076800","Fri Dec 13 11:28:19 +0000 2019","0","Kompas TV #merdeka #merdekabelajar #agoenconsultant https://t.co/MUTyjc0NNZ","1205449366544076800","https://pbs.twimg.com/media/ELqdx-zU8AAnMjs.jpg","","in","Karawang, Jawa Barat","0","0","0","https://twitter.com/agoen_digital/status/1205449366544076800","481471199","agoen_digital"
"1205447649979060224","Fri Dec 13 11:21:30 +0000 2019","1","Disdik Kota Bandung Sambut Antusiasme Penghapusan USBN dan UN #MerdekaBelajar https://t.co/jpV4MA7Gih","1205447649979060224","","","in","Surakarta, Jawa Tengah","0","0","0","https://twitter.com/bukik/status/1205447649979060224","16734434","bukik"
"1205446867955306496","Fri Dec 13 11:18:24 +0000 2019","0","Siapa yang berasal dari daerah berikut? Batu Depok Denpasar Gowa Makassar Pesisir Selatan Yuk ikuti kegiatan Komunitas Gurur Belajar Cek slide berikutnya #GuruBelajar #MerdekaBelajar #GuruPenggerak https://t.co/TZeOz28Zck","1205446867955306496","","","in","Serpong","0","0","0","https://twitter.com/KampusGuruCikal/status/1205446867955306496","2804980657","KampusGuruCikal"
"1205444901468377088","Fri Dec 13 11:10:35 +0000 2019","0","Merdeka Belajar Ala Nadiem Makarim https://t.co/MrFo9jnn8p","1205444901468377088","","","in","Malang, Indonesia","0","0","0","https://twitter.com/IvanBoediman/status/1205444901468377088","195185897","IvanBoediman"
"1205438759791157248","Fri Dec 13 10:46:10 +0000 2019","0","Check out a great #article Disdik Riau Siap Kawal Kebijakan 'Merdeka Belajar' Kemendikbud https://t.co/noZEYa6NTC","1205438759791157248","","","in","Pekanbaru","0","0","0","https://twitter.com/MCRiau/status/1205438759791157248","1874710220","MCRiau"
"1205427988956958720","Fri Dec 13 10:03:22 +0000 2019","0","Ide Nadiem Makarim! Merdeka Belajar Pilihan Cerdas https://t.co/XvMoeRQ71u","1205427988956958720","","","in","The Stunning Indonesia","0","0","0","https://twitter.com/iamdluhansa/status/1205427988956958720","364243004","iamdluhansa"
"1205423198046543872","Fri Dec 13 09:44:20 +0000 2019","0","Untuk seluruh rekan guru #merdekabelajar https://t.co/0Md7o2SYeX","1205423198046543872","","","in","indonesia","0","0","0","https://twitter.com/yuyunnue/status/1205423198046543872","177486015","yuyunnue"
"1205414489190875143","Fri Dec 13 09:09:44 +0000 2019","1","UN Tidak Dihapus Siswa Merdeka Belajar Kompetensi Guru Dibutuhkan https://t.co/JoEUCieK2r","1205414489190875143","","","in","Jakarta","0","0","0","https://twitter.com/tanaya1504/status/1205414489190875143","166041323","tanaya1504"
"1205413813069070336","Fri Dec 13 09:07:03 +0000 2019","11","UN Tidak Dihapus Siswa Merdeka Belajar Kompetensi Guru Dibutuhkan https://t.co/Zsaxx3jZDy","1205413813069070336","","","in","Indonesia","0","1","4","https://twitter.com/kompasiana/status/1205413813069070336","23786106","kompasiana"
"1205413754915024896","Fri Dec 13 09:06:49 +0000 2019","0","Inilah yang seharusnya terjadi para guru harus diberikan kebebasan untuk mencoba hal-hal baru dan tanpa itu kita gak akan maju sebagai negara itu namanya inovasi #MerdekaBelajar #IndonesiaMaju #KiHajarDewantara https://t.co/qt45lsmniu","1205413754915024896","","","in","Jakarta, Indonesia","0","0","0","https://twitter.com/YurikaAgustina/status/1205413754915024896","88869591","YurikaAgustina"
"1205411389403062272","Fri Dec 13 08:57:25 +0000 2019","5","Mendikbud Nadiem Makarim memastikan ujian nasional akan diganti menjadi asesmen kompetensi minimum dan survei karakter pada 2021. Siswa yang telah belajar untuk UN 2020 tidak perlu khawatir karena formatnya belum berubah di tahun ini.⁣⁣ @Kemdikbud_RI #iNews #MerdekaBelajar https://t.co/NoqYJhlPVl","1205411389403062272","https://pbs.twimg.com/media/ELp68hvU0AAcPva.jpg","","in","iNews Tower Jakarta","0","0","1","https://twitter.com/SeputariNews/status/1205411389403062272","375995332","SeputariNews"
"1205409501001728000","Fri Dec 13 08:49:55 +0000 2019","0"," Merdeka Belajar Versi Menteri Pendidikan dan Kebudayaan Nadien Anwar Makarim 1. Kemampuan bernalar menggunakan bahasa (literasi) 2. Kemampuan bernalar menggunakan matematika (Numerasi) 3. Dan Penguatan... https://t.co/uwZSLaMREO","1205409501001728000","","","in","Balikpapan, Kalimantan Timur","0","0","0","https://twitter.com/BimaSaputra2017/status/1205409501001728000","873015522312413184","BimaSaputra2017"
"1205408548739371009","Fri Dec 13 08:46:08 +0000 2019","0","#merdekabelajar semoga visi dan misimu sukses pak Nadiem Makarim","1205408548739371009","","","in","https://goo.gl/maps/ro3N3gAeAL","0","0","0","https://twitter.com/global_pahala/status/1205408548739371009","4186365912","global_pahala"
"1205406636900151296","Fri Dec 13 08:38:32 +0000 2019","29","Menteri Pendidikan dan Kebudayaan Nadiem Makarim menetapkan empat program pembelajaran yang dinamainya Merdeka Belajar. Salah satunya menghapus ujian nasional pada 2021 lalu menggantinya dengan aseesmen kompetensi minimum dan survei karakter. https://t.co/kaCmIDIGy5","1205406636900151296","https://pbs.twimg.com/media/ELp27euUUAAOh0n.jpg","","in","","0","0","11","https://twitter.com/Metro_TV/status/1205406636900151296","57261519","Metro_TV"
"1205406339540779008","Fri Dec 13 08:37:21 +0000 2019","1","Ini waktunya..ini momennya bagi #GuruPenggerak Komunitas @guru_belajar di penjuru nusantara! Bergerak bekerja barengan untuk nyalakan kebijakan #MerdekaBelajar menjadi kenyataan. Buktikan #berpihakpadaanak adalah kunci kemajuan pendidikan Indonesia! https://t.co/KuqRRpA6G3","1205406339540779008","https://pbs.twimg.com/ext_tw_video_thumb/1205406299728408576/pu/img/LnGdED0T-XcCAzJF.jpg","","in","Surakarta, Jawa Tengah","0","0","1","https://twitter.com/bukik/status/1205406339540779008","16734434","bukik"
"1205399614557278208","Fri Dec 13 08:10:38 +0000 2019","0","Coba kerjakan dalam 10 detik tanpa menggunakan Kalkulator. Diketahui: 1 x 1 = 1 11 x 11 = 121 111 x 111 = 12321 Berapakah 1111 x 1111? #MerdekaBelajar","1205399614557278208","","","in","","0","0","0","https://twitter.com/VongkyAlexander/status/1205399614557278208","1205006217145245698","VongkyAlexander"
"1205396372687589377","Fri Dec 13 07:57:45 +0000 2019","0","Fahri Hamzah Pertanyakan Sikap Jokowi Soal Kebijakan Merdeka Belajar Nadiem Makarim https://t.co/ooBajelhlj https://t.co/j6berKX5hB","1205396372687589377","https://pbs.twimg.com/media/ELptnPHW4AANWOL.jpg","","in","Jakarta Selatan, DKI Jakarta","0","0","0","https://twitter.com/Realitarakyat01/status/1205396372687589377","1103583350705479680","Realitarakyat01"
"1205392380351827968","Fri Dec 13 07:41:53 +0000 2019","0","Belajar Merdeka itu penting","1205392380351827968","","","in","Mamuju, Indonesia","0","0","0","https://twitter.com/esa_bung/status/1205392380351827968","966553691233837056","esa_bung"
"1205391181447757824","Fri Dec 13 07:37:07 +0000 2019","0","Jika merdeka belajar dibuat kurikulum nya jadi apa ? Pencitraan yang mau belajar gitu jdi kalau ada yng mau kuliah di luar negeri ditolak lah ya sempurna ","1205391181447757824","","","in","","0","0","0","https://twitter.com/Sermino3/status/1205391181447757824","1163883397548085248","Sermino3"
"1205384461275168768","Fri Dec 13 07:10:25 +0000 2019","0","Merdeka Belajar Kunci dalam Pembelajaran Guru dan Murid The post https://t.co/uXoPwEdsyZ","1205384461275168768","","","in","Cirebon, Indonesia","0","0","0","https://twitter.com/officialliputan/status/1205384461275168768","53267425","officialliputan"
"1205384454354587648","Fri Dec 13 07:10:23 +0000 2019","4","Millealab kolaborasi dengan #semuamuridsemuaguru https://t.co/KSIVam2eC2 #virtualeducation #MerdekaBelajar #gurucerdas #guruinovasi #gurumerdekabelajar #gurucanggih #GuruPenggerak #kemdikbud #shintavr #pustekomkemendikbud #millealab #vrindonesia #virtualrealityindonesia https://t.co/ZtB1pOlnoO","1205384454354587648","https://pbs.twimg.com/media/ELpixPkUEAISBj4.jpg","","in","Jakarta Selatan, DKI Jakarta","0","0","4","https://twitter.com/ShintaVR/status/1205384454354587648","3267027722","ShintaVR"
