"conversation_id_str","created_at","favorite_count","full_text","id_str","image_url","in_reply_to_screen_name","lang","location","quote_count","reply_count","retweet_count","tweet_url","user_id_str","username"
"1293805265339342849","Thu Aug 13 07:03:07 +0000 2020","7","Kegiatan Workshop Penyelarasan Kurikulum Merdeka Belajar Program Studi Agroekoteknologi FP UB Workshop ini merupakan tindak lanjut atas program kurikulum merdeka belajar Universitas Brawijaya yang akan segera diberlakukan https://t.co/SEFuenRuEF","1293805265339342849","https://pbs.twimg.com/media/EfSE6vGUwAEpfRJ.jpg","","in","FPUB","0","0","0","https://twitter.com/fpub_official/status/1293805265339342849","473555639","fpub_official"
"1293794683672567808","Thu Aug 13 06:21:04 +0000 2020","0","Road to 75 tahun Indonesia Merdeka🇲🇨 Hi SMIvers dalam Rangka memeriahkan 75 tahun Indonesia Merdeka SMI Solo memberikan Promo Merdeka Belajar. Tanpa Uang pendaftaran sudah bisa bergabung dengan SMI Online Class https://t.co/HqMSSs682n","1293794683672567808","","","in","Jl. Veteran No. 02, Solo","0","0","0","https://twitter.com/SoloSMI/status/1293794683672567808","1948524986","SoloSMI"
"1293793890953117697","Thu Aug 13 06:17:55 +0000 2020","3","Hai #SahabatLiterasi Balai Bahasa Kalimantan Tengah mengadakan Sayembara Menulis Puisi untuk para pelajar tingkat SLTP di Kalimantan Tengah. #GLN #sayembara #literasi #puisi #sltp #bahasa #Kalteng #kalimantantengah #MerdekaBelajar #menulis #inovasiuntuknegeri #kreatif https://t.co/8XmaJ7Ze2B","1293793890953117697","https://pbs.twimg.com/media/EfR6qqKU0AEKReT.jpg","","in","Central Borneo, Indonesia","0","0","2","https://twitter.com/bbkalteng/status/1293793890953117697","934352272665976832","bbkalteng"
"1293790435270246400","Thu Aug 13 06:04:11 +0000 2020","1","Belajar ikhlas untuk menjadi orang merdeka Kemerdekaan hakiki adalah bila kita tidak diperbudak keinginan dipuji dihargai dihormati dibalas budi oleh orang lain. Kemerdekaan adalah milik orang yang ikhlas. Abdullah Gymnastiar","1293790435270246400","","","in","Jeneponto","0","0","0","https://twitter.com/muharzul/status/1293790435270246400","1925351912","muharzul"
"1293789420382859264","Thu Aug 13 06:00:09 +0000 2020","5","Hai #SahabatLiterasi Balai Bahasa Kalimantan Tengah mengadakan Sayembara Cipta Puisi untuk para pelajar tingkat SD/MI di Kalimantan Tengah. #GLN #sayembara #literasi #puisi #sd #bahasa #Kalteng #kalimantantengah #MerdekaBelajar #menulis #inovasiuntuknegeri #kreatif #gemarmenulis https://t.co/HVYt17mWwD","1293789420382859264","https://pbs.twimg.com/media/EfR2l7kU4AAFh1L.jpg","","in","Central Borneo, Indonesia","0","0","3","https://twitter.com/bbkalteng/status/1293789420382859264","934352272665976832","bbkalteng"
"1293789134696267778","Thu Aug 13 05:59:01 +0000 2020","0","Salah satu persiapan menjelang HUT Republik Indonesia. Semagat untuk Indonesia Maju dan Merdeka Belajar kapan saja dan dimana saja. @ Takengon Aceh Indonesia https://t.co/mzDP9c3ZIR","1293789134696267778","","","in","Kota Takengon, Indonesia","0","0","0","https://twitter.com/sadriadam/status/1293789134696267778","250573972","sadriadam"
"1293788138070921216","Thu Aug 13 05:55:04 +0000 2020","0","Uda mau 75 thn indonesia merdeka. Internet masih lemot. Apa lagi @IndiHome ampunn disaat pademi covid-19 anak2 bayak belajar dri rumah internet ngadat melulu trimakasij @IndiHome @TelkomCare kalian sudah membuat anak2 kami hari ini buat alasan g bisa belajar online.","1293788138070921216","","","in","DKI JAKARTA","0","1","0","https://twitter.com/momong_tomo/status/1293788138070921216","2854032552","momong_tomo"
"1293785962355384320","Thu Aug 13 05:46:25 +0000 2020","1","Jangan lupa saksikan Program Merdeka Belajar Bersama GO siang ini pukul 13.00 - 14.00 WIB langsung di Riau Televisi @riautv ... . #MerdekaBelajarBersamaGO #MerdekaBelajar #newnormal #tp2021 https://t.co/FMegJsnrUt","1293785962355384320","","","in","Riau, Indonesia","0","0","0","https://twitter.com/GO_Pekanbaru/status/1293785962355384320","1289421586374696960","GO_Pekanbaru"
"1293781081120899072","Thu Aug 13 05:27:01 +0000 2020","0","Hai Orang Tua Murid! Ada informasi menarik nih. Aktivitas belajar di Sekolah Murid Merdeka kini semakin seru dan keren lho! Ada 3 fitur baru yang jadikan Sekolah Murid Merdeka semakin inovatif dan informatif. Di https://t.co/uAWj37xIqn","1293781081120899072","","","in","","0","0","0","https://twitter.com/muridmerdeka/status/1293781081120899072","1279131536298663937","muridmerdeka"
"1293774303972847616","Thu Aug 13 05:00:05 +0000 2020","172","#SahabatDikbud di tengah pandemi Covid-19 4 peserta Tim Olimpiade Biologi Indonesia bertekad untuk menjadi yang terbaik di ajang Olimpiade Biologi Internasional (IBO) 2020 yang digelar secara daring 7--13 Agustus 2020. Selengkapnya di https://t.co/CpP5P70BEO. #MerdekaBelajar https://t.co/VOmNa7BUae","1293774303972847616","https://pbs.twimg.com/media/EfRo3UsUwAAByOV.jpg","","in","Jakarta","8","9","17","https://twitter.com/Kemdikbud_RI/status/1293774303972847616","631701837","Kemdikbud_RI"
"1293771743765569537","Thu Aug 13 04:49:55 +0000 2020","0","nah man aku tengah nangis belajar pasal merdeka tersentuh Nye ya Allah ","1293771743765569537","","","in","she / her","0","0","0","https://twitter.com/etherealjongho/status/1293771743765569537","1196659906746576897","etherealjongho"
"1293750118689071105","Thu Aug 13 03:23:59 +0000 2020","1","Info untuk #SahabatBahasa dan #SahabatDikbud #Gerakanliterasinasional #cerdasberliterasi #literasi #lestarikanbahasadaerah #MerdekaBelajar #BangkituntukIndonesiaMaju","1293750118689071105","","","in","Jalan Yoka, Waena, Heram , Jay","0","0","1","https://twitter.com/bbahasapapua/status/1293750118689071105","1221661982035591169","bbahasapapua"
"1293745930047389697","Thu Aug 13 03:07:21 +0000 2020","0","Alur Belajar Merdeka https://t.co/XerLkmksX1 lewat @YouTube","1293745930047389697","","","in","kocan","0","0","0","https://twitter.com/C4121N_makarina/status/1293745930047389697","933653780","C4121N_makarina"
"1293743653240725504","Thu Aug 13 02:58:18 +0000 2020","1","kata pak pkn merdeka belajar :') itu : ~ jamkos ~ ~ jamkos ~ ~ jamkos ~ ~jamkos ~ ~jamkos","1293743653240725504","","","in","","0","0","0","https://twitter.com/apobaangpo/status/1293743653240725504","1139498891064180736","apobaangpo"
"1293708416041357313","Thu Aug 13 00:38:16 +0000 2020","1","Dinas Komunikasi dan Informatika @kominfobantul Pemerintah Kabupaten Bantul @pemkabbantul mempersembahkan Goes To School Virtual dengan tema Merdeka Belajar bersama host Miko Cakcoy @pathoknegoro dengan https://t.co/nSXkEpcSV8","1293708416041357313","","","in","Yogyakarta, Indonesia","0","0","0","https://twitter.com/starjogja/status/1293708416041357313","159450635","starjogja"
"1293706970579468288","Thu Aug 13 00:32:32 +0000 2020","0","Empat hari menuju hari kemerdekaan Republik Indonesia. Jangan lupa bahagia. #MerdekaBelajar #Kihajar2020 #dirgahayuindonesia #indonesiamaju #banggabuatanindonesia #75tahunindonesiamerdeka #BelajarDariRumah https://t.co/fByC0YZZ3i","1293706970579468288","","","in","Jl. Palasari No. 59 B Sumedang","0","0","0","https://twitter.com/smkbhs/status/1293706970579468288","1151695104","smkbhs"
"1293704150828683264","Thu Aug 13 00:21:20 +0000 2020","0","Semangat pagi #MerdekaBelajar #dirgahayurepublikindonesia #dirgahayuindonesia #indonesiamaju #banggabuatanindonesia #75tahunindonesiamerdeka #BelajarDariRumah #BanggaJadiAnakSMK #VokasiMenguatkanIndonesia https://t.co/tCl8hnUrO4","1293704150828683264","","","in","Jl. Palasari No. 59 B Sumedang","0","0","0","https://twitter.com/smkbhs/status/1293704150828683264","1151695104","smkbhs"
"1293702548134563841","Thu Aug 13 00:14:57 +0000 2020","40","Selamat pagi #SahabatDikbud. Yuk persiapkan diri untuk belajar hari ini! Berikut jadwal acara #BelajardariRumah di @TVRINasional untuk hari Kamis 13 Agustus 2020. #MerdekaBelajar #BersamaHadapiKorona https://t.co/7LzeMmHESb","1293702548134563841","https://pbs.twimg.com/media/EfQnnFoU8AAFchS.jpg","","in","Jakarta","0","3","8","https://twitter.com/Kemdikbud_RI/status/1293702548134563841","631701837","Kemdikbud_RI"
"1293464338926202880","Wed Aug 12 08:28:24 +0000 2020","33","Halo #SobatPrestasi ada info penting nih buat Kawan SMK. Gelombang baru sudah dibuka. Silakan mendaftar bagi siswa siswi SMK. Untuk kemarin yang belum sempat daftar jangan terlambat lagi ya! . #jujuritujuara #BerprestasidariRumah #MerdekaBelajar #SMKBisa #SMKHebat https://t.co/CXrnMhnOqD","1293464338926202880","https://pbs.twimg.com/media/EfNO9aQUMAAyzGj.jpg","","in","Indonesia","1","0","4","https://twitter.com/puspresnas/status/1293464338926202880","1245249011885289472","puspresnas"
"1293462974758232065","Wed Aug 12 08:22:59 +0000 2020","24","#RabuBerliterasi #SahabatBahasa dan #SahabatDikbud berikut pandangan sastrawan Ignas Kleden tentang kritik sastra. #SayembaraKritikSastra #CintaSastraIndonesia #CerdasBerliterasi #MerdekaBelajar #BangkituntukIndonesiaMaju https://t.co/br6q3Txcgl","1293462974758232065","https://pbs.twimg.com/media/EfNNtdRUYAERVrR.jpg","","in","Jalan Daksinapati Barat IV ","0","0","2","https://twitter.com/BadanBahasa/status/1293462974758232065","50696331","BadanBahasa"
"1293445985524424704","Wed Aug 12 07:15:28 +0000 2020","0","Merdeka Belajar itu.... Bukan terserah anak mau belajar atau tidak. Tetapi terserah bagaimana cara belajarnya yang penting senang menyenangkan &amp; materi tercapai. Sayang &amp; mencintai anak bukan berarti mengikuti https://t.co/uh09WCRnRj","1293445985524424704","","","in","","0","0","0","https://twitter.com/aharyocw/status/1293445985524424704","203063864","aharyocw"
"1293445699162370048","Wed Aug 12 07:14:20 +0000 2020","0","Mantap nih membantu anak bangsa untuk merdeka belajar #AnsorPeduliPendidikan https://t.co/dP79252MKj","1293445699162370048","","","in","Indonesia","0","0","0","https://twitter.com/AzzJasmine/status/1293445699162370048","457308857","AzzJasmine"
"1293428517686845442","Wed Aug 12 06:06:04 +0000 2020","3","Pernyataan #MasMenteri mengenai kurikulum darurat yang akan mempermudah orang tua dan siswa belajar. #MerdekaBelajar #BelajardariCovid19 #CegahCovid19 #Guru #TenagaKependidikan #GuruAgenPerubahanIndonesia #Mengajar #BersamaIndonesiaMaju #PendidikanUntukSemua #KurikulumDarurat https://t.co/W0THo7c1xz","1293428517686845442","https://pbs.twimg.com/ext_tw_video_thumb/1293427414073094145/pu/img/JLgx5z6ufgXwTK17.jpg","","in","","0","0","3","https://twitter.com/MasMenteri/status/1293428517686845442","891564038781415424","MasMenteri"
"1293412122458615809","Wed Aug 12 05:00:55 +0000 2020","0","Aku datang aku belajar aku ujian aku revisi dan aku menang! MERDEKA","1293412122458615809","","","in","","0","0","0","https://twitter.com/fyacc/status/1293412122458615809","224927382","fyacc"
"1293402056292671489","Wed Aug 12 04:20:55 +0000 2020","5","Hai #SahabatLiterasi Balai Bahasa Kalimantan Tengah mengadakan Sayembara Menulis Surat untuk para pelajar tingkat SD di Kalimantan Tengah. #sayembara #literasi #surat #sd #bahasa #BBKT #Kalteng #kalimantantengah #MerdekaBelajar #menulis #inovasiuntuknegeri #kreatif #gemarmenulis https://t.co/hjD0b7uiLu","1293402056292671489","https://pbs.twimg.com/media/EfMWSv_U4AAoztG.jpg","","in","Central Borneo, Indonesia","0","0","1","https://twitter.com/bbkalteng/status/1293402056292671489","934352272665976832","bbkalteng"
"1293387849505546240","Wed Aug 12 03:24:27 +0000 2020","0","Merek Merdeka Belajar Dipakai Kemdikbud Ini Klarifikasi Lengkap Pendiri Sekolah Cikal - https://t.co/0CQBoDuYmf .............","1293387849505546240","","","in","Jakarta","0","0","0","https://twitter.com/kalderanews/status/1293387849505546240","817669043792420864","kalderanews"
"1293387827632148486","Wed Aug 12 03:24:22 +0000 2020","0","Merek Merdeka Belajar Dipakai Kemdikbud Ini Klarifikasi Lengkap Pendiri Sekolah Cikal - https://t.co/0CQBoDuYmf","1293387827632148486","","","in","Jakarta","0","0","0","https://twitter.com/kalderanews/status/1293387827632148486","817669043792420864","kalderanews"
"1293387715703009280","Wed Aug 12 03:23:56 +0000 2020","0","Komisi X: Konsep Merdeka Belajar dan Kampus Merdeka Belum Disetujui - https://t.co/J8w42ChDYn .............","1293387715703009280","","","in","Jakarta","0","0","0","https://twitter.com/kalderanews/status/1293387715703009280","817669043792420864","kalderanews"
"1293387562065596416","Wed Aug 12 03:23:19 +0000 2020","0","Komisi X: Konsep Merdeka Belajar dan Kampus Merdeka Belum Disetujui - https://t.co/J8w42ChDYn","1293387562065596416","","","in","Jakarta","0","0","0","https://twitter.com/kalderanews/status/1293387562065596416","817669043792420864","kalderanews"
"1293373003762294789","Wed Aug 12 02:25:28 +0000 2020","0","Semoga semangat anak2ku mungil generasi penerus bangsa tetap membara untuk belajar dan berlatih demi melestarikan adat seni budaya Indonesia. Jangan melemah dan facum berkegiatan hanya karena wabah atau bencana yg melanda negeri kita tercinta. Merdeka! https://t.co/YtXkyPq84h","1293373003762294789","https://pbs.twimg.com/media/EfL74uFUEAA9CAI.jpg","","in","Jawa Timur, Indonesia","0","0","0","https://twitter.com/rizkyrino_utami/status/1293373003762294789","744432186065977344","rizkyrino_utami"
"1293372813244395520","Wed Aug 12 02:24:43 +0000 2020","0","Semoga semangat anak2ku mungil generasi penerus bangsa tetap membara untuk belajar dan berlatih demi melestarikan adat seni budaya Indonesia. Jangan melemah dan facum berkegiatan hanya karena wabah atau bencana yg melanda negeri kita tercinta. Merdeka!🇮🇩 https://t.co/a9XCnljvcp","1293372813244395520","https://pbs.twimg.com/media/EfL7ty6UwAECuzF.jpg","","in","Jawa Timur, Indonesia","0","0","0","https://twitter.com/rizkyrino_utami/status/1293372813244395520","744432186065977344","rizkyrino_utami"
"1293338978498691078","Wed Aug 12 00:10:16 +0000 2020","35","Selamat pagi #SahabatDikbud. Sudah berolahraga pagi ini? Yuk sekarang saatnya mengikuti serunya #BelajardariRumah di @TVRINasional. Berikut jadwal acara untuk hari Rabu 12 Agustus 2020. #MerdekaBelajar #BersamaHadapiKorona https://t.co/6pVr5XIIcg","1293338978498691078","https://pbs.twimg.com/media/EfLc8j4VoAEpa6K.jpg","","in","Jakarta","1","1","10","https://twitter.com/Kemdikbud_RI/status/1293338978498691078","631701837","Kemdikbud_RI"
"1293205799414591494","Tue Aug 11 15:21:03 +0000 2020","0","Merdeka Belajar di Era Pandemi Covid-19 https://t.co/Dnr4NJoPCR #timesindonesia #ketahananinformasi #beritabaik","1293205799414591494","","","in","Wisma Mas Isman Jakarta","0","0","0","https://twitter.com/timescoid/status/1293205799414591494","1052798082419580928","timescoid"
"1293205617440563200","Tue Aug 11 15:20:20 +0000 2020","0","Merdeka belajar sistemnya gimana si masih gakpaham wkwk. Tapi 2017 gak wajib si emang.","1293205617440563200","","","in","Avonlea, Saskatchewan","0","0","0","https://twitter.com/nr_tika/status/1293205617440563200","501631758","nr_tika"
"1293177485962567681","Tue Aug 11 13:28:33 +0000 2020","0","Inilah Arti Kampus Merdeka dalam Kebijakan Merdeka Belajar ala Mendikbud Nadiem - https://t.co/KUJoZ1C7Cr","1293177485962567681","","","in","Jakarta","0","0","0","https://twitter.com/kalderanews/status/1293177485962567681","817669043792420864","kalderanews"
"1293170035129606145","Tue Aug 11 12:58:56 +0000 2020","0","Apa Artinya MERDEKA? Ketika Ibu-Ibu Buta Huruf Bisa Belajar Baca-Tulis P... https://t.co/rsxjnp8tLe via @YouTube","1293170035129606145","","","in","","0","0","0","https://twitter.com/SyarifYunus70/status/1293170035129606145","183214859","SyarifYunus70"
"1293155432626700290","Tue Aug 11 12:00:55 +0000 2020","1","Mengajar dan mengurus rumah konsentrasi terus terpecah Bagaimana agar emosi tidak tumpah? Temukan solusinya ikuti program Manajemen Emosi Guru Merdeka Belajar Buka https://t.co/gEjfmMNYwF #MerdekaBelajar #KampusGuruCikal https://t.co/aDvcG0jtcW","1293155432626700290","https://pbs.twimg.com/media/EfI2AyEU4AIh0Wh.jpg","","in","Surakarta, Jawa Tengah","0","0","1","https://twitter.com/bukik/status/1293155432626700290","16734434","bukik"
"1293148861997944834","Tue Aug 11 11:34:48 +0000 2020","0","Mengajar dan mengurus rumah konsentrasi terus terpecah Bagaimana agar emosi tidak tumpah? Temukan solusinya ikuti program Manajemen Emosi Guru Merdeka Belajar Buka https://t.co/7G1yjj4ZvS #MerdekaBelajar https://t.co/B9LZmHQauv","1293148861997944834","","","in","Serpong","0","0","2","https://twitter.com/KampusGuruCikal/status/1293148861997944834","2804980657","KampusGuruCikal"
"1293147612757897218","Tue Aug 11 11:29:51 +0000 2020","3","Kalo udah kira kira ngerasa berjuang sendirian ya udah tinggalin. Buat apa masih bertahan kalo lo tau ujung ujungnya bakal sakit. Indonesia ga bakal merdeka kalo yang berjuang cuman satu dua orang. Belajar dari itu harusnya lo udah tau perlu ngapain next stepnya","1293147612757897218","","","in","Planet namex","0","1","0","https://twitter.com/bljarserius/status/1293147612757897218","1158196089951907840","bljarserius"
"1293140339079786499","Tue Aug 11 11:00:56 +0000 2020","0","Aku datang aku belajar aku ujian aku revisi dan aku menang! MERDEKA","1293140339079786499","","","in","","0","0","0","https://twitter.com/fyacc/status/1293140339079786499","224927382","fyacc"
"1293122135813050368","Tue Aug 11 09:48:36 +0000 2020","3","Para #SahabatMudaDesa di berbagai daerah kita ketemu besok (12/8) dalam diskusi panel mengulas tentang bagaimana Merdeka Belajar dari perspektif para akademisi muda. Yang minat gabung catat tanggal dan waktunya. Follow: @pusari_id #Pusari #Pemuda #Desa #MitraKemajuanDesa https://t.co/WL61Oqp9LS","1293122135813050368","https://pbs.twimg.com/media/EfIXuoQVAAIRUi6.jpg","","in","Medan-Sumatera utara","0","0","0","https://twitter.com/benarsinambela/status/1293122135813050368","71010317","benarsinambela"
"1293117541800243201","Tue Aug 11 09:30:21 +0000 2020","46","#SahabatDikbud sudah memasang bendera merah putih di rumah? Tahukah #SahabatDikbud kata bendera merupakan kata serapan dari bahasa Portugis yaitu bandeira . Kata apa lagi ya yang merupakan serapan dari bahasa asing? #SelasaBahasa #MerdekaBelajar https://t.co/Gbk6jWQKcv","1293117541800243201","https://pbs.twimg.com/media/EfITiKiU4AA7NE9.jpg","","in","Jakarta","1","2","12","https://twitter.com/Kemdikbud_RI/status/1293117541800243201","631701837","Kemdikbud_RI"
"1293114797727215617","Tue Aug 11 09:19:27 +0000 2020","22","Bagi Kamu yang menyukai bidang yang berkaitan dengan ilmu politik atau pemerintahan Kamu bisa memilih jurusan Administrasi Publik. Lantas seperti apa peluang atau prospek kerja administrasi publik ini? Mari kita simak berikut ini @jokowi @pustekkom #merdekabelajar #prospek https://t.co/ez7BoeXBMF","1293114797727215617","https://pbs.twimg.com/media/EfIQYCnUcAA2D0e.jpg","","in","Nanggewer, Cibinong Bogor","5","10","8","https://twitter.com/edunitas/status/1293114797727215617","1224516143840260098","edunitas"
"1293113787952709632","Tue Aug 11 09:15:26 +0000 2020","21","Hanya daftar di STIE IGI Kamu bisa dapatkan Beassiwa Kemerdekaan! Yuk segera daftar karena promo kami batasi Informasi pendaftaran kamu bisa klik link dibawah ini : https://t.co/RhvskQg3Sg @jokowi @pustekkom #Pendidikan #SistemInformasiSekolah #MerdekaBelajar #promo #stieigi https://t.co/r0UDNidppd","1293113787952709632","https://pbs.twimg.com/media/EfIPpHVUwAsjMOW.jpg","","in","Nanggewer, Cibinong Bogor","6","10","11","https://twitter.com/edunitas/status/1293113787952709632","1224516143840260098","edunitas"
"1293061446335488003","Tue Aug 11 05:47:27 +0000 2020","62","#SahabatDikbud dapatkan modul asesmen literasi membaca dan numerasi AKSIsekolah yang dapat digunakan oleh guru atau pendamping belajar untuk mendiagnosis level capaian kompetensi siswa dengan mengunjungi laman https://t.co/P5Pqjbkx1l. #MerdekaBelajar #BersamaHadapiKorona https://t.co/RZ6zc6phAL","1293061446335488003","https://pbs.twimg.com/media/EfHgaUtVAAEK1_l.jpg","","in","Jakarta","1","3","24","https://twitter.com/Kemdikbud_RI/status/1293061446335488003","631701837","Kemdikbud_RI"
"1293056828629106688","Tue Aug 11 05:29:06 +0000 2020","0","Jangan lupa saksikan Program Merdeka Belajar Bersama GO siang ini pukul 13.00 - 14.00 WIB langsung di Riau Televisi @riautv ... . #MerdekaBelajarBersamaGO #MerdekaBelajar #newnormal #tp2021 https://t.co/9BngVlHwDF","1293056828629106688","","","in","Riau, Indonesia","0","0","0","https://twitter.com/GO_Pekanbaru/status/1293056828629106688","1289421586374696960","GO_Pekanbaru"
"1293053031685042176","Tue Aug 11 05:14:01 +0000 2020","0","Merdeka belajar belajar merdeka","1293053031685042176","","","in","","0","0","0","https://twitter.com/PUJANGGAKELAN15/status/1293053031685042176","1973821184","PUJANGGAKELAN15"
"1293051632880701440","Tue Aug 11 05:08:27 +0000 2020","0","Soal tantangan #TanyaJawabSoal #MerdekaBelajar #BelajarDariRumah #BersamaHadapiKorona #GARA2covid19 @ Seratus Institute https://t.co/Qj5FkTWzF0","1293051632880701440","","","in","when i was on holiday with jr","0","0","0","https://twitter.com/rosyidadrianto/status/1293051632880701440","273025148","rosyidadrianto"
"1293044588496556032","Tue Aug 11 04:40:28 +0000 2020","14","#Sahabatperpusdikbud yuk akses layanan digital #Perpusdikbud . Melalui layanan daring kalian bisa meminjam koleksi digital unduh koleksi terbitan Kemendikbud unduh koleksi buku open akses jurnal elektronik Kemdikbud serta internasional #koleksidigital #Ayobaca #merdekabelajar https://t.co/2t0b9BPIpB","1293044588496556032","https://pbs.twimg.com/media/EfHRMmfUwAIzFqh.jpg","","in","Senayan, Jakarta","0","0","6","https://twitter.com/perpusdikbud/status/1293044588496556032","2191873495","perpusdikbud"
"1293044300507262977","Tue Aug 11 04:39:19 +0000 2020","0"," Merdeka Belajar STORYTELLING. WHY &amp; HOW SHOULD WE DO IT! Bersama Tim SDM &amp; Litbang ITLA Kamis 13 Agustus 2020 Jam 18.30-20.30 WIB Via Zoom https://t.co/kKpFATJAUv link otomatis anda peroleh saat registrasi. Program ini diselenggarakan oleh Indonesian Tour Leaders Association https://t.co/PurSEIdNnB","1293044300507262977","https://pbs.twimg.com/media/EfHQ7BoUcAMFmYF.jpg","","in","ÜT: 1.361714,103.990909","0","0","0","https://twitter.com/bobmoningka/status/1293044300507262977","56675025","bobmoningka"
"1293034016522637312","Tue Aug 11 03:58:27 +0000 2020","1","Orang GAPTEK Sedunia bisa #InternetMarketing #KursusInternetMarketing #KursusInternet #BisnisOnline #BelajarBisnis #BelajarMarketing #Pemasaran #PemasaranOnline #Pengusaha #IndonesiaMengajar #GuruBelajar #MerdekaBelajar #BelajarDirumah #BabaStudio #Zeembry https://t.co/X1n4p7zXM1","1293034016522637312","https://pbs.twimg.com/ext_tw_video_thumb/1293033554083946497/pu/img/G3xdap7nBMsRBucR.jpg","","in","Jakarta, Indonesia","0","0","0","https://twitter.com/zeembry/status/1293034016522637312","32878944","zeembry"
"1293028424278310918","Tue Aug 11 03:36:14 +0000 2020","0","Jelang HUT Ke-75 Republik Indonesia Pemerintah Kabupaten Trenggalek mengagas Konsep Merdeka Belajar. ⁣⁣ ⁣⁣ Dasarnya mengingat metode pembelajaran secara daring yg diterapkan selama masa pandemi ini tentu tak lepas dari adanya kendala diantaranya ma https://t.co/9SfGeruROd https://t.co/7gxB2q3iD7","1293028424278310918","https://pbs.twimg.com/media/EfHCf__XYAEWJ5K.jpg","","in","Jakarta Pusat, DKI Jakarta","0","0","0","https://twitter.com/APKASI/status/1293028424278310918","314363393","APKASI"
"1293020629944287232","Tue Aug 11 03:05:15 +0000 2020","3","Hai #sahabatbahasa yuk kita belajar berhitung menggunakan bahasa Rejang dialek Lebong. #MerdekaBelajar #BelajardariRumah #BersamaHadapiKorona #BangkituntukIndonesiaMaju https://t.co/vAOjcObjsP","1293020629944287232","https://pbs.twimg.com/media/EfG7aOQU0AEonbA.jpg","","in","Bengkulu, Indonesia","0","0","1","https://twitter.com/KantorBahasaBkl/status/1293020629944287232","727384859790954496","KantorBahasaBkl"
"1293001524071686144","Tue Aug 11 01:49:20 +0000 2020","0","Kapan terakhir bikin salindia? #fbsunnes #fbshumanis #unnes #merdekabelajar #kampusmerdeka #unneslawancovid #lawancovid19 #kemdikbud #bahasa #salindia https://t.co/N1jVP22x7Y","1293001524071686144","https://pbs.twimg.com/media/EfGqB1QUYAEFVb0.jpg","","in","Semarang, Indonesia","0","0","0","https://twitter.com/FBS_UNNES/status/1293001524071686144","453780447","FBS_UNNES"
"1292999362361008132","Tue Aug 11 01:40:45 +0000 2020","0","Suruh belajar sekolah daring gak punya ponsel pinter dengan terpaksa berbagai cara untuk membelinya antara lain. Menjual hewan kesayangan nya Mencuri di rumah majikan nya Meminjem uang dengan tetangga nya Nasib Pelajar di pelosok Negri ini #merdeka","1292999362361008132","","","in","Depok,indonesia","0","0","0","https://twitter.com/rifkyrafsangani/status/1292999362361008132","358158282","rifkyrafsangani"
"1292974125170868224","Tue Aug 11 00:00:28 +0000 2020","0","Tahun ini PSE #UGM diberi kepercayaan oleh @ditjendikti menjadi Pusat Unggulan Iptek Energi Terbarukan Berbasis Mikroalga. https://t.co/Ik6McF6jRT #jogjawarta #akademia @UGMYogyakarta @Kemdikbud_RI #MerdekaBelajar","1292974125170868224","","","in","Yogyakarta","0","0","1","https://twitter.com/jogjadailycom/status/1292974125170868224","2556404677","jogjadailycom"
"1292974021101776896","Tue Aug 11 00:00:03 +0000 2020","43","Selamat pagi #SahabatDikbud. Hari ini berbagai tayangan menarik #BelajardariRumah di @TVRINasional siap menemani waktu belajar #SahabatDikbud. Berikut jadwal acara untuk hari Selasa 11 Agustus 2020. #MerdekaBelajar #BersamaHadapiKorona https://t.co/XgfwdWQWZr","1292974021101776896","https://pbs.twimg.com/media/EfGRBNoUcAIOYXC.jpg","","in","Jakarta","1","1","7","https://twitter.com/Kemdikbud_RI/status/1292974021101776896","631701837","Kemdikbud_RI"
