"conversation_id_str","created_at","favorite_count","full_text","id_str","image_url","in_reply_to_screen_name","lang","location","quote_count","reply_count","retweet_count","tweet_url","user_id_str","username"
"1204708021403652098","Wed Dec 11 10:22:29 +0000 2019","0","1. Mengenalkan Konsep Kemerdekaan Belajar #GebrakanNadiem #MerdekaBelajar","1204708021403652098","","","in","Rumah","0","0","0","https://twitter.com/yusaphyputra/status/1204708021403652098","372174590","yusaphyputra"
"1204707943716835329","Wed Dec 11 10:22:10 +0000 2019","3","Nadiem Makarim tetapkan program Merdeka Belajar salah satunya hapus UN. ga sekalian gitu ada hapus skripsi.. :)","1204707943716835329","","","in","Kalimantan Barat, Indonesia","0","0","1","https://twitter.com/sebutsajadidii/status/1204707943716835329","1121219028888903680","sebutsajadidii"
"1204707691785928705","Wed Dec 11 10:21:10 +0000 2019","0","Lantas langkah apa saja yang akan dilakukan Nadiem Makarim untuk menciptakan SDM yang unggul lewat pendidikan? #GebrakanNadiem #MerdekaBelajar","1204707691785928705","","","in","Rumah","0","0","0","https://twitter.com/yusaphyputra/status/1204707691785928705","372174590","yusaphyputra"
"1204707645673758720","Wed Dec 11 10:20:59 +0000 2019","0","Dalam rencana 100 hari kerja dia berencana menemui orang-orang di dunia pendidikan untuk belajar membangun pendidikan Indonesia. #GebrakanNadiem #MerdekaBelajar","1204707645673758720","","","in","Rumah","0","0","0","https://twitter.com/yusaphyputra/status/1204707645673758720","372174590","yusaphyputra"
"1204707590933864448","Wed Dec 11 10:20:46 +0000 2019","0","#GebrakanNadiem #MerdekaBelajar Berlatar dari dunia bisnis Nadiem belajar bak seorang murid untuk menyesuaikan diri untuk memamahi dunia pendidikan.","1204707590933864448","","","in","Rumah","0","0","0","https://twitter.com/yusaphyputra/status/1204707590933864448","372174590","yusaphyputra"
"1204707496587186177","Wed Dec 11 10:20:24 +0000 2019","0","Sementara itu mantan CEO Gojek ini memiliki cara lain sebelum menyusun rencana program pendidikan Indonesia. #GebrakanNadiem #MerdekaBelajar","1204707496587186177","","","in","Rumah","0","0","0","https://twitter.com/yusaphyputra/status/1204707496587186177","372174590","yusaphyputra"
"1204707428807262209","Wed Dec 11 10:20:08 +0000 2019","0","Dilantiknya Nadiem Makarim menjadi Menteri Pendidikan dan Kebudayaan (Mendikbud) seakan menjadi angin segar untuk pendidikan di Indonesia. #GebrakanNadiem #MerdekaBelajar","1204707428807262209","","","in","Rumah","0","0","0","https://twitter.com/yusaphyputra/status/1204707428807262209","372174590","yusaphyputra"
"1204707383571693568","Wed Dec 11 10:19:57 +0000 2019","0","Menteri Pendidikan dan Kebudayaan Nadiem Makarim mendapat kehormatan luar biasa dari Presiden Joko Widodo atau Jokowi untuk mereformasi pengembangan Sumber Daya Manusia (SDM) melalui dunia pendidikan. #GebrakanNadiem #MerdekaBelajar","1204707383571693568","","","in","Rumah","0","0","0","https://twitter.com/yusaphyputra/status/1204707383571693568","372174590","yusaphyputra"
"1204707281192939520","Wed Dec 11 10:19:32 +0000 2019","0","4 Langkah Nadiem Makarim Ciptakan SDM Unggul Lewat Pendidikan https://t.co/7WQ36Tzl6J #GebrakanNadiem #MerdekaBelajar","1204707281192939520","","","in","Rumah","0","0","0","https://twitter.com/yusaphyputra/status/1204707281192939520","372174590","yusaphyputra"
"1204707112573640704","Wed Dec 11 10:18:52 +0000 2019","0","Ini penjelasan Mas Menteri langsung mengenai konsep merdeka belajar https://t.co/6yNibxTgbq https://t.co/kX86XAuAIL","1204707112573640704","","","in","Pagar Alam Sumsel","0","0","0","https://twitter.com/ibnufajar75/status/1204707112573640704","189894975","ibnufajar75"
"1204706585873801216","Wed Dec 11 10:16:47 +0000 2019","0","4 Program Pokok Mendikbud Nadiem Makarim Merdeka Belajar! #nadiemmakarim https://t.co/YjB4h58Hu8 https://t.co/YcvJx6cCN0","1204706585873801216","https://pbs.twimg.com/media/ELf6P4zU4AAI8LY.jpg","","in","Indonesia","0","0","0","https://twitter.com/jpnncom/status/1204706585873801216","79130206","jpnncom"
"1204705695964073984","Wed Dec 11 10:13:14 +0000 2019","0","Menurut Nadiem interpretasi Kementerian Pendidikan dan Kebudayaan terhadap visi presiden ada dua hal yaitu merdeka belajar dan guru penggerak. #GebrakanNadiem","1204705695964073984","","","in","","0","0","0","https://twitter.com/r2_dewi/status/1204705695964073984","4566174014","r2_dewi"
"1204705397803646976","Wed Dec 11 10:12:03 +0000 2019","0","Sudah tahukah Edufriends tentang kebijakan pendidikan baru yang disampaikan oleh Mendikbud Nadiem Makarim? Mendikbud menyampaikan 4 program pokok kebijakan pendidikan yang dinamai #MerdekaBelajar #Edutore #SemuaBisaPintar","1204705397803646976","","","in","Indonesia","0","1","0","https://twitter.com/edutorecom/status/1204705397803646976","1065101468015878145","edutorecom"
"1204700866109771776","Wed Dec 11 09:54:03 +0000 2019","27"," merdeka belajar https://t.co/sL1jLobefa","1204700866109771776","https://pbs.twimg.com/media/ELf1ChWU0AAd9Kx.jpg","","in","","0","2","3","https://twitter.com/schoolvanilla/status/1204700866109771776","1157580053447729152","schoolvanilla"
"1204699620128911362","Wed Dec 11 09:49:06 +0000 2019","0","Mendikbud Tetapkan Empat Pokok Kebijakan Pendidikan Merdeka Belajar - https://t.co/dEHchQgsjy","1204699620128911362","","","in","","0","0","0","https://twitter.com/maklumatID/status/1204699620128911362","850085262570921985","maklumatID"
"1204698132325392384","Wed Dec 11 09:43:11 +0000 2019","56","Presentasi mas menteri ke kepala2 sudin hari ini menarik #MerdekaBelajar https://t.co/h8G78AEtM2","1204698132325392384","https://pbs.twimg.com/media/ELfyj3CU8AEiNmL.jpg","","in","Jakarta Selatan, DKI Jakarta","3","2","42","https://twitter.com/barrysianturi/status/1204698132325392384","2237377454","barrysianturi"
"1204696733965541378","Wed Dec 11 09:37:38 +0000 2019","0","Katanya Kita Di Jajah Hampir 3 5 Abad Dan Akhirnya Merdeka Dengan Sang Proklamotor Kita Soekarno Hatta Dan Hingga detik ini Harga Sebuah Kemerdekaan Itu Mahal Dan Berat MERDEKA BELAJAR - GURU PENGGERAK https://t.co/jIOZOBgpmg","1204696733965541378","","","in","Bandung Kulon, Indonesia","0","0","0","https://twitter.com/mtsalislam_bdg/status/1204696733965541378","855189927545327617","mtsalislam_bdg"
"1204695924238217217","Wed Dec 11 09:34:25 +0000 2019","0","Merdeka belajar","1204695924238217217","","","in","Padang","0","0","0","https://twitter.com/desfarini/status/1204695924238217217","546637075","desfarini"
"1204695526597222401","Wed Dec 11 09:32:50 +0000 2019","1","Waini. Ujian berbasis portofolio. Semoga merdeka dalam belajar segera menjadi kenyataan. Agar Kay bisa sekolah dengan menyenangkan seperti halnya Totto-Chan :')","1204695526597222401","","","in","","0","0","0","https://twitter.com/kamuitubeda/status/1204695526597222401","57228856","kamuitubeda"
"1204694289281761281","Wed Dec 11 09:27:55 +0000 2019","0","Mendikbud Nadiem Terapkan `Merdeka Belajar´ untuk Pembelajaran Nasional https://t.co/AVyZvRduUb","1204694289281761281","","","in","Kebon Jeruk","0","0","0","https://twitter.com/fadli_jlmbr/status/1204694289281761281","371611743","fadli_jlmbr"
"1204693523406057472","Wed Dec 11 09:24:52 +0000 2019","0","Kebijakan mas men yang berpihak pada anak... pertama nge-share di bilang ora patio penting hehehe tidak apalah yg penting tetap bergerak. Bismillah #allahmahabaik #merdekabelajar https://t.co/63IzNXW2hf","1204693523406057472","","","in","","0","0","0","https://twitter.com/Kharisma882/status/1204693523406057472","1045272107960037377","Kharisma882"
"1204692628639494144","Wed Dec 11 09:21:19 +0000 2019","3","Mendikbud Nadiem Makarim Terapkan Program 'Merdeka Belajar' Bakal Jadi Pengganti UN? https://t.co/ewznJnf8aD","1204692628639494144","","","in","Jl Jend Sudirman 52 Yogyakarta","0","0","1","https://twitter.com/tribunjogja/status/1204692628639494144","223476605","tribunjogja"
"1204691480373161986","Wed Dec 11 09:16:45 +0000 2019","0","Kita integrasikan kegiatan akademik dan kegiatan kesiswaan Untuk Belajar Lebih Merdeka Menjadi Prestasi - Menjadi Inspirasi Bersama Wakasek Kesiswaan dan Ketua OSIS Kakak Puteri https://t.co/QGQg4g1Pfo","1204691480373161986","","","in","Bandung Kulon, Indonesia","0","0","0","https://twitter.com/mtsalislam_bdg/status/1204691480373161986","855189927545327617","mtsalislam_bdg"
"1204691157805981696","Wed Dec 11 09:15:28 +0000 2019","0","[PENGUMUMAN] Empat Pokok Kebijakan Merdeka Belajar #SahabatDikbud berikut Empat Pokok Kebijakan Merdeka Belajar Kementerian Pendidikan dan Kebudayaan Sumber : Facebook Kementerian Pendidikan dan Kebudayaan https://t.co/eF2RZTSNvy","1204691157805981696","","","in","Bangkalan, Indonesia","0","0","0","https://twitter.com/SDNegeriPoter1/status/1204691157805981696","4558285994","SDNegeriPoter1"
"1204689809374998528","Wed Dec 11 09:10:07 +0000 2019","0","Mendikbud Nadiem Hapus UN lewat Merdeka Belajar Ini Penggantinya https://t.co/tvNNjHuNcN","1204689809374998528","","","in","Blitar, Jawa Timur","0","0","0","https://twitter.com/BangSuhan/status/1204689809374998528","1562980801","BangSuhan"
"1204689543527428097","Wed Dec 11 09:09:03 +0000 2019","0","Mendikbud Tetapkan 4 Pokok Kebijakan Pendidikan 'Merdeka Belajar' https://t.co/lp9PVjKIAa","1204689543527428097","","","in","Medan","0","0","0","https://twitter.com/sirzulfadli/status/1204689543527428097","541481333","sirzulfadli"
"1204689511554461696","Wed Dec 11 09:08:56 +0000 2019","0","4 Gebrakan Merdeka Belajar Mendikbud Nadiem termasuk Penghapusan UN! https://t.co/9TlacglWSr","1204689511554461696","","","in","","0","0","0","https://twitter.com/NelfaZahira/status/1204689511554461696","1234982214","NelfaZahira"
"1204688664027992066","Wed Dec 11 09:05:34 +0000 2019","0","Mendikbud Nadiem Makarim Terapkan Program 'Merdeka Belajar' Bakal Jadi Pengganti UN? https://t.co/fgLVIs5kK6 https://t.co/KAMEgR7ZwI","1204688664027992066","https://pbs.twimg.com/media/ELfp9LaUYAEUxQT.jpg","","in","indonesia","0","0","0","https://twitter.com/pendoponesia/status/1204688664027992066","2917989061","pendoponesia"
"1204688403100389376","Wed Dec 11 09:04:31 +0000 2019","0","Ini Konsep Baru UN dan USBN Versi Merdeka Belajar Mendikbud Makarim https://t.co/kpHjdmzSQj","1204688403100389376","","","in","Blitar","0","0","0","https://twitter.com/MeryAndinis/status/1204688403100389376","884736227064266752","MeryAndinis"
"1204687528810307584","Wed Dec 11 09:01:03 +0000 2019","0","Mantab Mas Menteri! #MerdekaBelajar https://t.co/AX0UfGlcaC","1204687528810307584","https://pbs.twimg.com/media/ELfo6yEU0AA0czO.jpg","","in","","0","0","0","https://twitter.com/rocky_pras/status/1204687528810307584","20650710","rocky_pras"
"1204687515044732929","Wed Dec 11 09:01:00 +0000 2019","2","Mendikbud Nadiem menjelaskan program Merdeka Belajar dijabarkan dalam 4 kebijakan yang meliputi | #Edukasi https://t.co/Y0u4uvXsAu","1204687515044732929","","","in","Jakarta","0","0","1","https://twitter.com/kompascom/status/1204687515044732929","23343960","kompascom"
"1204685168495202304","Wed Dec 11 08:51:40 +0000 2019","0","MERDEKA BELAJAR https://t.co/w5vg6MS1Dq","1204685168495202304","","","in","central java indonesia","0","0","0","https://twitter.com/suwartonog1/status/1204685168495202304","323767207","suwartonog1"
"1204682680052273152","Wed Dec 11 08:41:47 +0000 2019","155","Mantap Mas Menteri! #MerdekaBelajar https://t.co/2S2TyvnbmY","1204682680052273152","https://pbs.twimg.com/media/ELfkeusUEAE_eR1.jpg","","in","Jakarta","15","1","86","https://twitter.com/pipis/status/1204682680052273152","8102722","pipis"
"1204682367152951297","Wed Dec 11 08:40:32 +0000 2019","0","Mendikbud Terapkan Program Merdeka Belajar Ini 4 Kebijakan Pokoknya Termasuk Penyederhanaan RPP https://t.co/6vJi3cVVSK .. #GoSumut","1204682367152951297","","","in","Medan Kota, Indonesia","0","0","0","https://twitter.com/GoSumutdotcom/status/1204682367152951297","3700681692","GoSumutdotcom"
"1204681104680083458","Wed Dec 11 08:35:31 +0000 2019","11","Lewat arah kebijakan pendidikan Merdeka Belajar Mendikbud Nadiem menghapus UN 2021 dan mengubah format USBN 2020. Ini perbedaanya. https://t.co/I1gazR67Ag","1204681104680083458","","","in","Jakarta","2","0","6","https://twitter.com/kompascom/status/1204681104680083458","23343960","kompascom"
"1204680461198344192","Wed Dec 11 08:32:58 +0000 2019","0","Pokok-pokok kebijakan merdeka belajar #merdekabelajar #kemdikbud_ri https://t.co/6X5uKJac1b","1204680461198344192","","","in","Semarang","0","0","0","https://twitter.com/bbpmpjateng/status/1204680461198344192","256269128","bbpmpjateng"
"1204680350883962880","Wed Dec 11 08:32:32 +0000 2019","0","Mendikbud Terapkan Program Merdeka Belajar Ini 4 Kebijakan Pokoknya Termasuk Penyederhanaan RPP https://t.co/mDGvAsevQx .. ... #GoAceh","1204680350883962880","","","in","Lhokseumawe","0","0","0","https://twitter.com/GoAcehco/status/1204680350883962880","3627094934","GoAcehco"
"1204679227913588736","Wed Dec 11 08:28:04 +0000 2019","0","Mendikbud Terapkan Program Merdeka Belajar Ini 4 Kebijakan Pokoknya Termasuk Penyederhanaan RPP https://t.co/LsBi0VoLYy","1204679227913588736","","","in","Pekanbaru","0","0","0","https://twitter.com/GoNewsdotco/status/1204679227913588736","3811914674","GoNewsdotco"
"1204678852250755072","Wed Dec 11 08:26:34 +0000 2019","1","[UPDATE KBM] Hola! Hari ini ada kegiatan belajar mengajar di Taman Bungkul (skatepark) ya jam 19.00! Kalo ada yang punya waktu kosong yuk ikutan belajar dan bermain bareng anak merdeka https://t.co/0nCSgsFR7a","1204678852250755072","https://pbs.twimg.com/media/ELfhBIJUYAAjwjD.jpg","","in","Surabaya","0","0","0","https://twitter.com/SSChildSurabaya/status/1204678852250755072","311483005","SSChildSurabaya"
"1204678842062737408","Wed Dec 11 08:26:32 +0000 2019","0","Mendikbud Terapkan Program Merdeka Belajar Ini 4 Kebijakan Pokoknya Termasuk Penyederhanaan RPP https://t.co/3F7ZfRP7QR ..","1204678842062737408","","","in","Kota Padang","0","0","0","https://twitter.com/GoSumbarcom/status/1204678842062737408","585858346","GoSumbarcom"
"1204678499786559488","Wed Dec 11 08:25:10 +0000 2019","0","UN jika akan dihapuskan atau hanya akan diganti nama dengan sistem yang sama. Kemdikbud UN dilaksanakan untuk kelas 4 8 dan 11. Itu artinya lebih cepat dari biasanya. Lalu klimaks dari sekolah dimana? Jika nilai UN digunakan untuk masuk PTN. Saya Setuju! #MerdekaBelajar","1204678499786559488","","","in","Jakarta, Indonesia","0","0","0","https://twitter.com/sosiolognrl/status/1204678499786559488","88645324","sosiolognrl"
"1204678409709686784","Wed Dec 11 08:24:49 +0000 2019","0","4 Pokok Kebijakan Program Merdeka Belajar Selengkapnya silahkan cek disini ya https://t.co/E8rzvZucND https://t.co/nR99xqHGgt","1204678409709686784","https://pbs.twimg.com/media/ELfgn_6UUAAiJOc.jpg","","in","","0","0","0","https://twitter.com/ilmu_guru/status/1204678409709686784","942616472324472832","ilmu_guru"
"1204678349492293632","Wed Dec 11 08:24:35 +0000 2019","0","Nadiem Makarim Tetapkan Program Merdeka Belajar Salah Satunya Hapus UN https://t.co/yoXNuOG6iB","1204678349492293632","","","in","","0","0","0","https://twitter.com/danank65/status/1204678349492293632","1165982580681797632","danank65"
"1204677572438577152","Wed Dec 11 08:21:29 +0000 2019","0","Ada 4 program pokok dalam Kebijakan Pendidikan Merdeka Belajar yang ditetapkan Nadiem Makarim hari ini. Apa saja? UN terakhir 2020 tahun 2021 sudah tidak ada UN dan sistem zonasi lebih fleksibel https://t.co/qSwffumpV8","1204677572438577152","","","in","antara matematika dan sastra","0","0","1","https://twitter.com/arif_gumantia/status/1204677572438577152","57929103","arif_gumantia"
"1204677355597266944","Wed Dec 11 08:20:38 +0000 2019","1","Mendikbud Nadiem Anwar Makarim mengungkapkan ada empat program pokok kebijakan pendidikan `Merdeka Belajar` yang akan diterapkan sesuai dengan arahan Presiden dan Wakil Presiden guna meningkatkan kualitas sumber daya manusia di Indonesia. https://t.co/IWGdz0boEZ https://t.co/FnLkcq2Cv0","1204677355597266944","https://pbs.twimg.com/media/ELffpfpU8AAKjrP.jpg","","in","Kota Bandung, Jawa Barat","0","0","0","https://twitter.com/ElshintaBandung/status/1204677355597266944","854538636192174081","ElshintaBandung"
"1204675948731232256","Wed Dec 11 08:15:02 +0000 2019","1","Ada 4 program pokok dalam Kebijakan Pendidikan Merdeka Belajar yang ditetapkan Nadiem Makarim hari ini. Apa saja? https://t.co/VB40627mgg","1204675948731232256","","","in","","0","0","0","https://twitter.com/kumparanMOM/status/1204675948731232256","929046798315896837","kumparanMOM"
"1204674281923211264","Wed Dec 11 08:08:25 +0000 2019","0","Mendikbud Terapkan Empat Pokok Kebijakan Pendidikan 'Merdeka Belajar'. Selengkapnya: https://t.co/zsShrdcdHi via @IDWS #IDWS https://t.co/WKtFUoX1ar","1204674281923211264","https://pbs.twimg.com/media/ELfc3b3VAAA2tRZ.jpg","","in","Jakarta Capital Region","0","0","0","https://twitter.com/IDWS/status/1204674281923211264","44352068","IDWS"
"1204674219683921920","Wed Dec 11 08:08:10 +0000 2019","0","Nadiem juga jabarkan Merdeka Belajar apa itu? https://t.co/vApRbXl325","1204674219683921920","","","in","","0","0","0","https://twitter.com/IDNTimes/status/1204674219683921920","388190238","IDNTimes"
"1204673005655330817","Wed Dec 11 08:03:20 +0000 2019","0","Ini 4 Kebijakan Pendidikan Merdeka Belajar dari Mendikbud Termasuk Soal UN https://t.co/dNuUMjSpsH","1204673005655330817","","","in","Indonesia","0","0","0","https://twitter.com/Beritadotnews/status/1204673005655330817","1132372555275223040","Beritadotnews"
"1204671505235234816","Wed Dec 11 07:57:23 +0000 2019","75","Kebijakan Pendidikan Merdeka Belajar yang ditetapkan Mendikbud merupakan salah satu bentuk konkret pemeretaan akses dan kualitas pendidikan. Bagaimana tanggapan kamu dengan kebijakan Merdeka Belajar ini? #Rogupdate #MerdekaBelajar #Pendidikan #Mendikbud https://t.co/XODYtbTiue","1204671505235234816","https://pbs.twimg.com/media/ELfaWBkU0AA2DkE.jpg","","in","Jakarta Capital Region","2","1","20","https://twitter.com/ruangguru/status/1204671505235234816","457341503","ruangguru"
"1204670749916717057","Wed Dec 11 07:54:23 +0000 2019","0","SIARAN PERS Nomor: 408/sipres/A5.3/XII/2019: Mendikbud Tetapkan Empat Pokok Kebijakan Pendidikan Merdeka Belajar Jakarta Kemendikbud --- Menindaklanjuti arahan Presiden Republik Indonesia Joko Widodo dan Wakil https://t.co/awg2qasiMY","1204670749916717057","","","in","Denpasar, Indonesia","0","0","0","https://twitter.com/Youth_Shine_Dps/status/1204670749916717057","539136409","Youth_Shine_Dps"
"1204669906492502016","Wed Dec 11 07:51:02 +0000 2019","0","Empat Program Pokok Kebijakan Pendidikan Merdeka Belajar https://t.co/dj8kRcZZph https://t.co/xvdIYBxO6V","1204669906492502016","https://pbs.twimg.com/media/ELfY5UDXkAAxGv1.png","","in","Tomohon, Indonesia","0","0","0","https://twitter.com/publikreportcom/status/1204669906492502016","766318130297798656","publikreportcom"
"1204669402743861249","Wed Dec 11 07:49:01 +0000 2019","0","Mendikbud Terapkan Program Merdeka Belajar Ini 4 Kebijakan Pokoknya Termasuk Penyederhanaan RPP https://t.co/z0EA1j9R50 .. #GoRiau","1204669402743861249","","","in","Pekanbaru Riau","0","0","0","https://twitter.com/GoRiauCom/status/1204669402743861249","1632918924","GoRiauCom"
"1204668405845876738","Wed Dec 11 07:45:04 +0000 2019","0","Gebrakan Nadiem Makarim Empat Kebijakan 'Merdeka Belajar' https://t.co/ruCdHc5gcy","1204668405845876738","","","in","Jakarta, Indonesia","1","0","0","https://twitter.com/GATRA_com/status/1204668405845876738","202559038","GATRA_com"
"1204668268344041473","Wed Dec 11 07:44:31 +0000 2019","0","Menteri baru kebijakan baru seperti sudah menjadi rutinitas lima tahunan terutama di sektor pendidikan. Kali ini Menteri @Kemdikbud_RI Nadiem Anwar Makarim menyampaikan empat program pokok kebijakan pendidikan yang berjuluk Merdeka Belajar . https://t.co/H0dZSApQVm","1204668268344041473","","","in","Jakarta","0","0","0","https://twitter.com/ivooxid/status/1204668268344041473","745849790332805121","ivooxid"
"1204666974149595136","Wed Dec 11 07:39:22 +0000 2019","4","Menteri Pendidikan dan Kebudayaan (Mendikbud) Nadiem Anwar Makarim menetapkan empat program pokok kebijakan pendidikan Merdeka Belajar . https://t.co/lYCmUYmtTH","1204666974149595136","","","in","Kembangan, Indonesia","0","0","1","https://twitter.com/ceknricekcom_id/status/1204666974149595136","145511335","ceknricekcom_id"
"1204666386330439682","Wed Dec 11 07:37:02 +0000 2019","11","Baru saja disampaikan gebrakan pendidikan Mendikbud Nadiem Makarim lewat kebijakan Merdeka Belajar langsung mendapat sambutan dan dukungan guru. https://t.co/70vv5CcUMK","1204666386330439682","","","in","Jakarta","1","1","2","https://twitter.com/kompascom/status/1204666386330439682","23343960","kompascom"
"1204665875783045120","Wed Dec 11 07:35:01 +0000 2019","0","Nadiem Sampaikan Empat Kebijakan Merdeka Belajar https://t.co/PuFpra2iO2","1204665875783045120","","","in","JKT-INA","0","0","0","https://twitter.com/20detik/status/1204665875783045120","598959076","20detik"
"1204663203549966337","Wed Dec 11 07:24:23 +0000 2019","4","Mengenal Merdeka Belajar Program Pembelajaran Era Nadiem Makarim yang Hapuskan Ujian Nasional https://t.co/Wo26z0HeJS","1204663203549966337","","","in","Indonesia","0","1","1","https://twitter.com/tribunnews/status/1204663203549966337","124171593","tribunnews"
"1204662356371857408","Wed Dec 11 07:21:01 +0000 2019","0","Empat Program Pokok Kebijakan 'Merdeka Belajar' Ala Nadiem https://t.co/jwf1wDlIOT","1204662356371857408","","","in","","0","0","0","https://twitter.com/kampusinfo/status/1204662356371857408","755251740","kampusinfo"
"1204661160458350592","Wed Dec 11 07:16:16 +0000 2019","0","Komunitas Guru Dukung Gebrakan Merdeka Belajar Mendikbud Nadiem https://t.co/YGib4CBDqK","1204661160458350592","","","in","Surakarta, Jawa Tengah","0","0","2","https://twitter.com/bukik/status/1204661160458350592","16734434","bukik"
"1204659781434167296","Wed Dec 11 07:10:48 +0000 2019","0","Mengenal Merdeka Belajar Program Pembelajaran Era Nadiem Makarim yang Hapuskan Ujian Nasional https://t.co/a2kiHGKZH4","1204659781434167296","","","in","Indonesia","0","0","0","https://twitter.com/tribunnewswiki/status/1204659781434167296","1115596135287025664","tribunnewswiki"
"1204658808615653376","Wed Dec 11 07:06:56 +0000 2019","0","Nadiem: Empat Program Pokok Kebijakan Pendidikan Merdeka Belajar https://t.co/8Rr8qAlu0L","1204658808615653376","","","in","","0","0","0","https://twitter.com/radarkotanews/status/1204658808615653376","934787113488281600","radarkotanews"
"1204657455625457664","Wed Dec 11 07:01:33 +0000 2019","3","Menyambut Program Kebijakan Merdeka Belajar Gagasan Mas Nadiem https://t.co/3609nX6SkZ","1204657455625457664","","","in","Indonesia","0","0","2","https://twitter.com/kompasiana/status/1204657455625457664","23786106","kompasiana"
"1204655673977397248","Wed Dec 11 06:54:28 +0000 2019","1","Nadiem Makarim Menteri Pendidikan menetapkan empat program pokok kebijakan pendidikan Merdeka Belajar yang akan jadi arah pembelajaran pendidikan di Indonesia sesuai misi Presiden dan Wapres; meningkatkan kualitas sumber daya manusia. #YInfo","1204655673977397248","","","in","Surabaya","0","1","0","https://twitter.com/Youthssfm/status/1204655673977397248","132774172","Youthssfm"
"1204654310287478785","Wed Dec 11 06:49:03 +0000 2019","0","Program Merdeka Belajar ala Mendikbud Nadiem Hapus UN Sampai Fleksibilitas Zonasi https://t.co/AmJJkyth6A https://t.co/goxBPyTr8O","1204654310287478785","https://pbs.twimg.com/media/ELfKthgUYAAxq-1.jpg","","in","","0","0","0","https://twitter.com/Jualbajumuslimm/status/1204654310287478785","3645862819","Jualbajumuslimm"
"1204654057039650816","Wed Dec 11 06:48:03 +0000 2019","1","Kadisdik Edi Sakura Dukung Penuh Program Merdeka Belajar Mendikbud https://t.co/pKCAHWQzo0 https://t.co/cTsa8nXJF3","1204654057039650816","https://pbs.twimg.com/media/ELfKexGU0AAEqtU.jpg","","in","Bengkalis","0","0","0","https://twitter.com/disdikbks/status/1204654057039650816","887150081001963520","disdikbks"
"1204653679006994432","Wed Dec 11 06:46:33 +0000 2019","1","Program Merdeka Belajar ala Mendikbud Nadiem Hapus UN Sampai Fleksibilitas Zonasi https://t.co/t30jJWrYhI #RakyatBersamaBanser","1204653679006994432","","","in","","0","0","0","https://twitter.com/randualit/status/1204653679006994432","3738356244","randualit"
"1204652549380292608","Wed Dec 11 06:42:03 +0000 2019","0","Program Merdeka Belajar ala Mendikbud Nadiem Hapus UN Sampai Fleksibilitas Zonasi https://t.co/RyWLbs4cVN","1204652549380292608","","","in","Indonesia","0","0","0","https://twitter.com/merdekadotcom/status/1204652549380292608","456426648","merdekadotcom"
"1204652159674896386","Wed Dec 11 06:40:30 +0000 2019","6","Revolusi Pendidikan !! Nadiem Makarim Hapus Ujian Nasional Diganti Menjadi Merdeka Belajar https://t.co/FMgGy6msnq @gundala222 @Yaspayelunggam1 @amandagempita @bahdirdja @BossToukeeIsa","1204652159674896386","","","in","Jakarta Capital Region, Indone","3","1","4","https://twitter.com/cagubnyinyir2/status/1204652159674896386","1013331201396912128","cagubnyinyir2"
"1204651793793204224","Wed Dec 11 06:39:03 +0000 2019","10","Akhirnya Mendikbud Nadiem Makarim membuat gebrakan dalam program pendidikan nasional. Melalui program Merdeka Belajar Nadiem menghapus UN. https://t.co/545s2LRwdF","1204651793793204224","","","in","Jakarta","1","1","7","https://twitter.com/kompascom/status/1204651793793204224","23343960","kompascom"
"1204651484467494912","Wed Dec 11 06:37:49 +0000 2019","0","Jargon Merdeka Belajar ini aplikasi nya untuk guru atau murid ? Kalau murid pengen merdeka belajar ya harus di support guru yang capable.. https://t.co/swT88UUFPw","1204651484467494912","https://pbs.twimg.com/media/ELfIIQdUwAAWVln.jpg","","in","","0","1","0","https://twitter.com/vic_sundesk/status/1204651484467494912","62130938","vic_sundesk"
