"conversation_id_str","created_at","favorite_count","full_text","id_str","image_url","in_reply_to_screen_name","lang","location","quote_count","reply_count","retweet_count","tweet_url","user_id_str","username"
"1295322926099705858","Mon Aug 17 11:33:46 +0000 2020","0"," GEBYAR MERDEKA #BELITDA Di masa pandemi seperti ini urusan ngajar anak sekolah pasti dibebani ke orang tua belajar anak juga pastinya tidak maksimal. Nah sebagai solusi bagi orang tua rizki.privat hadir dan https://t.co/2hwnrFSPeh","1295322926099705858","","","in","South Sulawesi, Indonesia","0","0","0","https://twitter.com/TDAmakassar/status/1295322926099705858","416623166","TDAmakassar"
"1295322743123013632","Mon Aug 17 11:33:02 +0000 2020","0","HUT Ke-75 RI Ribuan Siswa di OKI Turut Merdeka Belajar https://t.co/ybTPPOGPp0 https://t.co/WVaczLZCcw","1295322743123013632","https://pbs.twimg.com/media/EfnpK5LUYAEFobW.jpg","","in","Sumatera Selatan, Indonesia","0","0","0","https://twitter.com/onews_id/status/1295322743123013632","992970090634084352","onews_id"
"1295311817842069504","Mon Aug 17 10:49:37 +0000 2020","0","Bahwa setiap anak adalah unik punya hak yang sama untuk belajar dan tidak membandingkan dengan anak lain adalah hakikat Merdeka belajar. Membuat pembelajaran dan pengalaman belajar yang bermakna bagi siswa dan https://t.co/rGqiMt0tIh","1295311817842069504","","","in","Indonesia","0","0","0","https://twitter.com/Arisyanti/status/1295311817842069504","59010713","Arisyanti"
"1295311000221040645","Mon Aug 17 10:46:22 +0000 2020","4","Dirgahayu Indonesia yang ke 75. Semoga merdeka belajar semakin terwujud. https://t.co/rfeXUTdFQw","1295311000221040645","https://pbs.twimg.com/ext_tw_video_thumb/1295310435256696833/pu/img/k5zuUVzXMJ9F5mC9.jpg","","in","Magelang","0","1","0","https://twitter.com/AndhiAchmad/status/1295311000221040645","533732071","AndhiAchmad"
"1295310045152911360","Mon Aug 17 10:42:35 +0000 2020","0","🇮🇩 MERDEKA! Live Trading Harian spesial 17 Agustus Bagaimana cara pasang bendera saat trading Bitcoin? Yuk simak live streaming nya untuk belajar strategi trading dengan flag pattern 🇮🇩Senin 17 Agustus 2020 ⏰ pukul 21.00 WIB ‍ live di https://t.co/XRERz8RAsv","1295310045152911360","","","in","Medan","0","0","0","https://twitter.com/Randi270793/status/1295310045152911360","1261171632342630401","Randi270793"
"1295306199831736321","Mon Aug 17 10:27:18 +0000 2020","0"," filter dong bahasanya kalo di tl banyak anak kecil anak kecil main rp. belajar noh apalin taun indonesia dijajah ampe merdeka jan taun lahir chara doang lu apalin.","1295306199831736321","","","in","known as odi","1","2","2","https://twitter.com/exvtra/status/1295306199831736321","1034363004966526976","exvtra"
"1295303609744318466","Mon Aug 17 10:17:00 +0000 2020","0","*KOMPETISI ONLINE - POPI 2020* Pentas Opini Pemuda/i Indonesia (POPI) 2020 merupakan lomba opini/gagasan/pendapat dengan tema Merdeka Belajar dan dikemas dalam bentuk podcast di instagram. Kegiatan ini https://t.co/34RC6K8EYu","1295303609744318466","","","in","Indonesia","0","0","0","https://twitter.com/ruangmahasiswa/status/1295303609744318466","3313978249","ruangmahasiswa"
"1295300961993289728","Mon Aug 17 10:06:29 +0000 2020","0","Kuy... Ntar malam bersama rangkulpadang novisaseria @riaoktorina . . Biar tanduk emak-emak gak meruncing . . #merdekabelajar #KeluargaKita #mencintaidenganlebihbaik https://t.co/U9tT8Iyt0d","1295300961993289728","","","in","Padang","0","0","0","https://twitter.com/dr_pipitt/status/1295300961993289728","561317172","dr_pipitt"
"1295300315973947393","Mon Aug 17 10:03:55 +0000 2020","1","Rekan-rekan apakah ikut upacara hari kemerdekaan? Mari kita rayakan &amp; isi kemerdekaan ini dengan terus belajar &amp; belajar. Semoga ilmu kita dapat bermanfaat untuk diri kita sendiri dan keluarga kita. Merdeka !!!! Indonesia Maju https://t.co/LO8bkmWkDC","1295300315973947393","https://pbs.twimg.com/media/EfnUw0cUMAAr7Iy.jpg","","in","Kota Bengkulu, Indonesia","0","0","0","https://twitter.com/direktoridosen/status/1295300315973947393","1901591046","direktoridosen"
"1295299640804257792","Mon Aug 17 10:01:14 +0000 2020","0","Merdeka dari rasa takut.. Merdeka dari rasa tdk nyaman dgn kekurangan diri~ belajar menerima ketidaksempurnaan.. Yoo bisa bisa yoo.. ","1295299640804257792","","","in","Antara Jekardah, Bdg, & Jogja~","0","0","0","https://twitter.com/JesicaIntan99/status/1295299640804257792","78307236","JesicaIntan99"
"1295299192768745472","Mon Aug 17 09:59:27 +0000 2020","1","Hari Kemerdekaan RI ke 75 🇲🇨 Merdeka? Ternyata masih cukup jauh untuk dierealisasikan semoga negara ini semakin pintar &amp; belajar dari kesalahan2 terdahulu &amp; bahaya yang akan muncul di masa depan 🇲🇨#17agustus #harikemerdekaanindonesia #indepence #merdeka #belummerdeka #indonesia https://t.co/wxE0rpXwes","1295299192768745472","https://pbs.twimg.com/media/EfnTwCiUMAAZRts.jpg","","in","","0","0","0","https://twitter.com/KinAuliaTheFly/status/1295299192768745472","3310413805","KinAuliaTheFly"
"1295297213204180994","Mon Aug 17 09:51:35 +0000 2020","0","MERDEKA 🇲🇨 - Merdeka itu ketika buka tabungan haji (BNI iB Baitullah Hasanah) di BNI Syariah langsung dapat benefit belajar ngaji seumur hidup so ke tanah suci ga perlu ragu lagi Insya Allah udah siap lahir https://t.co/Y5krPNaeUc","1295297213204180994","","","in","Indonesia","0","0","0","https://twitter.com/febyfsr/status/1295297213204180994","130752287","febyfsr"
"1295295611806167040","Mon Aug 17 09:45:13 +0000 2020","0","Di Hari Kemerdekaan Ribuan Siswa di OKI Turut Merdeka Belajar https://t.co/rJEyd58MRU lewat @BERITAANDA.NET","1295295611806167040","","","in","Indonesia","0","0","0","https://twitter.com/NEW_BERITAANDA/status/1295295611806167040","426520813","NEW_BERITAANDA"
"1295293008020209664","Mon Aug 17 09:34:53 +0000 2020","0","Kebijakan Merdeka Belajar sebagai Upaya Pemerintah dalam Pembangunan Manusia https://t.co/oBgyTgtIyw","1295293008020209664","","","in","Jakarta Capital Region","0","0","0","https://twitter.com/cakrawala_co/status/1295293008020209664","886506570305028096","cakrawala_co"
"1295291710029705217","Mon Aug 17 09:29:43 +0000 2020","0","Mau bagi-bagi kupon nih untuk ebook bundle Laravel+Vue. Silahkan gunakan kode kupon: MERDEKABELAJAR untuk mendapatkan potongan harga 99rb. Klaim kodenya di: https://t.co/qdBiFKIhQR --- *) Note: Kode berlaku sampai tanggal 20 Agustus 2020 buruan dipakai! https://t.co/XVuFKOVDbi","1295291710029705217","https://pbs.twimg.com/media/EfnMvYDVoAARIDT.jpg","","in","Internet, Indonesia","0","0","0","https://twitter.com/petanikode/status/1295291710029705217","227945054","petanikode"
"1295288774318944260","Mon Aug 17 09:18:03 +0000 2020","5","Dirgahayu Republik Indonesia! Mari bangkit bersama untuk mencapai Indonesia Maju! Merdeka! . . . #BangkituntukIndonesiaMaju #IndonesiaMaju #HUTRI75 #paudpedia #paudkemdikbud #merdekabelajar https://t.co/wL4021jkrV","1295288774318944260","https://pbs.twimg.com/media/EfnKRl9U0AEZ8uB.jpg","","in","","0","0","0","https://twitter.com/paudpedia/status/1295288774318944260","1227029291398885376","paudpedia"
"1295288142237327361","Mon Aug 17 09:15:33 +0000 2020","0","Capaian Kinerja Balai Bahasa Sulawesi Tengah selama semester pertama 2020. #dirgahayuindonesia #75tahunindonesiamerdeka #MerdekaBelajar #BangkituntukIndonesiaMaju sumber : https://t.co/kZTecsaj2U https://t.co/bwAYhwxX2S","1295288142237327361","https://pbs.twimg.com/media/EfnJsaJVAAA0TqY.jpg","","in","Kota Palu, Sulawesi Tengah","0","0","0","https://twitter.com/BalaiSulteng/status/1295288142237327361","1080992494240784385","BalaiSulteng"
"1295287913412878336","Mon Aug 17 09:14:38 +0000 2020","0","Selamat Ulang Tahun ke-75 Republik Indonesia #dirgahayuindonesia #BangkituntukIndonesiaMaju #MerdekaBelajar https://t.co/IhbXaPELLK","1295287913412878336","https://pbs.twimg.com/media/EfnJe8bU8AA7Qjy.jpg","","in","Kota Palu, Sulawesi Tengah","0","0","0","https://twitter.com/BalaiSulteng/status/1295287913412878336","1080992494240784385","BalaiSulteng"
"1295286833912221697","Mon Aug 17 09:10:21 +0000 2020","1","Indonesia tempat kelahiranku tempatku tumbuh dan belajar. Tempat lahir ibu dan juga ayahku. Tak terasa 75 tahun sudah indonesia merdeka membuat banyak dari kita nyaman untuk tinggal. Selamat hari merdeka indonesiaku. . #DirgahayuRI75 #DirgahayuRepublikIndonesia #Dirgahayu","1295286833912221697","","","in","","0","0","0","https://twitter.com/MohAlfin99/status/1295286833912221697","1274638401942114305","MohAlfin99"
"1295283656135647232","Mon Aug 17 08:57:43 +0000 2020","0","HUT Ke-75 RI Ribuan Siswa di OKI Turut Merdeka Belajar https://t.co/GSsfMcqBRs","1295283656135647232","","","in","Kota Palembang","0","0","0","https://twitter.com/PelitaSumatera/status/1295283656135647232","1086148213264965632","PelitaSumatera"
"1295281690219175936","Mon Aug 17 08:49:54 +0000 2020","5","Kemerdekaan Setinggi Tanah Karena merdeka itu sederhana menyediakan dukungan #MerdekaBelajar bagi guru-guru Indonesia Dibuat dilakukan dan digunakan oleh guru Klik https://t.co/F4663mtFUq Boleh disebar https://t.co/j1un7gd91x","1295281690219175936","https://pbs.twimg.com/media/EfnDu0jU8AA5XP5.jpg","","in","Surakarta, Jawa Tengah","0","0","2","https://twitter.com/bukik/status/1295281690219175936","16734434","bukik"
"1295278744806912000","Mon Aug 17 08:38:12 +0000 2020","0","Belajar menerima bahwa merdeka hari ini adalah sebuah rencana. Niat libur aja gajadi kan ya","1295278744806912000","","","in","Boyolali","0","0","0","https://twitter.com/justwimp/status/1295278744806912000","198030353","justwimp"
"1295275394459787266","Mon Aug 17 08:24:53 +0000 2020","1","Salam merdeka Sahabat Inisiator Meski belum merdeka sepenuhnya dari pandemi jangan membuat kita menjadi patah semangat. Dari adik-adik kita di pondok An Nur kita belajar menjadi pribadi merdeka meskipun interaksi sosial yang terbatas. https://t.co/OaiZQEfix6","1295275394459787266","https://pbs.twimg.com/media/Efm-GIXU4AYQjHs.jpg","","in","Santan. Aceh Besar","0","0","1","https://twitter.com/HumanIn_Aceh/status/1295275394459787266","499384474","HumanIn_Aceh"
"1295274237083566080","Mon Aug 17 08:20:17 +0000 2020","5","Ibarat indonesia iso merdeka amergo perjuangane pahlawan . Ndahniyo nek hatimu durung merdeka opo aku oleh merjuangno? *hiyaaa ibarate ngono belajar gombal sek . Wes pantes ta?","1295274237083566080","","","in","Kota Surabaya, Jawa Timur","0","0","0","https://twitter.com/Deniikurniawan7/status/1295274237083566080","2363501336","Deniikurniawan7"
"1295272017877299201","Mon Aug 17 08:11:28 +0000 2020","0","Mulailah belajar tanpa siapa2 mungkin dg itu kamu akan bisa fokus pd masa depan. Lepas Dan bebas merdeka dari rasa yg menjajah. Selamat ulang tahun indonesiaku jayalah selalu https://t.co/Svym4vlPeu","1295272017877299201","https://pbs.twimg.com/media/Efm6_eYUEAAGn3x.png","","in","Lamongan","0","0","0","https://twitter.com/AnnataFirsya/status/1295272017877299201","810463587638464512","AnnataFirsya"
"1295271989892939776","Mon Aug 17 08:11:22 +0000 2020","2","Selamat Hari ulang tahun Kemerdekaan Indonesia yang ke 75!! seperempat abad lagi menuju generasi EMAS indonesia. Semoga rencana generasi EMAS tersebut terlaksana dam bukan hanya sekedar wacana. #dirgahayuindonesia #hutri75 #merdeka #merdekabelajar #17agustus https://t.co/IOOlZHRJaU","1295271989892939776","https://pbs.twimg.com/media/Efm7ARlUcAEGZW8.jpg","","in","Indonesia","0","0","0","https://twitter.com/bahassoalfess/status/1295271989892939776","1145123964940718080","bahassoalfess"
"1295270836681601024","Mon Aug 17 08:06:47 +0000 2020","0","Merdeka itu juga soal bisa belajar penerimaan merasa cukup dan menemukan inner peace dalam diri.","1295270836681601024","","","in","","0","0","0","https://twitter.com/lanynaa/status/1295270836681601024","146774633","lanynaa"
"1295263916587720704","Mon Aug 17 07:39:17 +0000 2020","0","Merdeka buat gue adalah ketika bisa ngeliat mereka tersenyum lantaran bisa sekolah dg nyaman dg akses belajar yg gampang dan dg fasilitas sekolah yg layak. Tapi sayang masih banyak yg tidak semerdeka mereka. https://t.co/Q4vJrNGuEh","1295263916587720704","","","in","Kota Tangerang, Banten","0","0","0","https://twitter.com/AdiRaharjo1994/status/1295263916587720704","937085004160557061","AdiRaharjo1994"
"1295262063208673280","Mon Aug 17 07:31:55 +0000 2020","0","Merdeka Belajar di Kampus Merdeka Teknik Mesin IST AKPRIND Yogyakarta #teknikmesin #mesin #merdekabelajar #kampusmerdeka #dirumahaja #kuliahdijogja #kuliah @ Institut Sains dan Teknologi https://t.co/G6xeUwgSSo","1295262063208673280","","","in","","0","0","0","https://twitter.com/yuli690e/status/1295262063208673280","61135027","yuli690e"
"1295260388024442883","Mon Aug 17 07:25:15 +0000 2020","3","Mas Nadiem Mau Merdeka Belajar atau Belajar Merdeka? https://t.co/13ffZBpkAY","1295260388024442883","","","in","Indonesia","0","0","1","https://twitter.com/kompasiana/status/1295260388024442883","23786106","kompasiana"
"1295256547384123393","Mon Aug 17 07:10:00 +0000 2020","0","FSGI Sebut Hibah Merdeka Belajar Tidak Sah Berpotensi Rugikan Negara https://t.co/jGh9UavljH","1295256547384123393","","","in","Indonesia","0","0","0","https://twitter.com/democrazymedia/status/1295256547384123393","1243804423001763841","democrazymedia"
"1295255584644579335","Mon Aug 17 07:06:10 +0000 2020","2","Iya apalah artinya merdeka dari bangsa asing kalau ternyata masih dijajah saudara setanah air? Belajar dari sejarah dijajah bangsa lain msh mendatangkan lbh byk benefit daripada dijajah saudara setanah air sendiri if u know what I mean.","1295255584644579335","","","in","Jakarta - Indonesia","0","0","0","https://twitter.com/VincentJose/status/1295255584644579335","66104207","VincentJose"
"1295254937299849216","Mon Aug 17 07:03:36 +0000 2020","1","Selamat merayakan ulang tahun ke-75 kemerdekaan Indonesia #SahabatBahasa dan #SahabatDikbud #Gerakanliterasinasional #cerdasberliterasi #literasi #lestarikanbahasadaerah #MerdekaBelajar #BangkitUntukIndonesiaMaju #IndonesiaMaju https://t.co/aWnNk08XyP","1295254937299849216","https://pbs.twimg.com/media/EfmrfAKUwAELsqR.jpg","","in","Jalan Yoka, Waena, Heram , Jay","0","0","0","https://twitter.com/bbahasapapua/status/1295254937299849216","1221661982035591169","bbahasapapua"
"1295254877740777474","Mon Aug 17 07:03:22 +0000 2020","8","Persembahan kami dalam Rangka HUT Kemerdekaan RI ke -75: (5) TV Guru Indonesia TV Streaming Bapak Ibu guru pendidik mahasiswa siswa siapapun yg mau berbagi ilmu untuk saling belajar.. Merdeka! https://t.co/gIRwyiKGpn","1295254877740777474","https://pbs.twimg.com/media/EfmrclVU4AELqTD.jpg","","in","","0","0","2","https://twitter.com/unifahr/status/1295254877740777474","1201194210","unifahr"
"1295254418141585409","Mon Aug 17 07:01:32 +0000 2020","0","merdeka terbebas dari hutang ada yang merdeka terbebas dari rasa malas ada yang merdeka terbebas dari ketakutan merdeka terbebas dari kebodohan dengan terus belajar mengejar ilmu dan arti-arti kemerdekaan lainnya.","1295254418141585409","","","in","Jkt, Yk, Clp, krmnjw","0","0","0","https://twitter.com/titiprinduku/status/1295254418141585409","797807262","titiprinduku"
"1295254216550694913","Mon Aug 17 07:00:44 +0000 2020","16","Dg semangat 75-th Indonesia merdeka Kita harus bangkit tidak hanya dari pandemi corona tapi bangkit sbg bangsa yg bermartabat. Kita harus belajar dari Bung Karno Dg membumikan Pancasila kita akan menjadi bangsa yg bermartabat dan kuat - @BPIPRI #TerimaKasihPahlawan https://t.co/kHAgMCdTyj","1295254216550694913","https://pbs.twimg.com/media/Efmq15BUEAA7jwU.jpg","","in","twitter.com","0","21","11","https://twitter.com/mulanbilqis/status/1295254216550694913","1138727688","mulanbilqis"
"1295253942104801281","Mon Aug 17 06:59:39 +0000 2020","0","Peluncuran perdana website https://t.co/2ON3rLnGi0 Apa pendapat Bapak/Ibu tentang website ini? Yuk tulis di komentar #merdekabelajar #KemerdekanRI75 #kemerdekaan #indonesiamaju https://t.co/VV2TA4cvfY","1295253942104801281","","","in","Serpong","0","0","1","https://twitter.com/KampusGuruCikal/status/1295253942104801281","2804980657","KampusGuruCikal"
"1295252992225157120","Mon Aug 17 06:55:52 +0000 2020","0"," Kurang cerdas dapat diperbaiki dengan belajar kurang cakap dapat dihilangkan dengan pengalaman. Namun tidak jujur sulit diperbaiki. Bung Hatta Merdeka Belajar Bersama HSE! ⁣. Dalam rangka memperingati HUT https://t.co/eO5tvCJvA9","1295252992225157120","","","in","","0","0","0","https://twitter.com/Hanggapramudyan/status/1295252992225157120","40262286","Hanggapramudyan"
"1295252462631174146","Mon Aug 17 06:53:46 +0000 2020","0","🇲🇨DIRGAHAYU REPUBLIK INDONESIA KE 75🇲🇨 Kemerdekaan ialah hak segala bangsa Kebebasan merupakan tujuan hidup manusia Merdeka ialah ketika kita bisa merasakan kebebasan mendapatkan pendidikan belajar dalam kondisi apapun dengan semangat merdeka belajar https://t.co/23LKs1hyJ7","1295252462631174146","https://pbs.twimg.com/ext_tw_video_thumb/1295252313104191488/pu/img/pCSuzl-etADErawD.jpg","","in","Jakarta Timur, DKI Jakarta","0","1","0","https://twitter.com/bsi_kalimalang/status/1295252462631174146","3254174850","bsi_kalimalang"
"1295252131067330560","Mon Aug 17 06:52:27 +0000 2020","0","Dirgahayu Republik Indonesia ke 75 . Kurang cerdas dapat diperbaiki dengan belajar kurang cakap dapat dihilangkan dengan pengalaman. Namun tidak jujur sulit diperbaiki. Bung Hatta . . . MERDEKA https://t.co/kJ7WQbpbjb","1295252131067330560","","","in","Yogyakarta, Indonesia","0","0","0","https://twitter.com/hsehomeschool/status/1295252131067330560","1237076344246165504","hsehomeschool"
"1295251353208463360","Mon Aug 17 06:49:21 +0000 2020","11","Dirgahayu Indonesia ku - Indonsia kita semua. Bersama gotong royong kita lawan Covid -19. Indonesia adalah bangsa yang kuat. Songsong masa depan dg keyakinan kerja keras dan terus belajar. Merdeka! https://t.co/ooeXO3NGpH","1295251353208463360","https://pbs.twimg.com/media/EfmoPaUVAAAVGDq.jpg","","in","","0","1","3","https://twitter.com/unifahr/status/1295251353208463360","1201194210","unifahr"
"1295246894835232768","Mon Aug 17 06:31:38 +0000 2020","1","Belajar make up mumpung ga ada ortu . Merdeka bgg ","1295246894835232768","","","in","","0","1","0","https://twitter.com/Bellaika06/status/1295246894835232768","412241354","Bellaika06"
"1295242081917702144","Mon Aug 17 06:12:31 +0000 2020","0"," Belajar tanpa berpikir itu tidaklah berguna tapi berpikir tanpa belajar itu sangatlah berbahaya! By. Soekarno Dirgahayu Republik Indonesia ke 75. Merdeka.... #dirgahayurepublikindonesia75 #hutri75 @ Ende East https://t.co/9VoULI5oOU","1295242081917702144","","","in","ÜT: -8.619504,115.254813","0","0","0","https://twitter.com/widiantara/status/1295242081917702144","84241740","widiantara"
"1295240939183603714","Mon Aug 17 06:07:58 +0000 2020","3","[DIRGAHAYU INDONESIA KE-75🇮🇩] Merdeka bukan berarti bebas. Merdeka bukan berarti perjuangan kita sudah selesai sampai disini. Merdeka berarti kita harus berjuang lebih keras untuk mempertahankan kemerdekaan belajar dan bekerja lebih giat dan memberi kontribusi nyata bagi https://t.co/s2pZxjrXjs","1295240939183603714","https://pbs.twimg.com/media/Efmew9jUwAsHJC4.jpg","","in","Yogyakarta, Indonesia","0","1","1","https://twitter.com/pharmacious/status/1295240939183603714","393544622","pharmacious"
"1295239814199951362","Mon Aug 17 06:03:30 +0000 2020","2","Dadaku adalah dada yang belajar merdeka dari patah hati.","1295239814199951362","","","in"," Jakarta, Indonesia","0","0","4","https://twitter.com/lautankata/status/1295239814199951362","259667799","lautankata"
"1295239296694120448","Mon Aug 17 06:01:27 +0000 2020","1","Terima kasih kepada seluruh peserta yang telah mengikuti kegiatan Silaturahmi Relawan Pendidikan dengan tema #MerdekaBelajar: Dari Keadaan Kita Belajar dengan Belajar Kita Memperbaiki Keadaan. Kegiatan tersebut dapat disaksikan kembali di https://t.co/KHmFoS9sSq. https://t.co/3aZ37wjjIm","1295239296694120448","https://pbs.twimg.com/media/EfmdQNoUMAAOQw6.jpg","","in","Daerah Istimewa Yogyakarta","0","1","0","https://twitter.com/KI_Yogya/status/1295239296694120448","803828569","KI_Yogya"
"1295238932679012353","Mon Aug 17 06:00:00 +0000 2020","0","[PROMO KEMERDEKAAN] Merdeka berarti kita sudah bebas! Nah Snapask menawarkan kalian kebebasan dalam belajar! Kalian bisa belajar dari manapun kapanpun sesuka kamu. Jangan lupa untuk menggunakan Promo Hari Kemerdekaan dan dapatkan potongan menarik! https://t.co/67I1QcmMK8","1295238932679012353","","","in","Indonesia","0","0","0","https://twitter.com/Snapaskid/status/1295238932679012353","1067284634872860672","Snapaskid"
"1295237752443740161","Mon Aug 17 05:55:19 +0000 2020","0","Indonesia belum merdeka kalo masih bernegosiasi dengan musuh. Harus belajar dari kesalahan masa lalu.","1295237752443740161","","","in","Turkey","0","0","0","https://twitter.com/Dennaaja_/status/1295237752443740161","159843510","Dennaaja_"
"1295237376156012544","Mon Aug 17 05:53:49 +0000 2020","0","🇲🇨DIRGAHAYU REPUBLIK INDONESIA KE 75🇲🇨 Kemerdekaan ialah hak segala bangsa Kebebasan merupakan tujuan hidup manusia Merdeka ialah ketika kita bisa merasakan kebebasan mendapatkan pendidikan belajar dalam kondisi https://t.co/dwNwsWau7P","1295237376156012544","","","in","Depok, Jawa Barat, Indonesia","0","0","0","https://twitter.com/bsimargonda_id/status/1295237376156012544","3528052274","bsimargonda_id"
"1295236338111873024","Mon Aug 17 05:49:41 +0000 2020","0","DIRGAHAYU REPUBLIK INDONESIA KE 75🇲🇨 Kemerdekaan ialah hak segala bangsa Kebebasan merupakan tujuan hidup manusia Merdeka ialah ketika kita bisa merasakan kebebasan mendapatkan pendidikan belajar dalam kondisi https://t.co/Hd9apUxU0p","1295236338111873024","","","in","Jl. Banten No.1 Karangpawitan","0","0","0","https://twitter.com/bsikarawang/status/1295236338111873024","585775303","bsikarawang"
"1295235756512833536","Mon Aug 17 05:47:23 +0000 2020","0","Merdeka? Apakah kita benar-benar merdeka ketika hati dan pikiran masih terbelenggu dengan nafsu keduniaan.?? Belajar memahami arti kemerdekaan dengan tidak latah kepada pikiran-pikiran menyesatkan yg bersembunyi dibalik istilah kebebasan .. #merdeka!","1295235756512833536","","","in","East Java, Indonesia","0","0","0","https://twitter.com/bramantya_dj/status/1295235756512833536","294310720","bramantya_dj"
"1295235291368759298","Mon Aug 17 05:45:32 +0000 2020","4","Dirgahayu Republik Indonesia! Peringatan HUT ke-75 RI menjadi momen bagi #SahabatPerpusdikbud bersatu padu &amp; berpartisipasi aktif dalam penanggulangan penyebaran Covid-19. Jangan lupa merapkan protokol kesehatan dalam kehidupan kalian ya. #merdekabelajar #BangkituntuIndonesiaMaju https://t.co/9rDwDHjx59","1295235291368759298","https://pbs.twimg.com/media/EfmZoffU0AALak4.jpg","","in","Senayan, Jakarta","0","0","1","https://twitter.com/perpusdikbud/status/1295235291368759298","2191873495","perpusdikbud"
"1295234282160451585","Mon Aug 17 05:41:31 +0000 2020","7","75 tahun Indonesia merdeka dan masih banyak anak-anak putus sekolah dan bekerja di umur yang belum seharusnya mereka bekerja. Yuk yang sedang kuliah rajin belajar ya! Semoga kita bisa bantu lebih banyak orang yang ngga seberuntung kita. Merdeka bersekolah! 🇮🇩","1295234282160451585","","","in","Indonesia","0","0","2","https://twitter.com/SeventeenAU1/status/1295234282160451585","1216097265158217728","SeventeenAU1"
"1295233937426378753","Mon Aug 17 05:40:09 +0000 2020","0","1945-1965 belajar merdeka 1965 (pertengahan)-2020 belajar jadi bigot dan inlander","1295233937426378753","","","in","Wasteland","0","0","0","https://twitter.com/_scumfvkk_/status/1295233937426378753","604282110","_scumfvkk_"
"1295231268569915392","Mon Aug 17 05:29:33 +0000 2020","0","Berikan kedaulatan anak dalam belajar dan bermain dengan alam untuk bisa bertumbuh dan meraskan kemerdekaan yang sesungguhnya... Anak masa depan peradaban bangsa 75 tahun Indonesia merdeka https://t.co/3nEDDfjHFW","1295231268569915392","","","in","Purbalingga, Indonesia","0","1","0","https://twitter.com/pherlee/status/1295231268569915392","66906999","pherlee"
"1295230631396478983","Mon Aug 17 05:27:01 +0000 2020","9","Indonesia sudah 75 tahun merdeka masa sih kamu masih nggak bisa bedain antara di- disambung dengan di- dipisah? Kamu tetap bisa gombal dengan tetap tampak berpendidikan dan melestarikan Bahasa Indonesia.. Pesan mimin: salah nggak apa-apa asalkan kita terus belajar! https://t.co/7rDvp0dr0d","1295230631396478983","https://pbs.twimg.com/media/EfmVZNRXsAAQ5c9.jpg","","in","Jakarta, Indonesia","1","2","9","https://twitter.com/gramediadotcom/status/1295230631396478983","61522818","gramediadotcom"
"1295230472625283072","Mon Aug 17 05:26:23 +0000 2020","0","[31 Hari Tantangan #SiapAdaptasi Hari ke-18] DIRGAHAYU INDONESIA-ku! Doa untukmu semoga Indonesiaku.. Merdeka dalam berpikir Merdeka dalam belajar Merdeka dalam berkarya Merdeka dari ketamakan Merdeka untuk https://t.co/luWi2fiqv2","1295230472625283072","","","in","","0","0","0","https://twitter.com/zldeldaa/status/1295230472625283072","1899787015","zldeldaa"
"1295230380719579136","Mon Aug 17 05:26:01 +0000 2020","6","merdeka apanya kalo masih ada desa yang ga ada sinyal telepon ataupun internet tapi siswanya disuruh belajar online #DirgahayuIndonesia75","1295230380719579136","","","in","Jakarta Capital Region, Indone","0","0","2","https://twitter.com/tiaraputrianant/status/1295230380719579136","912307411075063808","tiaraputrianant"
"1295230124569309185","Mon Aug 17 05:25:00 +0000 2020","0","Merdeka Dari hasil Juang bukan dari lelang. MERDEKA BUNG Tokoh-tokoh di atas hanya sebagian saja masih banyak yg berjasa tapi dilupakan. #merdeka #merdekabelajar #sekalimerdekatetapmerdeka #merdekadotcom https://t.co/hgyyP8xRPW","1295230124569309185","","","in","Blitar, Jawa Timur","0","0","0","https://twitter.com/SupanjiNerry/status/1295230124569309185","1096188743919095809","SupanjiNerry"
