"conversation_id_str","created_at","favorite_count","full_text","id_str","image_url","in_reply_to_screen_name","lang","location","quote_count","reply_count","retweet_count","tweet_url","user_id_str","username"
"1297866631679361024","Mon Aug 24 12:01:32 +0000 2020","1","Memaknai Kembali Merdeka Belajar Menurut Ki Hadjar Dewantara https://t.co/feAidctWt5","1297866631679361024","","","in","Indonesia","0","0","1","https://twitter.com/kompasiana/status/1297866631679361024","23786106","kompasiana"
"1297865991523901443","Mon Aug 24 11:59:00 +0000 2020","1","Memaknai Kembali Merdeka Belajar Menurut Ki Hadjar Dewantara https://t.co/EBTRCskBeF","1297865991523901443","","","in","Indonesia","0","0","1","https://twitter.com/kompasiana/status/1297865991523901443","23786106","kompasiana"
"1297862741475184640","Mon Aug 24 11:46:05 +0000 2020","0","#Repost kemdikbud.ri #SahabatDikbud bagaimana ya cara menciptakan lingkungan yang nyaman bagi anak selama #BelajardariRumah? . Yuk simak informasinya pada gambar berikut! . #MerdekaBelajar https://t.co/CHciQrKMno","1297862741475184640","","","in","","0","0","0","https://twitter.com/PrahumIrfandika/status/1297862741475184640","1281060505822482432","PrahumIrfandika"
"1297862399714787330","Mon Aug 24 11:44:43 +0000 2020","2","FSGI Surati Jokowi Untuk Atasi Polemik Hibah Merdeka Belajar https://t.co/geSSNPwmg5","1297862399714787330","","","in","Jakarta","0","0","0","https://twitter.com/jawapos/status/1297862399714787330","2392460208","jawapos"
"1297857650936315906","Mon Aug 24 11:25:51 +0000 2020","36","Selamat ulang tahun @TVRINasional! Selamat Hari Televisi Nasional untuk semua stasiun televisi di lndonesia! Terus semangat untuk menyajikan tayangan berkualitas bagi generasi bangsa. #MerdekaBelajar https://t.co/aVquVSKgDa","1297857650936315906","https://pbs.twimg.com/media/EgLqpqyUEAUo4NH.jpg","","in","Jakarta","1","0","12","https://twitter.com/Kemdikbud_RI/status/1297857650936315906","631701837","Kemdikbud_RI"
"1297857501505785857","Mon Aug 24 11:25:16 +0000 2020","0","Webinar Kwartir Nasional Gerakan Pramuka Pramuka Perguruan Tinggi Kampus Merdeka Merdeka Belajar Selasa 25 Agustus 2020 https://t.co/z5eOriX6FO","1297857501505785857","https://pbs.twimg.com/media/EgLqhNzU0AAvaGx.jpg","","in","Makassar","0","0","0","https://twitter.com/DaengLalo/status/1297857501505785857","30220811","DaengLalo"
"1297856843104935937","Mon Aug 24 11:22:39 +0000 2020","2","Wujudkan Indonesia Merdeka Sinyal untuk Merdeka Belajar di Masa Pandemi COVID-19 - https://t.co/QYj37jwYUN - tulisan Wahyu Agung Kuncoro @wak_cobain Cc @IWe_Nugroho @just_imung #pendidikanadalahhak #COVID19 #Indonesia https://t.co/nYauTKGHyZ","1297856843104935937","","","in","Jakarta Indonesia","0","1","2","https://twitter.com/vhalhen123/status/1297856843104935937","141199148","vhalhen123"
"1297853764284497921","Mon Aug 24 11:10:25 +0000 2020","1","Federasi Serikat Guru Surati Presiden Jokowi Sebut Hibah Merdeka Belajar Cacat Prosedur - Follow @demokrasicoid https://t.co/eCIm05Ze0h","1297853764284497921","","","in","Indonesia","0","0","0","https://twitter.com/demokrasicoid/status/1297853764284497921","3189327655","demokrasicoid"
"1297844861731631104","Mon Aug 24 10:35:02 +0000 2020","0","Bank Indonesia mendukung kebijakan Merdeka Belajar yang dicanangkan Kemendikbud dengan menjadi pionir realisasi program Kampus Merdeka #Kemendikbud https://t.co/GCkbASaw87","1297844861731631104","","","in","Indonesia","0","0","0","https://twitter.com/jpnncom/status/1297844861731631104","79130206","jpnncom"
"1297835377852477441","Mon Aug 24 09:57:21 +0000 2020","16","Kamu berminat menjadi mahasiswa Psikologi? Note buat kamu yang mau masuk Psikologi! . Tentunya kami mempunyai rekomendasi kampus terbaik dengan jurusan psikologi! https://t.co/yaIGDHkhgB @jokowi @pustekkom #infopsikologi #merdekabelajar #pendidikan #psikolog #jurusanpsikolog https://t.co/dLqZXC3Sse","1297835377852477441","https://pbs.twimg.com/media/EgLVsy5U4AAz8-S.jpg","","in","Nanggewer, Cibinong Bogor","1","7","7","https://twitter.com/edunitas/status/1297835377852477441","1224516143840260098","edunitas"
"1297803970862227456","Mon Aug 24 07:52:33 +0000 2020","0","Yuk ikutan lomba POPI (Pentas Opini Pemuda/i Indonesia) 2020. Tema tahun ini adalah Merdeka Belajar Lomba ini bersifat GRATIS (Tidak dipungut biaya apapun) dan menangkan hadiah TOTAL Jutaan Rupiah + Ratusan GB Kuota Internet dari RuangMahasiswa X by.U #lomba17an #POPI2020 https://t.co/RQxWTDFHit","1297803970862227456","https://pbs.twimg.com/media/EgK5VlkUcAAM001.jpg","","in","Indonesia","0","0","0","https://twitter.com/OPINI_id/status/1297803970862227456","359364908","OPINI_id"
"1297798261906931713","Mon Aug 24 07:29:52 +0000 2020","2","Info untuk #SahabatBahasa dan #SahabatDikbud #Gerakanliterasinasional #cerdasberliterasi #literasi #lestarikanbahasadaerah #MerdekaBelajar #BangkitUntukIndonesiaMaju #IndonesiaMaju https://t.co/JMQKmcyF0k","1297798261906931713","https://pbs.twimg.com/media/EgK0UKxVAAAEaZv.jpg","","in","Jalan Yoka, Waena, Heram , Jay","0","0","0","https://twitter.com/bbahasapapua/status/1297798261906931713","1221661982035591169","bbahasapapua"
"1297782160686948352","Mon Aug 24 06:25:53 +0000 2020","0","BI Dukung Kebijakan Merdeka Belajar https://t.co/GXwOzBWizc","1297782160686948352","","","in","Jakarta Capital Region","0","0","0","https://twitter.com/topbusiness_id/status/1297782160686948352","974501163146997766","topbusiness_id"
"1297781554010157059","Mon Aug 24 06:23:28 +0000 2020","1","RPP Kanvas RPP Merdeka Belajar RPP satu lembar. https://t.co/7PcY3MxAYV via @YouTube","1297781554010157059","","","in","","0","0","0","https://twitter.com/SoekojoGatot/status/1297781554010157059","1267432225970073601","SoekojoGatot"
"1297780764449226752","Mon Aug 24 06:20:20 +0000 2020","4","Federasi Serikat Guru Surati Presiden Jokowi Sebut Hibah Merdeka Belajar Cacat Prosedur https://t.co/zcMhuDLc7M","1297780764449226752","","","in","Indonesia","0","0","2","https://twitter.com/idtodayco/status/1297780764449226752","1082992095361609728","idtodayco"
"1297780009688379392","Mon Aug 24 06:17:20 +0000 2020","0"," MERDEKA! MERDEKA! 🇲🇾 Seronok Azib &amp; Muhammad ni laungkan merdeka Comel betul letak bendera Malaysia dekat projek Art Bot mereka Selain belajar tentang robotik mereka juga belajar cara untuk berkawan. Dari awal senyap je masing². Lama² jadi kawan untuk belajar sama² https://t.co/KXlT4hCEv4","1297780009688379392","https://pbs.twimg.com/ext_tw_video_thumb/1297779972107464704/pu/img/MBnRZdxWX5bBj3OB.jpg","","in","Nextgen Makers Robotic Academy","0","1","0","https://twitter.com/MakersNextgen/status/1297780009688379392","1213538447475896320","MakersNextgen"
"1297775649885523969","Mon Aug 24 06:00:01 +0000 2020","1","Kesempatan gak datang dua kali. #AmbilLangkahMu sekarang dan ikutan ninja Progate lain yang sudah merdeka belajar coding fun dan GRATIS! Daftar di https://t.co/bXevVhVueD skrg! Detail program: https://t.co/OHk5h644AI #online #bootcamp #coding #codingbootcamp #belajarcoding https://t.co/o2gV1Fnzw7","1297775649885523969","https://pbs.twimg.com/media/EfxI71eUYAE0FX3.png","","in","Jakarta Capital Region, Indone","2","0","0","https://twitter.com/progateID/status/1297775649885523969","1219213729482412032","progateID"
"1297770786724311040","Mon Aug 24 05:40:41 +0000 2020","0","Ni anak gak belajar sejarah apa ya? Gak inget negaranya sendiri merdeka pake cara apa? Diplomasi. Pake otak. Kan dari bh udh dibilang kalo ada masalah di email aja. Kalo gitu caranya malah terkesan menjatuhkan dong..","1297770786724311040","","","in","ophidiophobia","0","0","0","https://twitter.com/maymayouu/status/1297770786724311040","1251915643630174210","maymayouu"
"1297764841008988160","Mon Aug 24 05:17:04 +0000 2020","2","Kampus Merdeka Mahasiswa Aperti BUMN Bisa Belajar Antarkampus dan Antarprogram Studi https://t.co/y8cGDNG3fV","1297764841008988160","","","in","Jakarta, Indonesia","0","0","0","https://twitter.com/Bisniscom/status/1297764841008988160","118646322","Bisniscom"
"1297763532428070912","Mon Aug 24 05:11:52 +0000 2020","0","Untuk urusan kerja atau business? Belajar online &amp; dapat international certificate ! Lebih wow ada promosi merdeka enroll 1 FREE 1 ! Jangan tungguuuuu Cepat click https://t.co/jT7s0ByUQ6 for more details ! https://t.co/9Gdgo2jUiQ","1297763532428070912","https://pbs.twimg.com/media/EgKVDNxU0AEmgBy.jpg","","in","Kuala Lumpur","0","0","0","https://twitter.com/azmahiera/status/1297763532428070912","1349409182","azmahiera"
"1297759624150560768","Mon Aug 24 04:56:20 +0000 2020","0","Federasi Serikat Guru Surati Presiden Jokowi Sebut Hibah Merdeka Belajar Cacat Prosedur https://t.co/R0BLqpHBQA","1297759624150560768","","","in","Jakarta","0","0","0","https://twitter.com/ayojalanterus/status/1297759624150560768","1277809442990391297","ayojalanterus"
"1297757857329197056","Mon Aug 24 04:49:19 +0000 2020","1","Pidato Menteri Pendidikan dan Kebudayaan Nadiem Anwar Makarim pada Hari Guru Nasional tahun lalu melambungkan istilah Merdeka Belajar melalui tagarnya. Isi pidatonya sendiri lumayan mengejutkan. Ada nuansa baru di situ. https://t.co/H9Kh8HlknH #merdekabelajar #pendidikan","1297757857329197056","","","in","Pekalongan, Indonesia","0","0","0","https://twitter.com/kotomonodotco/status/1297757857329197056","3194640708","kotomonodotco"
"1297752020753899521","Mon Aug 24 04:26:07 +0000 2020","1","Merdeka Belajar Terbebas dari Rezim Kuota Internet https://t.co/D3zbl7S2mc https://t.co/MzwlUlYfVf","1297752020753899521","https://pbs.twimg.com/media/EgKKlPSVoAEREB6.jpg","","in","Jakarta","0","0","0","https://twitter.com/Beritasatu/status/1297752020753899521","154102750","Beritasatu"
"1297744393776947202","Mon Aug 24 03:55:49 +0000 2020","0","Wong goblog wajibe blajar mandiri merdeka dan berdikari. Karena dg kemandiriannya maka leluasa menikmati lika-liku kegoblogan dan digoblogi. Dengan GOBLOG yg dimiliki maka ia belajar mandiri merdeka. M E R D E K A #예술가의_목소리_예성_생일축하해","1297744393776947202","","","in","","1","0","0","https://twitter.com/BOCAH_LENGOOOB/status/1297744393776947202","1114332927142191104","BOCAH_LENGOOOB"
"1297734943611604992","Mon Aug 24 03:18:15 +0000 2020","2","Daripada Gosip mending ngopi ️ . . #wantodki10 #gelorajkt #gelorajktbarat #gelorajakbar #geloraindonesia #partaigeloraindonesia #indonesiamaju #indonesiapanggungkitabersama #likeforlikes #like4likes #likeforfollow #viewindonesia #merdekabelajar #gelorauntuknegeri Ari Wibowo https://t.co/L3zX0dqqdN","1297734943611604992","https://pbs.twimg.com/media/EgJ7C5xUYAQyDLa.jpg","","in","Jakarta Barat, DKI Jakarta","0","0","0","https://twitter.com/BraderWanto/status/1297734943611604992","83336493","BraderWanto"
"1297734349773627392","Mon Aug 24 03:15:54 +0000 2020","42","#SahabatDikbud Guru Berbagi Kemendikbud bersama @RefoIndonesia &amp; @Google mengadakan #IndonesiaEduWebinars dgn tema Terus Belajar Terus Mengajar 24--27 Agustus 2020. Yuk ikut serta! Informasi selengkapnya kunjungi https://t.co/krUuJH2f88. #MerdekaBelajar https://t.co/h4AyXNfMqR","1297734349773627392","https://pbs.twimg.com/media/EgJ6go5UMAACfnD.jpg","","in","Jakarta","0","1","13","https://twitter.com/Kemdikbud_RI/status/1297734349773627392","631701837","Kemdikbud_RI"
"1297727396783648768","Mon Aug 24 02:48:16 +0000 2020","0","Federasi Serikat Guru Surati Presiden Jokowi Sebut Hibah Merdeka Belajar Cacat Prosedur | Berita7 https://t.co/5QGBsoQ9gn","1297727396783648768","","","in","Indonesia","0","0","0","https://twitter.com/Berita7dotid/status/1297727396783648768","895307117174730752","Berita7dotid"
"1297726151595421697","Mon Aug 24 02:43:19 +0000 2020","7","Federasi Serikat Guru Surati Presiden Jokowi Sebut Hibah Merdeka Belajar Cacat Prosedur https://t.co/4tqxvfgh0m","1297726151595421697","","","in","Indonesia","0","0","3","https://twitter.com/geloraco/status/1297726151595421697","3319260420","geloraco"
"1297724279635578881","Mon Aug 24 02:35:53 +0000 2020","0","PROMO 75 MERDEKA 24 31 Agu 2020 Masih dalam susana HUT RI KE 75 Ayoo segera mulai belajar di Bimbel SG Pajajaran dengan menerapkan Protokol COVID-19 ONLINE BISA OFFLINE BISA Whattsap: 085797558588 GRATIS PENDAFTARAN SAMPAI TGL 31 AGUSTUS 2020 Dengan screenshot ini https://t.co/l6G5MlZGib","1297724279635578881","https://pbs.twimg.com/media/EgJxSq-U8AAxov5.jpg","","in","pajajaran bogor","0","0","0","https://twitter.com/sgpajajaran/status/1297724279635578881","284893867","sgpajajaran"
"1297715776741236737","Mon Aug 24 02:02:06 +0000 2020","13","#SahabatDikbud dapatkan Panduan Pembelajaran Program #BelajardariRumah di @TVRINasional untuk minggu ini (24--30 Agustus 2020) dengan mengunjungi laman berikut. https://t.co/UFmuhOYyWL #MerdekaBelajar #BersamaHadapiKorona","1297715776741236737","","","in","Jakarta","0","1","7","https://twitter.com/Kemdikbud_RI/status/1297715776741236737","631701837","Kemdikbud_RI"
"1297709271006744576","Mon Aug 24 01:36:15 +0000 2020","0","Surati Jokowi FSGI Minta Penyerahan Hibah Merek Merdeka Belajar Diperbaiki https://t.co/8hHZ1voSKR","1297709271006744576","","","in","Cipete, Jakarta Selatan","0","0","0","https://twitter.com/MonitorCOID/status/1297709271006744576","3029835496","MonitorCOID"
"1297694810027958272","Mon Aug 24 00:38:47 +0000 2020","0","Merdeka Belajar FSGI Minta Jokowi Turun Tangan https://t.co/MPsyZigSgW","1297694810027958272","","","in","","0","0","0","https://twitter.com/SukaKhilap12/status/1297694810027958272","1211795356280750080","SukaKhilap12"
"1297694095167467520","Mon Aug 24 00:35:56 +0000 2020","7","Kurikulum Pembelajaran Merdeka Belajar: Kisah Di Balik Layar Kurikulum Pembelajaran Merdeka Belajar versi pertama akhirnya diluncurkan setelah berdialektika selama lima tahun. https://t.co/0hKTRtKupc","1297694095167467520","","","in","Surakarta, Jawa Tengah","0","0","2","https://twitter.com/bukik/status/1297694095167467520","16734434","bukik"
"1297678619888586753","Sun Aug 23 23:34:27 +0000 2020","0","Merdeka Belajar Tak Hanya Milik Pelajar https://t.co/gK1m2tqTmW lewat @Lintas Lampung","1297678619888586753","","","in","Lampung","0","0","0","https://twitter.com/Lintas_lampung/status/1297678619888586753","4662070634","Lintas_lampung"
"1297677500017831936","Sun Aug 23 23:30:00 +0000 2020","0","Serikat Guru Curigai Ada Manipulasi di Merek Merdeka Belajar https://t.co/JnqSbrCVxH","1297677500017831936","","","in","Jakarta Capital Region","0","0","0","https://twitter.com/indonesiakitaco/status/1297677500017831936","780817820972044288","indonesiakitaco"
"1297662408849154048","Sun Aug 23 22:30:02 +0000 2020","0","Federasi Serikat Guru Indonesia atau FSGI mengirim surat kepada Presiden Jokowi soal hibah merek Merdeka Belajar. #guru https://t.co/Xjq71IfCbn","1297662408849154048","","","in","Indonesia","0","0","0","https://twitter.com/jpnncom/status/1297662408849154048","79130206","jpnncom"
"1297603884118990848","Sun Aug 23 18:37:28 +0000 2020","7","[cm] gaess kalian ambil merdeka belajar kah? boleh sharing mungkin yg udah pernah ngalamin hehe","1297603884118990848","","","in","","0","1","0","https://twitter.com/collegemenfess/status/1297603884118990848","1046084008742801408","collegemenfess"
"1297595370919297025","Sun Aug 23 18:03:39 +0000 2020","0","Assalamualaikum warahmatullahi wabarakhatu Berdasarkan konsep Kampus Merdeka dengan pendekatan Merdeka Belajar kegiatan Magang dapat dilaksanakan selama satu sampai dua semester dengan beban studi sebesar 20 sampai https://t.co/UNN7axwlyu","1297595370919297025","","","in","Pasaman, Indonesia","0","0","0","https://twitter.com/Karotes1/status/1297595370919297025","1297348400422113282","Karotes1"
"1297561923467108353","Sun Aug 23 15:50:44 +0000 2020","2","[INFORMASI PENTING] Halo KM FISIP! Bagi Mahasiswa Fisip Semester 7 (T.A.2017/2018) &amp; Semester 5 (T.A.2018/2019) diharapkan untuk mengikuti Sosialisasi Kurikulum Merdeka Belajar pada Semester Gasal T.A. 2020/2021 di lingkungan Fisip UPN Veteran Jawa Timur. https://t.co/NwvSmuYmHo","1297561923467108353","https://pbs.twimg.com/media/EgHdrxHUYAAQhrf.jpg","","in","Gunung Anyar, Surabaya - Ind","0","1","0","https://twitter.com/BEMFISIP_UPN/status/1297561923467108353","383824796","BEMFISIP_UPN"
"1297558975798374407","Sun Aug 23 15:39:01 +0000 2020","1","Guru Penggerak Lokomotif Merdeka Belajar https://t.co/oim8Gil12L","1297558975798374407","","","in","Jakarta","0","0","0","https://twitter.com/jawapos/status/1297558975798374407","2392460208","jawapos"
"1297554772531109889","Sun Aug 23 15:22:19 +0000 2020","8","Gerakan Bangkit Belajar MERDEKA bersama Anggota DPR RI Ibu Siti Mukaromah usai penyerahan Handy Talky kepada MTs PAKIS. @CenterSiti @MukhammadToha1 @cakimiNOW @sitimukaromah72 @SyaifulHooda @Kemenag_RI @Kemdikbud_RI https://t.co/T6ILY8vQ4O","1297554772531109889","https://pbs.twimg.com/media/EgHXL9NUEAYleQi.jpg","","in","Cilongok, Indonesia","0","1","9","https://twitter.com/PakisPetani/status/1297554772531109889","1267417632203894787","PakisPetani"
"1297553095853891584","Sun Aug 23 15:15:40 +0000 2020","8","Membumikan Gerakan Bangkit Belajar MERDEKA disaat Pandemi Penyerahan Handy Talky sbg sarana Pembelajaran Jarak Jauh. @cakimiNOW @MukhammadToha1 @CenterSiti @sitimukaromah72 @SyaifulHooda https://t.co/p7eXGv7KJm","1297553095853891584","https://pbs.twimg.com/media/EgHVqY4UwAA-U2V.jpg","","in","Cilongok, Indonesia","0","0","8","https://twitter.com/PakisPetani/status/1297553095853891584","1267417632203894787","PakisPetani"
"1297542560152342528","Sun Aug 23 14:33:48 +0000 2020","0","Kemendikbud: Saatnya Lanjutkan Misi Merdeka Belajar https://t.co/hdsaOF2mpM","1297542560152342528","","","in","Banda Aceh","0","0","0","https://twitter.com/harianacehcoid/status/1297542560152342528","2329327184","harianacehcoid"
"1297537567093485568","Sun Aug 23 14:13:57 +0000 2020","1","Kemendikbud menegaskan program Merdeka Belajar sesuai filosofi Ki Hadjar Dewantara. https://t.co/80NWpXZJk9","1297537567093485568","","","in","Jakarta, Indonesia","0","2","2","https://twitter.com/republikaonline/status/1297537567093485568","22126902","republikaonline"
"1297533536656859137","Sun Aug 23 13:57:56 +0000 2020","4","Kurikulum Pembelajaran Merdeka Belajar: Di Balik Layar https://t.co/QZ2K6t1qau","1297533536656859137","","","in","Dimanapun, selama ada kamu","0","0","2","https://twitter.com/BlogBukik/status/1297533536656859137","251378181","BlogBukik"
"1297531930712440832","Sun Aug 23 13:51:33 +0000 2020","0","Sekolah Cikal Hibahkan Merek Merdeka Belajar ke Negara https://t.co/XrpReD5Bp5","1297531930712440832","","","in","Banda Aceh","0","0","0","https://twitter.com/harianacehcoid/status/1297531930712440832","2329327184","harianacehcoid"
"1297530410142924802","Sun Aug 23 13:45:31 +0000 2020","0","Hibah Merek Merdeka Belajar FSGI Kirim Surat ke Presiden https://t.co/136a6ruZWe","1297530410142924802","","","in","Banda Aceh","0","0","0","https://twitter.com/harianacehcoid/status/1297530410142924802","2329327184","harianacehcoid"
"1297528034128326662","Sun Aug 23 13:36:04 +0000 2020","3","Cikal tak pernah persoalkan penggunaan Merdeka Belajar untuk kepentingan pendidikan. https://t.co/VV3gpih0PL","1297528034128326662","","","in","Jakarta, Indonesia","0","0","2","https://twitter.com/republikaonline/status/1297528034128326662","22126902","republikaonline"
"1297469913989177345","Sun Aug 23 09:45:07 +0000 2020","63","#SahabatDikbud akhir pekan seringkali menjadi waktu berkualitas bersama keluarga. Aktivitas membacakan buku untuk anak bisa menjadi pilihan untuk mengisinya. Ada banyak manfaat dari kegiatan yang satu ini. Yuk simak beberapa di antaranya! #MerdekaBelajar #MingguRindu https://t.co/OEFiRbPc9T","1297469913989177345","https://pbs.twimg.com/media/EgGKAfbVAAMTBQW.jpg","","in","Jakarta","0","3","21","https://twitter.com/Kemdikbud_RI/status/1297469913989177345","631701837","Kemdikbud_RI"
"1297461585305309190","Sun Aug 23 09:12:02 +0000 2020","1","Merdeka Belajar https://t.co/rcgThgSE1p","1297461585305309190","","","in","Indonesia","0","0","1","https://twitter.com/kompasiana/status/1297461585305309190","23786106","kompasiana"
"1297458561644191744","Sun Aug 23 09:00:01 +0000 2020","0","FSGI Surati Jokowi soal Hibah Merek Dagang Merdeka Belajar https://t.co/jZD6FTkVOG","1297458561644191744","","","in","Indonesia","0","0","0","https://twitter.com/democrazymedia/status/1297458561644191744","1243804423001763841","democrazymedia"
"1297437477771370496","Sun Aug 23 07:36:14 +0000 2020","0","FSGI Minta Jokowi Turun Tangan Perbaiki Penyerahan Hibah Merek Merdeka Belajar https://t.co/ZK05vJmEHB","1297437477771370496","","","in","Cipete, Jakarta Selatan","0","0","0","https://twitter.com/MonitorCOID/status/1297437477771370496","3029835496","MonitorCOID"
"1297437212976599040","Sun Aug 23 07:35:11 +0000 2020","0","FSGI Duga Ada Konflik Kepentingan di Balik Rencana Hibah Merek Merdeka Belajar https://t.co/7FdM0Th5qh","1297437212976599040","","","in","Kabupaten Purworejo Jawa Tenga","0","0","0","https://twitter.com/rsaupwr/status/1297437212976599040","1284414133845151745","rsaupwr"
"1297427459877376001","Sun Aug 23 06:56:26 +0000 2020","6","FSGI Surati Jokowi soal Hibah Merek Dagang Merdeka Belajar https://t.co/vg3bOLeMBW","1297427459877376001","","","in","","0","1","1","https://twitter.com/CNNIndonesia/status/1297427459877376001","17128975","CNNIndonesia"
"1297425841245294594","Sun Aug 23 06:50:00 +0000 2020","0","Serikat Guru Surati Jokowi Terkait Merek Dagang Merdeka Belajar https://t.co/iMjEP1bOdy","1297425841245294594","","","in","Indonesia","0","0","0","https://twitter.com/democrazymedia/status/1297425841245294594","1243804423001763841","democrazymedia"
"1297424045105807360","Sun Aug 23 06:42:51 +0000 2020","0","FSGI Duga Ada Konflik Kepentingan pada Merek Merdeka Belajar https://t.co/OWv8ShzubC","1297424045105807360","","","in","","0","0","0","https://twitter.com/JakartaNewsID1/status/1297424045105807360","1033940986169155586","JakartaNewsID1"
"1297420063671083009","Sun Aug 23 06:27:02 +0000 2020","0","Hibah merek dagang Merdeka Belajar dari Sekolah Cikal pada Kemendikbud dinilai melanggar aturan sehingga FSGI resmi melaporkan Mendikbud Nadiem kepada presiden Jokowi. #FSGI https://t.co/kmkKLkQ82K","1297420063671083009","","","in","Indonesia","0","0","0","https://twitter.com/jpnncom/status/1297420063671083009","79130206","jpnncom"
"1297415565150052355","Sun Aug 23 06:09:10 +0000 2020","0","FSGI Duga Ada Konflik Kepentingan pada Merek Merdeka Belajar https://t.co/R5ggtX9xOB","1297415565150052355","","","in","","0","0","0","https://twitter.com/JakartaNewsID1/status/1297415565150052355","1033940986169155586","JakartaNewsID1"
"1297392888393867265","Sun Aug 23 04:39:03 +0000 2020","0","Serikat Guru Laporkan Nadiem ke Jokowi Soal Hibah 'Merdeka Belajar' https://t.co/DaaiyMYQ18 #DariSuara","1297392888393867265","","","in","Jakarta Capital Region","1","0","0","https://twitter.com/suaradotcom/status/1297392888393867265","2340155395","suaradotcom"
"1297383449871839232","Sun Aug 23 04:01:33 +0000 2020","0","Serikat Guru surati Jokowi terkait merek dagang Merdeka Belajar https://t.co/tsk39t16Bs https://t.co/DKZ9L9Ok1l","1297383449871839232","https://pbs.twimg.com/media/EgE7XyFVAAAC8fL.png","","in","Indonesia","0","0","0","https://twitter.com/alineadotid/status/1297383449871839232","354168059","alineadotid"
"1297382123695833089","Sun Aug 23 03:56:17 +0000 2020","1","GOOD NEWS! Ada special promotion untuk sesiapa yang berminat nak Belajar mandarin sempena merdeka! Siapa berminat boleh whatsapp i sebelum promotion habis https://t.co/ZZGGWtheHX https://t.co/8JdOTnEL13","1297382123695833089","https://pbs.twimg.com/media/EgE6J_RUYAM6QO8.jpg","","in","","0","0","0","https://twitter.com/mandarinclass_/status/1297382123695833089","1293000168715894784","mandarinclass_"
"1297323146953912320","Sun Aug 23 00:01:55 +0000 2020","37","Selamat pagi #SahabatDikbud. Yuk berolahraga sebelum menyaksikan berbagai tayangan seru #BelajardariRumah di @TVRINasional! Berikut jadwal acara untuk hari Minggu 23 Agustus 2020. #MerdekaBelajar #BersamaHadapiKorona https://t.co/nIZvg4MRNb","1297323146953912320","https://pbs.twimg.com/media/EgEEhsgUMAAEE4s.jpg","","in","Jakarta","0","1","5","https://twitter.com/Kemdikbud_RI/status/1297323146953912320","631701837","Kemdikbud_RI"
"1297215813535936512","Sat Aug 22 16:55:25 +0000 2020","0","Dulu pernah pas lagi menggebu-gebu nya belajar sejarah terus mikir Pengen ah bawa Indonesia ke VISI MISI awal negeri ini merdeka ","1297215813535936512","","","in","venus","0","0","0","https://twitter.com/yay4y4y/status/1297215813535936512","1186690844994072576","yay4y4y"
"1297207716629213186","Sat Aug 22 16:23:15 +0000 2020","0","... Membacalah sebelum membaca itu dilarang #negeri #indonesiamaju🇲🇨 #indonesiamaju #merdekabelajar https://t.co/rIC16GZHIy","1297207716629213186","","","in","Indonesia","1","0","1","https://twitter.com/aksararaska/status/1297207716629213186","816836265584623616","aksararaska"
"1296954707613609984","Fri Aug 21 23:37:53 +0000 2020","3","#SahabatDikbud kini Mendikbud Nadiem Makarim hadir di media sosial Instagram. Akun dengan nama nadiemmakarim resmi dan telah terverifikasi. #MerdekaBelajar via @Kemdikbud_RI #ElshintaLongWeekend https://t.co/AMgbMPbXmn","1296954707613609984","https://pbs.twimg.com/media/Ef7N_YgU4AA0iKe.jpg","","in","","0","0","4","https://twitter.com/RadioElshinta/status/1296954707613609984","121640063","RadioElshinta"
"1296948829896372226","Fri Aug 21 23:14:31 +0000 2020","0","Dampak merdeka belajar jadi menganut faham ngerti sing ngerti urusan belakangan modal nekat jeg gas aja https://t.co/3McowezCGv","1296948829896372226","https://pbs.twimg.com/media/Ef-wFOHVoAAr8T9.jpg","","in","Denpasar, Bali","0","1","0","https://twitter.com/blushhoon/status/1296948829896372226","2888256518","blushhoon"
