"conversation_id_str","created_at","favorite_count","full_text","id_str","image_url","in_reply_to_screen_name","lang","location","quote_count","reply_count","retweet_count","tweet_url","user_id_str","username"
"1445158448467877891","Mon Oct 04 22:46:38 +0000 2021","8","Whatsapp Instagram Facebook down pasti Tulang Mark zuckerberg lagi galau ya... Masih untung Mas Twitter tetap sehat sejahtera ... Rupanya di zaman ini sosial media menjadi sangat vital dan sangat dibutuhkan... Untunglah masih banyak aplikasi sosmed lainnya","1445158448467877891","","","in","Kota Bandung, Jawa Barat","0","1","0","https://twitter.com/larasati_2122/status/1445158448467877891","1306988533","larasati_2122"
"1445050762854207490","Mon Oct 04 15:38:44 +0000 2021","0","Miracle in this day. Hari ini adalah senin pastinya banyak mobilitas yg harus jalan tapi heran ada 4 temenku turut hadir juga . Teruntuk siapapun yg aksi sosial trs gamau dibayar. Anda luar biasa Sehat selalu ya Sehatmu nggo tetulung . https://t.co/6RcELyiCji","1445050762854207490","https://pbs.twimg.com/media/FA3WZVLUcAA407s.jpg","","in","Moyudan","0","0","0","https://twitter.com/No_novitaama/status/1445050762854207490","3292546886","No_novitaama"
"1445037522048847879","Mon Oct 04 14:46:07 +0000 2021","21","Perokok terus menurun di AS (garis hitam). Tapi turunnya ga imbang antara orang dg pendidikan bawah (oranye) dg yg sarjana (biru). Kesenjangan sosial membuat hidup sehat susah dicapai. Menyalahkan orang miskin merokok itu ga adil krn yg paling untung adalah perusahaan rokok. https://t.co/GlY22VqUqF","1445037522048847879","https://pbs.twimg.com/media/FA3N4FyVUAU4Wev.png","","in","Boston, MA","0","2","5","https://twitter.com/hermansaksono/status/1445037522048847879","15858166","hermansaksono"
"1445003370373156869","Mon Oct 04 12:30:25 +0000 2021","2","Ber-media sosial dengan baik dan sehat itu menyenangkan bertemunya juga dengan orang-orang baik yang selalu mengingatkan dalam kebaikan.","1445003370373156869","","","in","","0","0","1","https://twitter.com/rifyuds/status/1445003370373156869","1429713346832474117","rifyuds"
"1444987471750594566","Mon Oct 04 11:27:14 +0000 2021","0","[COMING SOON BAKSOS 2021] Hallohai AGROINDUSTRIALIS! Bagaimana kabar kalian semua? Semoga tetap dalam kondisi yang sehat ya Bakti Sosial HIMATITAN 2021 akan segera datang nih teman-teman! Kondisi daring seperti ini daripada tambahan bosan mending ikut kepanitian BAKSOS https://t.co/pi4MVbasCK","1444987471750594566","https://pbs.twimg.com/media/FA2gb58VcAMSh3I.jpg","","in","Malang, Jawa Timur","1","1","0","https://twitter.com/ub_himatitan/status/1444987471750594566","508399031","ub_himatitan"
"1444892795592798208","Mon Oct 04 05:11:01 +0000 2021","0","Kadang kebuntuan ide dan kreatifitas di rumah bisa muncul ide baru ataupun ide dari orang lain secara tiba2 ketika kita iseng iseng main di luar/refreshing. Ternyata terlalu lama WFH itu ga sehat. Bagaimanapun juga manusia itu makhluk sosial.","1444892795592798208","","","in","Surabaya, Indonesia","0","0","0","https://twitter.com/daredeveloperid/status/1444892795592798208","83090178","daredeveloperid"
"1444880985728839686","Mon Oct 04 04:24:06 +0000 2021","0","[ BAKTI SOSIAL ] Haloo Semua Bagaimana kabar kalian? Semoga sehat selalu ya dan jangan lupa untuk selalu menaati protokol kesehatan yang ada! Saat ini BEM FEB UPNVY sedang membuka donasi yang akan disalurkan pada kegiatan : BAKTI SOSIAL ️ 7 November 2021 (cont)","1444880985728839686","","","in","UPN Veteran Yogyakarta","0","1","0","https://twitter.com/bemfebupnvy/status/1444880985728839686","185218582","bemfebupnvy"
"1444840407729201154","Mon Oct 04 01:42:51 +0000 2021","4","Sederhana adalah Keseharian Inisiatif adalah cara kerja Beliau Optimistic adalah Cita Beliau Memberikan Keadilan Sosial Bagi Seluruh Rakyat Indonesia Pemimpin Tanpa Sekat..Sehat Dan Berkah Padhe @jokowi 🇲🇨🇲🇨🇲🇨","1444840407729201154","","","in","Indonesia","0","0","0","https://twitter.com/Kotjo3/status/1444840407729201154","1306651573536264193","Kotjo3"
"1444633487588278274","Sun Oct 03 12:00:38 +0000 2021","0","Waktunya hidup sehat tanpa media sosial","1444633487588278274","","","in","Bandung","0","0","0","https://twitter.com/_Fauzianreza/status/1444633487588278274","65028586","_Fauzianreza"
"1444474972244643845","Sun Oct 03 01:30:45 +0000 2021","0","Seorang menteri membidangi kegiatan sosial bekerja harus menggunakan hati &amp; perasaan menjalankan dengan akal serta fikiran yang sehat sehingga dapat melaksanakan tugas dengan penuh hikmat. Tanpa marah &amp; maki-maki anda tetap di gaji bu.","1444474972244643845","","","in","","0","0","0","https://twitter.com/KRTPurbonagoro/status/1444474972244643845","1354032213961056257","KRTPurbonagoro"
"1444306675205226504","Sat Oct 02 14:21:59 +0000 2021","0","The friends that i have lalu menurut aku dari semua sosial media lingkungan aku di twitter yang paling sehat dewasa dna bisa membantu dalam berbagai hal. Dan banyak topik asik disini","1444306675205226504","","","in","not spoiler free","0","0","0","https://twitter.com/ineonimislocis/status/1444306675205226504","1302803045122625539","ineonimislocis"
"1444242440341262346","Sat Oct 02 10:06:45 +0000 2021","0","Aku capek olahraga aku capek tapi aku mau sehat aku mau ngurangin BB ku.. Aku pengen bisa coba baju size kecil aku juga capek di bully sama kekuarga kalau pas kumpul acara besar. Knp ya keadilan sosial berpihak sama yg kurus dan cantik? Kita kan sama...","1444242440341262346","","","in","","0","0","0","https://twitter.com/yukeie16/status/1444242440341262346","908926452728455168","yukeie16"
"1444215311083786243","Sat Oct 02 08:18:57 +0000 2021","0","[ BAKTI SOSIAL ] Haloo Semua Bagaimana kabar kalian? Semoga sehat selalu ya dan jangan lupa untuk selalu menaati protokol kesehatan yang ada! Saat ini BEM FEB UPNVY sedang membuka donasi yang akan disalurkan pada kegiatan : BAKTI SOSIAL ️ 7 November 2021 (cont) https://t.co/IYZRXuJMKs","1444215311083786243","https://pbs.twimg.com/media/FAriKgUVQAQ79rB.jpg","","in","UPN Veteran Yogyakarta","0","1","0","https://twitter.com/bemfebupnvy/status/1444215311083786243","185218582","bemfebupnvy"
"1444126614548217857","Sat Oct 02 02:26:30 +0000 2021","0","[PENGABDIAN SOSIAL 2021: Pematerian Hidup Sehat dan Pencegahan Virus] Halo Futuris! Akhirnya hari yang ditunggu-tunggu telah tiba. https://t.co/gAb8hg0MRV","1444126614548217857","https://pbs.twimg.com/media/FAqRQHqVUAE-KY7.jpg","","in","Universitas Padjadjaran","0","1","0","https://twitter.com/omikronunpad/status/1444126614548217857","1248957084474814465","omikronunpad"
"1444112322146947078","Sat Oct 02 01:29:42 +0000 2021","0","Not that I say that socmed and OTT are bad kagaaakk. Media sosial dan OTT banyak kasih pengaruh baik kok buat hidup w I feel entertained because of both of those. Cuma kaga sehat aja kalo dikonsumsi terlalu banyak dan sering.","1444112322146947078","","","in","Bekasi","0","0","0","https://twitter.com/dailymenintech/status/1444112322146947078","874665077638438913","dailymenintech"
"1444098957110480896","Sat Oct 02 00:36:36 +0000 2021","0","Buener banget. Udah 2x dose + natural immunity &amp; juga pola hidup sehat. Masker itu sebenernya ya cuma solidaritas sosial aja sih.","1444098957110480896","","","in","Malang, Jawa Timur","0","0","0","https://twitter.com/davidwantino1/status/1444098957110480896","770271745622159360","davidwantino1"
"1443941532042612737","Fri Oct 01 14:11:03 +0000 2021","0","jujur iya apalagi waktu jaman sd waduh jaya banget gue prestasi jalan sosial jalan temen banyak mental sehat jarang sedih beda bgt sm skrg","1443941532042612737","","","in","","0","0","0","https://twitter.com/eccendast/status/1443941532042612737","1289736010838888448","eccendast"
"1443932746640887808","Fri Oct 01 13:36:08 +0000 2021","0","Dulu sedih liat porter-porter stasiun kereta yang udah pada tua viral di sosial media. Pas liat langsung beneran sesedih itu liatnya. Salut. Semoga selalu dimampukan untuk menggapai rezeki yang halal ya bapac-bapack hebat. Sehat terus.","1443932746640887808","","","in","Jakarta, Indonesia","0","0","0","https://twitter.com/rexymail/status/1443932746640887808","186032308","rexymail"
"1443870369438257153","Fri Oct 01 09:28:16 +0000 2021","5","#SobatNgalam selamat memperingati Hari Kesaktian Pancasila 01 Oktober 2021. Momentum ini bukan hanya untuk dikenang tetapi juga menjaga Pancasila dengan menghadirkan sila Keadilan Sosial Bagi Seluruh Rakyat Indonesia. Salam Sehat ️ @PemkotMalang @ArnandoFernando @ipoksamidub https://t.co/sVyB3p6Xef","1443870369438257153","https://pbs.twimg.com/media/FAmocXkVkAEb7qQ.jpg","","in","Kota Malang","0","0","6","https://twitter.com/pkm_cisadea/status/1443870369438257153","1372036090471706625","pkm_cisadea"
"1443852333373444099","Fri Oct 01 08:16:36 +0000 2021","1","Kobarkan Semangat Juangmu Untuk Negeri Yang Sehat Tanpa Narkoba follow media sosial bnnk surakarta untuk info P4GN lainnya. Bersih Narkoba Bersih Covid-19 #bnnksurakarta https://t.co/XjtlwyOLRa https://t.co/TOpTocqjZZ","1443852333373444099","https://pbs.twimg.com/media/FAmYC7jX0AAxbQw.jpg","","in","Jl. Ki Ageng Mangir Gg.02, SKA","0","0","0","https://twitter.com/BNNKSurakarta/status/1443852333373444099","1106008226145824768","BNNKSurakarta"
